CAR,STEP,TIME,LEADER_AND_DISTANCE,DRIVING_DISTANCE,WIFI_SIGNAL_STRENGTH,MESH_SIGNAL_STRENGTH,DATAGRAM_COUNT,BYTES_COUNT,WIFI_DATAGRAM,MESH_DATAGRAM
car1,1,0.1,"(None, None)",None,-60,,1,409,[],"[""b'14:37:23.368083 IP 192.168.0.1.43570 > 192.168.0.255.9090: UDP, length 409\\nE...5.@.@............2#.....{'header': {'from_car_id': 'car1', 'proto_type': 'CAM', 'proto_version': 0, 'message_id': 1, 'generated_time': 0.1}, 'body': {'station_id': 0.57276342126728, 'leader': null, 'speed': 0.0, 'station_characteristics': {'mobile_its_station': false, 'private_its_station': false, 'physical_relevant_its_station': false}, 'reference_position': {'lane': 0, 'position': [5.1, -4.8, 0], 'elevation': 0, 'heading': 0}}}\\n'""]"
car1,2,0.2,"(None, None)",0.0259999999999998,-60,,1,427,[],"[""b'14:37:23.461862 IP 192.168.0.1.43570 > 192.168.0.255.9090: UDP, length 427\\nE...5.@.@............2#....#{'header': {'from_car_id': 'car1', 'proto_type': 'CAM', 'proto_version': 0, 'message_id': 3, 'generated_time': 0.2}, 'body': {'station_id': 0.3952887061200674, 'leader': null, 'speed': 0.26, 'station_characteristics': {'mobile_its_station': false, 'private_its_station': false, 'physical_relevant_its_station': false}, 'reference_position': {'lane': 1, 'position': [5.1259999999999994, -1.6, 0], 'elevation': 0, 'heading': 0}}}\\n'""]"
car1,3,0.3,"(None, None)",0.0779999999999994,-60,,1,426,[],"[""b'14:37:23.552457 IP 192.168.0.1.43570 > 192.168.0.255.9090: UDP, length 426\\nE...5.@.@............2#...j{{'header': {'from_car_id': 'car1', 'proto_type': 'CAM', 'proto_version': 0, 'message_id': 5, 'generated_time': 0.3}, 'body': {'station_id': 0.9627387380092495, 'leader': null, 'speed': 0.52, 'station_characteristics': {'mobile_its_station': false, 'private_its_station': false, 'physical_relevant_its_station': false}, 'reference_position': {'lane': 1, 'position': [5.177999999999999, -1.6, 0], 'elevation': 0, 'heading': 0}}}\\n'""]"
car1,4,0.4,"(None, None)",0.1559999999999997,-60,,1,425,[],"[""b'14:37:23.652871 IP 192.168.0.1.43570 > 192.168.0.255.9090: UDP, length 425\\nE...6.@.@............2#.....{'header': {'from_car_id': 'car1', 'proto_type': 'CAM', 'proto_version': 0, 'message_id': 7, 'generated_time': 0.4}, 'body': {'station_id': 0.288052839151947, 'leader': null, 'speed': 0.78, 'station_characteristics': {'mobile_its_station': false, 'private_its_station': false, 'physical_relevant_its_station': false}, 'reference_position': {'lane': 1, 'position': [5.255999999999999, -1.6, 0], 'elevation': 0, 'heading': 0}}}\\n'""]"
car1,5,0.5,"(None, None)",0.2599999999999998,-60,,2,879,[],"[""b'14:37:23.752110 IP 192.168.0.1.43570 > 192.168.0.255.9090: UDP, length 428\\nE...6&@.@............2#...;H{'header': {'from_car_id': 'car1', 'proto_type': 'CAM', 'proto_version': 0, 'message_id': 9, 'generated_time': 0.5}, 'body': {'station_id': 0.021916279757421164, 'leader': null, 'speed': 1.04, 'station_characteristics': {'mobile_its_station': false, 'private_its_station': false, 'physical_relevant_its_station': false}, 'reference_position': {'lane': 1, 'position': [5.359999999999999, -1.6, 0], 'elevation': 0, 'heading': 0}}}\\n'"", ""b'14:37:23.760551 IP 192.168.0.2.43118 > 192.168.0.255.9090: UDP, length 451\\nE.....@.@............n#...+.{'header': {'from_car_id': 'car2', 'proto_type': 'CAM', 'proto_version': 0, 'message_id': 10, 'generated_time': 0.5}, 'body': {'station_id': 0.6879841710500861, 'leader': null, 'speed': -1073741824.0, 'station_characteristics': {'mobile_its_station': false, 'private_its_station': false, 'physical_relevant_its_station': false}, 'reference_position': {'lane': -1073741824, 'position': [-1073741824.0, -1073741824.0, 0], 'elevation': 0, 'heading': 0}}}\\n'""]"
car1,6,0.6,"(None, None)",0.3899999999999997,-60,,2,877,[],"[""b'14:37:23.853043 IP 192.168.0.1.43570 > 192.168.0.255.9090: UDP, length 426\\nE...65@.@............2#.....{'header': {'from_car_id': 'car1', 'proto_type': 'CAM', 'proto_version': 0, 'message_id': 11, 'generated_time': 0.6}, 'body': {'station_id': 0.1606458598637278, 'leader': null, 'speed': 1.3, 'station_characteristics': {'mobile_its_station': false, 'private_its_station': false, 'physical_relevant_its_station': false}, 'reference_position': {'lane': 1, 'position': [5.489999999999999, -1.6, 0], 'elevation': 0, 'heading': 0}}}\\n'"", ""b'14:37:23.861495 IP 192.168.0.2.43118 > 192.168.0.255.9090: UDP, length 451\\nE.....@.@............n#...1.{'header': {'from_car_id': 'car2', 'proto_type': 'CAM', 'proto_version': 0, 'message_id': 12, 'generated_time': 0.6}, 'body': {'station_id': 0.8511237972511148, 'leader': null, 'speed': -1073741824.0, 'station_characteristics': {'mobile_its_station': false, 'private_its_station': false, 'physical_relevant_its_station': false}, 'reference_position': {'lane': -1073741824, 'position': [-1073741824.0, -1073741824.0, 0], 'elevation': 0, 'heading': 0}}}\\n'""]"
car1,7,0.7,"(None, None)",0.5459999999999994,-60,,2,878,[],"[""b'14:37:23.952325 IP 192.168.0.1.43570 > 192.168.0.255.9090: UDP, length 427\\nE...68@.@............2#.....{'header': {'from_car_id': 'car1', 'proto_type': 'CAM', 'proto_version': 0, 'message_id': 13, 'generated_time': 0.7}, 'body': {'station_id': 0.8889950294042045, 'leader': null, 'speed': 1.56, 'station_characteristics': {'mobile_its_station': false, 'private_its_station': false, 'physical_relevant_its_station': false}, 'reference_position': {'lane': 1, 'position': [5.645999999999999, -1.6, 0], 'elevation': 0, 'heading': 0}}}\\n'"", ""b'14:37:23.960752 IP 192.168.0.2.43118 > 192.168.0.255.9090: UDP, length 451\\nE.....@.@............n#...7.{'header': {'from_car_id': 'car2', 'proto_type': 'CAM', 'proto_version': 0, 'message_id': 14, 'generated_time': 0.7}, 'body': {'station_id': 0.4062750114105912, 'leader': null, 'speed': -1073741824.0, 'station_characteristics': {'mobile_its_station': false, 'private_its_station': false, 'physical_relevant_its_station': false}, 'reference_position': {'lane': -1073741824, 'position': [-1073741824.0, -1073741824.0, 0], 'elevation': 0, 'heading': 0}}}\\n'""]"
car1,8,0.8,"(None, None)",0.7279999999999998,-60,,2,879,[],"[""b'14:37:24.052188 IP 192.168.0.1.43570 > 192.168.0.255.9090: UDP, length 428\\nE...6A@.@............2#...4F{'header': {'from_car_id': 'car1', 'proto_type': 'CAM', 'proto_version': 0, 'message_id': 15, 'generated_time': 0.8}, 'body': {'station_id': 0.22579295218562723, 'leader': null, 'speed': 1.82, 'station_characteristics': {'mobile_its_station': false, 'private_its_station': false, 'physical_relevant_its_station': false}, 'reference_position': {'lane': 1, 'position': [5.827999999999999, -1.6, 0], 'elevation': 0, 'heading': 0}}}\\n'"", ""b'14:37:24.060669 IP 192.168.0.2.43118 > 192.168.0.255.9090: UDP, length 451\\nE.....@.@............n#.....{'header': {'from_car_id': 'car2', 'proto_type': 'CAM', 'proto_version': 0, 'message_id': 16, 'generated_time': 0.8}, 'body': {'station_id': 0.8882833939806938, 'leader': null, 'speed': -1073741824.0, 'station_characteristics': {'mobile_its_station': false, 'private_its_station': false, 'physical_relevant_its_station': false}, 'reference_position': {'lane': -1073741824, 'position': [-1073741824.0, -1073741824.0, 0], 'elevation': 0, 'heading': 0}}}\\n'""]"
car1,9,0.9,"(None, None)",0.9359999999999999,-60,,2,867,[],"[""b'14:37:24.154612 IP 192.168.0.1.43570 > 192.168.0.255.9090: UDP, length 415\\nE...6Y@.@............2#.../I{'header': {'from_car_id': 'car1', 'proto_type': 'CAM', 'proto_version': 0, 'message_id': 17, 'generated_time': 0.9}, 'body': {'station_id': 0.3655522748139881, 'leader': null, 'speed': 2.08, 'station_characteristics': {'mobile_its_station': false, 'private_its_station': false, 'physical_relevant_its_station': false}, 'reference_position': {'lane': 1, 'position': [6.036, -1.6, 0], 'elevation': 0, 'heading': 0}}}\\n'"", ""b'14:37:24.163267 IP 192.168.0.2.43118 > 192.168.0.255.9090: UDP, length 452\\nE....#@.@............n#...h5{'header': {'from_car_id': 'car2', 'proto_type': 'CAM', 'proto_version': 0, 'message_id': 18, 'generated_time': 0.9}, 'body': {'station_id': 0.32007008581683705, 'leader': null, 'speed': -1073741824.0, 'station_characteristics': {'mobile_its_station': false, 'private_its_station': false, 'physical_relevant_its_station': false}, 'reference_position': {'lane': -1073741824, 'position': [-1073741824.0, -1073741824.0, 0], 'elevation': 0, 'heading': 0}}}\\n'""]"
car1,10,1.0,"(None, None)",1.17,-60,,2,863,[],"[""b'14:37:24.253966 IP 192.168.0.1.43570 > 192.168.0.255.9090: UDP, length 414\\nE...6_@.@............2#.....{'header': {'from_car_id': 'car1', 'proto_type': 'CAM', 'proto_version': 0, 'message_id': 19, 'generated_time': 1.0}, 'body': {'station_id': 0.6657450283173112, 'leader': null, 'speed': 2.34, 'station_characteristics': {'mobile_its_station': false, 'private_its_station': false, 'physical_relevant_its_station': false}, 'reference_position': {'lane': 1, 'position': [6.27, -1.6, 0], 'elevation': 0, 'heading': 0}}}\\n'"", ""b'14:37:24.262351 IP 192.168.0.2.43118 > 192.168.0.255.9090: UDP, length 449\\nE....\\'@.@............n#...^.{'header': {'from_car_id': 'car2', 'proto_type': 'CAM', 'proto_version': 0, 'message_id': 20, 'generated_time': 1.0}, 'body': {'station_id': 0.44672235256688, 'leader': null, 'speed': -1073741824.0, 'station_characteristics': {'mobile_its_station': false, 'private_its_station': false, 'physical_relevant_its_station': false}, 'reference_position': {'lane': -1073741824, 'position': [-1073741824.0, -1073741824.0, 0], 'elevation': 0, 'heading': 0}}}\\n'""]"
car1,11,1.1,"(None, None)",1.4299999999999997,-60,,2,892,[],"[""b'14:37:24.353791 IP 192.168.0.1.43570 > 192.168.0.255.9090: UDP, length 441\\nE...6k@.@..\\\\.........2#...W-{'header': {'from_car_id': 'car1', 'proto_type': 'CAM', 'proto_version': 0, 'message_id': 21, 'generated_time': 1.1}, 'body': {'station_id': 0.7154326954134063, 'leader': null, 'speed': 2.5999999999999996, 'station_characteristics': {'mobile_its_station': false, 'private_its_station': false, 'physical_relevant_its_station': false}, 'reference_position': {'lane': 1, 'position': [6.529999999999999, -1.6, 0], 'elevation': 0, 'heading': 0}}}\\n'"", ""b'14:37:24.362357 IP 192.168.0.2.43118 > 192.168.0.255.9090: UDP, length 451\\nE....)@.@............n#...-.{'header': {'from_car_id': 'car2', 'proto_type': 'CAM', 'proto_version': 0, 'message_id': 22, 'generated_time': 1.1}, 'body': {'station_id': 0.9582838347787485, 'leader': null, 'speed': -1073741824.0, 'station_characteristics': {'mobile_its_station': false, 'private_its_station': false, 'physical_relevant_its_station': false}, 'reference_position': {'lane': -1073741824, 'position': [-1073741824.0, -1073741824.0, 0], 'elevation': 0, 'heading': 0}}}\\n'""]"
car1,12,1.2,"(None, None)",1.7159999999999993,-60,,2,892,[],"[""b'14:37:24.453422 IP 192.168.0.1.43570 > 192.168.0.255.9090: UDP, length 441\\nE...6n@.@..Y.........2#...L2{'header': {'from_car_id': 'car1', 'proto_type': 'CAM', 'proto_version': 0, 'message_id': 23, 'generated_time': 1.2}, 'body': {'station_id': 0.1868801981204583, 'leader': null, 'speed': 2.8599999999999994, 'station_characteristics': {'mobile_its_station': false, 'private_its_station': false, 'physical_relevant_its_station': false}, 'reference_position': {'lane': 1, 'position': [6.815999999999998, -1.6, 0], 'elevation': 0, 'heading': 0}}}\\n'"", ""b'14:37:24.462030 IP 192.168.0.2.43118 > 192.168.0.255.9090: UDP, length 451\\nE....=@.@..~.........n#...9.{'header': {'from_car_id': 'car2', 'proto_type': 'CAM', 'proto_version': 0, 'message_id': 24, 'generated_time': 1.2}, 'body': {'station_id': 0.6492651130687351, 'leader': null, 'speed': -1073741824.0, 'station_characteristics': {'mobile_its_station': false, 'private_its_station': false, 'physical_relevant_its_station': false}, 'reference_position': {'lane': -1073741824, 'position': [-1073741824.0, -1073741824.0, 0], 'elevation': 0, 'heading': 0}}}\\n'""]"
car1,13,1.3,"(None, None)",2.0279999999999996,-60,,2,891,[],"[""b'14:37:24.553565 IP 192.168.0.1.43570 > 192.168.0.255.9090: UDP, length 440\\nE...6.@.@..C.........2#....,{'header': {'from_car_id': 'car1', 'proto_type': 'CAM', 'proto_version': 0, 'message_id': 25, 'generated_time': 1.3}, 'body': {'station_id': 0.9068171659820428, 'leader': null, 'speed': 3.119999999999999, 'station_characteristics': {'mobile_its_station': false, 'private_its_station': false, 'physical_relevant_its_station': false}, 'reference_position': {'lane': 1, 'position': [7.127999999999999, -1.6, 0], 'elevation': 0, 'heading': 0}}}\\n'"", ""b'14:37:24.562108 IP 192.168.0.2.43118 > 192.168.0.255.9090: UDP, length 451\\nE....@@.@..{.........n#.....{'header': {'from_car_id': 'car2', 'proto_type': 'CAM', 'proto_version': 0, 'message_id': 26, 'generated_time': 1.3}, 'body': {'station_id': 0.3278245095943487, 'leader': null, 'speed': -1073741824.0, 'station_characteristics': {'mobile_its_station': false, 'private_its_station': false, 'physical_relevant_its_station': false}, 'reference_position': {'lane': -1073741824, 'position': [-1073741824.0, -1073741824.0, 0], 'elevation': 0, 'heading': 0}}}\\n'""]"
car1,14,1.4,"(None, None)",2.3659999999999997,-60,,2,891,[],"[""b'14:37:24.653725 IP 192.168.0.1.43570 > 192.168.0.255.9090: UDP, length 440\\nE...6.@.@..0.........2#....#{'header': {'from_car_id': 'car1', 'proto_type': 'CAM', 'proto_version': 0, 'message_id': 27, 'generated_time': 1.4}, 'body': {'station_id': 0.5045483814562757, 'leader': null, 'speed': 3.379999999999999, 'station_characteristics': {'mobile_its_station': false, 'private_its_station': false, 'physical_relevant_its_station': false}, 'reference_position': {'lane': 1, 'position': [7.465999999999999, -1.6, 0], 'elevation': 0, 'heading': 0}}}\\n'"", ""b'14:37:24.662351 IP 192.168.0.2.43118 > 192.168.0.255.9090: UDP, length 451\\nE....D@.@..w.........n#...(.{'header': {'from_car_id': 'car2', 'proto_type': 'CAM', 'proto_version': 0, 'message_id': 28, 'generated_time': 1.4}, 'body': {'station_id': 0.7965307805005567, 'leader': null, 'speed': -1073741824.0, 'station_characteristics': {'mobile_its_station': false, 'private_its_station': false, 'physical_relevant_its_station': false}, 'reference_position': {'lane': -1073741824, 'position': [-1073741824.0, -1073741824.0, 0], 'elevation': 0, 'heading': 0}}}\\n'""]"
car1,15,1.5,"(None, None)",2.7299999999999995,-60,,2,892,[],"[""b'14:37:24.753785 IP 192.168.0.1.43570 > 192.168.0.255.9090: UDP, length 440\\nE...6.@.@.. .........2#.....{'header': {'from_car_id': 'car1', 'proto_type': 'CAM', 'proto_version': 0, 'message_id': 29, 'generated_time': 1.5}, 'body': {'station_id': 0.7140575662634656, 'leader': null, 'speed': 3.639999999999999, 'station_characteristics': {'mobile_its_station': false, 'private_its_station': false, 'physical_relevant_its_station': false}, 'reference_position': {'lane': 1, 'position': [7.829999999999999, -1.6, 0], 'elevation': 0, 'heading': 0}}}\\n'"", ""b'14:37:24.762328 IP 192.168.0.2.43118 > 192.168.0.255.9090: UDP, length 452\\nE....O@.@..k.........n#...X?{'header': {'from_car_id': 'car2', 'proto_type': 'CAM', 'proto_version': 0, 'message_id': 30, 'generated_time': 1.5}, 'body': {'station_id': 0.02284775783913129, 'leader': null, 'speed': -1073741824.0, 'station_characteristics': {'mobile_its_station': false, 'private_its_station': false, 'physical_relevant_its_station': false}, 'reference_position': {'lane': -1073741824, 'position': [-1073741824.0, -1073741824.0, 0], 'elevation': 0, 'heading': 0}}}\\n'""]"
car1,16,1.6,"(None, None)",3.119999999999999,-60,,2,893,[],"[""b'14:37:24.854096 IP 192.168.0.1.43570 > 192.168.0.255.9090: UDP, length 442\\nE...6.@.@............2#.....{'header': {'from_car_id': 'car1', 'proto_type': 'CAM', 'proto_version': 0, 'message_id': 31, 'generated_time': 1.6}, 'body': {'station_id': 0.29985442598688716, 'leader': null, 'speed': 3.8999999999999986, 'station_characteristics': {'mobile_its_station': false, 'private_its_station': false, 'physical_relevant_its_station': false}, 'reference_position': {'lane': 1, 'position': [8.219999999999999, -1.6, 0], 'elevation': 0, 'heading': 0}}}\\n'"", ""b'14:37:24.862788 IP 192.168.0.2.43118 > 192.168.0.255.9090: UDP, length 451\\nE....[@.@..`.........n#.....{'header': {'from_car_id': 'car2', 'proto_type': 'CAM', 'proto_version': 0, 'message_id': 32, 'generated_time': 1.6}, 'body': {'station_id': 0.6517796876450751, 'leader': null, 'speed': -1073741824.0, 'station_characteristics': {'mobile_its_station': false, 'private_its_station': false, 'physical_relevant_its_station': false}, 'reference_position': {'lane': -1073741824, 'position': [-1073741824.0, -1073741824.0, 0], 'elevation': 0, 'heading': 0}}}\\n'""]"
car1,17,1.7,"(None, None)",3.5359999999999996,-60,,2,880,[],"[""b'14:37:24.954084 IP 192.168.0.1.43570 > 192.168.0.255.9090: UDP, length 429\\nE...6.@.@............2#....W{'header': {'from_car_id': 'car1', 'proto_type': 'CAM', 'proto_version': 0, 'message_id': 33, 'generated_time': 1.7}, 'body': {'station_id': 0.32289072594167467, 'leader': null, 'speed': 4.159999999999998, 'station_characteristics': {'mobile_its_station': false, 'private_its_station': false, 'physical_relevant_its_station': false}, 'reference_position': {'lane': 1, 'position': [8.636, -1.6, 0], 'elevation': 0, 'heading': 0}}}\\n'"", ""b'14:37:24.962723 IP 192.168.0.2.43118 > 192.168.0.255.9090: UDP, length 451\\nE....s@.@..H.........n#.....{'header': {'from_car_id': 'car2', 'proto_type': 'CAM', 'proto_version': 0, 'message_id': 34, 'generated_time': 1.7}, 'body': {'station_id': 0.4369243338192952, 'leader': null, 'speed': -1073741824.0, 'station_characteristics': {'mobile_its_station': false, 'private_its_station': false, 'physical_relevant_its_station': false}, 'reference_position': {'lane': -1073741824, 'position': [-1073741824.0, -1073741824.0, 0], 'elevation': 0, 'heading': 0}}}\\n'""]"
car1,18,1.8,"(None, None)",3.9779999999999998,-60,,2,879,[],"[""b'14:37:25.054260 IP 192.168.0.1.43570 > 192.168.0.255.9090: UDP, length 428\\nE...6.@.@............2#.....{'header': {'from_car_id': 'car1', 'proto_type': 'CAM', 'proto_version': 0, 'message_id': 35, 'generated_time': 1.8}, 'body': {'station_id': 0.8432369349239437, 'leader': null, 'speed': 4.419999999999998, 'station_characteristics': {'mobile_its_station': false, 'private_its_station': false, 'physical_relevant_its_station': false}, 'reference_position': {'lane': 1, 'position': [9.078, -1.6, 0], 'elevation': 0, 'heading': 0}}}\\n'"", ""b'14:37:25.062756 IP 192.168.0.2.43118 > 192.168.0.255.9090: UDP, length 451\\nE.....@.@..:.........n#.....{'header': {'from_car_id': 'car2', 'proto_type': 'CAM', 'proto_version': 0, 'message_id': 36, 'generated_time': 1.8}, 'body': {'station_id': 0.8509992769223489, 'leader': null, 'speed': -1073741824.0, 'station_characteristics': {'mobile_its_station': false, 'private_its_station': false, 'physical_relevant_its_station': false}, 'reference_position': {'lane': -1073741824, 'position': [-1073741824.0, -1073741824.0, 0], 'elevation': 0, 'heading': 0}}}\\n'""]"
car1,19,1.9,"(None, None)",4.446,-60,,1,451,[],"[""b'14:37:25.162420 IP 192.168.0.2.43118 > 192.168.0.255.9090: UDP, length 451\\nE.....@.@..7.........n#.....{'header': {'from_car_id': 'car2', 'proto_type': 'CAM', 'proto_version': 0, 'message_id': 38, 'generated_time': 1.9}, 'body': {'station_id': 0.0496580207282844, 'leader': null, 'speed': -1073741824.0, 'station_characteristics': {'mobile_its_station': false, 'private_its_station': false, 'physical_relevant_its_station': false}, 'reference_position': {'lane': -1073741824, 'position': [-1073741824.0, -1073741824.0, 0], 'elevation': 0, 'heading': 0}}}\\n'""]"
car1,20,2.0,"(None, None)",4.9399999999999995,-60,,2,880,[],"[""b'14:37:25.254137 IP 192.168.0.1.43570 > 192.168.0.255.9090: UDP, length 428\\nE...6.@.@............2#.....{'header': {'from_car_id': 'car1', 'proto_type': 'CAM', 'proto_version': 0, 'message_id': 39, 'generated_time': 2.0}, 'body': {'station_id': 0.5721366052696982, 'leader': null, 'speed': 4.939999999999998, 'station_characteristics': {'mobile_its_station': false, 'private_its_station': false, 'physical_relevant_its_station': false}, 'reference_position': {'lane': 1, 'position': [10.04, -1.6, 0], 'elevation': 0, 'heading': 0}}}\\n'"", ""b'14:37:25.262584 IP 192.168.0.2.43118 > 192.168.0.255.9090: UDP, length 452\\nE.....@.@............n#...c<{'header': {'from_car_id': 'car2', 'proto_type': 'CAM', 'proto_version': 0, 'message_id': 40, 'generated_time': 2.0}, 'body': {'station_id': 0.22696730586035452, 'leader': null, 'speed': -1073741824.0, 'station_characteristics': {'mobile_its_station': false, 'private_its_station': false, 'physical_relevant_its_station': false}, 'reference_position': {'lane': -1073741824, 'position': [-1073741824.0, -1073741824.0, 0], 'elevation': 0, 'heading': 0}}}\\n'""]"
car1,21,2.1,"(None, None)",5.4399999999999995,-60,,2,865,[],"[""b'14:37:25.353995 IP 192.168.0.1.43570 > 192.168.0.255.9090: UDP, length 414\\nE...6.@.@............2#....G{'header': {'from_car_id': 'car1', 'proto_type': 'CAM', 'proto_version': 0, 'message_id': 41, 'generated_time': 2.1}, 'body': {'station_id': 0.9300246637020847, 'leader': null, 'speed': 5.0, 'station_characteristics': {'mobile_its_station': false, 'private_its_station': false, 'physical_relevant_its_station': false}, 'reference_position': {'lane': 1, 'position': [10.54, -1.6, 0], 'elevation': 0, 'heading': 0}}}\\n'"", ""b'14:37:25.362336 IP 192.168.0.2.43118 > 192.168.0.255.9090: UDP, length 451\\nE.....@.@............n#...&.{'header': {'from_car_id': 'car2', 'proto_type': 'CAM', 'proto_version': 0, 'message_id': 42, 'generated_time': 2.1}, 'body': {'station_id': 0.9637982674702129, 'leader': null, 'speed': -1073741824.0, 'station_characteristics': {'mobile_its_station': false, 'private_its_station': false, 'physical_relevant_its_station': false}, 'reference_position': {'lane': -1073741824, 'position': [-1073741824.0, -1073741824.0, 0], 'elevation': 0, 'heading': 0}}}\\n'""]"
car1,22,2.2,"(None, None)",5.9399999999999995,-60,,2,865,[],"[""b'14:37:25.454831 IP 192.168.0.1.43570 > 192.168.0.255.9090: UDP, length 414\\nE...6.@.@............2#....C{'header': {'from_car_id': 'car1', 'proto_type': 'CAM', 'proto_version': 0, 'message_id': 43, 'generated_time': 2.2}, 'body': {'station_id': 0.6261162557158219, 'leader': null, 'speed': 5.0, 'station_characteristics': {'mobile_its_station': false, 'private_its_station': false, 'physical_relevant_its_station': false}, 'reference_position': {'lane': 1, 'position': [11.04, -1.6, 0], 'elevation': 0, 'heading': 0}}}\\n'"", ""b'14:37:25.463202 IP 192.168.0.2.43118 > 192.168.0.255.9090: UDP, length 451\\nE.....@.@............n#.....{'header': {'from_car_id': 'car2', 'proto_type': 'CAM', 'proto_version': 0, 'message_id': 44, 'generated_time': 2.2}, 'body': {'station_id': 0.6894699819415309, 'leader': null, 'speed': -1073741824.0, 'station_characteristics': {'mobile_its_station': false, 'private_its_station': false, 'physical_relevant_its_station': false}, 'reference_position': {'lane': -1073741824, 'position': [-1073741824.0, -1073741824.0, 0], 'elevation': 0, 'heading': 0}}}\\n'""]"
car1,23,2.3,"(None, None)",6.4399999999999995,-60,,1,414,[],"[""b'14:37:25.555039 IP 192.168.0.1.43570 > 192.168.0.255.9090: UDP, length 414\\nE...7.@.@............2#...w;{'header': {'from_car_id': 'car1', 'proto_type': 'CAM', 'proto_version': 0, 'message_id': 45, 'generated_time': 2.3}, 'body': {'station_id': 0.5541293609887428, 'leader': null, 'speed': 5.0, 'station_characteristics': {'mobile_its_station': false, 'private_its_station': false, 'physical_relevant_its_station': false}, 'reference_position': {'lane': 1, 'position': [11.54, -1.6, 0], 'elevation': 0, 'heading': 0}}}\\n'""]"
car1,24,2.4,"(None, None)",6.9399999999999995,-60,,2,865,[],"[""b'14:37:25.654656 IP 192.168.0.1.43570 > 192.168.0.255.9090: UDP, length 414\\nE...7.@.@............2#....:{'header': {'from_car_id': 'car1', 'proto_type': 'CAM', 'proto_version': 0, 'message_id': 46, 'generated_time': 2.4}, 'body': {'station_id': 0.8014512841845821, 'leader': null, 'speed': 5.0, 'station_characteristics': {'mobile_its_station': false, 'private_its_station': false, 'physical_relevant_its_station': false}, 'reference_position': {'lane': 1, 'position': [12.04, -1.6, 0], 'elevation': 0, 'heading': 0}}}\\n'"", ""b'14:37:25.662985 IP 192.168.0.2.43118 > 192.168.0.255.9090: UDP, length 451\\nE.....@.@............n#...0.{'header': {'from_car_id': 'car2', 'proto_type': 'CAM', 'proto_version': 0, 'message_id': 47, 'generated_time': 2.4}, 'body': {'station_id': 0.6711306182239777, 'leader': null, 'speed': -1073741824.0, 'station_characteristics': {'mobile_its_station': false, 'private_its_station': false, 'physical_relevant_its_station': false}, 'reference_position': {'lane': -1073741824, 'position': [-1073741824.0, -1073741824.0, 0], 'elevation': 0, 'heading': 0}}}\\n'""]"
car1,25,2.5,"(None, None)",7.4399999999999995,-60,,2,866,[],"[""b'14:37:25.754941 IP 192.168.0.1.43570 > 192.168.0.255.9090: UDP, length 415\\nE...7*@.@............2#...l.{'header': {'from_car_id': 'car1', 'proto_type': 'CAM', 'proto_version': 0, 'message_id': 48, 'generated_time': 2.5}, 'body': {'station_id': 0.30718343092656253, 'leader': null, 'speed': 5.0, 'station_characteristics': {'mobile_its_station': false, 'private_its_station': false, 'physical_relevant_its_station': false}, 'reference_position': {'lane': 1, 'position': [12.54, -1.6, 0], 'elevation': 0, 'heading': 0}}}\\n'"", ""b'14:37:25.763756 IP 192.168.0.2.43118 > 192.168.0.255.9090: UDP, length 451\\nE.....@.@............n#.....{'header': {'from_car_id': 'car2', 'proto_type': 'CAM', 'proto_version': 0, 'message_id': 49, 'generated_time': 2.5}, 'body': {'station_id': 0.6046351879274565, 'leader': null, 'speed': -1073741824.0, 'station_characteristics': {'mobile_its_station': false, 'private_its_station': false, 'physical_relevant_its_station': false}, 'reference_position': {'lane': -1073741824, 'position': [-1073741824.0, -1073741824.0, 0], 'elevation': 0, 'heading': 0}}}\\n'""]"
car1,26,2.6,"(None, None)",7.9399999999999995,-60,,2,866,[],"[""b'14:37:25.854458 IP 192.168.0.1.43570 > 192.168.0.255.9090: UDP, length 415\\nE...70@.@............2#...k.{'header': {'from_car_id': 'car1', 'proto_type': 'CAM', 'proto_version': 0, 'message_id': 50, 'generated_time': 2.6}, 'body': {'station_id': 0.04343379018544968, 'leader': null, 'speed': 5.0, 'station_characteristics': {'mobile_its_station': false, 'private_its_station': false, 'physical_relevant_its_station': false}, 'reference_position': {'lane': 1, 'position': [13.04, -1.6, 0], 'elevation': 0, 'heading': 0}}}\\n'"", ""b'14:37:25.862904 IP 192.168.0.2.43118 > 192.168.0.255.9090: UDP, length 451\\nE.....@.@............n#...'.{'header': {'from_car_id': 'car2', 'proto_type': 'CAM', 'proto_version': 0, 'message_id': 51, 'generated_time': 2.6}, 'body': {'station_id': 0.7829945641842037, 'leader': null, 'speed': -1073741824.0, 'station_characteristics': {'mobile_its_station': false, 'private_its_station': false, 'physical_relevant_its_station': false}, 'reference_position': {'lane': -1073741824, 'position': [-1073741824.0, -1073741824.0, 0], 'elevation': 0, 'heading': 0}}}\\n'""]"
car1,27,2.7,"(None, None)",8.44,-60,,2,865,[],"[""b'14:37:25.954653 IP 192.168.0.1.43570 > 192.168.0.255.9090: UDP, length 415\\nE...7A@.@............2#...s.{'header': {'from_car_id': 'car1', 'proto_type': 'CAM', 'proto_version': 0, 'message_id': 52, 'generated_time': 2.7}, 'body': {'station_id': 0.21812083851067854, 'leader': null, 'speed': 5.0, 'station_characteristics': {'mobile_its_station': false, 'private_its_station': false, 'physical_relevant_its_station': false}, 'reference_position': {'lane': 1, 'position': [13.54, -1.6, 0], 'elevation': 0, 'heading': 0}}}\\n'"", ""b'14:37:25.962944 IP 192.168.0.2.43118 > 192.168.0.255.9090: UDP, length 450\\nE.....@.@............n#....i{'header': {'from_car_id': 'car2', 'proto_type': 'CAM', 'proto_version': 0, 'message_id': 53, 'generated_time': 2.7}, 'body': {'station_id': 0.946371019145462, 'leader': null, 'speed': -1073741824.0, 'station_characteristics': {'mobile_its_station': false, 'private_its_station': false, 'physical_relevant_its_station': false}, 'reference_position': {'lane': -1073741824, 'position': [-1073741824.0, -1073741824.0, 0], 'elevation': 0, 'heading': 0}}}\\n'""]"
car1,28,2.8,"(None, None)",8.94,-60,,2,865,[],"[""b'14:37:26.055050 IP 192.168.0.1.43570 > 192.168.0.255.9090: UDP, length 414\\nE...7F@.@............2#...z8{'header': {'from_car_id': 'car1', 'proto_type': 'CAM', 'proto_version': 0, 'message_id': 54, 'generated_time': 2.8}, 'body': {'station_id': 0.9174575419544517, 'leader': null, 'speed': 5.0, 'station_characteristics': {'mobile_its_station': false, 'private_its_station': false, 'physical_relevant_its_station': false}, 'reference_position': {'lane': 1, 'position': [14.04, -1.6, 0], 'elevation': 0, 'heading': 0}}}\\n'"", ""b'14:37:26.063484 IP 192.168.0.2.43118 > 192.168.0.255.9090: UDP, length 451\\nE....*@.@............n#.....{'header': {'from_car_id': 'car2', 'proto_type': 'CAM', 'proto_version': 0, 'message_id': 55, 'generated_time': 2.8}, 'body': {'station_id': 0.6239047167283696, 'leader': null, 'speed': -1073741824.0, 'station_characteristics': {'mobile_its_station': false, 'private_its_station': false, 'physical_relevant_its_station': false}, 'reference_position': {'lane': -1073741824, 'position': [-1073741824.0, -1073741824.0, 0], 'elevation': 0, 'heading': 0}}}\\n'""]"
car1,29,2.9,"(None, None)",9.44,-60,,2,878,[],"[""b'14:37:26.155092 IP 192.168.0.1.43570 > 192.168.0.255.9090: UDP, length 427\\nE...7T@.@............2#.....{'header': {'from_car_id': 'car1', 'proto_type': 'CAM', 'proto_version': 0, 'message_id': 56, 'generated_time': 2.9}, 'body': {'station_id': 0.6356462032129672, 'leader': null, 'speed': 5.0, 'station_characteristics': {'mobile_its_station': false, 'private_its_station': false, 'physical_relevant_its_station': false}, 'reference_position': {'lane': 1, 'position': [14.540000000000001, -1.6, 0], 'elevation': 0, 'heading': 0}}}\\n'"", ""b'14:37:26.164229 IP 192.168.0.2.43118 > 192.168.0.255.9090: UDP, length 451\\nE....8@.@............n#...'.{'header': {'from_car_id': 'car2', 'proto_type': 'CAM', 'proto_version': 0, 'message_id': 57, 'generated_time': 2.9}, 'body': {'station_id': 0.7746917082690734, 'leader': null, 'speed': -1073741824.0, 'station_characteristics': {'mobile_its_station': false, 'private_its_station': false, 'physical_relevant_its_station': false}, 'reference_position': {'lane': -1073741824, 'position': [-1073741824.0, -1073741824.0, 0], 'elevation': 0, 'heading': 0}}}\\n'""]"
car1,30,3.0,"(None, None)",9.94,-60,,2,879,[],"[""b'14:37:26.254774 IP 192.168.0.1.43570 > 192.168.0.255.9090: UDP, length 428\\nE...7l@.@..h.........2#.....{'header': {'from_car_id': 'car1', 'proto_type': 'CAM', 'proto_version': 0, 'message_id': 58, 'generated_time': 3.0}, 'body': {'station_id': 0.31209244705816763, 'leader': null, 'speed': 5.0, 'station_characteristics': {'mobile_its_station': false, 'private_its_station': false, 'physical_relevant_its_station': false}, 'reference_position': {'lane': 1, 'position': [15.039999999999997, -1.6, 0], 'elevation': 0, 'heading': 0}}}\\n'"", ""b'14:37:26.263252 IP 192.168.0.2.43118 > 192.168.0.255.9090: UDP, length 451\\nE....N@.@..m.........n#...4.{'header': {'from_car_id': 'car2', 'proto_type': 'CAM', 'proto_version': 0, 'message_id': 59, 'generated_time': 3.0}, 'body': {'station_id': 0.6074705101081458, 'leader': null, 'speed': -1073741824.0, 'station_characteristics': {'mobile_its_station': false, 'private_its_station': false, 'physical_relevant_its_station': false}, 'reference_position': {'lane': -1073741824, 'position': [-1073741824.0, -1073741824.0, 0], 'elevation': 0, 'heading': 0}}}\\n'""]"
car1,31,3.1,"(None, None)",10.44,-60,,2,866,[],"[""b'14:37:26.354886 IP 192.168.0.1.43570 > 192.168.0.255.9090: UDP, length 414\\nE...7o@.@..s.........2#...x3{'header': {'from_car_id': 'car1', 'proto_type': 'CAM', 'proto_version': 0, 'message_id': 60, 'generated_time': 3.1}, 'body': {'station_id': 0.9673796884180624, 'leader': null, 'speed': 5.0, 'station_characteristics': {'mobile_its_station': false, 'private_its_station': false, 'physical_relevant_its_station': false}, 'reference_position': {'lane': 1, 'position': [15.54, -1.6, 0], 'elevation': 0, 'heading': 0}}}\\n'"", ""b'14:37:26.363275 IP 192.168.0.2.43118 > 192.168.0.255.9090: UDP, length 452\\nE....O@.@..k.........n#...[/{'header': {'from_car_id': 'car2', 'proto_type': 'CAM', 'proto_version': 0, 'message_id': 61, 'generated_time': 3.1}, 'body': {'station_id': 0.43496074477499147, 'leader': null, 'speed': -1073741824.0, 'station_characteristics': {'mobile_its_station': false, 'private_its_station': false, 'physical_relevant_its_station': false}, 'reference_position': {'lane': -1073741824, 'position': [-1073741824.0, -1073741824.0, 0], 'elevation': 0, 'heading': 0}}}\\n'""]"
car1,32,3.2,"(None, None)",10.94,-60,,2,865,[],"[""b'14:37:26.455291 IP 192.168.0.1.43570 > 192.168.0.255.9090: UDP, length 413\\nE...7.@.@..\\\\.........2#....L{'header': {'from_car_id': 'car1', 'proto_type': 'CAM', 'proto_version': 0, 'message_id': 62, 'generated_time': 3.2}, 'body': {'station_id': 0.823280746079085, 'leader': null, 'speed': 5.0, 'station_characteristics': {'mobile_its_station': false, 'private_its_station': false, 'physical_relevant_its_station': false}, 'reference_position': {'lane': 1, 'position': [16.04, -1.6, 0], 'elevation': 0, 'heading': 0}}}\\n'"", ""b'14:37:26.463702 IP 192.168.0.2.43118 > 192.168.0.255.9090: UDP, length 452\\nE....V@.@..d.........n#...^5{'header': {'from_car_id': 'car2', 'proto_type': 'CAM', 'proto_version': 0, 'message_id': 63, 'generated_time': 3.2}, 'body': {'station_id': 0.48286102207656956, 'leader': null, 'speed': -1073741824.0, 'station_characteristics': {'mobile_its_station': false, 'private_its_station': false, 'physical_relevant_its_station': false}, 'reference_position': {'lane': -1073741824, 'position': [-1073741824.0, -1073741824.0, 0], 'elevation': 0, 'heading': 0}}}\\n'""]"
car1,33,3.3,"(None, None)",11.44,-60,,2,864,[],"[""b'14:37:26.555791 IP 192.168.0.1.43570 > 192.168.0.255.9090: UDP, length 414\\nE...7.@.@..S.........2#...|2{'header': {'from_car_id': 'car1', 'proto_type': 'CAM', 'proto_version': 0, 'message_id': 64, 'generated_time': 3.3}, 'body': {'station_id': 0.7259244696280572, 'leader': null, 'speed': 5.0, 'station_characteristics': {'mobile_its_station': false, 'private_its_station': false, 'physical_relevant_its_station': false}, 'reference_position': {'lane': 1, 'position': [16.54, -1.6, 0], 'elevation': 0, 'heading': 0}}}\\n'"", ""b'14:37:26.564102 IP 192.168.0.2.43118 > 192.168.0.255.9090: UDP, length 450\\nE...._@.@..].........n#....`{'header': {'from_car_id': 'car2', 'proto_type': 'CAM', 'proto_version': 0, 'message_id': 65, 'generated_time': 3.3}, 'body': {'station_id': 0.635912788587578, 'leader': null, 'speed': -1073741824.0, 'station_characteristics': {'mobile_its_station': false, 'private_its_station': false, 'physical_relevant_its_station': false}, 'reference_position': {'lane': -1073741824, 'position': [-1073741824.0, -1073741824.0, 0], 'elevation': 0, 'heading': 0}}}\\n'""]"
car1,34,3.4,"(None, None)",11.94,-60,,2,866,[],"[""b'14:37:26.655933 IP 192.168.0.1.43570 > 192.168.0.255.9090: UDP, length 414\\nE...7.@.@..:.........2#....7{'header': {'from_car_id': 'car1', 'proto_type': 'CAM', 'proto_version': 0, 'message_id': 66, 'generated_time': 3.4}, 'body': {'station_id': 0.5910151094602587, 'leader': null, 'speed': 5.0, 'station_characteristics': {'mobile_its_station': false, 'private_its_station': false, 'physical_relevant_its_station': false}, 'reference_position': {'lane': 1, 'position': [17.04, -1.6, 0], 'elevation': 0, 'heading': 0}}}\\n'"", ""b'14:37:26.664547 IP 192.168.0.2.43118 > 192.168.0.255.9090: UDP, length 452\\nE....x@.@..B.........n#...e7{'header': {'from_car_id': 'car2', 'proto_type': 'CAM', 'proto_version': 0, 'message_id': 67, 'generated_time': 3.4}, 'body': {'station_id': 0.30660391033305767, 'leader': null, 'speed': -1073741824.0, 'station_characteristics': {'mobile_its_station': false, 'private_its_station': false, 'physical_relevant_its_station': false}, 'reference_position': {'lane': -1073741824, 'position': [-1073741824.0, -1073741824.0, 0], 'elevation': 0, 'heading': 0}}}\\n'""]"
car1,35,3.5,"(None, None)",12.44,-60,,2,866,[],"[""b'14:37:26.756033 IP 192.168.0.1.43570 > 192.168.0.255.9090: UDP, length 414\\nE...7.@.@..&.........2#...z1{'header': {'from_car_id': 'car1', 'proto_type': 'CAM', 'proto_version': 0, 'message_id': 68, 'generated_time': 3.5}, 'body': {'station_id': 0.2894663730392444, 'leader': null, 'speed': 5.0, 'station_characteristics': {'mobile_its_station': false, 'private_its_station': false, 'physical_relevant_its_station': false}, 'reference_position': {'lane': 1, 'position': [17.54, -1.6, 0], 'elevation': 0, 'heading': 0}}}\\n'"", ""b'14:37:26.764415 IP 192.168.0.2.43118 > 192.168.0.255.9090: UDP, length 452\\nE.....@.@..0.........n#...X){'header': {'from_car_id': 'car2', 'proto_type': 'CAM', 'proto_version': 0, 'message_id': 69, 'generated_time': 3.5}, 'body': {'station_id': 0.20732887740478856, 'leader': null, 'speed': -1073741824.0, 'station_characteristics': {'mobile_its_station': false, 'private_its_station': false, 'physical_relevant_its_station': false}, 'reference_position': {'lane': -1073741824, 'position': [-1073741824.0, -1073741824.0, 0], 'elevation': 0, 'heading': 0}}}\\n'""]"
car1,36,3.6,"(None, None)",12.94,-60,,2,867,[],"[""b'14:37:26.856587 IP 192.168.0.1.43570 > 192.168.0.255.9090: UDP, length 415\\nE...7.@.@............2#...h){'header': {'from_car_id': 'car1', 'proto_type': 'CAM', 'proto_version': 0, 'message_id': 70, 'generated_time': 3.6}, 'body': {'station_id': 0.22345614601750086, 'leader': null, 'speed': 5.0, 'station_characteristics': {'mobile_its_station': false, 'private_its_station': false, 'physical_relevant_its_station': false}, 'reference_position': {'lane': 1, 'position': [18.04, -1.6, 0], 'elevation': 0, 'heading': 0}}}\\n'"", ""b'14:37:26.864949 IP 192.168.0.2.43118 > 192.168.0.255.9090: UDP, length 452\\nE.....@.@............n#...N\\'{'header': {'from_car_id': 'car2', 'proto_type': 'CAM', 'proto_version': 0, 'message_id': 71, 'generated_time': 3.6}, 'body': {'station_id': 0.08737765688987609, 'leader': null, 'speed': -1073741824.0, 'station_characteristics': {'mobile_its_station': false, 'private_its_station': false, 'physical_relevant_its_station': false}, 'reference_position': {'lane': -1073741824, 'position': [-1073741824.0, -1073741824.0, 0], 'elevation': 0, 'heading': 0}}}\\n'""]"
car1,37,3.7,"(None, None)",13.44,-60,,2,865,[],"[""b'14:37:26.956922 IP 192.168.0.1.43570 > 192.168.0.255.9090: UDP, length 415\\nE...7.@.@.~..........2#...^.{'header': {'from_car_id': 'car1', 'proto_type': 'CAM', 'proto_version': 0, 'message_id': 72, 'generated_time': 3.7}, 'body': {'station_id': 0.46200284484883647, 'leader': null, 'speed': 5.0, 'station_characteristics': {'mobile_its_station': false, 'private_its_station': false, 'physical_relevant_its_station': false}, 'reference_position': {'lane': 1, 'position': [18.54, -1.6, 0], 'elevation': 0, 'heading': 0}}}\\n'"", ""b'14:37:26.965289 IP 192.168.0.2.43118 > 192.168.0.255.9090: UDP, length 450\\nE.....@.@............n#....r{'header': {'from_car_id': 'car2', 'proto_type': 'CAM', 'proto_version': 0, 'message_id': 73, 'generated_time': 3.7}, 'body': {'station_id': 0.475623305565017, 'leader': null, 'speed': -1073741824.0, 'station_characteristics': {'mobile_its_station': false, 'private_its_station': false, 'physical_relevant_its_station': false}, 'reference_position': {'lane': -1073741824, 'position': [-1073741824.0, -1073741824.0, 0], 'elevation': 0, 'heading': 0}}}\\n'""]"
