STEP;TIME;CAR;LEADER;LEADER_DISTANCE;DRIVING_DISTANCE;TCP_DUMP_MSGS;SIGNAL_STRENGTH
1;0.1s;car1;No leader;No leader;Not initialised;[];-60@car1-wlan1
1;0.1s;car2;No leader;No leader;Not initialised;[];-60@car2-wlan1
2;0.2s;car1;No leader;No leader;Not initialised;"[b'tcpdump: verbose output suppressed, use -v or -vv for full protocol decode\n', b'listening on car1-wlan0, link-type EN10MB (Ethernet), capture size 262144 bytes\n', b'21:03:23.410684 EAPOL key (3) v2, len 95\n', b'..._.................p....<..A....?.9.O.3.~ZC..3...................................................\n', b'21:03:23.410913 EAPOL key (3) v1, len 117\n', b'...u..\n', b'................1N.[...4`\n', b'....I-.Q....J.....................................E.7.""k.i.....,..0.....................\n', b'21:03:23.462176 EAPOL key (3) v2, len 151\n', b'.....................p....<..A....?.9.O.3.~ZC..3.....................................),C..r..w..$.8D..X........T..P.......ny..-..............].V&....!.....\n', b'21:03:23.462284 EAPOL key (3) v1, len 95\n', b'..._..\n', b'..........................................................................gn...i.@p.`4......\n', b'21:03:23.476511 IP6 :: > ff02::16: HBH ICMP6, multicast listener report v2, 1 group record(s), length 28\n', b'`....$..................................:.........m.........................\n', b'21:03:23.681798 IP6 :: > ff02::16: HBH ICMP6, multicast listener report v2, 1 group record(s), length 28\n', b'`....$..................................:.........k.........................\n', b'21:03:24.253047 IP6 fe80::ff:fe00:400 > ff02::16: HBH ICMP6, multicast listener report v2, 1 group record(s), length 28\n', b'`....$..................................:.........j\t........................\n', b'21:03:24.253055 IP6 fe80::ff:fe00:400 > ip6-allrouters: ICMP6, router solicitation, length 16\n', b'`.....:...................................s.............\n', b'21:03:24.273824 IP6 :: > ff02::1:ff00:200: ICMP6, neighbor solicitation, who has fe80::ff:fe00:200, length 32\n', b'`.... :...................................z..........................)..\n', b'21:03:24.366398 IP6 :: > ff02::16: HBH ICMP6, multicast listener report v2, 1 group record(s), length 28\n', b'`....$..................................:.........m.........................\n', b'21:03:24.827192 IP6 fe80::ff:fe00:400 > ff02::16: HBH ICMP6, multicast listener report v2, 1 group record(s), length 28\n', b'`....$..................................:.........j\t........................\n', b'21:03:25.296806 IP6 fe80::ff:fe00:200 > ff02::16: HBH ICMP6, multicast listener report v2, 1 group record(s), length 28\n', b'`....$..................................:.........n\t........................\n', b'21:03:25.296948 IP6 fe80::ff:fe00:200 > ip6-allrouters: ICMP6, router solicitation, length 16\n', b'`.....:...................................w.............\n', b'21:03:25.326831 IP6 fe80::ff:fe00:200 > ff02::16: HBH ICMP6, multicast listener report v2, 1 group record(s), length 28\n', b'`....$..................................:.........n\t........................\n', b'21:03:28.632060 IP6 fe80::ff:fe00:400 > ip6-allrouters: ICMP6, router solicitation, length 16\n', b'`.....:...................................s.............\n', b'21:03:29.648222 IP6 fe80::ff:fe00:200 > ip6-allrouters: ICMP6, router solicitation, length 16\n', b'`.....:...................................w.............\n', b'21:03:31.396448 IP6 :: > ff02::16: HBH ICMP6, multicast listener report v2, 1 group record(s), length 28\n', b'`....$..................................:.........i.........................\n', b'21:03:31.616794 IP6 :: > ff02::16: HBH ICMP6, multicast listener report v2, 2 group record(s), length 48\n', b'`....8..................................:.........mo............................................\n', b'21:03:32.001862 IP6 :: > ff02::1:ff00:1: ICMP6, neighbor solicitation, who has 2001::1, length 32\n', b'`.... :....................................Q.... .................m~.k.`\n', b'21:03:32.222409 IP6 :: > ff02::16: HBH ICMP6, multicast listener report v2, 2 group record(s), length 48\n', b'`....8..................................:.........mo............................................\n', b'21:03:32.230522 IP6 :: > ff02::16: HBH ICMP6, multicast listener report v2, 1 group record(s), length 28\n', b'`....$..................................:.........i.........................\n', b'21:03:32.230573 IP6 :: > ff02::1:ff00:600: ICMP6, neighbor solicitation, who has fe80::ff:fe00:600, length 32\n', b'`.... :...................................s........................X...W\n', b'21:03:32.656503 IP6 :: > ff02::1:ff00:0: ICMP6, neighbor solicitation, who has fe80::ff:fe00:0, length 32\n', b'`.... :...................................\\s...........................""\n', b'21:03:33.202746 IP6 fe80::ff:fe00:600 > ff02::16: HBH ICMP6, multicast listener report v2, 1 group record(s), length 28\n', b'`....$..................................:.........f\t........................\n', b'21:03:33.202811 IP6 fe80::ff:fe00:600 > ip6-allrouters: ICMP6, router solicitation, length 16\n', b'`.....:...................................o.............\n', b'21:03:33.597210 IP6 fe80::ff:fe00:0 > ff02::16: HBH ICMP6, multicast listener report v2, 2 group record(s), length 48\n', b'`....8..................................:.........o.............................................\n', b'21:03:33.597215 IP6 fe80::ff:fe00:0 > ip6-allrouters: ICMP6, router solicitation, length 16\n', b'`.....:...................................{.............\n', b'21:03:34.018916 IP6 fe80::ff:fe00:600 > ff02::16: HBH ICMP6, multicast listener report v2, 1 group record(s), length 28\n', b'`....$..................................:.........f\t........................\n', b'21:03:34.137159 IP6 fe80::ff:fe00:0 > ff02::16: HBH ICMP6, multicast listener report v2, 2 group record(s), length 48\n', b'`....8..................................:.........o.............................................\n', b'21:03:36.851899 IP6 fe80::ff:fe00:400 > ip6-allrouters: ICMP6, router solicitation, length 16\n', b'`.....:...................................s.............\n', b'21:03:37.662950 IP6 fe80::ff:fe00:600 > ip6-allrouters: ICMP6, router solicitation, length 16\n', b'`.....:...................................o.............\n', b'21:03:37.842707 IP6 fe80::ff:fe00:200 > ip6-allrouters: ICMP6, router solicitation, length 16\n', b'`.....:...................................w.............\n', b'21:03:37.850947 IP6 fe80::ff:fe00:0 > ip6-allrouters: ICMP6, router solicitation, length 16\n', b'`.....:...................................{.............\n', b'21:03:39.342034 IP6 fe80::200:ff:fe11:1.mdns > ff02::fb.mdns: 0 [2q] PTR (QM)? _ipps._tcp.local. PTR (QM)? _ipp._tcp.local. (45)\n', b'`....5.......................................5..............._ipps._tcp.local......_ipp......\n', b'21:03:45.777833 IP6 fe80::ff:fe00:0 > ip6-allrouters: ICMP6, router solicitation, length 16\n', b'`.....:...................................{.............\n', b'21:03:46.877051 IP6 fe80::ff:fe00:600 > ip6-allrouters: ICMP6, router solicitation, length 16\n', b'`.....:...................................o.............\n', b'21:03:54.991212 IP6 fe80::ff:fe00:200 > ip6-allrouters: ICMP6, router solicitation, length 16\n', b'`.....:...................................w.............\n', b'21:03:55.001450 IP6 fe80::ff:fe00:400 > ip6-allrouters: ICMP6, router solicitation, length 16\n', b'`.....:...................................s.............\n', b'21:04:01.137975 IP6 fe80::ff:fe00:0 > ip6-allrouters: ICMP6, router solicitation, length 16\n', b'`.....:...................................{.............\n', b'21:04:05.232893 IP6 fe80::ff:fe00:600 > ip6-allrouters: ICMP6, router solicitation, length 16\n', b'`.....:...................................o.............\n', b'21:04:11.433989 IP6 fe80::200:ff:fe11:1.mdns > ff02::fb.mdns: 0 [2q] PTR (QM)? _ipps._tcp.local. PTR (QM)? _ipp._tcp.local. (45)\n', b'`....5.......................................5..............._ipps._tcp.local......_ipp......\n', b'21:04:29.807213 IP6 fe80::ff:fe00:200 > ip6-allrouters: ICMP6, router solicitation, length 16\n', b'`.....:...................................w.............\n', b'21:04:29.853626 IP6 fe80::ff:fe00:400 > ip6-allrouters: ICMP6, router solicitation, length 16\n', b'`.....:...................................s.............\n', b'21:04:33.954830 IP6 fe80::ff:fe00:0 > ip6-allrouters: ICMP6, router solicitation, length 16\n', b'`.....:...................................{.............\n']";-60@car1-wlan1
2;0.2s;car2;No leader;No leader;Not initialised;"[b'tcpdump: verbose output suppressed, use -v or -vv for full protocol decode\n', b'listening on car2-wlan0, link-type EN10MB (Ethernet), capture size 262144 bytes\n', b'21:03:23.131683 EAPOL key (3) v2, len 95\n', b'..._..............]..... ...&8%j$D..........v..\t...................................................\n', b'21:03:23.131892 EAPOL key (3) v1, len 117\n', b'...u..\n', b'..............Xr.v}Ai.. ....3r.)V..W.R.}.q.................................V.a:.jTC.........0.....................\n', b'21:03:23.143327 EAPOL key (3) v2, len 151\n', b'..................]..... ...&8%j$D..........v..\t.................................&...,HI.)........8.4..6....|....g....bC.V...G.....]t.g.Dl\\Dq...K.....t....\n', b'21:03:23.143391 EAPOL key (3) v1, len 95\n', b'..._..\n', b'...........................................................................HG$q...[L.*b.....\n', b'21:03:23.155326 IP6 :: > ff02::16: HBH ICMP6, multicast listener report v2, 1 group record(s), length 28\n', b'`....$..................................:.........k.........................\n', b'21:03:23.233480 IP6 :: > ff02::1:ff00:400: ICMP6, neighbor solicitation, who has fe80::ff:fe00:400, length 32\n', b'`.... :....................................v......................{...c.\n', b'21:03:23.325869 IP6 fe80::200:ff:fe11:1.mdns > ff02::fb.mdns: 0 [2q] PTR (QM)? _ipps._tcp.local. PTR (QM)? _ipp._tcp.local. (45)\n', b'`....5.......................................5..............._ipps._tcp.local......_ipp......\n', b'21:03:23.538967 IP6 :: > ff02::16: HBH ICMP6, multicast listener report v2, 1 group record(s), length 28\n', b'`....$..................................:.........m.........................\n', b'21:03:23.663793 IP6 :: > ff02::16: HBH ICMP6, multicast listener report v2, 1 group record(s), length 28\n', b'`....$..................................:.........k.........................\n', b'21:03:24.239657 IP6 fe80::ff:fe00:400 > ff02::16: HBH ICMP6, multicast listener report v2, 1 group record(s), length 28\n', b'`....$..................................:.........j\t........................\n', b'21:03:24.239801 IP6 fe80::ff:fe00:400 > ip6-allrouters: ICMP6, router solicitation, length 16\n', b'`.....:...................................s.............\n', b'21:03:24.283816 IP6 :: > ff02::1:ff00:200: ICMP6, neighbor solicitation, who has fe80::ff:fe00:200, length 32\n', b'`.... :...................................z..........................)..\n', b'21:03:24.374845 IP6 :: > ff02::16: HBH ICMP6, multicast listener report v2, 1 group record(s), length 28\n', b'`....$..................................:.........m.........................\n', b'21:03:24.813864 IP6 fe80::ff:fe00:400 > ff02::16: HBH ICMP6, multicast listener report v2, 1 group record(s), length 28\n', b'`....$..................................:.........j\t........................\n', b'21:03:25.328562 IP6 fe80::ff:fe00:200 > ff02::16: HBH ICMP6, multicast listener report v2, 1 group record(s), length 28\n', b'`....$..................................:.........n\t........................\n', b'21:03:25.339186 IP6 fe80::ff:fe00:200 > ip6-allrouters: ICMP6, router solicitation, length 16\n', b'`.....:...................................w.............\n', b'21:03:25.339434 IP6 fe80::ff:fe00:200 > ff02::16: HBH ICMP6, multicast listener report v2, 1 group record(s), length 28\n', b'`....$..................................:.........n\t........................\n', b'21:03:28.623496 IP6 fe80::ff:fe00:400 > ip6-allrouters: ICMP6, router solicitation, length 16\n', b'`.....:...................................s.............\n', b'21:03:29.730391 IP6 fe80::ff:fe00:200 > ip6-allrouters: ICMP6, router solicitation, length 16\n', b'`.....:...................................w.............\n', b'21:03:31.396471 IP6 :: > ff02::16: HBH ICMP6, multicast listener report v2, 1 group record(s), length 28\n', b'`....$..................................:.........i.........................\n', b'21:03:31.616802 IP6 :: > ff02::16: HBH ICMP6, multicast listener report v2, 2 group record(s), length 48\n', b'`....8..................................:.........mo............................................\n', b'21:03:32.001941 IP6 :: > ff02::1:ff00:1: ICMP6, neighbor solicitation, who has 2001::1, length 32\n', b'`.... :....................................Q.... .................m~.k.`\n', b'21:03:32.226437 IP6 :: > ff02::16: HBH ICMP6, multicast listener report v2, 2 group record(s), length 48\n', b'`....8..................................:.........mo............................................\n', b'21:03:32.230537 IP6 :: > ff02::16: HBH ICMP6, multicast listener report v2, 1 group record(s), length 28\n', b'`....$..................................:.........i.........................\n', b'21:03:32.230585 IP6 :: > ff02::1:ff00:600: ICMP6, neighbor solicitation, who has fe80::ff:fe00:600, length 32\n', b'`.... :...................................s........................X...W\n', b'21:03:32.656522 IP6 :: > ff02::1:ff00:0: ICMP6, neighbor solicitation, who has fe80::ff:fe00:0, length 32\n', b'`.... :...................................\\s...........................""\n', b'21:03:33.202766 IP6 fe80::ff:fe00:600 > ff02::16: HBH ICMP6, multicast listener report v2, 1 group record(s), length 28\n', b'`....$..................................:.........f\t........................\n', b'21:03:33.202822 IP6 fe80::ff:fe00:600 > ip6-allrouters: ICMP6, router solicitation, length 16\n', b'`.....:...................................o.............\n', b'21:03:33.597221 IP6 fe80::ff:fe00:0 > ff02::16: HBH ICMP6, multicast listener report v2, 2 group record(s), length 48\n', b'`....8..................................:.........o.............................................\n', b'21:03:33.597225 IP6 fe80::ff:fe00:0 > ip6-allrouters: ICMP6, router solicitation, length 16\n', b'`.....:...................................{.............\n', b'21:03:34.018943 IP6 fe80::ff:fe00:600 > ff02::16: HBH ICMP6, multicast listener report v2, 1 group record(s), length 28\n', b'`....$..................................:.........f\t........................\n', b'21:03:34.137180 IP6 fe80::ff:fe00:0 > ff02::16: HBH ICMP6, multicast listener report v2, 2 group record(s), length 48\n', b'`....8..................................:.........o.............................................\n', b'21:03:36.813793 IP6 fe80::ff:fe00:400 > ip6-allrouters: ICMP6, router solicitation, length 16\n', b'`.....:...................................s.............\n', b'21:03:37.662966 IP6 fe80::ff:fe00:600 > ip6-allrouters: ICMP6, router solicitation, length 16\n', b'`.....:...................................o.............\n', b'21:03:37.850968 IP6 fe80::ff:fe00:0 > ip6-allrouters: ICMP6, router solicitation, length 16\n', b'`.....:...................................{.............\n', b'21:03:37.851059 IP6 fe80::ff:fe00:200 > ip6-allrouters: ICMP6, router solicitation, length 16\n', b'`.....:...................................w.............\n', b'21:03:39.342057 IP6 fe80::200:ff:fe11:1.mdns > ff02::fb.mdns: 0 [2q] PTR (QM)? _ipps._tcp.local. PTR (QM)? _ipp._tcp.local. (45)\n', b'`....5.......................................5..............._ipps._tcp.local......_ipp......\n', b'21:03:45.777841 IP6 fe80::ff:fe00:0 > ip6-allrouters: ICMP6, router solicitation, length 16\n', b'`.....:...................................{.............\n', b'21:03:46.877647 IP6 fe80::ff:fe00:600 > ip6-allrouters: ICMP6, router solicitation, length 16\n', b'`.....:...................................o.............\n', b'21:03:54.991231 IP6 fe80::ff:fe00:400 > ip6-allrouters: ICMP6, router solicitation, length 16\n', b'`.....:...................................s.............\n', b'21:03:55.001472 IP6 fe80::ff:fe00:200 > ip6-allrouters: ICMP6, router solicitation, length 16\n', b'`.....:...................................w.............\n', b'21:04:01.137995 IP6 fe80::ff:fe00:0 > ip6-allrouters: ICMP6, router solicitation, length 16\n', b'`.....:...................................{.............\n', b'21:04:05.232910 IP6 fe80::ff:fe00:600 > ip6-allrouters: ICMP6, router solicitation, length 16\n', b'`.....:...................................o.............\n', b'21:04:11.440002 IP6 fe80::200:ff:fe11:1.mdns > ff02::fb.mdns: 0 [2q] PTR (QM)? _ipps._tcp.local. PTR (QM)? _ipp._tcp.local. (45)\n', b'`....5.......................................5..............._ipps._tcp.local......_ipp......\n', b'21:04:29.807193 IP6 fe80::ff:fe00:400 > ip6-allrouters: ICMP6, router solicitation, length 16\n', b'`.....:...................................s.............\n', b'21:04:29.853553 IP6 fe80::ff:fe00:200 > ip6-allrouters: ICMP6, router solicitation, length 16\n', b'`.....:...................................w.............\n', b'21:04:33.954853 IP6 fe80::ff:fe00:0 > ip6-allrouters: ICMP6, router solicitation, length 16\n', b'`.....:...................................{.............\n']";-60@car2-wlan1
3;0.3s;car1;No leader;No leader;Not initialised;[];-60@car1-wlan1
3;0.3s;car2;No leader;No leader;Not initialised;[];-60@car2-wlan1
4;0.4s;car1;No leader;No leader;Not initialised;[];-60@car1-wlan1
4;0.4s;car2;No leader;No leader;Not initialised;[];-60@car2-wlan1
5;0.5s;car1;No leader;No leader;Not initialised;[];-60@car1-wlan1
5;0.5s;car2;No leader;No leader;Not initialised;[];-60@car2-wlan1
6;0.6s;car1;No leader;No leader;Not initialised;[];-60@car1-wlan1
6;0.6s;car2;No leader;No leader;Not initialised;[];-60@car2-wlan1
7;0.7s;car1;No leader;No leader;Not initialised;[];-60@car1-wlan1
7;0.7s;car2;No leader;No leader;Not initialised;[];-60@car2-wlan1
8;0.8s;car1;No leader;No leader;Not initialised;[];-60@car1-wlan1
8;0.8s;car2;No leader;No leader;Not initialised;[];-60@car2-wlan1
9;0.9s;car1;No leader;No leader;Not initialised;[];-60@car1-wlan1
9;0.9s;car2;No leader;No leader;Not initialised;[];-60@car2-wlan1
10;1.0s;car1;No leader;No leader;Not initialised;[];-60@car1-wlan1
10;1.0s;car2;No leader;No leader;Not initialised;[];-60@car2-wlan1
11;1.1s;car1;No leader;No leader;Not initialised;[];-60@car1-wlan1
11;1.1s;car2;No leader;No leader;Not initialised;[];-60@car2-wlan1
12;1.2s;car1;No leader;No leader;0.026000000000000023;[];-60@car1-wlan1
12;1.2s;car2;No leader;No leader;Not initialised;[];-60@car2-wlan1
13;1.3s;car1;No leader;No leader;0.07800000000000007;[];-60@car1-wlan1
13;1.3s;car2;No leader;No leader;Not initialised;[];-60@car2-wlan1
14;1.4s;car1;No leader;No leader;0.15600000000000014;[b'21:04:42.109908 IP6 fe80::ff:fe00:600 > ip6-allrouters: ICMP6, router solicitation, length 16\n', b'`.....:...................................o.............\n'];-60@car1-wlan1
14;1.4s;car2;No leader;No leader;Not initialised;[b'21:04:42.109924 IP6 fe80::ff:fe00:600 > ip6-allrouters: ICMP6, router solicitation, length 16\n', b'`.....:...................................o.............\n'];-60@car2-wlan1
15;1.5s;car1;No leader;No leader;0.26000000000000023;[];-60@car1-wlan1
15;1.5s;car2;No leader;No leader;Not initialised;[];-60@car2-wlan1
16;1.6s;car1;No leader;No leader;0.3900000000000001;[];-60@car1-wlan1
16;1.6s;car2;No leader;No leader;Not initialised;[];-60@car2-wlan1
17;1.7s;car1;No leader;No leader;0.5460000000000003;[];-60@car1-wlan1
17;1.7s;car2;No leader;No leader;Not initialised;[];-60@car2-wlan1
18;1.8s;car1;No leader;No leader;0.7280000000000002;[];-60@car1-wlan1
18;1.8s;car2;No leader;No leader;Not initialised;[];-60@car2-wlan1
19;1.9s;car1;No leader;No leader;0.9360000000000002;[];-60@car1-wlan1
19;1.9s;car2;No leader;No leader;Not initialised;[];-60@car2-wlan1
20;2.0s;car1;No leader;No leader;1.17;[];-60@car1-wlan1
20;2.0s;car2;No leader;No leader;Not initialised;[];-60@car2-wlan1
21;2.1s;car1;No leader;No leader;1.4299999999999997;[];-60@car1-wlan1
21;2.1s;car2;No leader;No leader;Not initialised;[];-60@car2-wlan1
22;2.2s;car1;No leader;No leader;1.7159999999999997;[];-60@car1-wlan1
22;2.2s;car2;No leader;No leader;Not initialised;[];-60@car2-wlan1
23;2.3s;car1;No leader;No leader;2.0279999999999996;[];-60@car1-wlan1
23;2.3s;car2;No leader;No leader;Not initialised;[];-60@car2-wlan1
24;2.4s;car1;No leader;No leader;2.3659999999999997;[];-60@car1-wlan1
24;2.4s;car2;No leader;No leader;Not initialised;[];-60@car2-wlan1
25;2.5s;car1;No leader;No leader;2.7299999999999995;[];-60@car1-wlan1
25;2.5s;car2;No leader;No leader;Not initialised;[];-60@car2-wlan1
26;2.6s;car1;No leader;No leader;3.119999999999999;[];-60@car1-wlan1
26;2.6s;car2;No leader;No leader;Not initialised;[];-60@car2-wlan1
27;2.7s;car1;No leader;No leader;3.5359999999999987;[];-60@car1-wlan1
27;2.7s;car2;No leader;No leader;Not initialised;[];-60@car2-wlan1
28;2.8s;car1;No leader;No leader;3.977999999999999;[];-60@car1-wlan1
28;2.8s;car2;No leader;No leader;Not initialised;[];-60@car2-wlan1
29;2.9s;car1;No leader;No leader;4.445999999999999;[];-60@car1-wlan1
29;2.9s;car2;No leader;No leader;Not initialised;[];-60@car2-wlan1
30;3.0s;car1;No leader;No leader;4.939999999999999;[];-60@car1-wlan1
30;3.0s;car2;No leader;No leader;Not initialised;[];-60@car2-wlan1
31;3.1s;car1;No leader;No leader;5.459999999999998;[];-60@car1-wlan1
31;3.1s;car2;No leader;No leader;Not initialised;[];-60@car2-wlan1
32;3.2s;car1;No leader;No leader;6.005999999999998;[];-60@car1-wlan1
32;3.2s;car2;No leader;No leader;Not initialised;[];-60@car2-wlan1
33;3.3s;car1;No leader;No leader;6.577999999999998;[];-60@car1-wlan1
33;3.3s;car2;No leader;No leader;Not initialised;[];-60@car2-wlan1
34;3.4s;car1;No leader;No leader;7.175999999999997;[];-60@car1-wlan1
34;3.4s;car2;No leader;No leader;Not initialised;[];-60@car2-wlan1
35;3.5s;car1;No leader;No leader;7.799999999999997;[];-60@car1-wlan1
35;3.5s;car2;No leader;No leader;Not initialised;[];-60@car2-wlan1
36;3.6s;car1;No leader;No leader;8.449999999999998;[];-60@car1-wlan1
36;3.6s;car2;No leader;No leader;Not initialised;[];-60@car2-wlan1
37;3.7s;car1;No leader;No leader;9.125999999999998;[];-60@car1-wlan1
37;3.7s;car2;No leader;No leader;Not initialised;[];-60@car2-wlan1
38;3.8s;car1;No leader;No leader;9.827999999999998;[];-60@car1-wlan1
38;3.8s;car2;No leader;No leader;Not initialised;[];-60@car2-wlan1
39;3.9s;car1;No leader;No leader;10.555999999999997;[];-60@car1-wlan1
39;3.9s;car2;No leader;No leader;Not initialised;[];-60@car2-wlan1
40;4.0s;car1;No leader;No leader;11.309999999999997;[];-60@car1-wlan1
40;4.0s;car2;No leader;No leader;Not initialised;[];-60@car2-wlan1
41;4.1s;car1;No leader;No leader;12.089999999999996;[];-60@car1-wlan1
41;4.1s;car2;car1;0.48999999999999666;Not initialised;[];-60@car2-wlan1
42;4.2s;car1;No leader;No leader;12.895999999999995;[];-60@car1-wlan1
42;4.2s;car2;car1;1.269999999999996;0.0259999999999998;[];-60@car2-wlan1
43;4.3s;car1;No leader;No leader;13.727999999999994;[];-60@car1-wlan1
43;4.3s;car2;car1;2.0499999999999954;0.0779999999999994;[];-60@car2-wlan1
44;4.4s;car1;No leader;No leader;14.585999999999993;[];-60@car1-wlan1
44;4.4s;car2;car1;2.829999999999994;0.1559999999999997;[];-60@car2-wlan1
45;4.5s;car1;No leader;No leader;15.469999999999992;[];-60@car1-wlan1
45;4.5s;car2;car1;3.6099999999999923;0.2599999999999998;[];-60@car2-wlan1
46;4.6s;car1;No leader;No leader;16.379999999999992;[];-60@car1-wlan1
46;4.6s;car2;car1;4.389999999999993;0.3899999999999997;[];-60@car2-wlan1
47;4.7s;car1;No leader;No leader;17.315999999999992;[];-60@car1-wlan1
47;4.7s;car2;car1;5.169999999999993;0.5459999999999994;[];-60@car2-wlan1
48;4.8s;car1;No leader;No leader;18.27799999999999;[];-60@car1-wlan1
48;4.8s;car2;car1;5.949999999999992;0.7279999999999998;[];-60@car2-wlan1
49;4.9s;car1;No leader;No leader;19.26599999999999;[];-60@car1-wlan1
49;4.9s;car2;car1;6.7299999999999915;0.9359999999999999;[];-60@car2-wlan1
50;5.0s;car1;No leader;No leader;20.27999999999999;[];-60@car1-wlan1
50;5.0s;car2;car1;7.509999999999991;1.17;[];-60@car2-wlan1
51;5.1s;car1;No leader;No leader;21.31999999999999;[];-60@car1-wlan1
51;5.1s;car2;car1;8.28999999999999;1.4299999999999997;[];-60@car2-wlan1
52;5.2s;car1;No leader;No leader;22.38599999999999;[];-60@car1-wlan1
52;5.2s;car2;car1;9.06999999999999;1.7159999999999993;[];-60@car2-wlan1
53;5.3s;car1;obs;69.22200000000001;23.477999999999987;[];-60@car1-wlan1
53;5.3s;car2;car1;9.849999999999987;2.0279999999999996;[];-60@car2-wlan1
54;5.4s;car1;obs;68.10400000000001;24.595999999999986;[];-60@car1-wlan1
54;5.4s;car2;car1;10.629999999999987;2.3659999999999997;[];-60@car2-wlan1
55;5.5s;car1;obs;66.96000000000002;25.739999999999984;[];-60@car1-wlan1
55;5.5s;car2;car1;11.409999999999986;2.7299999999999995;[];-60@car2-wlan1
56;5.6s;car1;obs;65.79000000000002;26.909999999999982;[];-60@car1-wlan1
56;5.6s;car2;car1;12.189999999999984;3.119999999999999;[];-60@car2-wlan1
57;5.7s;car1;obs;64.59400000000002;28.10599999999998;[];-60@car1-wlan1
57;5.7s;car2;car1;12.969999999999981;3.5359999999999996;[];-60@car2-wlan1
58;5.8s;car1;obs;63.37200000000003;29.327999999999978;[];-60@car1-wlan1
58;5.8s;car2;car1;13.749999999999979;3.9779999999999998;[];-60@car2-wlan1
