STEP;TIME;CAR;LEADER;LEADER_DISTANCE;DRIVING_DISTANCE;TCP_DUMP_MSGS;SIGNAL_STRENGTH
1;0.1s;car1;No leader;No leader;Not initialised;[];-77.0@car1-wlan1
1;0.1s;car2;No leader;No leader;Not initialised;[];-77.0@car2-wlan1
2;0.2s;car1;No leader;No leader;Not initialised;[];-77.0@car1-wlan1
2;0.2s;car2;No leader;No leader;Not initialised;[];-77.0@car2-wlan1
3;0.3s;car1;No leader;No leader;Not initialised;[];-77.0@car1-wlan1
3;0.3s;car2;No leader;No leader;Not initialised;[];-77.0@car2-wlan1
4;0.4s;car1;No leader;No leader;Not initialised;[];-77.0@car1-wlan1
4;0.4s;car2;No leader;No leader;Not initialised;[];-77.0@car2-wlan1
5;0.5s;car1;No leader;No leader;Not initialised;[];-77.0@car1-wlan1
5;0.5s;car2;No leader;No leader;Not initialised;[];-77.0@car2-wlan1
6;0.6s;car1;No leader;No leader;Not initialised;[];-77.0@car1-wlan1
6;0.6s;car2;No leader;No leader;Not initialised;[];-77.0@car2-wlan1
7;0.7s;car1;No leader;No leader;Not initialised;"[b'14:56:44.395370 IP 192.168.1.1.33197 > 192.168.1.255.9090: UDP, length 97\n', b'E..}Y.@.@.\\f..........#..iC.CAM::192.168.1.1::{""time"": ""0.2"", ""position"": ""(1.0, -4.8, 0)"", ""speed"": ""0.0"", ""leader"": ""None""}\n', b'14:56:44.402344 IP 192.168.1.2.34202 > 192.168.1.255.9090: UDP, length 126\n', b'E...d.@.@.Qn..........#.....CAM::192.168.1.2::{""time"": ""0.2"", ""position"": ""(-1073741824.0, -1073741824.0, 0)"", ""speed"": ""-1073741824.0"", ""leader"": ""None""}\n', b'14:56:44.545708 IP 192.168.1.1.33197 > 192.168.1.255.9090: UDP, length 97\n', b'E..}Y.@.@.\\G..........#..iB.CAM::192.168.1.1::{""time"": ""0.3"", ""position"": ""(1.0, -4.8, 0)"", ""speed"": ""0.0"", ""leader"": ""None""}\n', b'14:56:44.550440 IP 192.168.1.2.34202 > 192.168.1.255.9090: UDP, length 126\n', b'E...d.@.@.Q]..........#.....CAM::192.168.1.2::{""time"": ""0.3"", ""position"": ""(-1073741824.0, -1073741824.0, 0)"", ""speed"": ""-1073741824.0"", ""leader"": ""None""}\n', b'14:56:44.746451 IP 192.168.1.1.33197 > 192.168.1.255.9090: UDP, length 97\n', b'E..}Y.@.@.\\C..........#..iA.CAM::192.168.1.1::{""time"": ""0.4"", ""position"": ""(1.0, -4.8, 0)"", ""speed"": ""0.0"", ""leader"": ""None""}\n', b'14:56:44.751954 IP 192.168.1.2.34202 > 192.168.1.255.9090: UDP, length 126\n', b'E...d.@.@.QR..........#.....CAM::192.168.1.2::{""time"": ""0.4"", ""position"": ""(-1073741824.0, -1073741824.0, 0)"", ""speed"": ""-1073741824.0"", ""leader"": ""None""}\n', b'14:56:44.896668 IP 192.168.1.1.33197 > 192.168.1.255.9090: UDP, length 97\n', b'E..}Y.@.@.\\;..........#..i@.CAM::192.168.1.1::{""time"": ""0.5"", ""position"": ""(1.0, -4.8, 0)"", ""speed"": ""0.0"", ""leader"": ""None""}\n', b'14:56:44.901235 IP 192.168.1.2.34202 > 192.168.1.255.9090: UDP, length 126\n', b'E...d.@.@.QL..........#.....CAM::192.168.1.2::{""time"": ""0.5"", ""position"": ""(-1073741824.0, -1073741824.0, 0)"", ""speed"": ""-1073741824.0"", ""leader"": ""None""}\n', b'14:56:45.046805 IP 192.168.1.1.33197 > 192.168.1.255.9090: UDP, length 97\n', b'E..}Y.@.@.\\2..........#..i?.CAM::192.168.1.1::{""time"": ""0.6"", ""position"": ""(1.0, -4.8, 0)"", ""speed"": ""0.0"", ""leader"": ""None""}\n', b'14:56:45.051250 IP 192.168.1.2.34202 > 192.168.1.255.9090: UDP, length 126\n', b'E...d.@.@.Q2..........#.....CAM::192.168.1.2::{""time"": ""0.6"", ""position"": ""(-1073741824.0, -1073741824.0, 0)"", ""speed"": ""-1073741824.0"", ""leader"": ""None""}\n']";-77.0@car1-wlan1
7;0.7s;car2;No leader;No leader;Not initialised;"[b'14:56:44.398327 IP 192.168.1.2.34202 > 192.168.1.255.9090: UDP, length 126\n', b'E...d.@.@.Qn..........#.....CAM::192.168.1.2::{""time"": ""0.2"", ""position"": ""(-1073741824.0, -1073741824.0, 0)"", ""speed"": ""-1073741824.0"", ""leader"": ""None""}\n', b'14:56:44.399364 IP 192.168.1.1.33197 > 192.168.1.255.9090: UDP, length 97\n', b'E..}Y.@.@.\\f..........#..iC.CAM::192.168.1.1::{""time"": ""0.2"", ""position"": ""(1.0, -4.8, 0)"", ""speed"": ""0.0"", ""leader"": ""None""}\n', b'14:56:44.547446 IP 192.168.1.2.34202 > 192.168.1.255.9090: UDP, length 126\n', b'E...d.@.@.Q]..........#.....CAM::192.168.1.2::{""time"": ""0.3"", ""position"": ""(-1073741824.0, -1073741824.0, 0)"", ""speed"": ""-1073741824.0"", ""leader"": ""None""}\n', b'14:56:44.548141 IP 192.168.1.1.33197 > 192.168.1.255.9090: UDP, length 97\n', b'E..}Y.@.@.\\G..........#..iB.CAM::192.168.1.1::{""time"": ""0.3"", ""position"": ""(1.0, -4.8, 0)"", ""speed"": ""0.0"", ""leader"": ""None""}\n', b'14:56:44.748848 IP 192.168.1.1.33197 > 192.168.1.255.9090: UDP, length 97\n', b'E..}Y.@.@.\\C..........#..iA.CAM::192.168.1.1::{""time"": ""0.4"", ""position"": ""(1.0, -4.8, 0)"", ""speed"": ""0.0"", ""leader"": ""None""}\n', b'14:56:44.749151 IP 192.168.1.2.34202 > 192.168.1.255.9090: UDP, length 126\n', b'E...d.@.@.QR..........#.....CAM::192.168.1.2::{""time"": ""0.4"", ""position"": ""(-1073741824.0, -1073741824.0, 0)"", ""speed"": ""-1073741824.0"", ""leader"": ""None""}\n', b'14:56:44.898280 IP 192.168.1.2.34202 > 192.168.1.255.9090: UDP, length 126\n', b'E...d.@.@.QL..........#.....CAM::192.168.1.2::{""time"": ""0.5"", ""position"": ""(-1073741824.0, -1073741824.0, 0)"", ""speed"": ""-1073741824.0"", ""leader"": ""None""}\n', b'14:56:44.899161 IP 192.168.1.1.33197 > 192.168.1.255.9090: UDP, length 97\n', b'E..}Y.@.@.\\;..........#..i@.CAM::192.168.1.1::{""time"": ""0.5"", ""position"": ""(1.0, -4.8, 0)"", ""speed"": ""0.0"", ""leader"": ""None""}\n', b'14:56:45.048360 IP 192.168.1.2.34202 > 192.168.1.255.9090: UDP, length 126\n', b'E...d.@.@.Q2..........#.....CAM::192.168.1.2::{""time"": ""0.6"", ""position"": ""(-1073741824.0, -1073741824.0, 0)"", ""speed"": ""-1073741824.0"", ""leader"": ""None""}\n', b'14:56:45.049047 IP 192.168.1.1.33197 > 192.168.1.255.9090: UDP, length 97\n', b'E..}Y.@.@.\\2..........#..i?.CAM::192.168.1.1::{""time"": ""0.6"", ""position"": ""(1.0, -4.8, 0)"", ""speed"": ""0.0"", ""leader"": ""None""}\n']";-77.0@car2-wlan1
8;0.8s;car1;No leader;No leader;Not initialised;[];-77.0@car1-wlan1
8;0.8s;car2;No leader;No leader;Not initialised;[];-77.0@car2-wlan1
9;0.9s;car1;No leader;No leader;Not initialised;[];-77.0@car1-wlan1
9;0.9s;car2;No leader;No leader;Not initialised;[];-77.0@car2-wlan1
10;1.0s;car1;No leader;No leader;Not initialised;[];-77.0@car1-wlan1
10;1.0s;car2;No leader;No leader;Not initialised;[];-77.0@car2-wlan1
11;1.1s;car1;No leader;No leader;Not initialised;[];-77.0@car1-wlan1
11;1.1s;car2;No leader;No leader;Not initialised;[];-77.0@car2-wlan1
12;1.2s;car1;No leader;No leader;0.026000000000000023;[];-77.0@car1-wlan1
12;1.2s;car2;No leader;No leader;Not initialised;[];-77.0@car2-wlan1
13;1.3s;car1;No leader;No leader;0.07800000000000007;"[b'14:56:45.247604 IP 192.168.1.1.33197 > 192.168.1.255.9090: UDP, length 97\n', b'E..}Z.@.@.\\...........#..i>.CAM::192.168.1.1::{""time"": ""0.7"", ""position"": ""(1.0, -4.8, 0)"", ""speed"": ""0.0"", ""leader"": ""None""}\n', b'14:56:45.253019 IP 192.168.1.2.34202 > 192.168.1.255.9090: UDP, length 126\n', b'E...d.@.@.Q(..........#.....CAM::192.168.1.2::{""time"": ""0.7"", ""position"": ""(-1073741824.0, -1073741824.0, 0)"", ""speed"": ""-1073741824.0"", ""leader"": ""None""}\n', b'14:56:45.397405 IP 192.168.1.1.33197 > 192.168.1.255.9090: UDP, length 97\n', b'E..}Z.@.@.[...........#..i=.CAM::192.168.1.1::{""time"": ""0.8"", ""position"": ""(1.0, -4.8, 0)"", ""speed"": ""0.0"", ""leader"": ""None""}\n', b'14:56:45.402775 IP 192.168.1.2.34202 > 192.168.1.255.9090: UDP, length 126\n', b'E...d.@.@.Q""..........#.....CAM::192.168.1.2::{""time"": ""0.8"", ""position"": ""(-1073741824.0, -1073741824.0, 0)"", ""speed"": ""-1073741824.0"", ""leader"": ""None""}\n', b'14:56:45.597103 IP 192.168.1.1.33197 > 192.168.1.255.9090: UDP, length 97\n', b'E..}ZA@.@.[...........#..i<.CAM::192.168.1.1::{""time"": ""0.9"", ""position"": ""(1.0, -4.8, 0)"", ""speed"": ""0.0"", ""leader"": ""None""}\n', b'14:56:45.601694 IP 192.168.1.2.34202 > 192.168.1.255.9090: UDP, length 126\n', b'E...e\t@.@.P...........#.....CAM::192.168.1.2::{""time"": ""0.9"", ""position"": ""(-1073741824.0, -1073741824.0, 0)"", ""speed"": ""-1073741824.0"", ""leader"": ""None""}\n', b'14:56:45.747158 IP 192.168.1.1.33197 > 192.168.1.255.9090: UDP, length 97\n', b'E..}Z_@.@.[...........#..iD.CAM::192.168.1.1::{""time"": ""1.0"", ""position"": ""(1.0, -4.8, 0)"", ""speed"": ""0.0"", ""leader"": ""None""}\n', b'14:56:45.752840 IP 192.168.1.2.34202 > 192.168.1.255.9090: UDP, length 126\n', b'E...e.@.@.P...........#.....CAM::192.168.1.2::{""time"": ""1.0"", ""position"": ""(-1073741824.0, -1073741824.0, 0)"", ""speed"": ""-1073741824.0"", ""leader"": ""None""}\n', b'14:56:45.947257 IP 192.168.1.1.33197 > 192.168.1.255.9090: UDP, length 97\n', b'E..}Z.@.@.[...........#..iC.CAM::192.168.1.1::{""time"": ""1.1"", ""position"": ""(1.0, -4.8, 0)"", ""speed"": ""0.0"", ""leader"": ""None""}\n', b'14:56:45.952246 IP 192.168.1.2.34202 > 192.168.1.255.9090: UDP, length 126\n', b'E...e4@.@.P...........#.....CAM::192.168.1.2::{""time"": ""1.1"", ""position"": ""(-1073741824.0, -1073741824.0, 0)"", ""speed"": ""-1073741824.0"", ""leader"": ""None""}\n', b'14:56:46.097514 IP 192.168.1.1.33197 > 192.168.1.255.9090: UDP, length 100\n', b'E...Z.@.@.[...........#..l..CAM::192.168.1.1::{""time"": ""1.2"", ""position"": ""(1.026, -4.8, 0)"", ""speed"": ""0.26"", ""leader"": ""None""}\n', b'14:56:46.102871 IP 192.168.1.2.34202 > 192.168.1.255.9090: UDP, length 126\n', b'E...eD@.@.P...........#.....CAM::192.168.1.2::{""time"": ""1.2"", ""position"": ""(-1073741824.0, -1073741824.0, 0)"", ""speed"": ""-1073741824.0"", ""leader"": ""None""}\n']";-77.0@car1-wlan1
13;1.3s;car2;No leader;No leader;Not initialised;"[b'14:56:45.249236 IP 192.168.1.2.34202 > 192.168.1.255.9090: UDP, length 126\n', b'E...d.@.@.Q(..........#.....CAM::192.168.1.2::{""time"": ""0.7"", ""position"": ""(-1073741824.0, -1073741824.0, 0)"", ""speed"": ""-1073741824.0"", ""leader"": ""None""}\n', b'14:56:45.249934 IP 192.168.1.1.33197 > 192.168.1.255.9090: UDP, length 97\n', b'E..}Z.@.@.\\...........#..i>.CAM::192.168.1.1::{""time"": ""0.7"", ""position"": ""(1.0, -4.8, 0)"", ""speed"": ""0.0"", ""leader"": ""None""}\n', b'14:56:45.399204 IP 192.168.1.2.34202 > 192.168.1.255.9090: UDP, length 126\n', b'E...d.@.@.Q""..........#.....CAM::192.168.1.2::{""time"": ""0.8"", ""position"": ""(-1073741824.0, -1073741824.0, 0)"", ""speed"": ""-1073741824.0"", ""leader"": ""None""}\n', b'14:56:45.399929 IP 192.168.1.1.33197 > 192.168.1.255.9090: UDP, length 97\n', b'E..}Z.@.@.[...........#..i=.CAM::192.168.1.1::{""time"": ""0.8"", ""position"": ""(1.0, -4.8, 0)"", ""speed"": ""0.0"", ""leader"": ""None""}\n', b'14:56:45.599113 IP 192.168.1.2.34202 > 192.168.1.255.9090: UDP, length 126\n', b'E...e\t@.@.P...........#.....CAM::192.168.1.2::{""time"": ""0.9"", ""position"": ""(-1073741824.0, -1073741824.0, 0)"", ""speed"": ""-1073741824.0"", ""leader"": ""None""}\n', b'14:56:45.599665 IP 192.168.1.1.33197 > 192.168.1.255.9090: UDP, length 97\n', b'E..}ZA@.@.[...........#..i<.CAM::192.168.1.1::{""time"": ""0.9"", ""position"": ""(1.0, -4.8, 0)"", ""speed"": ""0.0"", ""leader"": ""None""}\n', b'14:56:45.748694 IP 192.168.1.2.34202 > 192.168.1.255.9090: UDP, length 126\n', b'E...e.@.@.P...........#.....CAM::192.168.1.2::{""time"": ""1.0"", ""position"": ""(-1073741824.0, -1073741824.0, 0)"", ""speed"": ""-1073741824.0"", ""leader"": ""None""}\n', b'14:56:45.750540 IP 192.168.1.1.33197 > 192.168.1.255.9090: UDP, length 97\n', b'E..}Z_@.@.[...........#..iD.CAM::192.168.1.1::{""time"": ""1.0"", ""position"": ""(1.0, -4.8, 0)"", ""speed"": ""0.0"", ""leader"": ""None""}\n', b'14:56:45.949094 IP 192.168.1.2.34202 > 192.168.1.255.9090: UDP, length 126\n', b'E...e4@.@.P...........#.....CAM::192.168.1.2::{""time"": ""1.1"", ""position"": ""(-1073741824.0, -1073741824.0, 0)"", ""speed"": ""-1073741824.0"", ""leader"": ""None""}\n', b'14:56:45.949642 IP 192.168.1.1.33197 > 192.168.1.255.9090: UDP, length 97\n', b'E..}Z.@.@.[...........#..iC.CAM::192.168.1.1::{""time"": ""1.1"", ""position"": ""(1.0, -4.8, 0)"", ""speed"": ""0.0"", ""leader"": ""None""}\n', b'14:56:46.099033 IP 192.168.1.2.34202 > 192.168.1.255.9090: UDP, length 126\n', b'E...eD@.@.P...........#.....CAM::192.168.1.2::{""time"": ""1.2"", ""position"": ""(-1073741824.0, -1073741824.0, 0)"", ""speed"": ""-1073741824.0"", ""leader"": ""None""}\n', b'14:56:46.099766 IP 192.168.1.1.33197 > 192.168.1.255.9090: UDP, length 100\n', b'E...Z.@.@.[...........#..l..CAM::192.168.1.1::{""time"": ""1.2"", ""position"": ""(1.026, -4.8, 0)"", ""speed"": ""0.26"", ""leader"": ""None""}\n']";-77.0@car2-wlan1
14;1.4s;car1;No leader;No leader;0.15600000000000014;[];-77.0@car1-wlan1
14;1.4s;car2;No leader;No leader;Not initialised;[];-77.0@car2-wlan1
15;1.5s;car1;No leader;No leader;0.26000000000000023;[];-77.0@car1-wlan1
15;1.5s;car2;No leader;No leader;Not initialised;[];-77.0@car2-wlan1
16;1.6s;car1;No leader;No leader;0.3900000000000001;[];-77.0@car1-wlan1
16;1.6s;car2;No leader;No leader;Not initialised;[];-77.0@car2-wlan1
17;1.7s;car1;No leader;No leader;0.5460000000000003;"[b'14:56:46.297241 IP 192.168.1.1.33197 > 192.168.1.255.9090: UDP, length 100\n', b'E...Z.@.@.[Z..........#..l..CAM::192.168.1.1::{""time"": ""1.3"", ""position"": ""(1.078, -4.8, 0)"", ""speed"": ""0.52"", ""leader"": ""None""}\n', b'14:56:46.305103 IP 192.168.1.2.34202 > 192.168.1.255.9090: UDP, length 126\n', b'E...e]@.@.P...........#.....CAM::192.168.1.2::{""time"": ""1.3"", ""position"": ""(-1073741824.0, -1073741824.0, 0)"", ""speed"": ""-1073741824.0"", ""leader"": ""None""}\n', b'14:56:46.497480 IP 192.168.1.1.33197 > 192.168.1.255.9090: UDP, length 113\n', b'E...Z.@.@.[...........#..y^.CAM::192.168.1.1::{""time"": ""1.4"", ""position"": ""(1.1560000000000001, -4.8, 0)"", ""speed"": ""0.78"", ""leader"": ""None""}\n', b'14:56:46.502834 IP 192.168.1.2.34202 > 192.168.1.255.9090: UDP, length 126\n', b'E...ex@.@.P...........#.....CAM::192.168.1.2::{""time"": ""1.4"", ""position"": ""(-1073741824.0, -1073741824.0, 0)"", ""speed"": ""-1073741824.0"", ""leader"": ""None""}\n', b'14:56:46.697561 IP 192.168.1.1.33197 > 192.168.1.255.9090: UDP, length 113\n', b'E...[#@.@.Z...........#..yf.CAM::192.168.1.1::{""time"": ""1.5"", ""position"": ""(1.2600000000000002, -4.8, 0)"", ""speed"": ""1.04"", ""leader"": ""None""}\n', b'14:56:46.703389 IP 192.168.1.2.34202 > 192.168.1.255.9090: UDP, length 126\n', b'E...e.@.@.PX..........#.....CAM::192.168.1.2::{""time"": ""1.5"", ""position"": ""(-1073741824.0, -1073741824.0, 0)"", ""speed"": ""-1073741824.0"", ""leader"": ""None""}\n', b'14:56:46.847257 IP 192.168.1.1.33197 > 192.168.1.255.9090: UDP, length 112\n', b'E...[0@.@.Z...........#..x:.CAM::192.168.1.1::{""time"": ""1.6"", ""position"": ""(1.3900000000000001, -4.8, 0)"", ""speed"": ""1.3"", ""leader"": ""None""}\n', b'14:56:46.852346 IP 192.168.1.2.34202 > 192.168.1.255.9090: UDP, length 126\n', b'E...e.@.@.P?..........#.....CAM::192.168.1.2::{""time"": ""1.6"", ""position"": ""(-1073741824.0, -1073741824.0, 0)"", ""speed"": ""-1073741824.0"", ""leader"": ""None""}\n']";-77.0@car1-wlan1
17;1.7s;car2;No leader;No leader;Not initialised;"[b'14:56:46.299135 IP 192.168.1.2.34202 > 192.168.1.255.9090: UDP, length 126\n', b'E...e]@.@.P...........#.....CAM::192.168.1.2::{""time"": ""1.3"", ""position"": ""(-1073741824.0, -1073741824.0, 0)"", ""speed"": ""-1073741824.0"", ""leader"": ""None""}\n', b'14:56:46.299616 IP 192.168.1.1.33197 > 192.168.1.255.9090: UDP, length 100\n', b'E...Z.@.@.[Z..........#..l..CAM::192.168.1.1::{""time"": ""1.3"", ""position"": ""(1.078, -4.8, 0)"", ""speed"": ""0.52"", ""leader"": ""None""}\n', b'14:56:46.499046 IP 192.168.1.2.34202 > 192.168.1.255.9090: UDP, length 126\n', b'E...ex@.@.P...........#.....CAM::192.168.1.2::{""time"": ""1.4"", ""position"": ""(-1073741824.0, -1073741824.0, 0)"", ""speed"": ""-1073741824.0"", ""leader"": ""None""}\n', b'14:56:46.499849 IP 192.168.1.1.33197 > 192.168.1.255.9090: UDP, length 113\n', b'E...Z.@.@.[...........#..y^.CAM::192.168.1.1::{""time"": ""1.4"", ""position"": ""(1.1560000000000001, -4.8, 0)"", ""speed"": ""0.78"", ""leader"": ""None""}\n', b'14:56:46.699525 IP 192.168.1.2.34202 > 192.168.1.255.9090: UDP, length 126\n', b'E...e.@.@.PX..........#.....CAM::192.168.1.2::{""time"": ""1.5"", ""position"": ""(-1073741824.0, -1073741824.0, 0)"", ""speed"": ""-1073741824.0"", ""leader"": ""None""}\n', b'14:56:46.700140 IP 192.168.1.1.33197 > 192.168.1.255.9090: UDP, length 113\n', b'E...[#@.@.Z...........#..yf.CAM::192.168.1.1::{""time"": ""1.5"", ""position"": ""(1.2600000000000002, -4.8, 0)"", ""speed"": ""1.04"", ""leader"": ""None""}\n', b'14:56:46.849285 IP 192.168.1.2.34202 > 192.168.1.255.9090: UDP, length 126\n', b'E...e.@.@.P?..........#.....CAM::192.168.1.2::{""time"": ""1.6"", ""position"": ""(-1073741824.0, -1073741824.0, 0)"", ""speed"": ""-1073741824.0"", ""leader"": ""None""}\n', b'14:56:46.849662 IP 192.168.1.1.33197 > 192.168.1.255.9090: UDP, length 112\n', b'E...[0@.@.Z...........#..x:.CAM::192.168.1.1::{""time"": ""1.6"", ""position"": ""(1.3900000000000001, -4.8, 0)"", ""speed"": ""1.3"", ""leader"": ""None""}\n']";-77.0@car2-wlan1
18;1.8s;car1;No leader;No leader;0.7280000000000002;[];-77.0@car1-wlan1
18;1.8s;car2;No leader;No leader;Not initialised;[];-77.0@car2-wlan1
19;1.9s;car1;No leader;No leader;0.9360000000000002;[];-77.0@car1-wlan1
19;1.9s;car2;No leader;No leader;Not initialised;[];-77.0@car2-wlan1
20;2.0s;car1;No leader;No leader;1.17;[];-77.0@car1-wlan1
20;2.0s;car2;No leader;No leader;Not initialised;[];-77.0@car2-wlan1
21;2.1s;car1;No leader;No leader;1.4299999999999997;"[b'14:56:47.247782 IP 192.168.1.1.33197 > 192.168.1.255.9090: UDP, length 113\n', b'E...[.@.@.Z}..........#..yY.CAM::192.168.1.1::{""time"": ""1.7"", ""position"": ""(1.5460000000000003, -4.8, 0)"", ""speed"": ""1.56"", ""leader"": ""None""}\n', b'14:56:47.254841 IP 192.168.1.2.34202 > 192.168.1.255.9090: UDP, length 126\n', b'E...f.@.@.O...........#.....CAM::192.168.1.2::{""time"": ""1.7"", ""position"": ""(-1073741824.0, -1073741824.0, 0)"", ""speed"": ""-1073741824.0"", ""leader"": ""None""}\n', b'14:56:47.397901 IP 192.168.1.1.33197 > 192.168.1.255.9090: UDP, length 113\n', b'E...[.@.@.ZX..........#..yX.CAM::192.168.1.1::{""time"": ""1.8"", ""position"": ""(1.7280000000000004, -4.8, 0)"", ""speed"": ""1.82"", ""leader"": ""None""}\n', b'14:56:47.402338 IP 192.168.1.2.34202 > 192.168.1.255.9090: UDP, length 126\n', b'E...f$@.@.O...........#.....CAM::192.168.1.2::{""time"": ""1.8"", ""position"": ""(-1073741824.0, -1073741824.0, 0)"", ""speed"": ""-1073741824.0"", ""leader"": ""None""}\n', b'14:56:47.598316 IP 192.168.1.1.33197 > 192.168.1.255.9090: UDP, length 113\n', b'E...[.@.@.ZE..........#..yQ.CAM::192.168.1.1::{""time"": ""1.9"", ""position"": ""(1.9360000000000002, -4.8, 0)"", ""speed"": ""2.08"", ""leader"": ""None""}\n', b'14:56:47.603675 IP 192.168.1.2.34202 > 192.168.1.255.9090: UDP, length 126\n', b'E...fF@.@.O...........#.....CAM::192.168.1.2::{""time"": ""1.9"", ""position"": ""(-1073741824.0, -1073741824.0, 0)"", ""speed"": ""-1073741824.0"", ""leader"": ""None""}\n', b'14:56:47.748822 IP 192.168.1.1.33197 > 192.168.1.255.9090: UDP, length 99\n', b'E...[.@.@.ZP..........#..k.#CAM::192.168.1.1::{""time"": ""2.0"", ""position"": ""(2.17, -4.8, 0)"", ""speed"": ""2.34"", ""leader"": ""None""}\n', b'14:56:47.754306 IP 192.168.1.2.34202 > 192.168.1.255.9090: UDP, length 126\n', b'E...fb@.@.O...........#.....CAM::192.168.1.2::{""time"": ""2.0"", ""position"": ""(-1073741824.0, -1073741824.0, 0)"", ""speed"": ""-1073741824.0"", ""leader"": ""None""}\n']";-77.0@car1-wlan1
21;2.1s;car2;No leader;No leader;Not initialised;"[b'14:56:47.249646 IP 192.168.1.2.34202 > 192.168.1.255.9090: UDP, length 126\n', b'E...f.@.@.O...........#.....CAM::192.168.1.2::{""time"": ""1.7"", ""position"": ""(-1073741824.0, -1073741824.0, 0)"", ""speed"": ""-1073741824.0"", ""leader"": ""None""}\n', b'14:56:47.250094 IP 192.168.1.1.33197 > 192.168.1.255.9090: UDP, length 113\n', b'E...[.@.@.Z}..........#..yY.CAM::192.168.1.1::{""time"": ""1.7"", ""position"": ""(1.5460000000000003, -4.8, 0)"", ""speed"": ""1.56"", ""leader"": ""None""}\n', b'14:56:47.399536 IP 192.168.1.2.34202 > 192.168.1.255.9090: UDP, length 126\n', b'E...f$@.@.O...........#.....CAM::192.168.1.2::{""time"": ""1.8"", ""position"": ""(-1073741824.0, -1073741824.0, 0)"", ""speed"": ""-1073741824.0"", ""leader"": ""None""}\n', b'14:56:47.400205 IP 192.168.1.1.33197 > 192.168.1.255.9090: UDP, length 113\n', b'E...[.@.@.ZX..........#..yX.CAM::192.168.1.1::{""time"": ""1.8"", ""position"": ""(1.7280000000000004, -4.8, 0)"", ""speed"": ""1.82"", ""leader"": ""None""}\n', b'14:56:47.600795 IP 192.168.1.2.34202 > 192.168.1.255.9090: UDP, length 126\n', b'E...fF@.@.O...........#.....CAM::192.168.1.2::{""time"": ""1.9"", ""position"": ""(-1073741824.0, -1073741824.0, 0)"", ""speed"": ""-1073741824.0"", ""leader"": ""None""}\n', b'14:56:47.600960 IP 192.168.1.1.33197 > 192.168.1.255.9090: UDP, length 113\n', b'E...[.@.@.ZE..........#..yQ.CAM::192.168.1.1::{""time"": ""1.9"", ""position"": ""(1.9360000000000002, -4.8, 0)"", ""speed"": ""2.08"", ""leader"": ""None""}\n', b'14:56:47.751067 IP 192.168.1.1.33197 > 192.168.1.255.9090: UDP, length 99\n', b'E...[.@.@.ZP..........#..k.#CAM::192.168.1.1::{""time"": ""2.0"", ""position"": ""(2.17, -4.8, 0)"", ""speed"": ""2.34"", ""leader"": ""None""}\n', b'14:56:47.751489 IP 192.168.1.2.34202 > 192.168.1.255.9090: UDP, length 126\n', b'E...fb@.@.O...........#.....CAM::192.168.1.2::{""time"": ""2.0"", ""position"": ""(-1073741824.0, -1073741824.0, 0)"", ""speed"": ""-1073741824.0"", ""leader"": ""None""}\n']";-77.0@car2-wlan1
22;2.2s;car1;No leader;No leader;1.7159999999999997;[];-77.0@car1-wlan1
22;2.2s;car2;No leader;No leader;Not initialised;[];-77.0@car2-wlan1
23;2.3s;car1;No leader;No leader;2.0279999999999996;[];-77.0@car1-wlan1
23;2.3s;car2;No leader;No leader;Not initialised;[];-77.0@car2-wlan1
24;2.4s;car1;No leader;No leader;2.3659999999999997;[];-77.0@car1-wlan1
24;2.4s;car2;No leader;No leader;Not initialised;[];-77.0@car2-wlan1
25;2.5s;car1;No leader;No leader;2.7299999999999995;[];-77.0@car1-wlan1
25;2.5s;car2;No leader;No leader;Not initialised;[];-77.0@car2-wlan1
26;2.6s;car1;No leader;No leader;3.119999999999999;[];-77.0@car1-wlan1
26;2.6s;car2;No leader;No leader;Not initialised;[];-77.0@car2-wlan1
27;2.7s;car1;No leader;No leader;3.5359999999999987;[];-77.0@car1-wlan1
27;2.7s;car2;No leader;No leader;Not initialised;[];-77.0@car2-wlan1
28;2.8s;car1;No leader;No leader;3.977999999999999;"[b'14:57:04.949216 IP 192.168.1.1.33197 > 192.168.1.255.9090: UDP, length 127\n', b'E...lq@.@.I...........#.....CAM::192.168.1.1::{""time"": ""2.1"", ""position"": ""(2.4299999999999997, -4.8, 0)"", ""speed"": ""2.5999999999999996"", ""leader"": ""None""}\n', b'14:57:04.957495 IP 192.168.1.2.34202 > 192.168.1.255.9090: UDP, length 126\n', b'E...n.@.@.G...........#.....CAM::192.168.1.2::{""time"": ""2.1"", ""position"": ""(-1073741824.0, -1073741824.0, 0)"", ""speed"": ""-1073741824.0"", ""leader"": ""None""}\n', b'14:57:05.049482 IP 192.168.1.1.33197 > 192.168.1.255.9090: UDP, length 127\n', b'E...l.@.@.Iw..........#.....CAM::192.168.1.1::{""time"": ""2.2"", ""position"": ""(2.7159999999999997, -4.8, 0)"", ""speed"": ""2.8599999999999994"", ""leader"": ""None""}\n', b'14:57:05.054685 IP 192.168.1.2.34202 > 192.168.1.255.9090: UDP, length 126\n', b'E...o.@.@.F...........#.....CAM::192.168.1.2::{""time"": ""2.2"", ""position"": ""(-1073741824.0, -1073741824.0, 0)"", ""speed"": ""-1073741824.0"", ""leader"": ""None""}\n', b'14:57:05.149853 IP 192.168.1.1.33197 > 192.168.1.255.9090: UDP, length 126\n', b'E...l.@.@.Iu..........#...w4CAM::192.168.1.1::{""time"": ""2.3"", ""position"": ""(3.0279999999999996, -4.8, 0)"", ""speed"": ""3.119999999999999"", ""leader"": ""None""}\n', b'14:57:05.155075 IP 192.168.1.2.34202 > 192.168.1.255.9090: UDP, length 126\n', b'E...o.@.@.F...........#.....CAM::192.168.1.2::{""time"": ""2.3"", ""position"": ""(-1073741824.0, -1073741824.0, 0)"", ""speed"": ""-1073741824.0"", ""leader"": ""None""}\n', b'14:57:05.249492 IP 192.168.1.1.33197 > 192.168.1.255.9090: UDP, length 126\n', b'E...l.@.@.Ik..........#...o-CAM::192.168.1.1::{""time"": ""2.4"", ""position"": ""(3.3659999999999997, -4.8, 0)"", ""speed"": ""3.379999999999999"", ""leader"": ""None""}\n', b'14:57:05.258264 IP 192.168.1.2.34202 > 192.168.1.255.9090: UDP, length 126\n', b'E...o*@.@.F...........#.....CAM::192.168.1.2::{""time"": ""2.4"", ""position"": ""(-1073741824.0, -1073741824.0, 0)"", ""speed"": ""-1073741824.0"", ""leader"": ""None""}\n', b'14:57:05.349346 IP 192.168.1.1.33197 > 192.168.1.255.9090: UDP, length 125\n', b'E...l.@.@.Ij..........#...\n', b'.CAM::192.168.1.1::{""time"": ""2.5"", ""position"": ""(3.729999999999999, -4.8, 0)"", ""speed"": ""3.639999999999999"", ""leader"": ""None""}\n', b'14:57:05.354970 IP 192.168.1.2.34202 > 192.168.1.255.9090: UDP, length 126\n', b'E...o7@.@.F...........#.....CAM::192.168.1.2::{""time"": ""2.5"", ""position"": ""(-1073741824.0, -1073741824.0, 0)"", ""speed"": ""-1073741824.0"", ""leader"": ""None""}\n', b'14:57:05.449461 IP 192.168.1.1.33197 > 192.168.1.255.9090: UDP, length 126\n', b'E...l.@.@.Ih..........#.....CAM::192.168.1.1::{""time"": ""2.6"", ""position"": ""(4.119999999999999, -4.8, 0)"", ""speed"": ""3.8999999999999986"", ""leader"": ""None""}\n', b'14:57:05.454423 IP 192.168.1.2.34202 > 192.168.1.255.9090: UDP, length 126\n', b'E...o:@.@.F...........#.....CAM::192.168.1.2::{""time"": ""2.6"", ""position"": ""(-1073741824.0, -1073741824.0, 0)"", ""speed"": ""-1073741824.0"", ""leader"": ""None""}\n', b'14:57:05.549474 IP 192.168.1.1.33197 > 192.168.1.255.9090: UDP, length 125\n', b'E...l.@.@.IS..........#.....CAM::192.168.1.1::{""time"": ""2.7"", ""position"": ""(4.535999999999999, -4.8, 0)"", ""speed"": ""4.159999999999998"", ""leader"": ""None""}\n', b'14:57:05.555437 IP 192.168.1.2.34202 > 192.168.1.255.9090: UDP, length 126\n', b'E...oR@.@.F...........#.....CAM::192.168.1.2::{""time"": ""2.7"", ""position"": ""(-1073741824.0, -1073741824.0, 0)"", ""speed"": ""-1073741824.0"", ""leader"": ""None""}\n']";-77.0@car1-wlan1
28;2.8s;car2;No leader;No leader;Not initialised;"[b'14:57:04.951559 IP 192.168.1.2.34202 > 192.168.1.255.9090: UDP, length 126\n', b'E...n.@.@.G...........#.....CAM::192.168.1.2::{""time"": ""2.1"", ""position"": ""(-1073741824.0, -1073741824.0, 0)"", ""speed"": ""-1073741824.0"", ""leader"": ""None""}\n', b'14:57:04.952376 IP 192.168.1.1.33197 > 192.168.1.255.9090: UDP, length 127\n', b'E...lq@.@.I...........#.....CAM::192.168.1.1::{""time"": ""2.1"", ""position"": ""(2.4299999999999997, -4.8, 0)"", ""speed"": ""2.5999999999999996"", ""leader"": ""None""}\n', b'14:57:05.051548 IP 192.168.1.2.34202 > 192.168.1.255.9090: UDP, length 126\n', b'E...o.@.@.F...........#.....CAM::192.168.1.2::{""time"": ""2.2"", ""position"": ""(-1073741824.0, -1073741824.0, 0)"", ""speed"": ""-1073741824.0"", ""leader"": ""None""}\n', b'14:57:05.051920 IP 192.168.1.1.33197 > 192.168.1.255.9090: UDP, length 127\n', b'E...l.@.@.Iw..........#.....CAM::192.168.1.1::{""time"": ""2.2"", ""position"": ""(2.7159999999999997, -4.8, 0)"", ""speed"": ""2.8599999999999994"", ""leader"": ""None""}\n', b'14:57:05.151571 IP 192.168.1.2.34202 > 192.168.1.255.9090: UDP, length 126\n', b'E...o.@.@.F...........#.....CAM::192.168.1.2::{""time"": ""2.3"", ""position"": ""(-1073741824.0, -1073741824.0, 0)"", ""speed"": ""-1073741824.0"", ""leader"": ""None""}\n', b'14:57:05.152389 IP 192.168.1.1.33197 > 192.168.1.255.9090: UDP, length 126\n', b'E...l.@.@.Iu..........#...w4CAM::192.168.1.1::{""time"": ""2.3"", ""position"": ""(3.0279999999999996, -4.8, 0)"", ""speed"": ""3.119999999999999"", ""leader"": ""None""}\n', b'14:57:05.253314 IP 192.168.1.1.33197 > 192.168.1.255.9090: UDP, length 126\n', b'E...l.@.@.Ik..........#...o-CAM::192.168.1.1::{""time"": ""2.4"", ""position"": ""(3.3659999999999997, -4.8, 0)"", ""speed"": ""3.379999999999999"", ""leader"": ""None""}\n', b'14:57:05.253761 IP 192.168.1.2.34202 > 192.168.1.255.9090: UDP, length 126\n', b'E...o*@.@.F...........#.....CAM::192.168.1.2::{""time"": ""2.4"", ""position"": ""(-1073741824.0, -1073741824.0, 0)"", ""speed"": ""-1073741824.0"", ""leader"": ""None""}\n', b'14:57:05.351297 IP 192.168.1.2.34202 > 192.168.1.255.9090: UDP, length 126\n', b'E...o7@.@.F...........#.....CAM::192.168.1.2::{""time"": ""2.5"", ""position"": ""(-1073741824.0, -1073741824.0, 0)"", ""speed"": ""-1073741824.0"", ""leader"": ""None""}\n', b'14:57:05.352694 IP 192.168.1.1.33197 > 192.168.1.255.9090: UDP, length 125\n', b'E...l.@.@.Ij..........#...\n', b'.CAM::192.168.1.1::{""time"": ""2.5"", ""position"": ""(3.729999999999999, -4.8, 0)"", ""speed"": ""3.639999999999999"", ""leader"": ""None""}\n', b'14:57:05.451018 IP 192.168.1.2.34202 > 192.168.1.255.9090: UDP, length 126\n', b'E...o:@.@.F...........#.....CAM::192.168.1.2::{""time"": ""2.6"", ""position"": ""(-1073741824.0, -1073741824.0, 0)"", ""speed"": ""-1073741824.0"", ""leader"": ""None""}\n', b'14:57:05.451937 IP 192.168.1.1.33197 > 192.168.1.255.9090: UDP, length 126\n', b'E...l.@.@.Ih..........#.....CAM::192.168.1.1::{""time"": ""2.6"", ""position"": ""(4.119999999999999, -4.8, 0)"", ""speed"": ""3.8999999999999986"", ""leader"": ""None""}\n', b'14:57:05.551114 IP 192.168.1.2.34202 > 192.168.1.255.9090: UDP, length 126\n', b'E...oR@.@.F...........#.....CAM::192.168.1.2::{""time"": ""2.7"", ""position"": ""(-1073741824.0, -1073741824.0, 0)"", ""speed"": ""-1073741824.0"", ""leader"": ""None""}\n', b'14:57:05.553135 IP 192.168.1.1.33197 > 192.168.1.255.9090: UDP, length 125\n', b'E...l.@.@.IS..........#.....CAM::192.168.1.1::{""time"": ""2.7"", ""position"": ""(4.535999999999999, -4.8, 0)"", ""speed"": ""4.159999999999998"", ""leader"": ""None""}\n']";-77.0@car2-wlan1
29;2.9s;car1;No leader;No leader;4.445999999999999;[];-76.0@car1-wlan1
29;2.9s;car2;No leader;No leader;Not initialised;[];-77.0@car2-wlan1
30;3.0s;car1;No leader;No leader;4.939999999999999;[];-76.0@car1-wlan1
30;3.0s;car2;No leader;No leader;Not initialised;[];-77.0@car2-wlan1
31;3.1s;car1;No leader;No leader;5.459999999999998;[];-76.0@car1-wlan1
31;3.1s;car2;No leader;No leader;Not initialised;[];-77.0@car2-wlan1
32;3.2s;car1;No leader;No leader;6.005999999999998;[];-76.0@car1-wlan1
32;3.2s;car2;No leader;No leader;Not initialised;[];-77.0@car2-wlan1
33;3.3s;car1;No leader;No leader;6.577999999999998;[];-76.0@car1-wlan1
33;3.3s;car2;No leader;No leader;Not initialised;[];-77.0@car2-wlan1
34;3.4s;car1;No leader;No leader;7.175999999999997;[];-76.0@car1-wlan1
34;3.4s;car2;No leader;No leader;Not initialised;[];-77.0@car2-wlan1
35;3.5s;car1;No leader;No leader;7.799999999999997;[];-76.0@car1-wlan1
35;3.5s;car2;No leader;No leader;Not initialised;[];-77.0@car2-wlan1
36;3.6s;car1;No leader;No leader;8.449999999999998;[];-76.0@car1-wlan1
36;3.6s;car2;No leader;No leader;Not initialised;[];-77.0@car2-wlan1
37;3.7s;car1;No leader;No leader;9.125999999999998;[];-76.0@car1-wlan1
37;3.7s;car2;No leader;No leader;Not initialised;[];-77.0@car2-wlan1
38;3.8s;car1;No leader;No leader;9.827999999999998;"[b'14:57:05.649230 IP 192.168.1.1.33197 > 192.168.1.255.9090: UDP, length 125\n', b'E...l.@.@.IJ..........#.....CAM::192.168.1.1::{""time"": ""2.8"", ""position"": ""(4.977999999999999, -4.8, 0)"", ""speed"": ""4.419999999999998"", ""leader"": ""None""}\n', b'14:57:05.655894 IP 192.168.1.2.34202 > 192.168.1.255.9090: UDP, length 126\n', b'E...o_@.@.F...........#.....CAM::192.168.1.2::{""time"": ""2.8"", ""position"": ""(-1073741824.0, -1073741824.0, 0)"", ""speed"": ""-1073741824.0"", ""leader"": ""None""}\n', b'14:57:05.749327 IP 192.168.1.1.33197 > 192.168.1.255.9090: UDP, length 125\n', b'E...l.@.@.IB..........#.....CAM::192.168.1.1::{""time"": ""2.9"", ""position"": ""(5.445999999999999, -4.8, 0)"", ""speed"": ""4.679999999999998"", ""leader"": ""None""}\n', b'14:57:05.753988 IP 192.168.1.2.34202 > 192.168.1.255.9090: UDP, length 126\n', b'E...or@.@.F...........#.....CAM::192.168.1.2::{""time"": ""2.9"", ""position"": ""(-1073741824.0, -1073741824.0, 0)"", ""speed"": ""-1073741824.0"", ""leader"": ""None""}\n', b'14:57:05.849356 IP 192.168.1.1.33197 > 192.168.1.255.9090: UDP, length 125\n', b'E...l.@.@.I=..........#.....CAM::192.168.1.1::{""time"": ""3.0"", ""position"": ""(5.939999999999999, -4.8, 0)"", ""speed"": ""4.939999999999998"", ""leader"": ""None""}\n', b'14:57:05.855080 IP 192.168.1.2.34202 > 192.168.1.255.9090: UDP, length 126\n', b'E...o.@.@.F...........#.....CAM::192.168.1.2::{""time"": ""3.0"", ""position"": ""(-1073741824.0, -1073741824.0, 0)"", ""speed"": ""-1073741824.0"", ""leader"": ""None""}\n', b'14:57:05.949624 IP 192.168.1.1.33197 > 192.168.1.255.9090: UDP, length 126\n', b'E...l.@.@.I\'..........#.....CAM::192.168.1.1::{""time"": ""3.1"", ""position"": ""(6.459999999999997, -4.8, 0)"", ""speed"": ""5.1999999999999975"", ""leader"": ""None""}\n', b'14:57:05.954281 IP 192.168.1.2.34202 > 192.168.1.255.9090: UDP, length 126\n', b'E...o.@.@.F}..........#.....CAM::192.168.1.2::{""time"": ""3.1"", ""position"": ""(-1073741824.0, -1073741824.0, 0)"", ""speed"": ""-1073741824.0"", ""leader"": ""None""}\n', b'14:57:06.048986 IP 192.168.1.1.33197 > 192.168.1.255.9090: UDP, length 125\n', b'E...l.@.@.I$..........#.....CAM::192.168.1.1::{""time"": ""3.2"", ""position"": ""(7.005999999999997, -4.8, 0)"", ""speed"": ""5.459999999999997"", ""leader"": ""None""}\n', b'14:57:06.056583 IP 192.168.1.2.34202 > 192.168.1.255.9090: UDP, length 126\n', b'E...o.@.@.Fr..........#.....CAM::192.168.1.2::{""time"": ""3.2"", ""position"": ""(-1073741824.0, -1073741824.0, 0)"", ""speed"": ""-1073741824.0"", ""leader"": ""None""}\n', b'14:57:06.149606 IP 192.168.1.1.33197 > 192.168.1.255.9090: UDP, length 125\n', b'E...l.@.@.I...........#.....CAM::192.168.1.1::{""time"": ""3.3"", ""position"": ""(7.577999999999998, -4.8, 0)"", ""speed"": ""5.719999999999997"", ""leader"": ""None""}\n', b'14:57:06.154841 IP 192.168.1.2.34202 > 192.168.1.255.9090: UDP, length 126\n', b'E...o.@.@.Fl..........#.....CAM::192.168.1.2::{""time"": ""3.3"", ""position"": ""(-1073741824.0, -1073741824.0, 0)"", ""speed"": ""-1073741824.0"", ""leader"": ""None""}\n', b'14:57:06.249153 IP 192.168.1.1.33197 > 192.168.1.255.9090: UDP, length 125\n', b'E...l.@.@.I...........#.....CAM::192.168.1.1::{""time"": ""3.4"", ""position"": ""(8.175999999999997, -4.8, 0)"", ""speed"": ""5.979999999999997"", ""leader"": ""None""}\n', b'14:57:06.253832 IP 192.168.1.2.34202 > 192.168.1.255.9090: UDP, length 126\n', b'E...o.@.@.FS..........#.....CAM::192.168.1.2::{""time"": ""3.4"", ""position"": ""(-1073741824.0, -1073741824.0, 0)"", ""speed"": ""-1073741824.0"", ""leader"": ""None""}\n', b'14:57:06.349500 IP 192.168.1.1.33197 > 192.168.1.255.9090: UDP, length 125\n', b'E...m.@.@.H...........#...\t.CAM::192.168.1.1::{""time"": ""3.5"", ""position"": ""(8.799999999999997, -4.8, 0)"", ""speed"": ""6.239999999999997"", ""leader"": ""None""}\n', b'14:57:06.354710 IP 192.168.1.2.34202 > 192.168.1.255.9090: UDP, length 126\n', b'E...o.@.@.F?..........#.....CAM::192.168.1.2::{""time"": ""3.5"", ""position"": ""(-1073741824.0, -1073741824.0, 0)"", ""speed"": ""-1073741824.0"", ""leader"": ""None""}\n', b'14:57:06.449759 IP 192.168.1.1.33197 > 192.168.1.255.9090: UDP, length 126\n', b'E...m.@.@.H...........#.....CAM::192.168.1.1::{""time"": ""3.6"", ""position"": ""(9.449999999999998, -4.8, 0)"", ""speed"": ""6.4999999999999964"", ""leader"": ""None""}\n', b'14:57:06.455443 IP 192.168.1.2.34202 > 192.168.1.255.9090: UDP, length 126\n', b'E...o.@.@.F:..........#.....CAM::192.168.1.2::{""time"": ""3.6"", ""position"": ""(-1073741824.0, -1073741824.0, 0)"", ""speed"": ""-1073741824.0"", ""leader"": ""None""}\n', b'14:57:06.549422 IP 192.168.1.1.33197 > 192.168.1.255.9090: UDP, length 126\n', b'E...m.@.@.H...........#...w/CAM::192.168.1.1::{""time"": ""3.7"", ""position"": ""(10.125999999999998, -4.8, 0)"", ""speed"": ""6.759999999999996"", ""leader"": ""None""}\n', b'14:57:06.554077 IP 192.168.1.2.34202 > 192.168.1.255.9090: UDP, length 126\n', b'E...o.@.@.F-..........#.....CAM::192.168.1.2::{""time"": ""3.7"", ""position"": ""(-1073741824.0, -1073741824.0, 0)"", ""speed"": ""-1073741824.0"", ""leader"": ""None""}\n']";-75.0@car1-wlan1
38;3.8s;car2;No leader;No leader;Not initialised;[];-77.0@car2-wlan1
39;3.9s;car1;No leader;No leader;10.555999999999997;[];-75.0@car1-wlan1
