STEP;TIME;CAR;LEADER;LEADER_DISTANCE;DRIVING_DISTANCE;TCP_DUMP_MSGS;SIGNAL_STRENGTH
1;0.1s;car1;No leader;No leader;Not initialised;[];-77.0@car1-wlan1
1;0.1s;car2;No leader;No leader;Not initialised;[];-77.0@car2-wlan1
2;0.2s;car1;No leader;No leader;Not initialised;[];-77.0@car1-wlan1
2;0.2s;car2;No leader;No leader;Not initialised;[];-77.0@car2-wlan1
3;0.3s;car1;No leader;No leader;Not initialised;[];-77.0@car1-wlan1
3;0.3s;car2;No leader;No leader;Not initialised;[];-77.0@car2-wlan1
4;0.4s;car1;No leader;No leader;Not initialised;[];-77.0@car1-wlan1
4;0.4s;car2;No leader;No leader;Not initialised;[];-77.0@car2-wlan1
5;0.5s;car1;No leader;No leader;Not initialised;[];-77.0@car1-wlan1
5;0.5s;car2;No leader;No leader;Not initialised;[];-77.0@car2-wlan1
6;0.6s;car1;No leader;No leader;Not initialised;[];-77.0@car1-wlan1
6;0.6s;car2;No leader;No leader;Not initialised;[];-77.0@car2-wlan1
7;0.7s;car1;No leader;No leader;Not initialised;[];-77.0@car1-wlan1
7;0.7s;car2;No leader;No leader;Not initialised;[];-77.0@car2-wlan1
8;0.8s;car1;No leader;No leader;Not initialised;[];-77.0@car1-wlan1
8;0.8s;car2;No leader;No leader;Not initialised;[];-77.0@car2-wlan1
9;0.9s;car1;No leader;No leader;Not initialised;[];-77.0@car1-wlan1
9;0.9s;car2;No leader;No leader;Not initialised;[];-77.0@car2-wlan1
10;1.0s;car1;No leader;No leader;Not initialised;[];-77.0@car1-wlan1
10;1.0s;car2;No leader;No leader;Not initialised;[];-77.0@car2-wlan1
11;1.1s;car1;No leader;No leader;Not initialised;[];-77.0@car1-wlan1
11;1.1s;car2;No leader;No leader;Not initialised;[];-77.0@car2-wlan1
12;1.2s;car1;No leader;No leader;0.026000000000000023;[];-77.0@car1-wlan1
12;1.2s;car2;No leader;No leader;Not initialised;[];-77.0@car2-wlan1
13;1.3s;car1;No leader;No leader;0.07800000000000007;"[b'15:08:49.314463 IP 192.168.1.1.32821 > 192.168.1.255.9090: UDP, length 97\n', b'E..}i.@.@.L$.........5#..iD.CAM::192.168.1.1::{""time"": ""0.2"", ""position"": ""(1.0, -4.8, 0)"", ""speed"": ""0.0"", ""leader"": ""None""}\n', b'15:08:49.323351 IP 192.168.1.2.33694 > 192.168.1.255.9090: UDP, length 126\n', b'E.....@.@.............#.....CAM::192.168.1.2::{""time"": ""0.2"", ""position"": ""(-1073741824.0, -1073741824.0, 0)"", ""speed"": ""-1073741824.0"", ""leader"": ""None""}\n', b'15:08:49.412815 IP 192.168.1.1.32821 > 192.168.1.255.9090: UDP, length 97\n', b'E..}j.@.@.L..........5#..iC.CAM::192.168.1.1::{""time"": ""0.3"", ""position"": ""(1.0, -4.8, 0)"", ""speed"": ""0.0"", ""leader"": ""None""}\n', b'15:08:49.419095 IP 192.168.1.2.33694 > 192.168.1.255.9090: UDP, length 126\n', b'E.....@.@.............#.....CAM::192.168.1.2::{""time"": ""0.3"", ""position"": ""(-1073741824.0, -1073741824.0, 0)"", ""speed"": ""-1073741824.0"", ""leader"": ""None""}\n', b'15:08:49.510998 IP 192.168.1.1.32821 > 192.168.1.255.9090: UDP, length 97\n', b'E..}j.@.@.L..........5#..iB.CAM::192.168.1.1::{""time"": ""0.4"", ""position"": ""(1.0, -4.8, 0)"", ""speed"": ""0.0"", ""leader"": ""None""}\n', b'15:08:49.517912 IP 192.168.1.2.33694 > 192.168.1.255.9090: UDP, length 126\n', b'E.....@.@.............#.....CAM::192.168.1.2::{""time"": ""0.4"", ""position"": ""(-1073741824.0, -1073741824.0, 0)"", ""speed"": ""-1073741824.0"", ""leader"": ""None""}\n', b'15:08:49.611451 IP 192.168.1.1.32821 > 192.168.1.255.9090: UDP, length 97\n', b'E..}j1@.@.K..........5#..iA.CAM::192.168.1.1::{""time"": ""0.5"", ""position"": ""(1.0, -4.8, 0)"", ""speed"": ""0.0"", ""leader"": ""None""}\n', b'15:08:49.617198 IP 192.168.1.2.33694 > 192.168.1.255.9090: UDP, length 126\n', b'E.....@.@.............#.....CAM::192.168.1.2::{""time"": ""0.5"", ""position"": ""(-1073741824.0, -1073741824.0, 0)"", ""speed"": ""-1073741824.0"", ""leader"": ""None""}\n', b'15:08:49.712208 IP 192.168.1.1.32821 > 192.168.1.255.9090: UDP, length 97\n', b'E..}j:@.@.K..........5#..i@.CAM::192.168.1.1::{""time"": ""0.6"", ""position"": ""(1.0, -4.8, 0)"", ""speed"": ""0.0"", ""leader"": ""None""}\n', b'15:08:49.716920 IP 192.168.1.2.33694 > 192.168.1.255.9090: UDP, length 126\n', b'E.....@.@.............#.....CAM::192.168.1.2::{""time"": ""0.6"", ""position"": ""(-1073741824.0, -1073741824.0, 0)"", ""speed"": ""-1073741824.0"", ""leader"": ""None""}\n', b'15:08:49.812233 IP 192.168.1.1.32821 > 192.168.1.255.9090: UDP, length 97\n', b'E..}jF@.@.K..........5#..i?.CAM::192.168.1.1::{""time"": ""0.7"", ""position"": ""(1.0, -4.8, 0)"", ""speed"": ""0.0"", ""leader"": ""None""}\n', b'15:08:49.816875 IP 192.168.1.2.33694 > 192.168.1.255.9090: UDP, length 126\n', b'E....7@.@.............#.....CAM::192.168.1.2::{""time"": ""0.7"", ""position"": ""(-1073741824.0, -1073741824.0, 0)"", ""speed"": ""-1073741824.0"", ""leader"": ""None""}\n', b'15:08:49.913623 IP 192.168.1.1.32821 > 192.168.1.255.9090: UDP, length 97\n', b'E..}j]@.@.K..........5#..i>.CAM::192.168.1.1::{""time"": ""0.8"", ""position"": ""(1.0, -4.8, 0)"", ""speed"": ""0.0"", ""leader"": ""None""}\n', b'15:08:49.918533 IP 192.168.1.2.33694 > 192.168.1.255.9090: UDP, length 126\n', b'E....I@.@.............#.....CAM::192.168.1.2::{""time"": ""0.8"", ""position"": ""(-1073741824.0, -1073741824.0, 0)"", ""speed"": ""-1073741824.0"", ""leader"": ""None""}\n', b'15:08:50.012884 IP 192.168.1.1.32821 > 192.168.1.255.9090: UDP, length 97\n', b'E..}js@.@.K..........5#..i=.CAM::192.168.1.1::{""time"": ""0.9"", ""position"": ""(1.0, -4.8, 0)"", ""speed"": ""0.0"", ""leader"": ""None""}\n', b'15:08:50.018185 IP 192.168.1.2.33694 > 192.168.1.255.9090: UDP, length 126\n', b'E....X@.@.............#.....CAM::192.168.1.2::{""time"": ""0.9"", ""position"": ""(-1073741824.0, -1073741824.0, 0)"", ""speed"": ""-1073741824.0"", ""leader"": ""None""}\n', b'15:08:50.112664 IP 192.168.1.1.32821 > 192.168.1.255.9090: UDP, length 97\n', b'E..}j~@.@.K..........5#..iE.CAM::192.168.1.1::{""time"": ""1.0"", ""position"": ""(1.0, -4.8, 0)"", ""speed"": ""0.0"", ""leader"": ""None""}\n', b'15:08:50.117663 IP 192.168.1.2.33694 > 192.168.1.255.9090: UDP, length 126\n', b'E....Z@.@.............#.....CAM::192.168.1.2::{""time"": ""1.0"", ""position"": ""(-1073741824.0, -1073741824.0, 0)"", ""speed"": ""-1073741824.0"", ""leader"": ""None""}\n', b'15:08:50.212771 IP 192.168.1.1.32821 > 192.168.1.255.9090: UDP, length 97\n', b'E..}j.@.@.K..........5#..iD.CAM::192.168.1.1::{""time"": ""1.1"", ""position"": ""(1.0, -4.8, 0)"", ""speed"": ""0.0"", ""leader"": ""None""}\n', b'15:08:50.218314 IP 192.168.1.2.33694 > 192.168.1.255.9090: UDP, length 126\n', b'E....k@.@.............#.....CAM::192.168.1.2::{""time"": ""1.1"", ""position"": ""(-1073741824.0, -1073741824.0, 0)"", ""speed"": ""-1073741824.0"", ""leader"": ""None""}\n', b'15:08:50.312588 IP 192.168.1.1.32821 > 192.168.1.255.9090: UDP, length 100\n', b'E...j.@.@.K..........5#..l.{CAM::192.168.1.1::{""time"": ""1.2"", ""position"": ""(1.026, -4.8, 0)"", ""speed"": ""0.26"", ""leader"": ""None""}\n']";-77.0@car1-wlan1
13;1.3s;car2;No leader;No leader;Not initialised;"[b'15:08:49.316742 IP 192.168.1.1.32821 > 192.168.1.255.9090: UDP, length 97\n', b'E..}i.@.@.L$.........5#..iD.CAM::192.168.1.1::{""time"": ""0.2"", ""position"": ""(1.0, -4.8, 0)"", ""speed"": ""0.0"", ""leader"": ""None""}\n', b'15:08:49.319281 IP 192.168.1.2.33694 > 192.168.1.255.9090: UDP, length 126\n', b'E.....@.@.............#.....CAM::192.168.1.2::{""time"": ""0.2"", ""position"": ""(-1073741824.0, -1073741824.0, 0)"", ""speed"": ""-1073741824.0"", ""leader"": ""None""}\n', b'15:08:49.414138 IP 192.168.1.2.33694 > 192.168.1.255.9090: UDP, length 126\n', b'E.....@.@.............#.....CAM::192.168.1.2::{""time"": ""0.3"", ""position"": ""(-1073741824.0, -1073741824.0, 0)"", ""speed"": ""-1073741824.0"", ""leader"": ""None""}\n', b'15:08:49.418102 IP 192.168.1.1.32821 > 192.168.1.255.9090: UDP, length 97\n', b'E..}j.@.@.L..........5#..iC.CAM::192.168.1.1::{""time"": ""0.3"", ""position"": ""(1.0, -4.8, 0)"", ""speed"": ""0.0"", ""leader"": ""None""}\n', b'15:08:49.512298 IP 192.168.1.2.33694 > 192.168.1.255.9090: UDP, length 126\n', b'E.....@.@.............#.....CAM::192.168.1.2::{""time"": ""0.4"", ""position"": ""(-1073741824.0, -1073741824.0, 0)"", ""speed"": ""-1073741824.0"", ""leader"": ""None""}\n', b'15:08:49.514419 IP 192.168.1.1.32821 > 192.168.1.255.9090: UDP, length 97\n', b'E..}j.@.@.L..........5#..iB.CAM::192.168.1.1::{""time"": ""0.4"", ""position"": ""(1.0, -4.8, 0)"", ""speed"": ""0.0"", ""leader"": ""None""}\n', b'15:08:49.614418 IP 192.168.1.2.33694 > 192.168.1.255.9090: UDP, length 126\n', b'E.....@.@.............#.....CAM::192.168.1.2::{""time"": ""0.5"", ""position"": ""(-1073741824.0, -1073741824.0, 0)"", ""speed"": ""-1073741824.0"", ""leader"": ""None""}\n', b'15:08:49.614945 IP 192.168.1.1.32821 > 192.168.1.255.9090: UDP, length 97\n', b'E..}j1@.@.K..........5#..iA.CAM::192.168.1.1::{""time"": ""0.5"", ""position"": ""(1.0, -4.8, 0)"", ""speed"": ""0.0"", ""leader"": ""None""}\n', b'15:08:49.713448 IP 192.168.1.2.33694 > 192.168.1.255.9090: UDP, length 126\n', b'E.....@.@.............#.....CAM::192.168.1.2::{""time"": ""0.6"", ""position"": ""(-1073741824.0, -1073741824.0, 0)"", ""speed"": ""-1073741824.0"", ""leader"": ""None""}\n', b'15:08:49.714529 IP 192.168.1.1.32821 > 192.168.1.255.9090: UDP, length 97\n', b'E..}j:@.@.K..........5#..i@.CAM::192.168.1.1::{""time"": ""0.6"", ""position"": ""(1.0, -4.8, 0)"", ""speed"": ""0.0"", ""leader"": ""None""}\n', b'15:08:49.813523 IP 192.168.1.2.33694 > 192.168.1.255.9090: UDP, length 126\n', b'E....7@.@.............#.....CAM::192.168.1.2::{""time"": ""0.7"", ""position"": ""(-1073741824.0, -1073741824.0, 0)"", ""speed"": ""-1073741824.0"", ""leader"": ""None""}\n', b'15:08:49.814733 IP 192.168.1.1.32821 > 192.168.1.255.9090: UDP, length 97\n', b'E..}jF@.@.K..........5#..i?.CAM::192.168.1.1::{""time"": ""0.7"", ""position"": ""(1.0, -4.8, 0)"", ""speed"": ""0.0"", ""leader"": ""None""}\n', b'15:08:49.915254 IP 192.168.1.2.33694 > 192.168.1.255.9090: UDP, length 126\n', b'E....I@.@.............#.....CAM::192.168.1.2::{""time"": ""0.8"", ""position"": ""(-1073741824.0, -1073741824.0, 0)"", ""speed"": ""-1073741824.0"", ""leader"": ""None""}\n', b'15:08:49.915942 IP 192.168.1.1.32821 > 192.168.1.255.9090: UDP, length 97\n', b'E..}j]@.@.K..........5#..i>.CAM::192.168.1.1::{""time"": ""0.8"", ""position"": ""(1.0, -4.8, 0)"", ""speed"": ""0.0"", ""leader"": ""None""}\n', b'15:08:50.014398 IP 192.168.1.2.33694 > 192.168.1.255.9090: UDP, length 126\n', b'E....X@.@.............#.....CAM::192.168.1.2::{""time"": ""0.9"", ""position"": ""(-1073741824.0, -1073741824.0, 0)"", ""speed"": ""-1073741824.0"", ""leader"": ""None""}\n', b'15:08:50.015305 IP 192.168.1.1.32821 > 192.168.1.255.9090: UDP, length 97\n', b'E..}js@.@.K..........5#..i=.CAM::192.168.1.1::{""time"": ""0.9"", ""position"": ""(1.0, -4.8, 0)"", ""speed"": ""0.0"", ""leader"": ""None""}\n', b'15:08:50.113999 IP 192.168.1.2.33694 > 192.168.1.255.9090: UDP, length 126\n', b'E....Z@.@.............#.....CAM::192.168.1.2::{""time"": ""1.0"", ""position"": ""(-1073741824.0, -1073741824.0, 0)"", ""speed"": ""-1073741824.0"", ""leader"": ""None""}\n', b'15:08:50.115353 IP 192.168.1.1.32821 > 192.168.1.255.9090: UDP, length 97\n', b'E..}j~@.@.K..........5#..iE.CAM::192.168.1.1::{""time"": ""1.0"", ""position"": ""(1.0, -4.8, 0)"", ""speed"": ""0.0"", ""leader"": ""None""}\n', b'15:08:50.214057 IP 192.168.1.2.33694 > 192.168.1.255.9090: UDP, length 126\n', b'E....k@.@.............#.....CAM::192.168.1.2::{""time"": ""1.1"", ""position"": ""(-1073741824.0, -1073741824.0, 0)"", ""speed"": ""-1073741824.0"", ""leader"": ""None""}\n', b'15:08:50.215262 IP 192.168.1.1.32821 > 192.168.1.255.9090: UDP, length 97\n', b'E..}j.@.@.K..........5#..iD.CAM::192.168.1.1::{""time"": ""1.1"", ""position"": ""(1.0, -4.8, 0)"", ""speed"": ""0.0"", ""leader"": ""None""}\n', b'15:08:50.313932 IP 192.168.1.2.33694 > 192.168.1.255.9090: UDP, length 126\n', b'E....l@.@.............#.....CAM::192.168.1.2::{""time"": ""1.2"", ""position"": ""(-1073741824.0, -1073741824.0, 0)"", ""speed"": ""-1073741824.0"", ""leader"": ""None""}\n', b'15:08:50.315094 IP 192.168.1.1.32821 > 192.168.1.255.9090: UDP, length 100\n', b'E...j.@.@.K..........5#..l.{CAM::192.168.1.1::{""time"": ""1.2"", ""position"": ""(1.026, -4.8, 0)"", ""speed"": ""0.26"", ""leader"": ""None""}\n']";-77.0@car2-wlan1
14;1.4s;car1;No leader;No leader;0.15600000000000014;[];-77.0@car1-wlan1
14;1.4s;car2;No leader;No leader;Not initialised;[];-77.0@car2-wlan1
15;1.5s;car1;No leader;No leader;0.26000000000000023;[];-77.0@car1-wlan1
15;1.5s;car2;No leader;No leader;Not initialised;[];-77.0@car2-wlan1
16;1.6s;car1;No leader;No leader;0.3900000000000001;[];-77.0@car1-wlan1
16;1.6s;car2;No leader;No leader;Not initialised;[];-77.0@car2-wlan1
17;1.7s;car1;No leader;No leader;0.5460000000000003;[];-77.0@car1-wlan1
17;1.7s;car2;No leader;No leader;Not initialised;[];-77.0@car2-wlan1
18;1.8s;car1;No leader;No leader;0.7280000000000002;[];-77.0@car1-wlan1
18;1.8s;car2;No leader;No leader;Not initialised;[];-77.0@car2-wlan1
19;1.9s;car1;No leader;No leader;0.9360000000000002;[];-77.0@car1-wlan1
19;1.9s;car2;No leader;No leader;Not initialised;[];-77.0@car2-wlan1
20;2.0s;car1;No leader;No leader;1.17;[];-77.0@car1-wlan1
20;2.0s;car2;No leader;No leader;Not initialised;[];-77.0@car2-wlan1
21;2.1s;car1;No leader;No leader;1.4299999999999997;[];-77.0@car1-wlan1
21;2.1s;car2;No leader;No leader;Not initialised;[];-77.0@car2-wlan1
22;2.2s;car1;No leader;No leader;1.7159999999999997;[];-77.0@car1-wlan1
22;2.2s;car2;No leader;No leader;Not initialised;[];-77.0@car2-wlan1
23;2.3s;car1;No leader;No leader;2.0279999999999996;"[b'15:08:50.319421 IP 192.168.1.2.33694 > 192.168.1.255.9090: UDP, length 126\n', b'E....l@.@.............#.....CAM::192.168.1.2::{""time"": ""1.2"", ""position"": ""(-1073741824.0, -1073741824.0, 0)"", ""speed"": ""-1073741824.0"", ""leader"": ""None""}\n', b'15:08:50.412577 IP 192.168.1.1.32821 > 192.168.1.255.9090: UDP, length 100\n', b'E...j.@.@.K..........5#..l.zCAM::192.168.1.1::{""time"": ""1.3"", ""position"": ""(1.078, -4.8, 0)"", ""speed"": ""0.52"", ""leader"": ""None""}\n', b'15:08:50.422066 IP 192.168.1.2.33694 > 192.168.1.255.9090: UDP, length 126\n', b'E....s@.@.............#.....CAM::192.168.1.2::{""time"": ""1.3"", ""position"": ""(-1073741824.0, -1073741824.0, 0)"", ""speed"": ""-1073741824.0"", ""leader"": ""None""}\n', b'15:08:50.477157 IP6 fe80::ff:fe00:300 > ip6-allrouters: ICMP6, router solicitation, length 16\n', b'`.....:...................................u.............\n', b'15:08:50.481016 IP6 fe80::ff:fe00:500 > ip6-allrouters: ICMP6, router solicitation, length 16\n', b'`.....:...................................q.............\n', b'15:08:50.514391 IP 192.168.1.1.32821 > 192.168.1.255.9090: UDP, length 113\n', b'E...j.@.@.Ko.........5#..y`-CAM::192.168.1.1::{""time"": ""1.4"", ""position"": ""(1.1560000000000001, -4.8, 0)"", ""speed"": ""0.78"", ""leader"": ""None""}\n', b'15:08:50.519432 IP 192.168.1.2.33694 > 192.168.1.255.9090: UDP, length 126\n', b'E.....@.@.............#.....CAM::192.168.1.2::{""time"": ""1.4"", ""position"": ""(-1073741824.0, -1073741824.0, 0)"", ""speed"": ""-1073741824.0"", ""leader"": ""None""}\n', b'15:08:50.613569 IP 192.168.1.1.32821 > 192.168.1.255.9090: UDP, length 113\n', b'E...j.@.@.Ka.........5#..yh1CAM::192.168.1.1::{""time"": ""1.5"", ""position"": ""(1.2600000000000002, -4.8, 0)"", ""speed"": ""1.04"", ""leader"": ""None""}\n', b'15:08:50.622223 IP 192.168.1.2.33694 > 192.168.1.255.9090: UDP, length 126\n', b'E.....@.@..m..........#.....CAM::192.168.1.2::{""time"": ""1.5"", ""position"": ""(-1073741824.0, -1073741824.0, 0)"", ""speed"": ""-1073741824.0"", ""leader"": ""None""}\n', b'15:08:50.712375 IP 192.168.1.1.32821 > 192.168.1.255.9090: UDP, length 112\n', b'E...j.@.@.KP.........5#..x;.CAM::192.168.1.1::{""time"": ""1.6"", ""position"": ""(1.3900000000000001, -4.8, 0)"", ""speed"": ""1.3"", ""leader"": ""None""}\n', b'15:08:50.719341 IP 192.168.1.2.33694 > 192.168.1.255.9090: UDP, length 126\n', b'E.....@.@..V..........#.....CAM::192.168.1.2::{""time"": ""1.6"", ""position"": ""(-1073741824.0, -1073741824.0, 0)"", ""speed"": ""-1073741824.0"", ""leader"": ""None""}\n', b'15:08:50.812611 IP 192.168.1.1.32821 > 192.168.1.255.9090: UDP, length 113\n', b'E...j.@.@.K<.........5#..y[-CAM::192.168.1.1::{""time"": ""1.7"", ""position"": ""(1.5460000000000003, -4.8, 0)"", ""speed"": ""1.56"", ""leader"": ""None""}\n', b'15:08:50.817420 IP 192.168.1.2.33694 > 192.168.1.255.9090: UDP, length 126\n', b'E.....@.@..>..........#.....CAM::192.168.1.2::{""time"": ""1.7"", ""position"": ""(-1073741824.0, -1073741824.0, 0)"", ""speed"": ""-1073741824.0"", ""leader"": ""None""}\n', b'15:08:50.912597 IP 192.168.1.1.32821 > 192.168.1.255.9090: UDP, length 113\n', b'E...j.@.@.K$.........5#..yZ+CAM::192.168.1.1::{""time"": ""1.8"", ""position"": ""(1.7280000000000004, -4.8, 0)"", ""speed"": ""1.82"", ""leader"": ""None""}\n', b'15:08:50.917938 IP 192.168.1.2.33694 > 192.168.1.255.9090: UDP, length 126\n', b'E.....@.@../..........#.....CAM::192.168.1.2::{""time"": ""1.8"", ""position"": ""(-1073741824.0, -1073741824.0, 0)"", ""speed"": ""-1073741824.0"", ""leader"": ""None""}\n', b'15:08:51.012857 IP 192.168.1.1.32821 > 192.168.1.255.9090: UDP, length 113\n', b'E...j.@.@.K..........5#..yS3CAM::192.168.1.1::{""time"": ""1.9"", ""position"": ""(1.9360000000000002, -4.8, 0)"", ""speed"": ""2.08"", ""leader"": ""None""}\n', b'15:08:51.020316 IP 192.168.1.2.33694 > 192.168.1.255.9090: UDP, length 126\n', b'E.....@.@..!..........#.....CAM::192.168.1.2::{""time"": ""1.9"", ""position"": ""(-1073741824.0, -1073741824.0, 0)"", ""speed"": ""-1073741824.0"", ""leader"": ""None""}\n', b'15:08:51.112187 IP 192.168.1.1.32821 > 192.168.1.255.9090: UDP, length 99\n', b'E...k.@.@.K..........5#..k..CAM::192.168.1.1::{""time"": ""2.0"", ""position"": ""(2.17, -4.8, 0)"", ""speed"": ""2.34"", ""leader"": ""None""}\n', b'15:08:51.116827 IP 192.168.1.2.33694 > 192.168.1.255.9090: UDP, length 126\n', b'E.....@.@.............#.....CAM::192.168.1.2::{""time"": ""2.0"", ""position"": ""(-1073741824.0, -1073741824.0, 0)"", ""speed"": ""-1073741824.0"", ""leader"": ""None""}\n', b'15:08:51.212327 IP 192.168.1.1.32821 > 192.168.1.255.9090: UDP, length 127\n', b'E...k.@.@.J..........5#....GCAM::192.168.1.1::{""time"": ""2.1"", ""position"": ""(2.4299999999999997, -4.8, 0)"", ""speed"": ""2.5999999999999996"", ""leader"": ""None""}\n', b'15:08:51.217898 IP 192.168.1.2.33694 > 192.168.1.255.9090: UDP, length 126\n', b'E.....@.@.............#.....CAM::192.168.1.2::{""time"": ""2.1"", ""position"": ""(-1073741824.0, -1073741824.0, 0)"", ""speed"": ""-1073741824.0"", ""leader"": ""None""}\n', b'15:08:51.312042 IP 192.168.1.1.32821 > 192.168.1.255.9090: UDP, length 127\n', b'E...k @.@.J..........5#....ECAM::192.168.1.1::{""time"": ""2.2"", ""position"": ""(2.7159999999999997, -4.8, 0)"", ""speed"": ""2.8599999999999994"", ""leader"": ""None""}\n', b'15:08:51.317935 IP 192.168.1.2.33694 > 192.168.1.255.9090: UDP, length 126\n', b'E.....@.@.............#.....CAM::192.168.1.2::{""time"": ""2.2"", ""position"": ""(-1073741824.0, -1073741824.0, 0)"", ""speed"": ""-1073741824.0"", ""leader"": ""None""}\n']";-77.0@car1-wlan1
23;2.3s;car2;No leader;No leader;Not initialised;"[b'15:08:50.415616 IP 192.168.1.2.33694 > 192.168.1.255.9090: UDP, length 126\n', b'E....s@.@.............#.....CAM::192.168.1.2::{""time"": ""1.3"", ""position"": ""(-1073741824.0, -1073741824.0, 0)"", ""speed"": ""-1073741824.0"", ""leader"": ""None""}\n', b'15:08:50.416959 IP 192.168.1.1.32821 > 192.168.1.255.9090: UDP, length 100\n', b'E...j.@.@.K..........5#..l.zCAM::192.168.1.1::{""time"": ""1.3"", ""position"": ""(1.078, -4.8, 0)"", ""speed"": ""0.52"", ""leader"": ""None""}\n', b'15:08:50.477187 IP6 fe80::ff:fe00:500 > ip6-allrouters: ICMP6, router solicitation, length 16\n', b'`.....:...................................q.............\n', b'15:08:50.479824 IP6 fe80::ff:fe00:300 > ip6-allrouters: ICMP6, router solicitation, length 16\n', b'`.....:...................................u.............\n', b'15:08:50.515765 IP 192.168.1.2.33694 > 192.168.1.255.9090: UDP, length 126\n', b'E.....@.@.............#.....CAM::192.168.1.2::{""time"": ""1.4"", ""position"": ""(-1073741824.0, -1073741824.0, 0)"", ""speed"": ""-1073741824.0"", ""leader"": ""None""}\n', b'15:08:50.517027 IP 192.168.1.1.32821 > 192.168.1.255.9090: UDP, length 113\n', b'E...j.@.@.Ko.........5#..y`-CAM::192.168.1.1::{""time"": ""1.4"", ""position"": ""(1.1560000000000001, -4.8, 0)"", ""speed"": ""0.78"", ""leader"": ""None""}\n', b'15:08:50.617170 IP 192.168.1.1.32821 > 192.168.1.255.9090: UDP, length 113\n', b'E...j.@.@.Ka.........5#..yh1CAM::192.168.1.1::{""time"": ""1.5"", ""position"": ""(1.2600000000000002, -4.8, 0)"", ""speed"": ""1.04"", ""leader"": ""None""}\n', b'15:08:50.619027 IP 192.168.1.2.33694 > 192.168.1.255.9090: UDP, length 126\n', b'E.....@.@..m..........#.....CAM::192.168.1.2::{""time"": ""1.5"", ""position"": ""(-1073741824.0, -1073741824.0, 0)"", ""speed"": ""-1073741824.0"", ""leader"": ""None""}\n', b'15:08:50.713364 IP 192.168.1.2.33694 > 192.168.1.255.9090: UDP, length 126\n', b'E.....@.@..V..........#.....CAM::192.168.1.2::{""time"": ""1.6"", ""position"": ""(-1073741824.0, -1073741824.0, 0)"", ""speed"": ""-1073741824.0"", ""leader"": ""None""}\n', b'15:08:50.717174 IP 192.168.1.1.32821 > 192.168.1.255.9090: UDP, length 112\n', b'E...j.@.@.KP.........5#..x;.CAM::192.168.1.1::{""time"": ""1.6"", ""position"": ""(1.3900000000000001, -4.8, 0)"", ""speed"": ""1.3"", ""leader"": ""None""}\n', b'15:08:50.813969 IP 192.168.1.2.33694 > 192.168.1.255.9090: UDP, length 126\n', b'E.....@.@..>..........#.....CAM::192.168.1.2::{""time"": ""1.7"", ""position"": ""(-1073741824.0, -1073741824.0, 0)"", ""speed"": ""-1073741824.0"", ""leader"": ""None""}\n', b'15:08:50.815219 IP 192.168.1.1.32821 > 192.168.1.255.9090: UDP, length 113\n', b'E...j.@.@.K<.........5#..y[-CAM::192.168.1.1::{""time"": ""1.7"", ""position"": ""(1.5460000000000003, -4.8, 0)"", ""speed"": ""1.56"", ""leader"": ""None""}\n', b'15:08:50.913901 IP 192.168.1.2.33694 > 192.168.1.255.9090: UDP, length 126\n', b'E.....@.@../..........#.....CAM::192.168.1.2::{""time"": ""1.8"", ""position"": ""(-1073741824.0, -1073741824.0, 0)"", ""speed"": ""-1073741824.0"", ""leader"": ""None""}\n', b'15:08:50.915166 IP 192.168.1.1.32821 > 192.168.1.255.9090: UDP, length 113\n', b'E...j.@.@.K$.........5#..yZ+CAM::192.168.1.1::{""time"": ""1.8"", ""position"": ""(1.7280000000000004, -4.8, 0)"", ""speed"": ""1.82"", ""leader"": ""None""}\n', b'15:08:51.014057 IP 192.168.1.2.33694 > 192.168.1.255.9090: UDP, length 126\n', b'E.....@.@..!..........#.....CAM::192.168.1.2::{""time"": ""1.9"", ""position"": ""(-1073741824.0, -1073741824.0, 0)"", ""speed"": ""-1073741824.0"", ""leader"": ""None""}\n', b'15:08:51.017848 IP 192.168.1.1.32821 > 192.168.1.255.9090: UDP, length 113\n', b'E...j.@.@.K..........5#..yS3CAM::192.168.1.1::{""time"": ""1.9"", ""position"": ""(1.9360000000000002, -4.8, 0)"", ""speed"": ""2.08"", ""leader"": ""None""}\n', b'15:08:51.113579 IP 192.168.1.2.33694 > 192.168.1.255.9090: UDP, length 126\n', b'E.....@.@.............#.....CAM::192.168.1.2::{""time"": ""2.0"", ""position"": ""(-1073741824.0, -1073741824.0, 0)"", ""speed"": ""-1073741824.0"", ""leader"": ""None""}\n', b'15:08:51.114861 IP 192.168.1.1.32821 > 192.168.1.255.9090: UDP, length 99\n', b'E...k.@.@.K..........5#..k..CAM::192.168.1.1::{""time"": ""2.0"", ""position"": ""(2.17, -4.8, 0)"", ""speed"": ""2.34"", ""leader"": ""None""}\n', b'15:08:51.213655 IP 192.168.1.2.33694 > 192.168.1.255.9090: UDP, length 126\n', b'E.....@.@.............#.....CAM::192.168.1.2::{""time"": ""2.1"", ""position"": ""(-1073741824.0, -1073741824.0, 0)"", ""speed"": ""-1073741824.0"", ""leader"": ""None""}\n', b'15:08:51.215553 IP 192.168.1.1.32821 > 192.168.1.255.9090: UDP, length 127\n', b'E...k.@.@.J..........5#....GCAM::192.168.1.1::{""time"": ""2.1"", ""position"": ""(2.4299999999999997, -4.8, 0)"", ""speed"": ""2.5999999999999996"", ""leader"": ""None""}\n', b'15:08:51.313481 IP 192.168.1.2.33694 > 192.168.1.255.9090: UDP, length 126\n', b'E.....@.@.............#.....CAM::192.168.1.2::{""time"": ""2.2"", ""position"": ""(-1073741824.0, -1073741824.0, 0)"", ""speed"": ""-1073741824.0"", ""leader"": ""None""}\n', b'15:08:51.314875 IP 192.168.1.1.32821 > 192.168.1.255.9090: UDP, length 127\n', b'E...k @.@.J..........5#....ECAM::192.168.1.1::{""time"": ""2.2"", ""position"": ""(2.7159999999999997, -4.8, 0)"", ""speed"": ""2.8599999999999994"", ""leader"": ""None""}\n']";-77.0@car2-wlan1
24;2.4s;car1;No leader;No leader;2.3659999999999997;[];-77.0@car1-wlan1
24;2.4s;car2;No leader;No leader;Not initialised;[];-77.0@car2-wlan1
25;2.5s;car1;No leader;No leader;2.7299999999999995;[];-77.0@car1-wlan1
25;2.5s;car2;No leader;No leader;Not initialised;[];-77.0@car2-wlan1
26;2.6s;car1;No leader;No leader;3.119999999999999;[];-77.0@car1-wlan1
26;2.6s;car2;No leader;No leader;Not initialised;[];-77.0@car2-wlan1
27;2.7s;car1;No leader;No leader;3.5359999999999987;[];-77.0@car1-wlan1
27;2.7s;car2;No leader;No leader;Not initialised;[];-77.0@car2-wlan1
28;2.8s;car1;No leader;No leader;3.977999999999999;[];-77.0@car1-wlan1
28;2.8s;car2;No leader;No leader;Not initialised;[];-77.0@car2-wlan1
29;2.9s;car1;No leader;No leader;4.445999999999999;[];-76.0@car1-wlan1
29;2.9s;car2;No leader;No leader;Not initialised;[];-77.0@car2-wlan1
30;3.0s;car1;No leader;No leader;4.939999999999999;[];-76.0@car1-wlan1
30;3.0s;car2;No leader;No leader;Not initialised;[];-77.0@car2-wlan1
31;3.1s;car1;No leader;No leader;5.459999999999998;[];-76.0@car1-wlan1
31;3.1s;car2;No leader;No leader;Not initialised;[];-77.0@car2-wlan1
32;3.2s;car1;No leader;No leader;6.005999999999998;[];-76.0@car1-wlan1
32;3.2s;car2;No leader;No leader;Not initialised;[];-77.0@car2-wlan1
33;3.3s;car1;No leader;No leader;6.577999999999998;"[b'15:08:51.412205 IP 192.168.1.1.32821 > 192.168.1.255.9090: UDP, length 126\n', b'E...k7@.@.J..........5#...x.CAM::192.168.1.1::{""time"": ""2.3"", ""position"": ""(3.0279999999999996, -4.8, 0)"", ""speed"": ""3.119999999999999"", ""leader"": ""None""}\n', b'15:08:51.419638 IP 192.168.1.2.33694 > 192.168.1.255.9090: UDP, length 126\n', b'E.....@.@.............#.....CAM::192.168.1.2::{""time"": ""2.3"", ""position"": ""(-1073741824.0, -1073741824.0, 0)"", ""speed"": ""-1073741824.0"", ""leader"": ""None""}\n', b'15:08:51.512687 IP 192.168.1.1.32821 > 192.168.1.255.9090: UDP, length 126\n', b'E...kA@.@.J..........5#...p.CAM::192.168.1.1::{""time"": ""2.4"", ""position"": ""(3.3659999999999997, -4.8, 0)"", ""speed"": ""3.379999999999999"", ""leader"": ""None""}\n', b'15:08:51.518570 IP 192.168.1.2.33694 > 192.168.1.255.9090: UDP, length 126\n', b'E.....@.@.............#.....CAM::192.168.1.2::{""time"": ""2.4"", ""position"": ""(-1073741824.0, -1073741824.0, 0)"", ""speed"": ""-1073741824.0"", ""leader"": ""None""}\n', b'15:08:51.612480 IP 192.168.1.1.32821 > 192.168.1.255.9090: UDP, length 125\n', b'E...kG@.@.J..........5#....?CAM::192.168.1.1::{""time"": ""2.5"", ""position"": ""(3.729999999999999, -4.8, 0)"", ""speed"": ""3.639999999999999"", ""leader"": ""None""}\n', b'15:08:51.618368 IP 192.168.1.2.33694 > 192.168.1.255.9090: UDP, length 126\n', b'E.... @.@.............#.....CAM::192.168.1.2::{""time"": ""2.5"", ""position"": ""(-1073741824.0, -1073741824.0, 0)"", ""speed"": ""-1073741824.0"", ""leader"": ""None""}\n', b'15:08:51.712328 IP 192.168.1.1.32821 > 192.168.1.255.9090: UDP, length 126\n', b'E...kT@.@.J..........5#....`CAM::192.168.1.1::{""time"": ""2.6"", ""position"": ""(4.119999999999999, -4.8, 0)"", ""speed"": ""3.8999999999999986"", ""leader"": ""None""}\n', b'15:08:51.717894 IP 192.168.1.2.33694 > 192.168.1.255.9090: UDP, length 126\n', b'E....\'@.@.............#.....CAM::192.168.1.2::{""time"": ""2.6"", ""position"": ""(-1073741824.0, -1073741824.0, 0)"", ""speed"": ""-1073741824.0"", ""leader"": ""None""}\n', b'15:08:51.812796 IP 192.168.1.1.32821 > 192.168.1.255.9090: UDP, length 125\n', b'E...kh@.@.J..........5#....<CAM::192.168.1.1::{""time"": ""2.7"", ""position"": ""(4.535999999999999, -4.8, 0)"", ""speed"": ""4.159999999999998"", ""leader"": ""None""}\n', b'15:08:51.818144 IP 192.168.1.2.33694 > 192.168.1.255.9090: UDP, length 126\n', b'E....@@.@.............#.....CAM::192.168.1.2::{""time"": ""2.7"", ""position"": ""(-1073741824.0, -1073741824.0, 0)"", ""speed"": ""-1073741824.0"", ""leader"": ""None""}\n', b'15:08:51.912576 IP 192.168.1.1.32821 > 192.168.1.255.9090: UDP, length 125\n', b'E...ki@.@.J..........5#...\n', b'<CAM::192.168.1.1::{""time"": ""2.8"", ""position"": ""(4.977999999999999, -4.8, 0)"", ""speed"": ""4.419999999999998"", ""leader"": ""None""}\n', b'15:08:51.917506 IP 192.168.1.2.33694 > 192.168.1.255.9090: UDP, length 126\n', b'E....J@.@.............#.....CAM::192.168.1.2::{""time"": ""2.8"", ""position"": ""(-1073741824.0, -1073741824.0, 0)"", ""speed"": ""-1073741824.0"", ""leader"": ""None""}\n', b'15:08:52.012959 IP 192.168.1.1.32821 > 192.168.1.255.9090: UDP, length 125\n', b'E...ky@.@.J..........5#....9CAM::192.168.1.1::{""time"": ""2.9"", ""position"": ""(5.445999999999999, -4.8, 0)"", ""speed"": ""4.679999999999998"", ""leader"": ""None""}\n', b'15:08:52.018002 IP 192.168.1.2.33694 > 192.168.1.255.9090: UDP, length 126\n', b'E....O@.@.............#.....CAM::192.168.1.2::{""time"": ""2.9"", ""position"": ""(-1073741824.0, -1073741824.0, 0)"", ""speed"": ""-1073741824.0"", ""leader"": ""None""}\n', b'15:08:52.113161 IP 192.168.1.1.32821 > 192.168.1.255.9090: UDP, length 125\n', b'E...k.@.@.J..........5#...\t>CAM::192.168.1.1::{""time"": ""3.0"", ""position"": ""(5.939999999999999, -4.8, 0)"", ""speed"": ""4.939999999999998"", ""leader"": ""None""}\n', b'15:08:52.118887 IP 192.168.1.2.33694 > 192.168.1.255.9090: UDP, length 126\n', b'E....`@.@.............#.....CAM::192.168.1.2::{""time"": ""3.0"", ""position"": ""(-1073741824.0, -1073741824.0, 0)"", ""speed"": ""-1073741824.0"", ""leader"": ""None""}\n', b'15:08:52.213031 IP 192.168.1.1.32821 > 192.168.1.255.9090: UDP, length 126\n', b'E...k.@.@.Jj.........5#....]CAM::192.168.1.1::{""time"": ""3.1"", ""position"": ""(6.459999999999997, -4.8, 0)"", ""speed"": ""5.1999999999999975"", ""leader"": ""None""}\n', b'15:08:52.218716 IP 192.168.1.2.33694 > 192.168.1.255.9090: UDP, length 126\n', b'E....w@.@.............#.....CAM::192.168.1.2::{""time"": ""3.1"", ""position"": ""(-1073741824.0, -1073741824.0, 0)"", ""speed"": ""-1073741824.0"", ""leader"": ""None""}\n', b'15:08:52.312664 IP 192.168.1.1.32821 > 192.168.1.255.9090: UDP, length 125\n', b'E...k.@.@.Ji.........5#....?CAM::192.168.1.1::{""time"": ""3.2"", ""position"": ""(7.005999999999997, -4.8, 0)"", ""speed"": ""5.459999999999997"", ""leader"": ""None""}\n', b'15:08:52.319118 IP 192.168.1.2.33694 > 192.168.1.255.9090: UDP, length 126\n', b'E.....@.@..|..........#.....CAM::192.168.1.2::{""time"": ""3.2"", ""position"": ""(-1073741824.0, -1073741824.0, 0)"", ""speed"": ""-1073741824.0"", ""leader"": ""None""}\n']";-76.0@car1-wlan1
33;3.3s;car2;No leader;No leader;Not initialised;"[b'15:08:51.413611 IP 192.168.1.2.33694 > 192.168.1.255.9090: UDP, length 126\n', b'E.....@.@.............#.....CAM::192.168.1.2::{""time"": ""2.3"", ""position"": ""(-1073741824.0, -1073741824.0, 0)"", ""speed"": ""-1073741824.0"", ""leader"": ""None""}\n', b'15:08:51.415197 IP 192.168.1.1.32821 > 192.168.1.255.9090: UDP, length 126\n', b'E...k7@.@.J..........5#...x.CAM::192.168.1.1::{""time"": ""2.3"", ""position"": ""(3.0279999999999996, -4.8, 0)"", ""speed"": ""3.119999999999999"", ""leader"": ""None""}\n', b'15:08:51.514413 IP 192.168.1.2.33694 > 192.168.1.255.9090: UDP, length 126\n', b'E.....@.@.............#.....CAM::192.168.1.2::{""time"": ""2.4"", ""position"": ""(-1073741824.0, -1073741824.0, 0)"", ""speed"": ""-1073741824.0"", ""leader"": ""None""}\n', b'15:08:51.515754 IP 192.168.1.1.32821 > 192.168.1.255.9090: UDP, length 126\n', b'E...kA@.@.J..........5#...p.CAM::192.168.1.1::{""time"": ""2.4"", ""position"": ""(3.3659999999999997, -4.8, 0)"", ""speed"": ""3.379999999999999"", ""leader"": ""None""}\n', b'15:08:51.614012 IP 192.168.1.2.33694 > 192.168.1.255.9090: UDP, length 126\n', b'E.... @.@.............#.....CAM::192.168.1.2::{""time"": ""2.5"", ""position"": ""(-1073741824.0, -1073741824.0, 0)"", ""speed"": ""-1073741824.0"", ""leader"": ""None""}\n', b'15:08:51.615879 IP 192.168.1.1.32821 > 192.168.1.255.9090: UDP, length 125\n', b'E...kG@.@.J..........5#....?CAM::192.168.1.1::{""time"": ""2.5"", ""position"": ""(3.729999999999999, -4.8, 0)"", ""speed"": ""3.639999999999999"", ""leader"": ""None""}\n', b'15:08:51.713653 IP 192.168.1.2.33694 > 192.168.1.255.9090: UDP, length 126\n', b'E....\'@.@.............#.....CAM::192.168.1.2::{""time"": ""2.6"", ""position"": ""(-1073741824.0, -1073741824.0, 0)"", ""speed"": ""-1073741824.0"", ""leader"": ""None""}\n', b'15:08:51.715092 IP 192.168.1.1.32821 > 192.168.1.255.9090: UDP, length 126\n', b'E...kT@.@.J..........5#....`CAM::192.168.1.1::{""time"": ""2.6"", ""position"": ""(4.119999999999999, -4.8, 0)"", ""speed"": ""3.8999999999999986"", ""leader"": ""None""}\n', b'15:08:51.814461 IP 192.168.1.2.33694 > 192.168.1.255.9090: UDP, length 126\n', b'E....@@.@.............#.....CAM::192.168.1.2::{""time"": ""2.7"", ""position"": ""(-1073741824.0, -1073741824.0, 0)"", ""speed"": ""-1073741824.0"", ""leader"": ""None""}\n', b'15:08:51.816015 IP 192.168.1.1.32821 > 192.168.1.255.9090: UDP, length 125\n', b'E...kh@.@.J..........5#....<CAM::192.168.1.1::{""time"": ""2.7"", ""position"": ""(4.535999999999999, -4.8, 0)"", ""speed"": ""4.159999999999998"", ""leader"": ""None""}\n', b'15:08:51.913931 IP 192.168.1.2.33694 > 192.168.1.255.9090: UDP, length 126\n', b'E....J@.@.............#.....CAM::192.168.1.2::{""time"": ""2.8"", ""position"": ""(-1073741824.0, -1073741824.0, 0)"", ""speed"": ""-1073741824.0"", ""leader"": ""None""}\n', b'15:08:51.915284 IP 192.168.1.1.32821 > 192.168.1.255.9090: UDP, length 125\n', b'E...ki@.@.J..........5#...\n', b'<CAM::192.168.1.1::{""time"": ""2.8"", ""position"": ""(4.977999999999999, -4.8, 0)"", ""speed"": ""4.419999999999998"", ""leader"": ""None""}\n', b'15:08:52.014522 IP 192.168.1.2.33694 > 192.168.1.255.9090: UDP, length 126\n', b'E....O@.@.............#.....CAM::192.168.1.2::{""time"": ""2.9"", ""position"": ""(-1073741824.0, -1073741824.0, 0)"", ""speed"": ""-1073741824.0"", ""leader"": ""None""}\n', b'15:08:52.015898 IP 192.168.1.1.32821 > 192.168.1.255.9090: UDP, length 125\n', b'E...ky@.@.J..........5#....9CAM::192.168.1.1::{""time"": ""2.9"", ""position"": ""(5.445999999999999, -4.8, 0)"", ""speed"": ""4.679999999999998"", ""leader"": ""None""}\n', b'15:08:52.114842 IP 192.168.1.2.33694 > 192.168.1.255.9090: UDP, length 126\n', b'E....`@.@.............#.....CAM::192.168.1.2::{""time"": ""3.0"", ""position"": ""(-1073741824.0, -1073741824.0, 0)"", ""speed"": ""-1073741824.0"", ""leader"": ""None""}\n', b'15:08:52.116268 IP 192.168.1.1.32821 > 192.168.1.255.9090: UDP, length 125\n', b'E...k.@.@.J..........5#...\t>CAM::192.168.1.1::{""time"": ""3.0"", ""position"": ""(5.939999999999999, -4.8, 0)"", ""speed"": ""4.939999999999998"", ""leader"": ""None""}\n', b'15:08:52.214240 IP 192.168.1.2.33694 > 192.168.1.255.9090: UDP, length 126\n', b'E....w@.@.............#.....CAM::192.168.1.2::{""time"": ""3.1"", ""position"": ""(-1073741824.0, -1073741824.0, 0)"", ""speed"": ""-1073741824.0"", ""leader"": ""None""}\n', b'15:08:52.216160 IP 192.168.1.1.32821 > 192.168.1.255.9090: UDP, length 126\n', b'E...k.@.@.Jj.........5#....]CAM::192.168.1.1::{""time"": ""3.1"", ""position"": ""(6.459999999999997, -4.8, 0)"", ""speed"": ""5.1999999999999975"", ""leader"": ""None""}\n', b'15:08:52.315744 IP 192.168.1.2.33694 > 192.168.1.255.9090: UDP, length 126\n', b'E.....@.@..|..........#.....CAM::192.168.1.2::{""time"": ""3.2"", ""position"": ""(-1073741824.0, -1073741824.0, 0)"", ""speed"": ""-1073741824.0"", ""leader"": ""None""}\n', b'15:08:52.316641 IP 192.168.1.1.32821 > 192.168.1.255.9090: UDP, length 125\n', b'E...k.@.@.Ji.........5#....?CAM::192.168.1.1::{""time"": ""3.2"", ""position"": ""(7.005999999999997, -4.8, 0)"", ""speed"": ""5.459999999999997"", ""leader"": ""None""}\n']";-77.0@car2-wlan1
34;3.4s;car1;No leader;No leader;7.175999999999997;[];-76.0@car1-wlan1
34;3.4s;car2;No leader;No leader;Not initialised;[];-77.0@car2-wlan1
35;3.5s;car1;No leader;No leader;7.799999999999997;[];-76.0@car1-wlan1
35;3.5s;car2;No leader;No leader;Not initialised;[];-77.0@car2-wlan1
36;3.6s;car1;No leader;No leader;8.449999999999998;[];-76.0@car1-wlan1
36;3.6s;car2;No leader;No leader;Not initialised;[];-77.0@car2-wlan1
37;3.7s;car1;No leader;No leader;9.125999999999998;[];-76.0@car1-wlan1
37;3.7s;car2;No leader;No leader;Not initialised;[];-77.0@car2-wlan1
38;3.8s;car1;No leader;No leader;9.827999999999998;[];-75.0@car1-wlan1
38;3.8s;car2;No leader;No leader;Not initialised;[];-77.0@car2-wlan1
39;3.9s;car1;No leader;No leader;10.555999999999997;[];-75.0@car1-wlan1
39;3.9s;car2;No leader;No leader;Not initialised;[];-77.0@car2-wlan1
40;4.0s;car1;No leader;No leader;11.309999999999997;[];-75.0@car1-wlan1
40;4.0s;car2;No leader;No leader;Not initialised;[];-77.0@car2-wlan1
41;4.1s;car1;No leader;No leader;12.089999999999996;[];-75.0@car1-wlan1
41;4.1s;car2;car1;0.48999999999999666;Not initialised;[];-77.0@car2-wlan1
42;4.2s;car1;No leader;No leader;12.895999999999995;[];-75.0@car1-wlan1
42;4.2s;car2;car1;1.269999999999996;0.0259999999999998;[];-76.0@car2-wlan1
43;4.3s;car1;No leader;No leader;13.727999999999994;"[b'15:08:52.412725 IP 192.168.1.1.32821 > 192.168.1.255.9090: UDP, length 125\n', b'E...k.@.@.Ja.........5#....<CAM::192.168.1.1::{""time"": ""3.3"", ""position"": ""(7.577999999999998, -4.8, 0)"", ""speed"": ""5.719999999999997"", ""leader"": ""None""}\n', b'15:08:52.423814 IP 192.168.1.2.33694 > 192.168.1.255.9090: UDP, length 126\n', b'E.....@.@..g..........#.....CAM::192.168.1.2::{""time"": ""3.3"", ""position"": ""(-1073741824.0, -1073741824.0, 0)"", ""speed"": ""-1073741824.0"", ""leader"": ""None""}\n', b'15:08:52.512821 IP 192.168.1.1.32821 > 192.168.1.255.9090: UDP, length 125\n', b'E...k.@.@.JW.........5#....6CAM::192.168.1.1::{""time"": ""3.4"", ""position"": ""(8.175999999999997, -4.8, 0)"", ""speed"": ""5.979999999999997"", ""leader"": ""None""}\n', b'15:08:52.518467 IP 192.168.1.2.33694 > 192.168.1.255.9090: UDP, length 126\n', b'E.....@.@..`..........#.....CAM::192.168.1.2::{""time"": ""3.4"", ""position"": ""(-1073741824.0, -1073741824.0, 0)"", ""speed"": ""-1073741824.0"", ""leader"": ""None""}\n', b'15:08:52.612326 IP 192.168.1.1.32821 > 192.168.1.255.9090: UDP, length 125\n', b'E...k.@.@.JV.........5#....8CAM::192.168.1.1::{""time"": ""3.5"", ""position"": ""(8.799999999999997, -4.8, 0)"", ""speed"": ""6.239999999999997"", ""leader"": ""None""}\n', b'15:08:52.616602 IP 192.168.1.2.33694 > 192.168.1.255.9090: UDP, length 126\n', b'E.....@.@..X..........#.....CAM::192.168.1.2::{""time"": ""3.5"", ""position"": ""(-1073741824.0, -1073741824.0, 0)"", ""speed"": ""-1073741824.0"", ""leader"": ""None""}\n', b'15:08:52.712071 IP 192.168.1.1.32821 > 192.168.1.255.9090: UDP, length 126\n', b'E...k.@.@.JR.........5#...._CAM::192.168.1.1::{""time"": ""3.6"", ""position"": ""(9.449999999999998, -4.8, 0)"", ""speed"": ""6.4999999999999964"", ""leader"": ""None""}\n', b'15:08:52.716862 IP 192.168.1.2.33694 > 192.168.1.255.9090: UDP, length 126\n', b'E.....@.@..I..........#.....CAM::192.168.1.2::{""time"": ""3.6"", ""position"": ""(-1073741824.0, -1073741824.0, 0)"", ""speed"": ""-1073741824.0"", ""leader"": ""None""}\n', b'15:08:52.812034 IP 192.168.1.1.32821 > 192.168.1.255.9090: UDP, length 126\n', b'E...k.@.@.JI.........5#...x.CAM::192.168.1.1::{""time"": ""3.7"", ""position"": ""(10.125999999999998, -4.8, 0)"", ""speed"": ""6.759999999999996"", ""leader"": ""None""}\n', b'15:08:52.817745 IP 192.168.1.2.33694 > 192.168.1.255.9090: UDP, length 126\n', b'E.....@.@..:..........#.....CAM::192.168.1.2::{""time"": ""3.7"", ""position"": ""(-1073741824.0, -1073741824.0, 0)"", ""speed"": ""-1073741824.0"", ""leader"": ""None""}\n', b'15:08:52.912815 IP 192.168.1.1.32821 > 192.168.1.255.9090: UDP, length 126\n', b'E...k.@.@.JD.........5#...{.CAM::192.168.1.1::{""time"": ""3.8"", ""position"": ""(10.827999999999998, -4.8, 0)"", ""speed"": ""7.019999999999996"", ""leader"": ""None""}\n', b'15:08:52.917999 IP 192.168.1.2.33694 > 192.168.1.255.9090: UDP, length 126\n', b'E.....@.@..4..........#.....CAM::192.168.1.2::{""time"": ""3.8"", ""position"": ""(-1073741824.0, -1073741824.0, 0)"", ""speed"": ""-1073741824.0"", ""leader"": ""None""}\n', b'15:08:53.013073 IP 192.168.1.1.32821 > 192.168.1.255.9090: UDP, length 126\n', b'E...k.@.@.JA.........5#...q.CAM::192.168.1.1::{""time"": ""3.9"", ""position"": ""(11.555999999999997, -4.8, 0)"", ""speed"": ""7.279999999999996"", ""leader"": ""None""}\n', b'15:08:53.018344 IP 192.168.1.2.33694 > 192.168.1.255.9090: UDP, length 126\n', b'E.....@.@..,..........#.....CAM::192.168.1.2::{""time"": ""3.9"", ""position"": ""(-1073741824.0, -1073741824.0, 0)"", ""speed"": ""-1073741824.0"", ""leader"": ""None""}\n', b'15:08:53.113870 IP 192.168.1.1.32821 > 192.168.1.255.9090: UDP, length 126\n', b'E...k.@.@.J,.........5#.....CAM::192.168.1.1::{""time"": ""4.0"", ""position"": ""(12.309999999999997, -4.8, 0)"", ""speed"": ""7.539999999999996"", ""leader"": ""None""}\n', b'15:08:53.118840 IP 192.168.1.2.33694 > 192.168.1.255.9090: UDP, length 126\n', b'E.....@.@..""..........#.....CAM::192.168.1.2::{""time"": ""4.0"", ""position"": ""(-1073741824.0, -1073741824.0, 0)"", ""speed"": ""-1073741824.0"", ""leader"": ""None""}\n', b'15:08:53.213653 IP 192.168.1.1.32821 > 192.168.1.255.9090: UDP, length 126\n', b'E...k.@.@.J\'.........5#...s.CAM::192.168.1.1::{""time"": ""4.1"", ""position"": ""(13.089999999999996, -4.8, 0)"", ""speed"": ""7.799999999999995"", ""leader"": ""None""}\n', b'15:08:53.218612 IP 192.168.1.2.33694 > 192.168.1.255.9090: UDP, length 97\n', b'E..}..@.@..-..........#..i{.CAM::192.168.1.2::{""time"": ""4.1"", ""position"": ""(5.1, -4.8, 0)"", ""speed"": ""0.0"", ""leader"": ""car1""}\n', b'15:08:53.314086 IP 192.168.1.1.32821 > 192.168.1.255.9090: UDP, length 126\n', b'E...k.@.@.J&.........5#...u.CAM::192.168.1.1::{""time"": ""4.2"", ""position"": ""(13.895999999999994, -4.8, 0)"", ""speed"": ""8.059999999999995"", ""leader"": ""None""}\n', b'15:08:53.318956 IP 192.168.1.2.33694 > 192.168.1.255.9090: UDP, length 113\n', b'E.....@.@.............#..yfxCAM::192.168.1.2::{""time"": ""4.2"", ""position"": ""(5.1259999999999994, -4.8, 0)"", ""speed"": ""0.26"", ""leader"": ""car1""}\n']";-75.0@car1-wlan1
43;4.3s;car2;car1;2.0499999999999954;0.0779999999999994;"[b'15:08:52.414374 IP 192.168.1.2.33694 > 192.168.1.255.9090: UDP, length 126\n', b'E.....@.@..g..........#.....CAM::192.168.1.2::{""time"": ""3.3"", ""position"": ""(-1073741824.0, -1073741824.0, 0)"", ""speed"": ""-1073741824.0"", ""leader"": ""None""}\n', b'15:08:52.418687 IP 192.168.1.1.32821 > 192.168.1.255.9090: UDP, length 125\n', b'E...k.@.@.Ja.........5#....<CAM::192.168.1.1::{""time"": ""3.3"", ""position"": ""(7.577999999999998, -4.8, 0)"", ""speed"": ""5.719999999999997"", ""leader"": ""None""}\n', b'15:08:52.514281 IP 192.168.1.2.33694 > 192.168.1.255.9090: UDP, length 126\n', b'E.....@.@..`..........#.....CAM::192.168.1.2::{""time"": ""3.4"", ""position"": ""(-1073741824.0, -1073741824.0, 0)"", ""speed"": ""-1073741824.0"", ""leader"": ""None""}\n', b'15:08:52.515893 IP 192.168.1.1.32821 > 192.168.1.255.9090: UDP, length 125\n', b'E...k.@.@.JW.........5#....6CAM::192.168.1.1::{""time"": ""3.4"", ""position"": ""(8.175999999999997, -4.8, 0)"", ""speed"": ""5.979999999999997"", ""leader"": ""None""}\n', b'15:08:52.612838 IP 192.168.1.2.33694 > 192.168.1.255.9090: UDP, length 126\n', b'E.....@.@..X..........#.....CAM::192.168.1.2::{""time"": ""3.5"", ""position"": ""(-1073741824.0, -1073741824.0, 0)"", ""speed"": ""-1073741824.0"", ""leader"": ""None""}\n', b'15:08:52.615658 IP 192.168.1.1.32821 > 192.168.1.255.9090: UDP, length 125\n', b'E...k.@.@.JV.........5#....8CAM::192.168.1.1::{""time"": ""3.5"", ""position"": ""(8.799999999999997, -4.8, 0)"", ""speed"": ""6.239999999999997"", ""leader"": ""None""}\n', b'15:08:52.713100 IP 192.168.1.2.33694 > 192.168.1.255.9090: UDP, length 126\n', b'E.....@.@..I..........#.....CAM::192.168.1.2::{""time"": ""3.6"", ""position"": ""(-1073741824.0, -1073741824.0, 0)"", ""speed"": ""-1073741824.0"", ""leader"": ""None""}\n', b'15:08:52.714597 IP 192.168.1.1.32821 > 192.168.1.255.9090: UDP, length 126\n', b'E...k.@.@.JR.........5#...._CAM::192.168.1.1::{""time"": ""3.6"", ""position"": ""(9.449999999999998, -4.8, 0)"", ""speed"": ""6.4999999999999964"", ""leader"": ""None""}\n', b'15:08:52.813015 IP 192.168.1.2.33694 > 192.168.1.255.9090: UDP, length 126\n', b'E.....@.@..:..........#.....CAM::192.168.1.2::{""time"": ""3.7"", ""position"": ""(-1073741824.0, -1073741824.0, 0)"", ""speed"": ""-1073741824.0"", ""leader"": ""None""}\n', b'15:08:52.814619 IP 192.168.1.1.32821 > 192.168.1.255.9090: UDP, length 126\n', b'E...k.@.@.JI.........5#...x.CAM::192.168.1.1::{""time"": ""3.7"", ""position"": ""(10.125999999999998, -4.8, 0)"", ""speed"": ""6.759999999999996"", ""leader"": ""None""}\n', b'15:08:52.914052 IP 192.168.1.2.33694 > 192.168.1.255.9090: UDP, length 126\n', b'E.....@.@..4..........#.....CAM::192.168.1.2::{""time"": ""3.8"", ""position"": ""(-1073741824.0, -1073741824.0, 0)"", ""speed"": ""-1073741824.0"", ""leader"": ""None""}\n', b'15:08:52.915642 IP 192.168.1.1.32821 > 192.168.1.255.9090: UDP, length 126\n', b'E...k.@.@.JD.........5#...{.CAM::192.168.1.1::{""time"": ""3.8"", ""position"": ""(10.827999999999998, -4.8, 0)"", ""speed"": ""7.019999999999996"", ""leader"": ""None""}\n', b'15:08:53.014469 IP 192.168.1.2.33694 > 192.168.1.255.9090: UDP, length 126\n', b'E.....@.@..,..........#.....CAM::192.168.1.2::{""time"": ""3.9"", ""position"": ""(-1073741824.0, -1073741824.0, 0)"", ""speed"": ""-1073741824.0"", ""leader"": ""None""}\n', b'15:08:53.016078 IP 192.168.1.1.32821 > 192.168.1.255.9090: UDP, length 126\n', b'E...k.@.@.JA.........5#...q.CAM::192.168.1.1::{""time"": ""3.9"", ""position"": ""(11.555999999999997, -4.8, 0)"", ""speed"": ""7.279999999999996"", ""leader"": ""None""}\n', b'15:08:53.115643 IP 192.168.1.2.33694 > 192.168.1.255.9090: UDP, length 126\n', b'E.....@.@..""..........#.....CAM::192.168.1.2::{""time"": ""4.0"", ""position"": ""(-1073741824.0, -1073741824.0, 0)"", ""speed"": ""-1073741824.0"", ""leader"": ""None""}\n', b'15:08:53.116548 IP 192.168.1.1.32821 > 192.168.1.255.9090: UDP, length 126\n', b'E...k.@.@.J,.........5#.....CAM::192.168.1.1::{""time"": ""4.0"", ""position"": ""(12.309999999999997, -4.8, 0)"", ""speed"": ""7.539999999999996"", ""leader"": ""None""}\n', b'15:08:53.214860 IP 192.168.1.2.33694 > 192.168.1.255.9090: UDP, length 97\n', b'E..}..@.@..-..........#..i{.CAM::192.168.1.2::{""time"": ""4.1"", ""position"": ""(5.1, -4.8, 0)"", ""speed"": ""0.0"", ""leader"": ""car1""}\n', b'15:08:53.216599 IP 192.168.1.1.32821 > 192.168.1.255.9090: UDP, length 126\n', b'E...k.@.@.J\'.........5#...s.CAM::192.168.1.1::{""time"": ""4.1"", ""position"": ""(13.089999999999996, -4.8, 0)"", ""speed"": ""7.799999999999995"", ""leader"": ""None""}\n', b'15:08:53.315742 IP 192.168.1.2.33694 > 192.168.1.255.9090: UDP, length 113\n', b'E.....@.@.............#..yfxCAM::192.168.1.2::{""time"": ""4.2"", ""position"": ""(5.1259999999999994, -4.8, 0)"", ""speed"": ""0.26"", ""leader"": ""car1""}\n', b'15:08:53.316986 IP 192.168.1.1.32821 > 192.168.1.255.9090: UDP, length 126\n', b'E...k.@.@.J&.........5#...u.CAM::192.168.1.1::{""time"": ""4.2"", ""position"": ""(13.895999999999994, -4.8, 0)"", ""speed"": ""8.059999999999995"", ""leader"": ""None""}\n']";-76.0@car2-wlan1
44;4.4s;car1;No leader;No leader;14.585999999999993;[];-75.0@car1-wlan1
44;4.4s;car2;car1;2.829999999999994;0.1559999999999997;[];-76.0@car2-wlan1
45;4.5s;car1;No leader;No leader;15.469999999999992;[];-74.0@car1-wlan1
45;4.5s;car2;car1;3.6099999999999923;0.2599999999999998;[];-76.0@car2-wlan1
46;4.6s;car1;No leader;No leader;16.379999999999992;[];-74.0@car1-wlan1
46;4.6s;car2;car1;4.389999999999993;0.3899999999999997;[];-76.0@car2-wlan1
47;4.7s;car1;No leader;No leader;17.315999999999992;[];-74.0@car1-wlan1
47;4.7s;car2;car1;5.169999999999993;0.5459999999999994;[];-76.0@car2-wlan1
48;4.8s;car1;No leader;No leader;18.27799999999999;[];-74.0@car1-wlan1
48;4.8s;car2;car1;5.949999999999992;0.7279999999999998;[];-76.0@car2-wlan1
49;4.9s;car1;No leader;No leader;19.26599999999999;[];-74.0@car1-wlan1
49;4.9s;car2;car1;6.7299999999999915;0.9359999999999999;[];-76.0@car2-wlan1
50;5.0s;car1;No leader;No leader;20.27999999999999;[];-73.0@car1-wlan1
50;5.0s;car2;car1;7.509999999999991;1.17;[];-76.0@car2-wlan1
51;5.1s;car1;No leader;No leader;21.31999999999999;[];-73.0@car1-wlan1
51;5.1s;car2;car1;8.28999999999999;1.4299999999999997;[];-76.0@car2-wlan1
52;5.2s;car1;No leader;No leader;22.38599999999999;[];-73.0@car1-wlan1
52;5.2s;car2;car1;9.06999999999999;1.7159999999999993;[];-76.0@car2-wlan1
53;5.3s;car1;obs;69.22200000000001;23.477999999999987;"[b'15:08:53.416569 IP 192.168.1.1.32821 > 192.168.1.255.9090: UDP, length 126\n', b'E...k.@.@.J..........5#.....CAM::192.168.1.1::{""time"": ""4.3"", ""position"": ""(14.727999999999994, -4.8, 0)"", ""speed"": ""8.319999999999995"", ""leader"": ""None""}\n', b'15:08:53.422217 IP 192.168.1.2.33694 > 192.168.1.255.9090: UDP, length 112\n', b'E.....@.@.............#..x+.CAM::192.168.1.2::{""time"": ""4.3"", ""position"": ""(5.177999999999999, -4.8, 0)"", ""speed"": ""0.52"", ""leader"": ""car1""}\n', b'15:08:53.515428 IP 192.168.1.1.32821 > 192.168.1.255.9090: UDP, length 126\n', b'E...k.@.@.J..........5#...r.CAM::192.168.1.1::{""time"": ""4.4"", ""position"": ""(15.585999999999995, -4.8, 0)"", ""speed"": ""8.579999999999995"", ""leader"": ""None""}\n', b'15:08:53.520992 IP 192.168.1.2.33694 > 192.168.1.255.9090: UDP, length 112\n', b'E.....@.@.............#..x).CAM::192.168.1.2::{""time"": ""4.4"", ""position"": ""(5.255999999999999, -4.8, 0)"", ""speed"": ""0.78"", ""leader"": ""car1""}\n', b'15:08:53.615866 IP 192.168.1.1.32821 > 192.168.1.255.9090: UDP, length 125\n', b'E...k.@.@.J..........5#....5CAM::192.168.1.1::{""time"": ""4.5"", ""position"": ""(16.46999999999999, -4.8, 0)"", ""speed"": ""8.839999999999995"", ""leader"": ""None""}\n', b'15:08:53.620471 IP 192.168.1.2.33694 > 192.168.1.255.9090: UDP, length 112\n', b'E.....@.@.............#..x).CAM::192.168.1.2::{""time"": ""4.5"", ""position"": ""(5.359999999999999, -4.8, 0)"", ""speed"": ""1.04"", ""leader"": ""car1""}\n', b'15:08:53.716646 IP 192.168.1.1.32821 > 192.168.1.255.9090: UDP, length 126\n', b'E...l.@.@.I..........5#...o.CAM::192.168.1.1::{""time"": ""4.6"", ""position"": ""(17.379999999999992, -4.8, 0)"", ""speed"": ""9.099999999999994"", ""leader"": ""None""}\n', b'15:08:53.721424 IP 192.168.1.2.33694 > 192.168.1.255.9090: UDP, length 111\n', b'E....$@.@.............#..w.[CAM::192.168.1.2::{""time"": ""4.6"", ""position"": ""(5.489999999999999, -4.8, 0)"", ""speed"": ""1.3"", ""leader"": ""car1""}\n', b'15:08:53.816103 IP 192.168.1.1.32821 > 192.168.1.255.9090: UDP, length 126\n', b'E...l.@.@.I..........5#...x.CAM::192.168.1.1::{""time"": ""4.7"", ""position"": ""(18.315999999999992, -4.8, 0)"", ""speed"": ""9.359999999999994"", ""leader"": ""None""}\n', b'15:08:53.821463 IP 192.168.1.2.33694 > 192.168.1.255.9090: UDP, length 112\n', b'E....\'@.@.............#..x#.CAM::192.168.1.2::{""time"": ""4.7"", ""position"": ""(5.645999999999999, -4.8, 0)"", ""speed"": ""1.56"", ""leader"": ""car1""}\n', b'15:08:53.915578 IP 192.168.1.1.32821 > 192.168.1.255.9090: UDP, length 125\n', b'E...l.@.@.I..........5#....8CAM::192.168.1.1::{""time"": ""4.8"", ""position"": ""(19.27799999999999, -4.8, 0)"", ""speed"": ""9.619999999999994"", ""leader"": ""None""}\n', b'15:08:53.920833 IP 192.168.1.2.33694 > 192.168.1.255.9090: UDP, length 112\n', b'E....2@.@.............#..x..CAM::192.168.1.2::{""time"": ""4.8"", ""position"": ""(5.827999999999999, -4.8, 0)"", ""speed"": ""1.82"", ""leader"": ""car1""}\n', b'15:08:54.015482 IP 192.168.1.1.32821 > 192.168.1.255.9090: UDP, length 125\n', b'E...l5@.@.I..........5#....=CAM::192.168.1.1::{""time"": ""4.9"", ""position"": ""(20.26599999999999, -4.8, 0)"", ""speed"": ""9.879999999999994"", ""leader"": ""None""}\n', b'15:08:54.023220 IP 192.168.1.2.33694 > 192.168.1.255.9090: UDP, length 100\n', b'E....3@.@.............#..l.OCAM::192.168.1.2::{""time"": ""4.9"", ""position"": ""(6.036, -4.8, 0)"", ""speed"": ""2.08"", ""leader"": ""car1""}\n', b'15:08:54.115842 IP 192.168.1.1.32821 > 192.168.1.255.9090: UDP, length 126\n', b'E...lL@.@.I..........5#....eCAM::192.168.1.1::{""time"": ""5.0"", ""position"": ""(21.27999999999999, -4.8, 0)"", ""speed"": ""10.139999999999993"", ""leader"": ""None""}\n', b'15:08:54.122224 IP 192.168.1.2.33694 > 192.168.1.255.9090: UDP, length 99\n', b'E....4@.@.............#..k..CAM::192.168.1.2::{""time"": ""5.0"", ""position"": ""(6.27, -4.8, 0)"", ""speed"": ""2.34"", ""leader"": ""car1""}\n', b'15:08:54.215961 IP 192.168.1.1.32821 > 192.168.1.255.9090: UDP, length 126\n', b'E...lX@.@.I..........5#....aCAM::192.168.1.1::{""time"": ""5.1"", ""position"": ""(22.31999999999999, -4.8, 0)"", ""speed"": ""10.399999999999993"", ""leader"": ""None""}\n', b'15:08:54.221716 IP 192.168.1.2.33694 > 192.168.1.255.9090: UDP, length 126\n', b'E....G@.@.............#....6CAM::192.168.1.2::{""time"": ""5.1"", ""position"": ""(6.529999999999999, -4.8, 0)"", ""speed"": ""2.5999999999999996"", ""leader"": ""car1""}\n', b'15:08:54.315551 IP 192.168.1.1.32821 > 192.168.1.255.9090: UDP, length 126\n', b'E...l`@.@.I..........5#....aCAM::192.168.1.1::{""time"": ""5.2"", ""position"": ""(23.38599999999999, -4.8, 0)"", ""speed"": ""10.659999999999993"", ""leader"": ""None""}\n', b'15:08:54.321750 IP 192.168.1.2.33694 > 192.168.1.255.9090: UDP, length 126\n', b'E....Z@.@.............#....=CAM::192.168.1.2::{""time"": ""5.2"", ""position"": ""(6.815999999999998, -4.8, 0)"", ""speed"": ""2.8599999999999994"", ""leader"": ""car1""}\n']";-73.0@car1-wlan1
53;5.3s;car2;car1;9.849999999999987;2.0279999999999996;"[b'15:08:53.419020 IP 192.168.1.2.33694 > 192.168.1.255.9090: UDP, length 112\n', b'E.....@.@.............#..x+.CAM::192.168.1.2::{""time"": ""4.3"", ""position"": ""(5.177999999999999, -4.8, 0)"", ""speed"": ""0.52"", ""leader"": ""car1""}\n', b'15:08:53.419293 IP 192.168.1.1.32821 > 192.168.1.255.9090: UDP, length 126\n', b'E...k.@.@.J..........5#.....CAM::192.168.1.1::{""time"": ""4.3"", ""position"": ""(14.727999999999994, -4.8, 0)"", ""speed"": ""8.319999999999995"", ""leader"": ""None""}\n', b'15:08:53.517008 IP 192.168.1.2.33694 > 192.168.1.255.9090: UDP, length 112\n', b'E.....@.@.............#..x).CAM::192.168.1.2::{""time"": ""4.4"", ""position"": ""(5.255999999999999, -4.8, 0)"", ""speed"": ""0.78"", ""leader"": ""car1""}\n', b'15:08:53.518963 IP 192.168.1.1.32821 > 192.168.1.255.9090: UDP, length 126\n', b'E...k.@.@.J..........5#...r.CAM::192.168.1.1::{""time"": ""4.4"", ""position"": ""(15.585999999999995, -4.8, 0)"", ""speed"": ""8.579999999999995"", ""leader"": ""None""}\n', b'15:08:53.617586 IP 192.168.1.2.33694 > 192.168.1.255.9090: UDP, length 112\n', b'E.....@.@.............#..x).CAM::192.168.1.2::{""time"": ""4.5"", ""position"": ""(5.359999999999999, -4.8, 0)"", ""speed"": ""1.04"", ""leader"": ""car1""}\n', b'15:08:53.618409 IP 192.168.1.1.32821 > 192.168.1.255.9090: UDP, length 125\n', b'E...k.@.@.J..........5#....5CAM::192.168.1.1::{""time"": ""4.5"", ""position"": ""(16.46999999999999, -4.8, 0)"", ""speed"": ""8.839999999999995"", ""leader"": ""None""}\n', b'15:08:53.717987 IP 192.168.1.2.33694 > 192.168.1.255.9090: UDP, length 111\n', b'E....$@.@.............#..w.[CAM::192.168.1.2::{""time"": ""4.6"", ""position"": ""(5.489999999999999, -4.8, 0)"", ""speed"": ""1.3"", ""leader"": ""car1""}\n', b'15:08:53.719313 IP 192.168.1.1.32821 > 192.168.1.255.9090: UDP, length 126\n', b'E...l.@.@.I..........5#...o.CAM::192.168.1.1::{""time"": ""4.6"", ""position"": ""(17.379999999999992, -4.8, 0)"", ""speed"": ""9.099999999999994"", ""leader"": ""None""}\n', b'15:08:53.817430 IP 192.168.1.2.33694 > 192.168.1.255.9090: UDP, length 112\n', b'E....\'@.@.............#..x#.CAM::192.168.1.2::{""time"": ""4.7"", ""position"": ""(5.645999999999999, -4.8, 0)"", ""speed"": ""1.56"", ""leader"": ""car1""}\n', b'15:08:53.819038 IP 192.168.1.1.32821 > 192.168.1.255.9090: UDP, length 126\n', b'E...l.@.@.I..........5#...x.CAM::192.168.1.1::{""time"": ""4.7"", ""position"": ""(18.315999999999992, -4.8, 0)"", ""speed"": ""9.359999999999994"", ""leader"": ""None""}\n', b'15:08:53.916957 IP 192.168.1.2.33694 > 192.168.1.255.9090: UDP, length 112\n', b'E....2@.@.............#..x..CAM::192.168.1.2::{""time"": ""4.8"", ""position"": ""(5.827999999999999, -4.8, 0)"", ""speed"": ""1.82"", ""leader"": ""car1""}\n', b'15:08:53.918491 IP 192.168.1.1.32821 > 192.168.1.255.9090: UDP, length 125\n', b'E...l.@.@.I..........5#....8CAM::192.168.1.1::{""time"": ""4.8"", ""position"": ""(19.27799999999999, -4.8, 0)"", ""speed"": ""9.619999999999994"", ""leader"": ""None""}\n', b'15:08:54.016791 IP 192.168.1.2.33694 > 192.168.1.255.9090: UDP, length 100\n', b'E....3@.@.............#..l.OCAM::192.168.1.2::{""time"": ""4.9"", ""position"": ""(6.036, -4.8, 0)"", ""speed"": ""2.08"", ""leader"": ""car1""}\n', b'15:08:54.018138 IP 192.168.1.1.32821 > 192.168.1.255.9090: UDP, length 125\n', b'E...l5@.@.I..........5#....=CAM::192.168.1.1::{""time"": ""4.9"", ""position"": ""(20.26599999999999, -4.8, 0)"", ""speed"": ""9.879999999999994"", ""leader"": ""None""}\n', b'15:08:54.117248 IP 192.168.1.2.33694 > 192.168.1.255.9090: UDP, length 99\n', b'E....4@.@.............#..k..CAM::192.168.1.2::{""time"": ""5.0"", ""position"": ""(6.27, -4.8, 0)"", ""speed"": ""2.34"", ""leader"": ""car1""}\n', b'15:08:54.118933 IP 192.168.1.1.32821 > 192.168.1.255.9090: UDP, length 126\n', b'E...lL@.@.I..........5#....eCAM::192.168.1.1::{""time"": ""5.0"", ""position"": ""(21.27999999999999, -4.8, 0)"", ""speed"": ""10.139999999999993"", ""leader"": ""None""}\n', b'15:08:54.217967 IP 192.168.1.2.33694 > 192.168.1.255.9090: UDP, length 126\n', b'E....G@.@.............#....6CAM::192.168.1.2::{""time"": ""5.1"", ""position"": ""(6.529999999999999, -4.8, 0)"", ""speed"": ""2.5999999999999996"", ""leader"": ""car1""}\n', b'15:08:54.219384 IP 192.168.1.1.32821 > 192.168.1.255.9090: UDP, length 126\n', b'E...lX@.@.I..........5#....aCAM::192.168.1.1::{""time"": ""5.1"", ""position"": ""(22.31999999999999, -4.8, 0)"", ""speed"": ""10.399999999999993"", ""leader"": ""None""}\n', b'15:08:54.316497 IP 192.168.1.2.33694 > 192.168.1.255.9090: UDP, length 126\n', b'E....Z@.@.............#....=CAM::192.168.1.2::{""time"": ""5.2"", ""position"": ""(6.815999999999998, -4.8, 0)"", ""speed"": ""2.8599999999999994"", ""leader"": ""car1""}\n', b'15:08:54.320750 IP 192.168.1.1.32821 > 192.168.1.255.9090: UDP, length 126\n', b'E...l`@.@.I..........5#....aCAM::192.168.1.1::{""time"": ""5.2"", ""position"": ""(23.38599999999999, -4.8, 0)"", ""speed"": ""10.659999999999993"", ""leader"": ""None""}\n']";-76.0@car2-wlan1
54;5.4s;car1;obs;68.10400000000001;24.595999999999986;[];-72.0@car1-wlan1
54;5.4s;car2;car1;10.629999999999987;2.3659999999999997;[];-76.0@car2-wlan1
55;5.5s;car1;obs;66.96000000000002;25.739999999999984;[];-72.0@car1-wlan1
55;5.5s;car2;car1;11.409999999999986;2.7299999999999995;[];-76.0@car2-wlan1
56;5.6s;car1;obs;65.79000000000002;26.909999999999982;[];-72.0@car1-wlan1
56;5.6s;car2;car1;12.189999999999984;3.119999999999999;[];-76.0@car2-wlan1
57;5.7s;car1;obs;64.59400000000002;28.10599999999998;[];-72.0@car1-wlan1
57;5.7s;car2;car1;12.969999999999981;3.5359999999999996;[];-76.0@car2-wlan1
58;5.8s;car1;obs;63.37200000000003;29.327999999999978;[];-71.0@car1-wlan1
58;5.8s;car2;car1;13.749999999999979;3.9779999999999998;[];-76.0@car2-wlan1
59;5.9s;car1;obs;62.124000000000024;30.57599999999998;[];-71.0@car1-wlan1
59;5.9s;car2;car1;14.52999999999998;4.446;[];-76.0@car2-wlan1
60;6.0s;car1;obs;60.85000000000002;31.84999999999998;[];-71.0@car1-wlan1
60;6.0s;car2;car1;15.309999999999981;4.9399999999999995;[];-76.0@car2-wlan1
61;6.1s;car1;obs;59.550000000000026;33.14999999999998;[];-70.0@car1-wlan1
61;6.1s;car2;car1;16.08999999999998;5.459999999999999;[];-75.0@car2-wlan1
62;6.2s;car1;obs;58.246693129878395;34.45330687012161;[];-70.0@car1-wlan1
62;6.2s;car2;car1;16.84730687012161;6.0059999999999985;[];-75.0@car2-wlan1
63;6.3s;car1;obs;56.943386259756764;35.75661374024324;[];-70.0@car1-wlan1
63;6.3s;car2;car1;17.57861374024324;6.577999999999998;[];-75.0@car2-wlan1
64;6.4s;car1;obs;55.64007938963513;37.05992061036487;"[b'15:08:54.416236 IP 192.168.1.1.32821 > 192.168.1.255.9090: UDP, length 126\n', b'E...lu@.@.I..........5#...g.CAM::192.168.1.1::{""time"": ""5.3"", ""position"": ""(24.477999999999987, -4.8, 0)"", ""speed"": ""10.919999999999993"", ""leader"": ""obs""}\n', b'15:08:54.424858 IP 192.168.1.2.33694 > 192.168.1.255.9090: UDP, length 125\n', b'E....h@.@.............#...R.CAM::192.168.1.2::{""time"": ""5.3"", ""position"": ""(7.127999999999999, -4.8, 0)"", ""speed"": ""3.119999999999999"", ""leader"": ""car1""}\n', b'15:08:54.467589 IP6 :: > ff02::16: HBH ICMP6, multicast listener report v2, 2 group record(s), length 48\n', b'`....8..................................:.........mo............................................\n', b'15:08:54.516016 IP 192.168.1.1.32821 > 192.168.1.255.9090: UDP, length 126\n', b'E...l.@.@.Iz.........5#...k.CAM::192.168.1.1::{""time"": ""5.4"", ""position"": ""(25.595999999999986, -4.8, 0)"", ""speed"": ""11.179999999999993"", ""leader"": ""obs""}\n', b'15:08:54.521473 IP 192.168.1.2.33694 > 192.168.1.255.9090: UDP, length 125\n', b'E....m@.@.............#...N.CAM::192.168.1.2::{""time"": ""5.4"", ""position"": ""(7.465999999999999, -4.8, 0)"", ""speed"": ""3.379999999999999"", ""leader"": ""car1""}\n', b'15:08:54.572246 IP6 :: > ff02::1:ff00:0: ICMP6, neighbor solicitation, who has fe80::ff:fe00:0, length 32\n', b'`.... :...................................x.......................+*....\n', b'15:08:54.616258 IP 192.168.1.1.32821 > 192.168.1.255.9090: UDP, length 126\n', b'E...l.@.@.Iu.........5#...n.CAM::192.168.1.1::{""time"": ""5.5"", ""position"": ""(26.739999999999988, -4.8, 0)"", ""speed"": ""11.439999999999992"", ""leader"": ""obs""}\n', b'15:08:54.622345 IP 192.168.1.2.33694 > 192.168.1.255.9090: UDP, length 125\n', b'E....t@.@.............#...B.CAM::192.168.1.2::{""time"": ""5.5"", ""position"": ""(7.829999999999999, -4.8, 0)"", ""speed"": ""3.639999999999999"", ""leader"": ""car1""}\n', b'15:08:54.716372 IP 192.168.1.1.32821 > 192.168.1.255.9090: UDP, length 126\n', b'E...l.@.@.I`.........5#...n.CAM::192.168.1.1::{""time"": ""5.6"", ""position"": ""(27.909999999999986, -4.8, 0)"", ""speed"": ""11.699999999999992"", ""leader"": ""obs""}\n', b'15:08:54.722474 IP 192.168.1.2.33694 > 192.168.1.255.9090: UDP, length 126\n', b'E.....@.@..v..........#....7CAM::192.168.1.2::{""time"": ""5.6"", ""position"": ""(8.219999999999999, -4.8, 0)"", ""speed"": ""3.8999999999999986"", ""leader"": ""car1""}\n', b'15:08:54.816583 IP 192.168.1.1.32821 > 192.168.1.255.9090: UDP, length 125\n', b'E...l.@.@.IK.........5#...J)CAM::192.168.1.1::{""time"": ""5.7"", ""position"": ""(29.10599999999998, -4.8, 0)"", ""speed"": ""11.959999999999992"", ""leader"": ""obs""}\n', b'15:08:54.822352 IP 192.168.1.2.33694 > 192.168.1.255.9090: UDP, length 113\n', b'E.....@.@..j..........#..y.\'CAM::192.168.1.2::{""time"": ""5.7"", ""position"": ""(8.636, -4.8, 0)"", ""speed"": ""4.159999999999998"", ""leader"": ""car1""}\n', b'15:08:54.916944 IP 192.168.1.1.32821 > 192.168.1.255.9090: UDP, length 126\n', b'E...l.@.@.I?.........5#...m.CAM::192.168.1.1::{""time"": ""5.8"", ""position"": ""(30.327999999999978, -4.8, 0)"", ""speed"": ""12.219999999999992"", ""leader"": ""obs""}\n', b'15:08:54.922122 IP 192.168.1.2.33694 > 192.168.1.255.9090: UDP, length 113\n', b'E.....@.@..V..........#..y.\'CAM::192.168.1.2::{""time"": ""5.8"", ""position"": ""(9.078, -4.8, 0)"", ""speed"": ""4.419999999999998"", ""leader"": ""car1""}\n', b'15:08:54.928353 IP6 :: > ff02::16: HBH ICMP6, multicast listener report v2, 2 group record(s), length 48\n', b'`....8..................................:.........mo............................................\n', b'15:08:55.019281 IP 192.168.1.1.32821 > 192.168.1.255.9090: UDP, length 126\n', b'E...l.@.@.I/.........5#...d.CAM::192.168.1.1::{""time"": ""5.9"", ""position"": ""(31.575999999999983, -4.8, 0)"", ""speed"": ""12.479999999999992"", ""leader"": ""obs""}\n', b'15:08:55.024257 IP 192.168.1.2.33694 > 192.168.1.255.9090: UDP, length 113\n', b'E.....@.@..K..........#..y.$CAM::192.168.1.2::{""time"": ""5.9"", ""position"": ""(9.546, -4.8, 0)"", ""speed"": ""4.679999999999998"", ""leader"": ""car1""}\n', b'15:08:55.116903 IP 192.168.1.1.32821 > 192.168.1.255.9090: UDP, length 125\n', b'E...l.@.@.I#.........5#...M\'CAM::192.168.1.1::{""time"": ""6.0"", ""position"": ""(32.84999999999998, -4.8, 0)"", ""speed"": ""12.739999999999991"", ""leader"": ""obs""}\n', b'15:08:55.122435 IP 192.168.1.2.33694 > 192.168.1.255.9090: UDP, length 113\n', b'E.....@.@..B..........#..y.*CAM::192.168.1.2::{""time"": ""6.0"", ""position"": ""(10.04, -4.8, 0)"", ""speed"": ""4.939999999999998"", ""leader"": ""car1""}\n', b'15:08:55.216292 IP 192.168.1.1.32821 > 192.168.1.255.9090: UDP, length 125\n', b'E...l.@.@.I..........5#...F*CAM::192.168.1.1::{""time"": ""6.1"", ""position"": ""(34.14999999999998, -4.8, 0)"", ""speed"": ""12.999999999999991"", ""leader"": ""obs""}\n', b'15:08:55.221729 IP 192.168.1.2.33694 > 192.168.1.255.9090: UDP, length 127\n', b'E.....@.@.............#.....CAM::192.168.1.2::{""time"": ""6.1"", ""position"": ""(10.559999999999999, -4.8, 0)"", ""speed"": ""5.1999999999999975"", ""leader"": ""car1""}\n', b'15:08:55.279592 IP6 :: > ff02::1:ff00:1: ICMP6, neighbor solicitation, who has 2001::1, length 32\n', b'`.... :......................................... .................x.q.iN\n', b'15:08:55.317095 IP 192.168.1.1.32821 > 192.168.1.255.9090: UDP, length 125\n', b'E...l.@.@.I\t.........5#....nCAM::192.168.1.1::{""time"": ""6.2"", ""position"": ""(35.45330687012161, -4.8, 0)"", ""speed"": ""13.033068701216276"", ""leader"": ""obs""}\n', b'15:08:55.322297 IP 192.168.1.2.33694 > 192.168.1.255.9090: UDP, length 126\n', b'E.....@.@.............#...`.CAM::192.168.1.2::{""time"": ""6.2"", ""position"": ""(11.105999999999998, -4.8, 0)"", ""speed"": ""5.459999999999997"", ""leader"": ""car1""}\n', b'15:08:55.416624 IP 192.168.1.1.32821 > 192.168.1.255.9090: UDP, length 125\n', b'E...m.@.@.H..........5#....iCAM::192.168.1.1::{""time"": ""6.3"", ""position"": ""(36.75661374024324, -4.8, 0)"", ""speed"": ""13.033068701216276"", ""leader"": ""obs""}\n', b'15:08:55.422806 IP 192.168.1.2.33694 > 192.168.1.255.9090: UDP, length 126\n', b'E.....@.@..\n', b'..........#...\\wCAM::192.168.1.2::{""time"": ""6.3"", ""position"": ""(11.677999999999997, -4.8, 0)"", ""speed"": ""5.719999999999997"", ""leader"": ""car1""}\n']";-70.0@car1-wlan1
64;6.4s;car2;car1;18.283920610364873;7.175999999999997;"[b'15:08:54.417447 IP 192.168.1.2.33694 > 192.168.1.255.9090: UDP, length 125\n', b'E....h@.@.............#...R.CAM::192.168.1.2::{""time"": ""5.3"", ""position"": ""(7.127999999999999, -4.8, 0)"", ""speed"": ""3.119999999999999"", ""leader"": ""car1""}\n', b'15:08:54.421531 IP 192.168.1.1.32821 > 192.168.1.255.9090: UDP, length 126\n', b'E...lu@.@.I..........5#...g.CAM::192.168.1.1::{""time"": ""5.3"", ""position"": ""(24.477999999999987, -4.8, 0)"", ""speed"": ""10.919999999999993"", ""leader"": ""obs""}\n', b'15:08:54.467609 IP6 :: > ff02::16: HBH ICMP6, multicast listener report v2, 2 group record(s), length 48\n', b'`....8..................................:.........mo............................................\n', b'15:08:54.517294 IP 192.168.1.2.33694 > 192.168.1.255.9090: UDP, length 125\n', b'E....m@.@.............#...N.CAM::192.168.1.2::{""time"": ""5.4"", ""position"": ""(7.465999999999999, -4.8, 0)"", ""speed"": ""3.379999999999999"", ""leader"": ""car1""}\n', b'15:08:54.519271 IP 192.168.1.1.32821 > 192.168.1.255.9090: UDP, length 126\n', b'E...l.@.@.Iz.........5#...k.CAM::192.168.1.1::{""time"": ""5.4"", ""position"": ""(25.595999999999986, -4.8, 0)"", ""speed"": ""11.179999999999993"", ""leader"": ""obs""}\n', b'15:08:54.572264 IP6 :: > ff02::1:ff00:0: ICMP6, neighbor solicitation, who has fe80::ff:fe00:0, length 32\n', b'`.... :...................................x.......................+*....\n', b'15:08:54.618025 IP 192.168.1.2.33694 > 192.168.1.255.9090: UDP, length 125\n', b'E....t@.@.............#...B.CAM::192.168.1.2::{""time"": ""5.5"", ""position"": ""(7.829999999999999, -4.8, 0)"", ""speed"": ""3.639999999999999"", ""leader"": ""car1""}\n', b'15:08:54.619466 IP 192.168.1.1.32821 > 192.168.1.255.9090: UDP, length 126\n', b'E...l.@.@.Iu.........5#...n.CAM::192.168.1.1::{""time"": ""5.5"", ""position"": ""(26.739999999999988, -4.8, 0)"", ""speed"": ""11.439999999999992"", ""leader"": ""obs""}\n', b'15:08:54.717326 IP 192.168.1.2.33694 > 192.168.1.255.9090: UDP, length 126\n', b'E.....@.@..v..........#....7CAM::192.168.1.2::{""time"": ""5.6"", ""position"": ""(8.219999999999999, -4.8, 0)"", ""speed"": ""3.8999999999999986"", ""leader"": ""car1""}\n', b'15:08:54.720289 IP 192.168.1.1.32821 > 192.168.1.255.9090: UDP, length 126\n', b'E...l.@.@.I`.........5#...n.CAM::192.168.1.1::{""time"": ""5.6"", ""position"": ""(27.909999999999986, -4.8, 0)"", ""speed"": ""11.699999999999992"", ""leader"": ""obs""}\n', b'15:08:54.818449 IP 192.168.1.2.33694 > 192.168.1.255.9090: UDP, length 113\n', b'E.....@.@..j..........#..y.\'CAM::192.168.1.2::{""time"": ""5.7"", ""position"": ""(8.636, -4.8, 0)"", ""speed"": ""4.159999999999998"", ""leader"": ""car1""}\n', b'15:08:54.819697 IP 192.168.1.1.32821 > 192.168.1.255.9090: UDP, length 125\n', b'E...l.@.@.IK.........5#...J)CAM::192.168.1.1::{""time"": ""5.7"", ""position"": ""(29.10599999999998, -4.8, 0)"", ""speed"": ""11.959999999999992"", ""leader"": ""obs""}\n', b'15:08:54.918460 IP 192.168.1.2.33694 > 192.168.1.255.9090: UDP, length 113\n', b'E.....@.@..V..........#..y.\'CAM::192.168.1.2::{""time"": ""5.8"", ""position"": ""(9.078, -4.8, 0)"", ""speed"": ""4.419999999999998"", ""leader"": ""car1""}\n', b'15:08:54.919427 IP 192.168.1.1.32821 > 192.168.1.255.9090: UDP, length 126\n', b'E...l.@.@.I?.........5#...m.CAM::192.168.1.1::{""time"": ""5.8"", ""position"": ""(30.327999999999978, -4.8, 0)"", ""speed"": ""12.219999999999992"", ""leader"": ""obs""}\n', b'15:08:54.928373 IP6 :: > ff02::16: HBH ICMP6, multicast listener report v2, 2 group record(s), length 48\n', b'`....8..................................:.........mo............................................\n', b'15:08:55.020688 IP 192.168.1.2.33694 > 192.168.1.255.9090: UDP, length 113\n', b'E.....@.@..K..........#..y.$CAM::192.168.1.2::{""time"": ""5.9"", ""position"": ""(9.546, -4.8, 0)"", ""speed"": ""4.679999999999998"", ""leader"": ""car1""}\n', b'15:08:55.022029 IP 192.168.1.1.32821 > 192.168.1.255.9090: UDP, length 126\n', b'E...l.@.@.I/.........5#...d.CAM::192.168.1.1::{""time"": ""5.9"", ""position"": ""(31.575999999999983, -4.8, 0)"", ""speed"": ""12.479999999999992"", ""leader"": ""obs""}\n', b'15:08:55.118780 IP 192.168.1.2.33694 > 192.168.1.255.9090: UDP, length 113\n', b'E.....@.@..B..........#..y.*CAM::192.168.1.2::{""time"": ""6.0"", ""position"": ""(10.04, -4.8, 0)"", ""speed"": ""4.939999999999998"", ""leader"": ""car1""}\n', b'15:08:55.120308 IP 192.168.1.1.32821 > 192.168.1.255.9090: UDP, length 125\n', b'E...l.@.@.I#.........5#...M\'CAM::192.168.1.1::{""time"": ""6.0"", ""position"": ""(32.84999999999998, -4.8, 0)"", ""speed"": ""12.739999999999991"", ""leader"": ""obs""}\n', b'15:08:55.217523 IP 192.168.1.2.33694 > 192.168.1.255.9090: UDP, length 127\n', b'E.....@.@.............#.....CAM::192.168.1.2::{""time"": ""6.1"", ""position"": ""(10.559999999999999, -4.8, 0)"", ""speed"": ""5.1999999999999975"", ""leader"": ""car1""}\n', b'15:08:55.219227 IP 192.168.1.1.32821 > 192.168.1.255.9090: UDP, length 125\n', b'E...l.@.@.I..........5#...F*CAM::192.168.1.1::{""time"": ""6.1"", ""position"": ""(34.14999999999998, -4.8, 0)"", ""speed"": ""12.999999999999991"", ""leader"": ""obs""}\n', b'15:08:55.279613 IP6 :: > ff02::1:ff00:1: ICMP6, neighbor solicitation, who has 2001::1, length 32\n', b'`.... :......................................... .................x.q.iN\n', b'15:08:55.318503 IP 192.168.1.2.33694 > 192.168.1.255.9090: UDP, length 126\n', b'E.....@.@.............#...`.CAM::192.168.1.2::{""time"": ""6.2"", ""position"": ""(11.105999999999998, -4.8, 0)"", ""speed"": ""5.459999999999997"", ""leader"": ""car1""}\n', b'15:08:55.319850 IP 192.168.1.1.32821 > 192.168.1.255.9090: UDP, length 125\n', b'E...l.@.@.I\t.........5#....nCAM::192.168.1.1::{""time"": ""6.2"", ""position"": ""(35.45330687012161, -4.8, 0)"", ""speed"": ""13.033068701216276"", ""leader"": ""obs""}\n', b'15:08:55.417651 IP 192.168.1.2.33694 > 192.168.1.255.9090: UDP, length 126\n', b'E.....@.@..\n', b'..........#...\\wCAM::192.168.1.2::{""time"": ""6.3"", ""position"": ""(11.677999999999997, -4.8, 0)"", ""speed"": ""5.719999999999997"", ""leader"": ""car1""}\n', b'15:08:55.421543 IP 192.168.1.1.32821 > 192.168.1.255.9090: UDP, length 125\n', b'E...m.@.@.H..........5#....iCAM::192.168.1.1::{""time"": ""6.3"", ""position"": ""(36.75661374024324, -4.8, 0)"", ""speed"": ""13.033068701216276"", ""leader"": ""obs""}\n']";-75.0@car2-wlan1
65;6.5s;car1;obs;54.3367725195135;38.3632274804865;[];-69.0@car1-wlan1
65;6.5s;car2;car1;18.963227480486506;7.799999999999995;[];-75.0@car2-wlan1
66;6.6s;car1;obs;53.03346564939187;39.66653435060813;[];-69.0@car1-wlan1
66;6.6s;car2;car1;19.616534350608134;8.449999999999996;[];-75.0@car2-wlan1
67;6.7s;car1;obs;51.73015877927024;40.96984122072976;[];-68.0@car1-wlan1
67;6.7s;car2;car1;20.243841220729767;9.125999999999996;[];-75.0@car2-wlan1
68;6.8s;car1;obs;50.42685190914861;42.27314809085139;[];-68.0@car1-wlan1
68;6.8s;car2;car1;20.845148090851396;9.827999999999996;[];-75.0@car2-wlan1
69;6.9s;car1;obs;49.12354503902698;43.576454960973024;[];-68.0@car1-wlan1
69;6.9s;car2;car1;21.42045496097303;10.555999999999996;[];-74.0@car2-wlan1
70;7.0s;car1;car3;12.744135889698688;44.879761831094655;[];-67.0@car1-wlan1
70;7.0s;car2;No leader;No leader;11.309999999999997;[];-74.0@car2-wlan1
71;7.1s;car1;car3;12.94465382964317;46.183068701216285;[];-67.0@car1-wlan1
71;7.1s;car2;car1;22.493068701216288;12.089999999999998;[];-74.0@car2-wlan1
72;7.2s;car1;car3;13.145171769587654;47.486375571337916;[];-66.0@car1-wlan1
72;7.2s;car2;car1;22.990375571337918;12.895999999999999;[];-74.0@car2-wlan1
73;7.3s;car1;car3;13.345689709532136;48.78968244145955;[];-66.0@car1-wlan1
73;7.3s;car2;car1;23.461682441459548;13.728;[];-74.0@car2-wlan1
74;7.4s;car1;car3;13.54620764947662;50.09298931158118;"[b'15:08:55.517089 IP 192.168.1.1.32821 > 192.168.1.255.9090: UDP, length 125\n', b'E...m.@.@.H..........5#....cCAM::192.168.1.1::{""time"": ""6.4"", ""position"": ""(38.05992061036487, -4.8, 0)"", ""speed"": ""13.033068701216276"", ""leader"": ""obs""}\n', b'15:08:55.522895 IP 192.168.1.2.33694 > 192.168.1.255.9090: UDP, length 126\n', b'E.....@.@.............#...U{CAM::192.168.1.2::{""time"": ""6.4"", ""position"": ""(12.275999999999996, -4.8, 0)"", ""speed"": ""5.979999999999997"", ""leader"": ""car1""}\n', b'15:08:55.600776 IP6 fe80::ff:fe00:0 > ff02::16: HBH ICMP6, multicast listener report v2, 2 group record(s), length 48\n', b'`....8..................................:.........o.............................................\n', b'15:08:55.601777 IP6 fe80::ff:fe00:0 > ip6-allrouters: ICMP6, router solicitation, length 16\n', b'`.....:...................................{.............\n', b'15:08:55.617002 IP 192.168.1.1.32821 > 192.168.1.255.9090: UDP, length 124\n', b'E...m-@.@.H..........5#....ECAM::192.168.1.1::{""time"": ""6.5"", ""position"": ""(39.3632274804865, -4.8, 0)"", ""speed"": ""13.033068701216276"", ""leader"": ""obs""}\n', b'15:08:55.622888 IP 192.168.1.2.33694 > 192.168.1.255.9090: UDP, length 126\n', b'E.....@.@.............#...VxCAM::192.168.1.2::{""time"": ""6.5"", ""position"": ""(12.899999999999995, -4.8, 0)"", ""speed"": ""6.239999999999997"", ""leader"": ""car1""}\n', b'15:08:55.716726 IP 192.168.1.1.32821 > 192.168.1.255.9090: UDP, length 125\n', b'E...m9@.@.H..........5#...ywCAM::192.168.1.1::{""time"": ""6.6"", ""position"": ""(40.66653435060813, -4.8, 0)"", ""speed"": ""13.033068701216276"", ""leader"": ""obs""}\n', b'15:08:55.722411 IP 192.168.1.2.33694 > 192.168.1.255.9090: UDP, length 127\n', b'E.....@.@.............#.....CAM::192.168.1.2::{""time"": ""6.6"", ""position"": ""(13.549999999999995, -4.8, 0)"", ""speed"": ""6.4999999999999964"", ""leader"": ""car1""}\n', b'15:08:55.816545 IP 192.168.1.1.32821 > 192.168.1.255.9090: UDP, length 125\n', b'E...m=@.@.H..........5#...vhCAM::192.168.1.1::{""time"": ""6.7"", ""position"": ""(41.96984122072976, -4.8, 0)"", ""speed"": ""13.033068701216276"", ""leader"": ""obs""}\n', b'15:08:55.822221 IP 192.168.1.2.33694 > 192.168.1.255.9090: UDP, length 126\n', b'E.....@.@.............#...Y}CAM::192.168.1.2::{""time"": ""6.7"", ""position"": ""(14.225999999999994, -4.8, 0)"", ""speed"": ""6.759999999999996"", ""leader"": ""car1""}\n', b'15:08:55.917211 IP 192.168.1.1.32821 > 192.168.1.255.9090: UDP, length 125\n', b'E...mQ@.@.H..........5#...qvCAM::192.168.1.1::{""time"": ""6.8"", ""position"": ""(43.27314809085139, -4.8, 0)"", ""speed"": ""13.033068701216276"", ""leader"": ""obs""}\n', b'15:08:55.923598 IP 192.168.1.2.33694 > 192.168.1.255.9090: UDP, length 126\n', b'E.....@.@.............#...\\wCAM::192.168.1.2::{""time"": ""6.8"", ""position"": ""(14.927999999999997, -4.8, 0)"", ""speed"": ""7.019999999999996"", ""leader"": ""car1""}\n', b'15:08:56.016823 IP 192.168.1.1.32821 > 192.168.1.255.9090: UDP, length 126\n', b'E...mS@.@.H..........5#.....CAM::192.168.1.1::{""time"": ""6.9"", ""position"": ""(44.576454960973024, -4.8, 0)"", ""speed"": ""13.033068701216276"", ""leader"": ""obs""}\n', b'15:08:56.017198 IP 192.168.1.1.32821 > 192.168.1.255.9090: UDP, length 49\n', b'E..MmT@.@.H..........5#..9..DENM::192.168.1.1::{""command"":2,""parameters"":[1]}\n', b'15:08:56.024806 IP 192.168.1.2.33694 > 192.168.1.255.9090: UDP, length 126\n', b'E....,@.@.............#...R{CAM::192.168.1.2::{""time"": ""6.9"", ""position"": ""(15.655999999999995, -4.8, 0)"", ""speed"": ""7.279999999999996"", ""leader"": ""car1""}\n', b'15:08:56.117426 IP 192.168.1.1.32821 > 192.168.1.255.9090: UDP, length 127\n', b'E...md@.@.H..........5#... eCAM::192.168.1.1::{""time"": ""7.0"", ""position"": ""(45.879761831094655, -1.6, 0)"", ""speed"": ""13.033068701216276"", ""leader"": ""car3""}\n', b'15:08:56.122615 IP 192.168.1.2.33694 > 192.168.1.255.9090: UDP, length 126\n', b'E....0@.@.............#...|1CAM::192.168.1.2::{""time"": ""7.0"", ""position"": ""(16.409999999999997, -4.8, 0)"", ""speed"": ""7.539999999999996"", ""leader"": ""None""}\n', b'15:08:56.218184 IP 192.168.1.1.32821 > 192.168.1.255.9090: UDP, length 127\n', b'E...ms@.@.H..........5#....}CAM::192.168.1.1::{""time"": ""7.1"", ""position"": ""(47.183068701216285, -1.6, 0)"", ""speed"": ""13.033068701216276"", ""leader"": ""car3""}\n', b'15:08:56.224046 IP 192.168.1.2.33694 > 192.168.1.255.9090: UDP, length 126\n', b'E....I@.@.............#...TxCAM::192.168.1.2::{""time"": ""7.1"", ""position"": ""(17.189999999999998, -1.6, 0)"", ""speed"": ""7.799999999999995"", ""leader"": ""car1""}\n', b'15:08:56.240056 IP6 fe80::ff:fe00:0 > ff02::16: HBH ICMP6, multicast listener report v2, 2 group record(s), length 48\n', b'`....8..................................:.........o.............................................\n', b'15:08:56.318668 IP 192.168.1.1.32821 > 192.168.1.255.9090: UDP, length 127\n', b'E...mw@.@.H..........5#....mCAM::192.168.1.1::{""time"": ""7.2"", ""position"": ""(48.486375571337916, -1.6, 0)"", ""speed"": ""13.033068701216276"", ""leader"": ""car3""}\n', b'15:08:56.324266 IP 192.168.1.2.33694 > 192.168.1.255.9090: UDP, length 114\n', b'E....L@.@.............#..z..CAM::192.168.1.2::{""time"": ""7.2"", ""position"": ""(17.996, -1.6, 0)"", ""speed"": ""8.059999999999995"", ""leader"": ""car1""}\n', b'15:08:56.418202 IP 192.168.1.1.32821 > 192.168.1.255.9090: UDP, length 126\n', b'E...m.@.@.H..........5#.....CAM::192.168.1.1::{""time"": ""7.3"", ""position"": ""(49.78968244145955, -1.6, 0)"", ""speed"": ""13.033068701216276"", ""leader"": ""car3""}\n', b'15:08:56.423591 IP 192.168.1.2.33694 > 192.168.1.255.9090: UDP, length 114\n', b'E....c@.@.............#..z..CAM::192.168.1.2::{""time"": ""7.3"", ""position"": ""(18.828, -1.6, 0)"", ""speed"": ""8.319999999999995"", ""leader"": ""car1""}\n']";-65.0@car1-wlan1
74;7.4s;car2;No leader;No leader;14.586;"[b'15:08:55.518274 IP 192.168.1.2.33694 > 192.168.1.255.9090: UDP, length 126\n', b'E.....@.@.............#...U{CAM::192.168.1.2::{""time"": ""6.4"", ""position"": ""(12.275999999999996, -4.8, 0)"", ""speed"": ""5.979999999999997"", ""leader"": ""car1""}\n', b'15:08:55.520038 IP 192.168.1.1.32821 > 192.168.1.255.9090: UDP, length 125\n', b'E...m.@.@.H..........5#....cCAM::192.168.1.1::{""time"": ""6.4"", ""position"": ""(38.05992061036487, -4.8, 0)"", ""speed"": ""13.033068701216276"", ""leader"": ""obs""}\n', b'15:08:55.600795 IP6 fe80::ff:fe00:0 > ff02::16: HBH ICMP6, multicast listener report v2, 2 group record(s), length 48\n', b'`....8..................................:.........o.............................................\n', b'15:08:55.601796 IP6 fe80::ff:fe00:0 > ip6-allrouters: ICMP6, router solicitation, length 16\n', b'`.....:...................................{.............\n', b'15:08:55.618153 IP 192.168.1.2.33694 > 192.168.1.255.9090: UDP, length 126\n', b'E.....@.@.............#...VxCAM::192.168.1.2::{""time"": ""6.5"", ""position"": ""(12.899999999999995, -4.8, 0)"", ""speed"": ""6.239999999999997"", ""leader"": ""car1""}\n', b'15:08:55.619972 IP 192.168.1.1.32821 > 192.168.1.255.9090: UDP, length 124\n', b'E...m-@.@.H..........5#....ECAM::192.168.1.1::{""time"": ""6.5"", ""position"": ""(39.3632274804865, -4.8, 0)"", ""speed"": ""13.033068701216276"", ""leader"": ""obs""}\n', b'15:08:55.718051 IP 192.168.1.2.33694 > 192.168.1.255.9090: UDP, length 127\n', b'E.....@.@.............#.....CAM::192.168.1.2::{""time"": ""6.6"", ""position"": ""(13.549999999999995, -4.8, 0)"", ""speed"": ""6.4999999999999964"", ""leader"": ""car1""}\n', b'15:08:55.719945 IP 192.168.1.1.32821 > 192.168.1.255.9090: UDP, length 125\n', b'E...m9@.@.H..........5#...ywCAM::192.168.1.1::{""time"": ""6.6"", ""position"": ""(40.66653435060813, -4.8, 0)"", ""speed"": ""13.033068701216276"", ""leader"": ""obs""}\n', b'15:08:55.817871 IP 192.168.1.2.33694 > 192.168.1.255.9090: UDP, length 126\n', b'E.....@.@.............#...Y}CAM::192.168.1.2::{""time"": ""6.7"", ""position"": ""(14.225999999999994, -4.8, 0)"", ""speed"": ""6.759999999999996"", ""leader"": ""car1""}\n', b'15:08:55.819847 IP 192.168.1.1.32821 > 192.168.1.255.9090: UDP, length 125\n', b'E...m=@.@.H..........5#...vhCAM::192.168.1.1::{""time"": ""6.7"", ""position"": ""(41.96984122072976, -4.8, 0)"", ""speed"": ""13.033068701216276"", ""leader"": ""obs""}\n', b'15:08:55.918470 IP 192.168.1.2.33694 > 192.168.1.255.9090: UDP, length 126\n', b'E.....@.@.............#...\\wCAM::192.168.1.2::{""time"": ""6.8"", ""position"": ""(14.927999999999997, -4.8, 0)"", ""speed"": ""7.019999999999996"", ""leader"": ""car1""}\n', b'15:08:55.920425 IP 192.168.1.1.32821 > 192.168.1.255.9090: UDP, length 125\n', b'E...mQ@.@.H..........5#...qvCAM::192.168.1.1::{""time"": ""6.8"", ""position"": ""(43.27314809085139, -4.8, 0)"", ""speed"": ""13.033068701216276"", ""leader"": ""obs""}\n', b'15:08:56.018670 IP 192.168.1.2.33694 > 192.168.1.255.9090: UDP, length 126\n', b'E....,@.@.............#...R{CAM::192.168.1.2::{""time"": ""6.9"", ""position"": ""(15.655999999999995, -4.8, 0)"", ""speed"": ""7.279999999999996"", ""leader"": ""car1""}\n', b'15:08:56.020085 IP 192.168.1.1.32821 > 192.168.1.255.9090: UDP, length 126\n', b'E...mS@.@.H..........5#.....CAM::192.168.1.1::{""time"": ""6.9"", ""position"": ""(44.576454960973024, -4.8, 0)"", ""speed"": ""13.033068701216276"", ""leader"": ""obs""}\n', b'15:08:56.021638 IP 192.168.1.1.32821 > 192.168.1.255.9090: UDP, length 49\n', b'E..MmT@.@.H..........5#..9..DENM::192.168.1.1::{""command"":2,""parameters"":[1]}\n', b'15:08:56.118780 IP 192.168.1.2.33694 > 192.168.1.255.9090: UDP, length 126\n', b'E....0@.@.............#...|1CAM::192.168.1.2::{""time"": ""7.0"", ""position"": ""(16.409999999999997, -4.8, 0)"", ""speed"": ""7.539999999999996"", ""leader"": ""None""}\n', b'15:08:56.120446 IP 192.168.1.1.32821 > 192.168.1.255.9090: UDP, length 127\n', b'E...md@.@.H..........5#... eCAM::192.168.1.1::{""time"": ""7.0"", ""position"": ""(45.879761831094655, -1.6, 0)"", ""speed"": ""13.033068701216276"", ""leader"": ""car3""}\n', b'15:08:56.219910 IP 192.168.1.2.33694 > 192.168.1.255.9090: UDP, length 126\n', b'E....I@.@.............#...TxCAM::192.168.1.2::{""time"": ""7.1"", ""position"": ""(17.189999999999998, -1.6, 0)"", ""speed"": ""7.799999999999995"", ""leader"": ""car1""}\n', b'15:08:56.221596 IP 192.168.1.1.32821 > 192.168.1.255.9090: UDP, length 127\n', b'E...ms@.@.H..........5#....}CAM::192.168.1.1::{""time"": ""7.1"", ""position"": ""(47.183068701216285, -1.6, 0)"", ""speed"": ""13.033068701216276"", ""leader"": ""car3""}\n', b'15:08:56.240080 IP6 fe80::ff:fe00:0 > ff02::16: HBH ICMP6, multicast listener report v2, 2 group record(s), length 48\n', b'`....8..................................:.........o.............................................\n', b'15:08:56.319864 IP 192.168.1.2.33694 > 192.168.1.255.9090: UDP, length 114\n', b'E....L@.@.............#..z..CAM::192.168.1.2::{""time"": ""7.2"", ""position"": ""(17.996, -1.6, 0)"", ""speed"": ""8.059999999999995"", ""leader"": ""car1""}\n', b'15:08:56.321457 IP 192.168.1.1.32821 > 192.168.1.255.9090: UDP, length 127\n', b'E...mw@.@.H..........5#....mCAM::192.168.1.1::{""time"": ""7.2"", ""position"": ""(48.486375571337916, -1.6, 0)"", ""speed"": ""13.033068701216276"", ""leader"": ""car3""}\n', b'15:08:56.419675 IP 192.168.1.2.33694 > 192.168.1.255.9090: UDP, length 114\n', b'E....c@.@.............#..z..CAM::192.168.1.2::{""time"": ""7.3"", ""position"": ""(18.828, -1.6, 0)"", ""speed"": ""8.319999999999995"", ""leader"": ""car1""}\n', b'15:08:56.421247 IP 192.168.1.1.32821 > 192.168.1.255.9090: UDP, length 126\n', b'E...m.@.@.H..........5#.....CAM::192.168.1.1::{""time"": ""7.3"", ""position"": ""(49.78968244145955, -1.6, 0)"", ""speed"": ""13.033068701216276"", ""leader"": ""car3""}\n']";-73.0@car2-wlan1
75;7.5s;car1;car3;13.746725589421104;51.39629618170281;[];-65.0@car1-wlan1
75;7.5s;car2;No leader;No leader;15.47;[];-73.0@car2-wlan1
76;7.6s;car1;car3;13.94724352936559;52.69960305182443;[];-64.0@car1-wlan1
76;7.6s;car2;No leader;No leader;16.380000000000003;[];-73.0@car2-wlan1
77;7.7s;car1;car3;14.147761469310076;54.00290992194606;[];-64.0@car1-wlan1
77;7.7s;car2;No leader;No leader;17.316000000000003;[];-73.0@car2-wlan1
78;7.8s;car1;car3;14.348279409254562;55.30621679206769;[];-64.0@car1-wlan1
78;7.8s;car2;No leader;No leader;18.278;[];-73.0@car2-wlan1
79;7.9s;car1;car3;14.548797349199049;56.60952366218932;[];-63.0@car1-wlan1
79;7.9s;car2;No leader;No leader;19.266;[];-72.0@car2-wlan1
80;8.0s;car1;car3;14.749315289143535;57.91283053231095;[];-63.0@car1-wlan1
80;8.0s;car2;No leader;No leader;20.28;[];-72.0@car2-wlan1
81;8.1s;car1;car3;14.949833229088021;59.21613740243257;[];-63.0@car1-wlan1
81;8.1s;car2;car1;26.296137402432574;21.32;[];-72.0@car2-wlan1
82;8.2s;car1;car3;15.150351169032508;60.519444272554196;[];-62.0@car1-wlan1
82;8.2s;car2;car1;26.533444272554203;22.385999999999996;[];-72.0@car2-wlan1
83;8.3s;car1;car3;15.350869108976994;61.82275114267583;[];-62.0@car1-wlan1
83;8.3s;car2;car1;26.74475114267583;23.477999999999994;[];-71.0@car2-wlan1
84;8.4s;car1;car3;15.55138704892148;63.12605801279746;"[b'15:08:56.518493 IP 192.168.1.1.32821 > 192.168.1.255.9090: UDP, length 126\n', b'E...m.@.@.Hy.........5#.....CAM::192.168.1.1::{""time"": ""7.4"", ""position"": ""(50.99298931158118, -1.6, 0)"", ""speed"": ""13.033068701216276"", ""leader"": ""car3""}\n', b'15:08:56.525125 IP 192.168.1.2.33694 > 192.168.1.255.9090: UDP, length 114\n', b'E....u@.@.............#..z..CAM::192.168.1.2::{""time"": ""7.4"", ""position"": ""(19.686, -1.6, 0)"", ""speed"": ""8.579999999999995"", ""leader"": ""None""}\n', b'15:08:56.622212 IP 192.168.1.1.32821 > 192.168.1.255.9090: UDP, length 126\n', b'E...m.@.@.Ha.........5#.....CAM::192.168.1.1::{""time"": ""7.5"", ""position"": ""(52.29629618170281, -1.6, 0)"", ""speed"": ""13.033068701216276"", ""leader"": ""car3""}\n', b'15:08:56.626841 IP 192.168.1.2.33694 > 192.168.1.255.9090: UDP, length 113\n', b'E....~@.@.............#..yi>CAM::192.168.1.2::{""time"": ""7.5"", ""position"": ""(20.57, -1.6, 0)"", ""speed"": ""8.839999999999995"", ""leader"": ""None""}\n', b'15:08:56.722092 IP 192.168.1.1.32821 > 192.168.1.255.9090: UDP, length 126\n', b'E...m.@.@.HQ.........5#.....CAM::192.168.1.1::{""time"": ""7.6"", ""position"": ""(53.59960305182443, -1.6, 0)"", ""speed"": ""13.033068701216276"", ""leader"": ""car3""}\n', b'15:08:56.728939 IP 192.168.1.2.33694 > 192.168.1.255.9090: UDP, length 113\n', b'E.....@.@.............#..yo8CAM::192.168.1.2::{""time"": ""7.6"", ""position"": ""(21.48, -1.6, 0)"", ""speed"": ""9.099999999999994"", ""leader"": ""None""}\n', b'15:08:56.821926 IP 192.168.1.1.32821 > 192.168.1.255.9090: UDP, length 126\n', b'E...m.@.@.HC.........5#.....CAM::192.168.1.1::{""time"": ""7.7"", ""position"": ""(54.90290992194606, -1.6, 0)"", ""speed"": ""13.033068701216276"", ""leader"": ""car3""}\n', b'15:08:56.827964 IP 192.168.1.2.33694 > 192.168.1.255.9090: UDP, length 114\n', b'E.....@.@..}..........#..z..CAM::192.168.1.2::{""time"": ""7.7"", ""position"": ""(22.416, -1.6, 0)"", ""speed"": ""9.359999999999994"", ""leader"": ""None""}\n', b'15:08:56.920928 IP 192.168.1.1.32821 > 192.168.1.255.9090: UDP, length 126\n', b'E...m.@.@.HA.........5#.....CAM::192.168.1.1::{""time"": ""7.8"", ""position"": ""(56.20621679206769, -1.6, 0)"", ""speed"": ""13.033068701216276"", ""leader"": ""car3""}\n', b'15:08:56.926696 IP 192.168.1.2.33694 > 192.168.1.255.9090: UDP, length 114\n', b'E.....@.@..i..........#..z..CAM::192.168.1.2::{""time"": ""7.8"", ""position"": ""(23.378, -1.6, 0)"", ""speed"": ""9.619999999999994"", ""leader"": ""None""}\n', b'15:08:57.021423 IP 192.168.1.1.32821 > 192.168.1.255.9090: UDP, length 127\n', b'E...m.@.@.H;.........5#....nCAM::192.168.1.1::{""time"": ""7.9"", ""position"": ""(57.509523662189316, -1.6, 0)"", ""speed"": ""13.033068701216276"", ""leader"": ""car3""}\n', b'15:08:57.026252 IP 192.168.1.2.33694 > 192.168.1.255.9090: UDP, length 114\n', b'E.....@.@..d..........#..z..CAM::192.168.1.2::{""time"": ""7.9"", ""position"": ""(24.366, -1.6, 0)"", ""speed"": ""9.879999999999994"", ""leader"": ""None""}\n', b'15:08:57.046678 IP6 fe80::200:ff:fe11:1.mdns > ff02::fb.mdns: 0 [2q] PTR (QM)? _ipps._tcp.local. PTR (QM)? _ipp._tcp.local. (45)\n', b'`.E..5.......................................5..............._ipps._tcp.local......_ipp......\n', b'15:08:57.120595 IP 192.168.1.1.32821 > 192.168.1.255.9090: UDP, length 126\n', b'E...m.@.@.H,.........5#.....CAM::192.168.1.1::{""time"": ""8.0"", ""position"": ""(58.81283053231094, -1.6, 0)"", ""speed"": ""13.033068701216276"", ""leader"": ""car3""}\n', b'15:08:57.125980 IP 192.168.1.2.33694 > 192.168.1.255.9090: UDP, length 127\n', b'E.....@.@..?..........#.....CAM::192.168.1.2::{""time"": ""8.0"", ""position"": ""(25.379999999999995, -1.6, 0)"", ""speed"": ""10.139999999999993"", ""leader"": ""None""}\n', b'15:08:57.221325 IP 192.168.1.1.32821 > 192.168.1.255.9090: UDP, length 126\n', b'E...m.@.@.H..........5#.....CAM::192.168.1.1::{""time"": ""8.1"", ""position"": ""(60.11613740243257, -1.6, 0)"", ""speed"": ""13.033068701216276"", ""leader"": ""car3""}\n', b'15:08:57.226401 IP 192.168.1.2.33694 > 192.168.1.255.9090: UDP, length 127\n', b'E.....@.@..1..........#.....CAM::192.168.1.2::{""time"": ""8.1"", ""position"": ""(26.419999999999998, -1.6, 0)"", ""speed"": ""10.399999999999993"", ""leader"": ""car1""}\n', b'15:08:57.320980 IP 192.168.1.1.32821 > 192.168.1.255.9090: UDP, length 125\n', b'E...m.@.@.H..........5#...M.CAM::192.168.1.1::{""time"": ""8.2"", ""position"": ""(61.4194442725542, -1.6, 0)"", ""speed"": ""13.033068701216276"", ""leader"": ""car3""}\n', b'15:08:57.328004 IP 192.168.1.2.33694 > 192.168.1.255.9090: UDP, length 115\n', b'E.....@.@..2..........#..{0:CAM::192.168.1.2::{""time"": ""8.2"", ""position"": ""(27.486, -1.6, 0)"", ""speed"": ""10.659999999999993"", ""leader"": ""car1""}\n', b'15:08:57.421067 IP 192.168.1.1.32821 > 192.168.1.255.9090: UDP, length 127\n', b'E...m.@.@.H..........5#....vCAM::192.168.1.1::{""time"": ""8.3"", ""position"": ""(62.722751142675826, -1.6, 0)"", ""speed"": ""13.033068701216276"", ""leader"": ""car3""}\n', b'15:08:57.426729 IP 192.168.1.2.33694 > 192.168.1.255.9090: UDP, length 115\n', b'E.....@.@../..........#..{-:CAM::192.168.1.2::{""time"": ""8.3"", ""position"": ""(28.578, -1.6, 0)"", ""speed"": ""10.919999999999993"", ""leader"": ""car1""}\n']";-61.0@car1-wlan1
                                                          