STEP;TIME;CAR;LEADER;LEADER_DISTANCE;DRIVING_DISTANCE;TCP_DUMP_MSGS;SIGNAL_STRENGTH
1;0.1s;car1;No leader;No leader;Not initialised;[];-77.0@car1-wlan1
1;0.1s;car2;No leader;No leader;Not initialised;[];-77.0@car2-wlan1
2;0.2s;car1;No leader;No leader;Not initialised;[];-77.0@car1-wlan1
2;0.2s;car2;No leader;No leader;Not initialised;[];-77.0@car2-wlan1
3;0.3s;car1;No leader;No leader;Not initialised;[];-77.0@car1-wlan1
3;0.3s;car2;No leader;No leader;Not initialised;[];-77.0@car2-wlan1
4;0.4s;car1;No leader;No leader;Not initialised;[];-77.0@car1-wlan1
4;0.4s;car2;No leader;No leader;Not initialised;[];-77.0@car2-wlan1
5;0.5s;car1;No leader;No leader;Not initialised;[];-77.0@car1-wlan1
5;0.5s;car2;No leader;No leader;Not initialised;[];-77.0@car2-wlan1
6;0.6s;car1;No leader;No leader;Not initialised;[];-77.0@car1-wlan1
6;0.6s;car2;No leader;No leader;Not initialised;[];-77.0@car2-wlan1
7;0.7s;car1;No leader;No leader;Not initialised;"[b'14:59:22.050512 IP 192.168.1.1.54993 > 192.168.1.255.9090: UDP, length 97\n', b'E..}M3@.@.h...........#..i..CAM::192.168.1.1::{""time"": ""0.2"", ""position"": ""(1.0, -4.8, 0)"", ""speed"": ""0.0"", ""leader"": ""None""}\n', b'14:59:22.055930 IP 192.168.1.2.53057 > 192.168.1.255.9090: UDP, length 126\n', b'E...0.@.@..l.........A#...x.CAM::192.168.1.2::{""time"": ""0.2"", ""position"": ""(-1073741824.0, -1073741824.0, 0)"", ""speed"": ""-1073741824.0"", ""leader"": ""None""}\n', b'14:59:22.200265 IP 192.168.1.1.54993 > 192.168.1.255.9090: UDP, length 97\n', b'E..}MG@.@.h...........#..i..CAM::192.168.1.1::{""time"": ""0.3"", ""position"": ""(1.0, -4.8, 0)"", ""speed"": ""0.0"", ""leader"": ""None""}\n', b'14:59:22.205056 IP 192.168.1.2.53057 > 192.168.1.255.9090: UDP, length 126\n', b'E...0.@.@..N.........A#...w.CAM::192.168.1.2::{""time"": ""0.3"", ""position"": ""(-1073741824.0, -1073741824.0, 0)"", ""speed"": ""-1073741824.0"", ""leader"": ""None""}\n', b'14:59:22.400443 IP 192.168.1.1.54993 > 192.168.1.255.9090: UDP, length 97\n', b'E..}MH@.@.h...........#..i..CAM::192.168.1.1::{""time"": ""0.4"", ""position"": ""(1.0, -4.8, 0)"", ""speed"": ""0.0"", ""leader"": ""None""}\n', b'14:59:22.406077 IP 192.168.1.2.53057 > 192.168.1.255.9090: UDP, length 126\n', b'E...0.@.@.. .........A#...v.CAM::192.168.1.2::{""time"": ""0.4"", ""position"": ""(-1073741824.0, -1073741824.0, 0)"", ""speed"": ""-1073741824.0"", ""leader"": ""None""}\n', b'14:59:22.551640 IP 192.168.1.1.54993 > 192.168.1.255.9090: UDP, length 97\n', b'E..}Mk@.@.h...........#..i..CAM::192.168.1.1::{""time"": ""0.5"", ""position"": ""(1.0, -4.8, 0)"", ""speed"": ""0.0"", ""leader"": ""None""}\n', b'14:59:22.555907 IP 192.168.1.2.53057 > 192.168.1.255.9090: UDP, length 126\n', b'E...0.@.@............A#...u.CAM::192.168.1.2::{""time"": ""0.5"", ""position"": ""(-1073741824.0, -1073741824.0, 0)"", ""speed"": ""-1073741824.0"", ""leader"": ""None""}\n', b'14:59:22.750745 IP 192.168.1.1.54993 > 192.168.1.255.9090: UDP, length 97\n', b'E..}M.@.@.h...........#..i..CAM::192.168.1.1::{""time"": ""0.6"", ""position"": ""(1.0, -4.8, 0)"", ""speed"": ""0.0"", ""leader"": ""None""}\n', b'14:59:22.755290 IP 192.168.1.2.53057 > 192.168.1.255.9090: UDP, length 126\n', b'E...1.@.@............A#...t.CAM::192.168.1.2::{""time"": ""0.6"", ""position"": ""(-1073741824.0, -1073741824.0, 0)"", ""speed"": ""-1073741824.0"", ""leader"": ""None""}\n']";-77.0@car1-wlan1
7;0.7s;car2;No leader;No leader;Not initialised;"[b'14:59:22.052153 IP 192.168.1.2.53057 > 192.168.1.255.9090: UDP, length 126\n', b'E...0.@.@..l.........A#...x.CAM::192.168.1.2::{""time"": ""0.2"", ""position"": ""(-1073741824.0, -1073741824.0, 0)"", ""speed"": ""-1073741824.0"", ""leader"": ""None""}\n', b'14:59:22.052927 IP 192.168.1.1.54993 > 192.168.1.255.9090: UDP, length 97\n', b'E..}M3@.@.h...........#..i..CAM::192.168.1.1::{""time"": ""0.2"", ""position"": ""(1.0, -4.8, 0)"", ""speed"": ""0.0"", ""leader"": ""None""}\n', b'14:59:22.202020 IP 192.168.1.2.53057 > 192.168.1.255.9090: UDP, length 126\n', b'E...0.@.@..N.........A#...w.CAM::192.168.1.2::{""time"": ""0.3"", ""position"": ""(-1073741824.0, -1073741824.0, 0)"", ""speed"": ""-1073741824.0"", ""leader"": ""None""}\n', b'14:59:22.202898 IP 192.168.1.1.54993 > 192.168.1.255.9090: UDP, length 97\n', b'E..}MG@.@.h...........#..i..CAM::192.168.1.1::{""time"": ""0.3"", ""position"": ""(1.0, -4.8, 0)"", ""speed"": ""0.0"", ""leader"": ""None""}\n', b'14:59:22.402324 IP 192.168.1.2.53057 > 192.168.1.255.9090: UDP, length 126\n', b'E...0.@.@.. .........A#...v.CAM::192.168.1.2::{""time"": ""0.4"", ""position"": ""(-1073741824.0, -1073741824.0, 0)"", ""speed"": ""-1073741824.0"", ""leader"": ""None""}\n', b'14:59:22.403869 IP 192.168.1.1.54993 > 192.168.1.255.9090: UDP, length 97\n', b'E..}MH@.@.h...........#..i..CAM::192.168.1.1::{""time"": ""0.4"", ""position"": ""(1.0, -4.8, 0)"", ""speed"": ""0.0"", ""leader"": ""None""}\n', b'14:59:22.553121 IP 192.168.1.2.53057 > 192.168.1.255.9090: UDP, length 126\n', b'E...0.@.@............A#...u.CAM::192.168.1.2::{""time"": ""0.5"", ""position"": ""(-1073741824.0, -1073741824.0, 0)"", ""speed"": ""-1073741824.0"", ""leader"": ""None""}\n', b'14:59:22.553950 IP 192.168.1.1.54993 > 192.168.1.255.9090: UDP, length 97\n', b'E..}Mk@.@.h...........#..i..CAM::192.168.1.1::{""time"": ""0.5"", ""position"": ""(1.0, -4.8, 0)"", ""speed"": ""0.0"", ""leader"": ""None""}\n', b'14:59:22.752050 IP 192.168.1.2.53057 > 192.168.1.255.9090: UDP, length 126\n', b'E...1.@.@............A#...t.CAM::192.168.1.2::{""time"": ""0.6"", ""position"": ""(-1073741824.0, -1073741824.0, 0)"", ""speed"": ""-1073741824.0"", ""leader"": ""None""}\n', b'14:59:22.753165 IP 192.168.1.1.54993 > 192.168.1.255.9090: UDP, length 97\n', b'E..}M.@.@.h...........#..i..CAM::192.168.1.1::{""time"": ""0.6"", ""position"": ""(1.0, -4.8, 0)"", ""speed"": ""0.0"", ""leader"": ""None""}\n']";-77.0@car2-wlan1
8;0.8s;car1;No leader;No leader;Not initialised;[];-77.0@car1-wlan1
8;0.8s;car2;No leader;No leader;Not initialised;[];-77.0@car2-wlan1
9;0.9s;car1;No leader;No leader;Not initialised;[];-77.0@car1-wlan1
9;0.9s;car2;No leader;No leader;Not initialised;[];-77.0@car2-wlan1
10;1.0s;car1;No leader;No leader;Not initialised;[];-77.0@car1-wlan1
10;1.0s;car2;No leader;No leader;Not initialised;[];-77.0@car2-wlan1
11;1.1s;car1;No leader;No leader;Not initialised;[];-77.0@car1-wlan1
11;1.1s;car2;No leader;No leader;Not initialised;[];-77.0@car2-wlan1
12;1.2s;car1;No leader;No leader;0.026000000000000023;[];-77.0@car1-wlan1
12;1.2s;car2;No leader;No leader;Not initialised;[];-77.0@car2-wlan1
13;1.3s;car1;No leader;No leader;0.07800000000000007;"[b'14:59:22.952085 IP 192.168.1.1.54993 > 192.168.1.255.9090: UDP, length 97\n', b'E..}M.@.@.h...........#..i..CAM::192.168.1.1::{""time"": ""0.7"", ""position"": ""(1.0, -4.8, 0)"", ""speed"": ""0.0"", ""leader"": ""None""}\n', b'14:59:22.956534 IP 192.168.1.2.53057 > 192.168.1.255.9090: UDP, length 126\n', b'E...1.@.@............A#...s.CAM::192.168.1.2::{""time"": ""0.7"", ""position"": ""(-1073741824.0, -1073741824.0, 0)"", ""speed"": ""-1073741824.0"", ""leader"": ""None""}\n', b'14:59:23.152826 IP 192.168.1.1.54993 > 192.168.1.255.9090: UDP, length 97\n', b'E..}M.@.@.hr..........#..i..CAM::192.168.1.1::{""time"": ""0.8"", ""position"": ""(1.0, -4.8, 0)"", ""speed"": ""0.0"", ""leader"": ""None""}\n', b'14:59:23.159272 IP 192.168.1.2.53057 > 192.168.1.255.9090: UDP, length 126\n', b'E...15@.@............A#...r.CAM::192.168.1.2::{""time"": ""0.8"", ""position"": ""(-1073741824.0, -1073741824.0, 0)"", ""speed"": ""-1073741824.0"", ""leader"": ""None""}\n', b'14:59:23.307212 IP 192.168.1.1.54993 > 192.168.1.255.9090: UDP, length 97\n', b'E..}M.@.@.hN..........#..i..CAM::192.168.1.1::{""time"": ""0.9"", ""position"": ""(1.0, -4.8, 0)"", ""speed"": ""0.0"", ""leader"": ""None""}\n', b'14:59:23.313391 IP 192.168.1.2.53057 > 192.168.1.255.9090: UDP, length 126\n', b'E...1Q@.@............A#...q.CAM::192.168.1.2::{""time"": ""0.9"", ""position"": ""(-1073741824.0, -1073741824.0, 0)"", ""speed"": ""-1073741824.0"", ""leader"": ""None""}\n', b'14:59:23.504934 IP 192.168.1.1.54993 > 192.168.1.255.9090: UDP, length 97\n', b'E..}M.@.@.h=..........#..i..CAM::192.168.1.1::{""time"": ""1.0"", ""position"": ""(1.0, -4.8, 0)"", ""speed"": ""0.0"", ""leader"": ""None""}\n', b'14:59:23.510594 IP 192.168.1.2.53057 > 192.168.1.255.9090: UDP, length 126\n', b'E...1R@.@............A#...y.CAM::192.168.1.2::{""time"": ""1.0"", ""position"": ""(-1073741824.0, -1073741824.0, 0)"", ""speed"": ""-1073741824.0"", ""leader"": ""None""}\n', b'14:59:23.655446 IP 192.168.1.1.54993 > 192.168.1.255.9090: UDP, length 97\n', b'E..}M.@.@.h-..........#..i..CAM::192.168.1.1::{""time"": ""1.1"", ""position"": ""(1.0, -4.8, 0)"", ""speed"": ""0.0"", ""leader"": ""None""}\n', b'14:59:23.660290 IP 192.168.1.2.53057 > 192.168.1.255.9090: UDP, length 126\n', b'E...1c@.@............A#...x.CAM::192.168.1.2::{""time"": ""1.1"", ""position"": ""(-1073741824.0, -1073741824.0, 0)"", ""speed"": ""-1073741824.0"", ""leader"": ""None""}\n', b'14:59:23.855222 IP 192.168.1.1.54993 > 192.168.1.255.9090: UDP, length 100\n', b'E...N.@.@.h...........#..lU.CAM::192.168.1.1::{""time"": ""1.2"", ""position"": ""(1.026, -4.8, 0)"", ""speed"": ""0.26"", ""leader"": ""None""}\n', b'14:59:23.860856 IP 192.168.1.2.53057 > 192.168.1.255.9090: UDP, length 126\n', b'E...1.@.@..p.........A#...w.CAM::192.168.1.2::{""time"": ""1.2"", ""position"": ""(-1073741824.0, -1073741824.0, 0)"", ""speed"": ""-1073741824.0"", ""leader"": ""None""}\n']";-77.0@car1-wlan1
13;1.3s;car2;No leader;No leader;Not initialised;"[b'14:59:22.953717 IP 192.168.1.2.53057 > 192.168.1.255.9090: UDP, length 126\n', b'E...1.@.@............A#...s.CAM::192.168.1.2::{""time"": ""0.7"", ""position"": ""(-1073741824.0, -1073741824.0, 0)"", ""speed"": ""-1073741824.0"", ""leader"": ""None""}\n', b'14:59:22.954370 IP 192.168.1.1.54993 > 192.168.1.255.9090: UDP, length 97\n', b'E..}M.@.@.h...........#..i..CAM::192.168.1.1::{""time"": ""0.7"", ""position"": ""(1.0, -4.8, 0)"", ""speed"": ""0.0"", ""leader"": ""None""}\n', b'14:59:23.154589 IP 192.168.1.2.53057 > 192.168.1.255.9090: UDP, length 126\n', b'E...15@.@............A#...r.CAM::192.168.1.2::{""time"": ""0.8"", ""position"": ""(-1073741824.0, -1073741824.0, 0)"", ""speed"": ""-1073741824.0"", ""leader"": ""None""}\n', b'14:59:23.155132 IP 192.168.1.1.54993 > 192.168.1.255.9090: UDP, length 97\n', b'E..}M.@.@.hr..........#..i..CAM::192.168.1.1::{""time"": ""0.8"", ""position"": ""(1.0, -4.8, 0)"", ""speed"": ""0.0"", ""leader"": ""None""}\n', b'14:59:23.308933 IP 192.168.1.2.53057 > 192.168.1.255.9090: UDP, length 126\n', b'E...1Q@.@............A#...q.CAM::192.168.1.2::{""time"": ""0.9"", ""position"": ""(-1073741824.0, -1073741824.0, 0)"", ""speed"": ""-1073741824.0"", ""leader"": ""None""}\n', b'14:59:23.311896 IP 192.168.1.1.54993 > 192.168.1.255.9090: UDP, length 97\n', b'E..}M.@.@.hN..........#..i..CAM::192.168.1.1::{""time"": ""0.9"", ""position"": ""(1.0, -4.8, 0)"", ""speed"": ""0.0"", ""leader"": ""None""}\n', b'14:59:23.506409 IP 192.168.1.2.53057 > 192.168.1.255.9090: UDP, length 126\n', b'E...1R@.@............A#...y.CAM::192.168.1.2::{""time"": ""1.0"", ""position"": ""(-1073741824.0, -1073741824.0, 0)"", ""speed"": ""-1073741824.0"", ""leader"": ""None""}\n', b'14:59:23.508483 IP 192.168.1.1.54993 > 192.168.1.255.9090: UDP, length 97\n', b'E..}M.@.@.h=..........#..i..CAM::192.168.1.1::{""time"": ""1.0"", ""position"": ""(1.0, -4.8, 0)"", ""speed"": ""0.0"", ""leader"": ""None""}\n', b'14:59:23.657585 IP 192.168.1.2.53057 > 192.168.1.255.9090: UDP, length 126\n', b'E...1c@.@............A#...x.CAM::192.168.1.2::{""time"": ""1.1"", ""position"": ""(-1073741824.0, -1073741824.0, 0)"", ""speed"": ""-1073741824.0"", ""leader"": ""None""}\n', b'14:59:23.657760 IP 192.168.1.1.54993 > 192.168.1.255.9090: UDP, length 97\n', b'E..}M.@.@.h-..........#..i..CAM::192.168.1.1::{""time"": ""1.1"", ""position"": ""(1.0, -4.8, 0)"", ""speed"": ""0.0"", ""leader"": ""None""}\n', b'14:59:23.857149 IP 192.168.1.2.53057 > 192.168.1.255.9090: UDP, length 126\n', b'E...1.@.@..p.........A#...w.CAM::192.168.1.2::{""time"": ""1.2"", ""position"": ""(-1073741824.0, -1073741824.0, 0)"", ""speed"": ""-1073741824.0"", ""leader"": ""None""}\n', b'14:59:23.858786 IP 192.168.1.1.54993 > 192.168.1.255.9090: UDP, length 100\n', b'E...N.@.@.h...........#..lU.CAM::192.168.1.1::{""time"": ""1.2"", ""position"": ""(1.026, -4.8, 0)"", ""speed"": ""0.26"", ""leader"": ""None""}\n']";-77.0@car2-wlan1
14;1.4s;car1;No leader;No leader;0.15600000000000014;[];-77.0@car1-wlan1
14;1.4s;car2;No leader;No leader;Not initialised;[];-77.0@car2-wlan1
15;1.5s;car1;No leader;No leader;0.26000000000000023;[];-77.0@car1-wlan1
15;1.5s;car2;No leader;No leader;Not initialised;[];-77.0@car2-wlan1
16;1.6s;car1;No leader;No leader;0.3900000000000001;[];-77.0@car1-wlan1
16;1.6s;car2;No leader;No leader;Not initialised;[];-77.0@car2-wlan1
17;1.7s;car1;No leader;No leader;0.5460000000000003;[];-77.0@car1-wlan1
17;1.7s;car2;No leader;No leader;Not initialised;[];-77.0@car2-wlan1
18;1.8s;car1;No leader;No leader;0.7280000000000002;"[b'14:59:24.055043 IP 192.168.1.1.54993 > 192.168.1.255.9090: UDP, length 100\n', b'E...N.@.@.g...........#..lO.CAM::192.168.1.1::{""time"": ""1.3"", ""position"": ""(1.078, -4.8, 0)"", ""speed"": ""0.52"", ""leader"": ""None""}\n', b'14:59:24.061175 IP 192.168.1.2.53057 > 192.168.1.255.9090: UDP, length 126\n', b'E...1.@.@..Q.........A#...v.CAM::192.168.1.2::{""time"": ""1.3"", ""position"": ""(-1073741824.0, -1073741824.0, 0)"", ""speed"": ""-1073741824.0"", ""leader"": ""None""}\n', b'14:59:24.255764 IP 192.168.1.1.54993 > 192.168.1.255.9090: UDP, length 113\n', b'E...N-@.@.g...........#..y\t.CAM::192.168.1.1::{""time"": ""1.4"", ""position"": ""(1.1560000000000001, -4.8, 0)"", ""speed"": ""0.78"", ""leader"": ""None""}\n', b'14:59:24.261459 IP 192.168.1.2.53057 > 192.168.1.255.9090: UDP, length 126\n', b'E...1.@.@..&.........A#...u.CAM::192.168.1.2::{""time"": ""1.4"", ""position"": ""(-1073741824.0, -1073741824.0, 0)"", ""speed"": ""-1073741824.0"", ""leader"": ""None""}\n', b'14:59:24.405382 IP 192.168.1.1.54993 > 192.168.1.255.9090: UDP, length 113\n', b'E...NA@.@.g...........#..y..CAM::192.168.1.1::{""time"": ""1.5"", ""position"": ""(1.2600000000000002, -4.8, 0)"", ""speed"": ""1.04"", ""leader"": ""None""}\n', b'14:59:24.410287 IP 192.168.1.2.53057 > 192.168.1.255.9090: UDP, length 126\n', b'E...1.@.@............A#...t.CAM::192.168.1.2::{""time"": ""1.5"", ""position"": ""(-1073741824.0, -1073741824.0, 0)"", ""speed"": ""-1073741824.0"", ""leader"": ""None""}\n', b'14:59:24.608278 IP 192.168.1.1.54993 > 192.168.1.255.9090: UDP, length 112\n', b'E...NX@.@.g...........#..x..CAM::192.168.1.1::{""time"": ""1.6"", ""position"": ""(1.3900000000000001, -4.8, 0)"", ""speed"": ""1.3"", ""leader"": ""None""}\n', b'14:59:24.613749 IP 192.168.1.2.53057 > 192.168.1.255.9090: UDP, length 126\n', b'E...2.@.@............A#...s.CAM::192.168.1.2::{""time"": ""1.6"", ""position"": ""(-1073741824.0, -1073741824.0, 0)"", ""speed"": ""-1073741824.0"", ""leader"": ""None""}\n', b'14:59:24.808646 IP 192.168.1.1.54993 > 192.168.1.255.9090: UDP, length 113\n', b'E...Nh@.@.g...........#..y..CAM::192.168.1.1::{""time"": ""1.7"", ""position"": ""(1.5460000000000003, -4.8, 0)"", ""speed"": ""1.56"", ""leader"": ""None""}\n', b'14:59:24.817637 IP 192.168.1.2.53057 > 192.168.1.255.9090: UDP, length 126\n', b'E...2E@.@............A#...r.CAM::192.168.1.2::{""time"": ""1.7"", ""position"": ""(-1073741824.0, -1073741824.0, 0)"", ""speed"": ""-1073741824.0"", ""leader"": ""None""}\n']";-77.0@car1-wlan1
18;1.8s;car2;No leader;No leader;Not initialised;"[b'14:59:24.056675 IP 192.168.1.2.53057 > 192.168.1.255.9090: UDP, length 126\n', b'E...1.@.@..Q.........A#...v.CAM::192.168.1.2::{""time"": ""1.3"", ""position"": ""(-1073741824.0, -1073741824.0, 0)"", ""speed"": ""-1073741824.0"", ""leader"": ""None""}\n', b'14:59:24.057401 IP 192.168.1.1.54993 > 192.168.1.255.9090: UDP, length 100\n', b'E...N.@.@.g...........#..lO.CAM::192.168.1.1::{""time"": ""1.3"", ""position"": ""(1.078, -4.8, 0)"", ""speed"": ""0.52"", ""leader"": ""None""}\n', b'14:59:24.257440 IP 192.168.1.2.53057 > 192.168.1.255.9090: UDP, length 126\n', b'E...1.@.@..&.........A#...u.CAM::192.168.1.2::{""time"": ""1.4"", ""position"": ""(-1073741824.0, -1073741824.0, 0)"", ""speed"": ""-1073741824.0"", ""leader"": ""None""}\n', b'14:59:24.259067 IP 192.168.1.1.54993 > 192.168.1.255.9090: UDP, length 113\n', b'E...N-@.@.g...........#..y\t.CAM::192.168.1.1::{""time"": ""1.4"", ""position"": ""(1.1560000000000001, -4.8, 0)"", ""speed"": ""0.78"", ""leader"": ""None""}\n', b'14:59:24.406942 IP 192.168.1.2.53057 > 192.168.1.255.9090: UDP, length 126\n', b'E...1.@.@............A#...t.CAM::192.168.1.2::{""time"": ""1.5"", ""position"": ""(-1073741824.0, -1073741824.0, 0)"", ""speed"": ""-1073741824.0"", ""leader"": ""None""}\n', b'14:59:24.407835 IP 192.168.1.1.54993 > 192.168.1.255.9090: UDP, length 113\n', b'E...NA@.@.g...........#..y..CAM::192.168.1.1::{""time"": ""1.5"", ""position"": ""(1.2600000000000002, -4.8, 0)"", ""speed"": ""1.04"", ""leader"": ""None""}\n', b'14:59:24.610721 IP 192.168.1.2.53057 > 192.168.1.255.9090: UDP, length 126\n', b'E...2.@.@............A#...s.CAM::192.168.1.2::{""time"": ""1.6"", ""position"": ""(-1073741824.0, -1073741824.0, 0)"", ""speed"": ""-1073741824.0"", ""leader"": ""None""}\n', b'14:59:24.610916 IP 192.168.1.1.54993 > 192.168.1.255.9090: UDP, length 112\n', b'E...NX@.@.g...........#..x..CAM::192.168.1.1::{""time"": ""1.6"", ""position"": ""(1.3900000000000001, -4.8, 0)"", ""speed"": ""1.3"", ""leader"": ""None""}\n', b'14:59:24.809967 IP 192.168.1.2.53057 > 192.168.1.255.9090: UDP, length 126\n', b'E...2E@.@............A#...r.CAM::192.168.1.2::{""time"": ""1.7"", ""position"": ""(-1073741824.0, -1073741824.0, 0)"", ""speed"": ""-1073741824.0"", ""leader"": ""None""}\n', b'14:59:24.811208 IP 192.168.1.1.54993 > 192.168.1.255.9090: UDP, length 113\n', b'E...Nh@.@.g...........#..y..CAM::192.168.1.1::{""time"": ""1.7"", ""position"": ""(1.5460000000000003, -4.8, 0)"", ""speed"": ""1.56"", ""leader"": ""None""}\n']";-77.0@car2-wlan1
19;1.9s;car1;No leader;No leader;0.9360000000000002;[];-77.0@car1-wlan1
19;1.9s;car2;No leader;No leader;Not initialised;[];-77.0@car2-wlan1
20;2.0s;car1;No leader;No leader;1.17;[];-77.0@car1-wlan1
20;2.0s;car2;No leader;No leader;Not initialised;[];-77.0@car2-wlan1
21;2.1s;car1;No leader;No leader;1.4299999999999997;[];-77.0@car1-wlan1
21;2.1s;car2;No leader;No leader;Not initialised;[];-77.0@car2-wlan1
22;2.2s;car1;No leader;No leader;1.7159999999999997;[];-77.0@car1-wlan1
22;2.2s;car2;No leader;No leader;Not initialised;[];-77.0@car2-wlan1
23;2.3s;car1;No leader;No leader;2.0279999999999996;"[b'14:59:25.009199 IP 192.168.1.1.54993 > 192.168.1.255.9090: UDP, length 113\n', b'E...N.@.@.gu..........#..y..CAM::192.168.1.1::{""time"": ""1.8"", ""position"": ""(1.7280000000000004, -4.8, 0)"", ""speed"": ""1.82"", ""leader"": ""None""}\n', b'14:59:25.016663 IP 192.168.1.2.53057 > 192.168.1.255.9090: UDP, length 126\n', b'E...2W@.@............A#...q.CAM::192.168.1.2::{""time"": ""1.8"", ""position"": ""(-1073741824.0, -1073741824.0, 0)"", ""speed"": ""-1073741824.0"", ""leader"": ""None""}\n', b'14:59:25.209527 IP 192.168.1.1.54993 > 192.168.1.255.9090: UDP, length 113\n', b'E...N.@.@.g\\..........#..y..CAM::192.168.1.1::{""time"": ""1.9"", ""position"": ""(1.9360000000000002, -4.8, 0)"", ""speed"": ""2.08"", ""leader"": ""None""}\n', b'14:59:25.214849 IP 192.168.1.2.53057 > 192.168.1.255.9090: UDP, length 126\n', b'E...2[@.@............A#...p.CAM::192.168.1.2::{""time"": ""1.9"", ""position"": ""(-1073741824.0, -1073741824.0, 0)"", ""speed"": ""-1073741824.0"", ""leader"": ""None""}\n', b'14:59:25.409189 IP 192.168.1.1.54993 > 192.168.1.255.9090: UDP, length 99\n', b'E...N.@.@.g^..........#..kf.CAM::192.168.1.1::{""time"": ""2.0"", ""position"": ""(2.17, -4.8, 0)"", ""speed"": ""2.34"", ""leader"": ""None""}\n', b'14:59:25.413672 IP 192.168.1.2.53057 > 192.168.1.255.9090: UDP, length 126\n', b'E...2c@.@............A#...x.CAM::192.168.1.2::{""time"": ""2.0"", ""position"": ""(-1073741824.0, -1073741824.0, 0)"", ""speed"": ""-1073741824.0"", ""leader"": ""None""}\n', b'14:59:25.609147 IP 192.168.1.1.54993 > 192.168.1.255.9090: UDP, length 127\n', b'E...N.@.@.g...........#...?.CAM::192.168.1.1::{""time"": ""2.1"", ""position"": ""(2.4299999999999997, -4.8, 0)"", ""speed"": ""2.5999999999999996"", ""leader"": ""None""}\n', b'14:59:25.614788 IP 192.168.1.2.53057 > 192.168.1.255.9090: UDP, length 126\n', b'E...2}@.@............A#...w.CAM::192.168.1.2::{""time"": ""2.1"", ""position"": ""(-1073741824.0, -1073741824.0, 0)"", ""speed"": ""-1073741824.0"", ""leader"": ""None""}\n', b'14:59:25.809802 IP 192.168.1.1.54993 > 192.168.1.255.9090: UDP, length 127\n', b'E...N.@.@.g...........#...E.CAM::192.168.1.1::{""time"": ""2.2"", ""position"": ""(2.7159999999999997, -4.8, 0)"", ""speed"": ""2.8599999999999994"", ""leader"": ""None""}\n', b'14:59:25.814761 IP 192.168.1.2.53057 > 192.168.1.255.9090: UDP, length 126\n', b'E...2.@.@............A#...v.CAM::192.168.1.2::{""time"": ""2.2"", ""position"": ""(-1073741824.0, -1073741824.0, 0)"", ""speed"": ""-1073741824.0"", ""leader"": ""None""}\n']";-77.0@car1-wlan1
23;2.3s;car2;No leader;No leader;Not initialised;"[b'14:59:25.010752 IP 192.168.1.2.53057 > 192.168.1.255.9090: UDP, length 126\n', b'E...2W@.@............A#...q.CAM::192.168.1.2::{""time"": ""1.8"", ""position"": ""(-1073741824.0, -1073741824.0, 0)"", ""speed"": ""-1073741824.0"", ""leader"": ""None""}\n', b'14:59:25.011627 IP 192.168.1.1.54993 > 192.168.1.255.9090: UDP, length 113\n', b'E...N.@.@.gu..........#..y..CAM::192.168.1.1::{""time"": ""1.8"", ""position"": ""(1.7280000000000004, -4.8, 0)"", ""speed"": ""1.82"", ""leader"": ""None""}\n', b'14:59:25.211273 IP 192.168.1.2.53057 > 192.168.1.255.9090: UDP, length 126\n', b'E...2[@.@............A#...p.CAM::192.168.1.2::{""time"": ""1.9"", ""position"": ""(-1073741824.0, -1073741824.0, 0)"", ""speed"": ""-1073741824.0"", ""leader"": ""None""}\n', b'14:59:25.212712 IP 192.168.1.1.54993 > 192.168.1.255.9090: UDP, length 113\n', b'E...N.@.@.g\\..........#..y..CAM::192.168.1.1::{""time"": ""1.9"", ""position"": ""(1.9360000000000002, -4.8, 0)"", ""speed"": ""2.08"", ""leader"": ""None""}\n', b'14:59:25.410450 IP 192.168.1.2.53057 > 192.168.1.255.9090: UDP, length 126\n', b'E...2c@.@............A#...x.CAM::192.168.1.2::{""time"": ""2.0"", ""position"": ""(-1073741824.0, -1073741824.0, 0)"", ""speed"": ""-1073741824.0"", ""leader"": ""None""}\n', b'14:59:25.411423 IP 192.168.1.1.54993 > 192.168.1.255.9090: UDP, length 99\n', b'E...N.@.@.g^..........#..kf.CAM::192.168.1.1::{""time"": ""2.0"", ""position"": ""(2.17, -4.8, 0)"", ""speed"": ""2.34"", ""leader"": ""None""}\n', b'14:59:25.610681 IP 192.168.1.2.53057 > 192.168.1.255.9090: UDP, length 126\n', b'E...2}@.@............A#...w.CAM::192.168.1.2::{""time"": ""2.1"", ""position"": ""(-1073741824.0, -1073741824.0, 0)"", ""speed"": ""-1073741824.0"", ""leader"": ""None""}\n', b'14:59:25.612037 IP 192.168.1.1.54993 > 192.168.1.255.9090: UDP, length 127\n', b'E...N.@.@.g...........#...?.CAM::192.168.1.1::{""time"": ""2.1"", ""position"": ""(2.4299999999999997, -4.8, 0)"", ""speed"": ""2.5999999999999996"", ""leader"": ""None""}\n', b'14:59:25.811507 IP 192.168.1.2.53057 > 192.168.1.255.9090: UDP, length 126\n', b'E...2.@.@............A#...v.CAM::192.168.1.2::{""time"": ""2.2"", ""position"": ""(-1073741824.0, -1073741824.0, 0)"", ""speed"": ""-1073741824.0"", ""leader"": ""None""}\n', b'14:59:25.812521 IP 192.168.1.1.54993 > 192.168.1.255.9090: UDP, length 127\n', b'E...N.@.@.g...........#...E.CAM::192.168.1.1::{""time"": ""2.2"", ""position"": ""(2.7159999999999997, -4.8, 0)"", ""speed"": ""2.8599999999999994"", ""leader"": ""None""}\n']";-77.0@car2-wlan1
24;2.4s;car1;No leader;No leader;2.3659999999999997;[];-77.0@car1-wlan1
24;2.4s;car2;No leader;No leader;Not initialised;[];-77.0@car2-wlan1
25;2.5s;car1;No leader;No leader;2.7299999999999995;[];-77.0@car1-wlan1
25;2.5s;car2;No leader;No leader;Not initialised;[];-77.0@car2-wlan1
26;2.6s;car1;No leader;No leader;3.119999999999999;[];-77.0@car1-wlan1
26;2.6s;car2;No leader;No leader;Not initialised;[];-77.0@car2-wlan1
27;2.7s;car1;No leader;No leader;3.5359999999999987;[];-77.0@car1-wlan1
27;2.7s;car2;No leader;No leader;Not initialised;[];-77.0@car2-wlan1
28;2.8s;car1;No leader;No leader;3.977999999999999;"[b'14:59:26.010905 IP 192.168.1.1.54993 > 192.168.1.255.9090: UDP, length 126\n', b'E...O.@.@.f...........#..."".CAM::192.168.1.1::{""time"": ""2.3"", ""position"": ""(3.0279999999999996, -4.8, 0)"", ""speed"": ""3.119999999999999"", ""leader"": ""None""}\n', b'14:59:26.018190 IP 192.168.1.2.53057 > 192.168.1.255.9090: UDP, length 126\n', b'E...2.@.@..i.........A#...u.CAM::192.168.1.2::{""time"": ""2.3"", ""position"": ""(-1073741824.0, -1073741824.0, 0)"", ""speed"": ""-1073741824.0"", ""leader"": ""None""}\n', b'14:59:26.211490 IP 192.168.1.1.54993 > 192.168.1.255.9090: UDP, length 126\n', b'E...O,@.@.f...........#....\tCAM::192.168.1.1::{""time"": ""2.4"", ""position"": ""(3.3659999999999997, -4.8, 0)"", ""speed"": ""3.379999999999999"", ""leader"": ""None""}\n', b'14:59:26.216275 IP 192.168.1.2.53057 > 192.168.1.255.9090: UDP, length 126\n', b'E...2.@.@..c.........A#...t.CAM::192.168.1.2::{""time"": ""2.4"", ""position"": ""(-1073741824.0, -1073741824.0, 0)"", ""speed"": ""-1073741824.0"", ""leader"": ""None""}\n', b'14:59:26.361175 IP 192.168.1.1.54993 > 192.168.1.255.9090: UDP, length 125\n', b'E...O6@.@.f...........#.....CAM::192.168.1.1::{""time"": ""2.5"", ""position"": ""(3.729999999999999, -4.8, 0)"", ""speed"": ""3.639999999999999"", ""leader"": ""None""}\n', b'14:59:26.366041 IP 192.168.1.2.53057 > 192.168.1.255.9090: UDP, length 126\n', b'E...2.@.@..C.........A#...s.CAM::192.168.1.2::{""time"": ""2.5"", ""position"": ""(-1073741824.0, -1073741824.0, 0)"", ""speed"": ""-1073741824.0"", ""leader"": ""None""}\n', b'14:59:26.561464 IP 192.168.1.1.54993 > 192.168.1.255.9090: UDP, length 126\n', b'E...Od@.@.f...........#...Y.CAM::192.168.1.1::{""time"": ""2.6"", ""position"": ""(4.119999999999999, -4.8, 0)"", ""speed"": ""3.8999999999999986"", ""leader"": ""None""}\n', b'14:59:26.568014 IP 192.168.1.2.53057 > 192.168.1.255.9090: UDP, length 126\n', b'E...2.@.@............A#...r.CAM::192.168.1.2::{""time"": ""2.6"", ""position"": ""(-1073741824.0, -1073741824.0, 0)"", ""speed"": ""-1073741824.0"", ""leader"": ""None""}\n', b'14:59:26.764382 IP 192.168.1.1.54993 > 192.168.1.255.9090: UDP, length 125\n', b'E...O.@.@.fy..........#.....CAM::192.168.1.1::{""time"": ""2.7"", ""position"": ""(4.535999999999999, -4.8, 0)"", ""speed"": ""4.159999999999998"", ""leader"": ""None""}\n', b'14:59:26.770284 IP 192.168.1.2.53057 > 192.168.1.255.9090: UDP, length 126\n', b'E...3.@.@............A#...q.CAM::192.168.1.2::{""time"": ""2.7"", ""position"": ""(-1073741824.0, -1073741824.0, 0)"", ""speed"": ""-1073741824.0"", ""leader"": ""None""}\n']";-77.0@car1-wlan1
28;2.8s;car2;No leader;No leader;Not initialised;"[b'14:59:26.012300 IP 192.168.1.2.53057 > 192.168.1.255.9090: UDP, length 126\n', b'E...2.@.@..i.........A#...u.CAM::192.168.1.2::{""time"": ""2.3"", ""position"": ""(-1073741824.0, -1073741824.0, 0)"", ""speed"": ""-1073741824.0"", ""leader"": ""None""}\n', b'14:59:26.015916 IP 192.168.1.1.54993 > 192.168.1.255.9090: UDP, length 126\n', b'E...O.@.@.f...........#..."".CAM::192.168.1.1::{""time"": ""2.3"", ""position"": ""(3.0279999999999996, -4.8, 0)"", ""speed"": ""3.119999999999999"", ""leader"": ""None""}\n', b'14:59:26.213249 IP 192.168.1.2.53057 > 192.168.1.255.9090: UDP, length 126\n', b'E...2.@.@..c.........A#...t.CAM::192.168.1.2::{""time"": ""2.4"", ""position"": ""(-1073741824.0, -1073741824.0, 0)"", ""speed"": ""-1073741824.0"", ""leader"": ""None""}\n', b'14:59:26.214107 IP 192.168.1.1.54993 > 192.168.1.255.9090: UDP, length 126\n', b'E...O,@.@.f...........#....\tCAM::192.168.1.1::{""time"": ""2.4"", ""position"": ""(3.3659999999999997, -4.8, 0)"", ""speed"": ""3.379999999999999"", ""leader"": ""None""}\n', b'14:59:26.362627 IP 192.168.1.2.53057 > 192.168.1.255.9090: UDP, length 126\n', b'E...2.@.@..C.........A#...s.CAM::192.168.1.2::{""time"": ""2.5"", ""position"": ""(-1073741824.0, -1073741824.0, 0)"", ""speed"": ""-1073741824.0"", ""leader"": ""None""}\n', b'14:59:26.363884 IP 192.168.1.1.54993 > 192.168.1.255.9090: UDP, length 125\n', b'E...O6@.@.f...........#.....CAM::192.168.1.1::{""time"": ""2.5"", ""position"": ""(3.729999999999999, -4.8, 0)"", ""speed"": ""3.639999999999999"", ""leader"": ""None""}\n', b'14:59:26.562821 IP 192.168.1.2.53057 > 192.168.1.255.9090: UDP, length 126\n', b'E...2.@.@............A#...r.CAM::192.168.1.2::{""time"": ""2.6"", ""position"": ""(-1073741824.0, -1073741824.0, 0)"", ""speed"": ""-1073741824.0"", ""leader"": ""None""}\n', b'14:59:26.566080 IP 192.168.1.1.54993 > 192.168.1.255.9090: UDP, length 126\n', b'E...Od@.@.f...........#...Y.CAM::192.168.1.1::{""time"": ""2.6"", ""position"": ""(4.119999999999999, -4.8, 0)"", ""speed"": ""3.8999999999999986"", ""leader"": ""None""}\n', b'14:59:26.766001 IP 192.168.1.2.53057 > 192.168.1.255.9090: UDP, length 126\n', b'E...3.@.@............A#...q.CAM::192.168.1.2::{""time"": ""2.7"", ""position"": ""(-1073741824.0, -1073741824.0, 0)"", ""speed"": ""-1073741824.0"", ""leader"": ""None""}\n', b'14:59:26.768070 IP 192.168.1.1.54993 > 192.168.1.255.9090: UDP, length 125\n', b'E...O.@.@.fy..........#.....CAM::192.168.1.1::{""time"": ""2.7"", ""position"": ""(4.535999999999999, -4.8, 0)"", ""speed"": ""4.159999999999998"", ""leader"": ""None""}\n']";-77.0@car2-wlan1
29;2.9s;car1;No leader;No leader;4.445999999999999;[];-76.0@car1-wlan1
29;2.9s;car2;No leader;No leader;Not initialised;[];-77.0@car2-wlan1
30;3.0s;car1;No leader;No leader;4.939999999999999;[];-76.0@car1-wlan1
30;3.0s;car2;No leader;No leader;Not initialised;[];-77.0@car2-wlan1
31;3.1s;car1;No leader;No leader;5.459999999999998;[];-76.0@car1-wlan1
31;3.1s;car2;No leader;No leader;Not initialised;[];-77.0@car2-wlan1
32;3.2s;car1;No leader;No leader;6.005999999999998;[];-76.0@car1-wlan1
32;3.2s;car2;No leader;No leader;Not initialised;[];-77.0@car2-wlan1
33;3.3s;car1;No leader;No leader;6.577999999999998;[];-76.0@car1-wlan1
33;3.3s;car2;No leader;No leader;Not initialised;[];-77.0@car2-wlan1
34;3.4s;car1;No leader;No leader;7.175999999999997;"[b'14:59:27.414853 IP 192.168.1.1.54993 > 192.168.1.255.9090: UDP, length 125\n', b'E...O.@.@.f""..........#.....CAM::192.168.1.1::{""time"": ""2.8"", ""position"": ""(4.977999999999999, -4.8, 0)"", ""speed"": ""4.419999999999998"", ""leader"": ""None""}\n', b'14:59:27.422316 IP 192.168.1.2.53057 > 192.168.1.255.9090: UDP, length 126\n', b'E...3*@.@............A#...p.CAM::192.168.1.2::{""time"": ""2.8"", ""position"": ""(-1073741824.0, -1073741824.0, 0)"", ""speed"": ""-1073741824.0"", ""leader"": ""None""}\n', b'14:59:27.516064 IP 192.168.1.1.54993 > 192.168.1.255.9090: UDP, length 125\n', b'E...O.@.@.f\n', b'..........#.....CAM::192.168.1.1::{""time"": ""2.9"", ""position"": ""(5.445999999999999, -4.8, 0)"", ""speed"": ""4.679999999999998"", ""leader"": ""None""}\n', b'14:59:27.521620 IP 192.168.1.2.53057 > 192.168.1.255.9090: UDP, length 126\n', b'E...31@.@............A#...o.CAM::192.168.1.2::{""time"": ""2.9"", ""position"": ""(-1073741824.0, -1073741824.0, 0)"", ""speed"": ""-1073741824.0"", ""leader"": ""None""}\n', b'14:59:27.614797 IP 192.168.1.1.54993 > 192.168.1.255.9090: UDP, length 125\n', b'E...P.@.@.e...........#.....CAM::192.168.1.1::{""time"": ""3.0"", ""position"": ""(5.939999999999999, -4.8, 0)"", ""speed"": ""4.939999999999998"", ""leader"": ""None""}\n', b'14:59:27.619396 IP 192.168.1.2.53057 > 192.168.1.255.9090: UDP, length 126\n', b'E...3F@.@............A#...w.CAM::192.168.1.2::{""time"": ""3.0"", ""position"": ""(-1073741824.0, -1073741824.0, 0)"", ""speed"": ""-1073741824.0"", ""leader"": ""None""}\n', b'14:59:27.715770 IP 192.168.1.1.54993 > 192.168.1.255.9090: UDP, length 126\n', b'E...P.@.@.e...........#...`.CAM::192.168.1.1::{""time"": ""3.1"", ""position"": ""(6.459999999999997, -4.8, 0)"", ""speed"": ""5.1999999999999975"", ""leader"": ""None""}\n', b'14:59:27.720804 IP 192.168.1.2.53057 > 192.168.1.255.9090: UDP, length 126\n', b'E...3Z@.@............A#...v.CAM::192.168.1.2::{""time"": ""3.1"", ""position"": ""(-1073741824.0, -1073741824.0, 0)"", ""speed"": ""-1073741824.0"", ""leader"": ""None""}\n', b'14:59:27.816130 IP 192.168.1.1.54993 > 192.168.1.255.9090: UDP, length 125\n', b'E...P2@.@.e...........#.....CAM::192.168.1.1::{""time"": ""3.2"", ""position"": ""(7.005999999999997, -4.8, 0)"", ""speed"": ""5.459999999999997"", ""leader"": ""None""}\n', b'14:59:27.820906 IP 192.168.1.2.53057 > 192.168.1.255.9090: UDP, length 126\n', b'E...3e@.@............A#...u.CAM::192.168.1.2::{""time"": ""3.2"", ""position"": ""(-1073741824.0, -1073741824.0, 0)"", ""speed"": ""-1073741824.0"", ""leader"": ""None""}\n', b'14:59:27.916761 IP 192.168.1.1.54993 > 192.168.1.255.9090: UDP, length 125\n', b'E...P=@.@.e...........#.....CAM::192.168.1.1::{""time"": ""3.3"", ""position"": ""(7.577999999999998, -4.8, 0)"", ""speed"": ""5.719999999999997"", ""leader"": ""None""}\n', b'14:59:27.922483 IP 192.168.1.2.53057 > 192.168.1.255.9090: UDP, length 126\n', b'E...3o@.@............A#...t.CAM::192.168.1.2::{""time"": ""3.3"", ""position"": ""(-1073741824.0, -1073741824.0, 0)"", ""speed"": ""-1073741824.0"", ""leader"": ""None""}\n']";-76.0@car1-wlan1
34;3.4s;car2;No leader;No leader;Not initialised;"[b'14:59:27.416292 IP 192.168.1.2.53057 > 192.168.1.255.9090: UDP, length 126\n', b'E...3*@.@............A#...p.CAM::192.168.1.2::{""time"": ""2.8"", ""position"": ""(-1073741824.0, -1073741824.0, 0)"", ""speed"": ""-1073741824.0"", ""leader"": ""None""}\n', b'14:59:27.417563 IP 192.168.1.1.54993 > 192.168.1.255.9090: UDP, length 125\n', b'E...O.@.@.f""..........#.....CAM::192.168.1.1::{""time"": ""2.8"", ""position"": ""(4.977999999999999, -4.8, 0)"", ""speed"": ""4.419999999999998"", ""leader"": ""None""}\n', b'14:59:27.517380 IP 192.168.1.2.53057 > 192.168.1.255.9090: UDP, length 126\n', b'E...31@.@............A#...o.CAM::192.168.1.2::{""time"": ""2.9"", ""position"": ""(-1073741824.0, -1073741824.0, 0)"", ""speed"": ""-1073741824.0"", ""leader"": ""None""}\n', b'14:59:27.519300 IP 192.168.1.1.54993 > 192.168.1.255.9090: UDP, length 125\n', b'E...O.@.@.f\n', b'..........#.....CAM::192.168.1.1::{""time"": ""2.9"", ""position"": ""(5.445999999999999, -4.8, 0)"", ""speed"": ""4.679999999999998"", ""leader"": ""None""}\n', b'14:59:27.616477 IP 192.168.1.2.53057 > 192.168.1.255.9090: UDP, length 126\n', b'E...3F@.@............A#...w.CAM::192.168.1.2::{""time"": ""3.0"", ""position"": ""(-1073741824.0, -1073741824.0, 0)"", ""speed"": ""-1073741824.0"", ""leader"": ""None""}\n', b'14:59:27.617413 IP 192.168.1.1.54993 > 192.168.1.255.9090: UDP, length 125\n', b'E...P.@.@.e...........#.....CAM::192.168.1.1::{""time"": ""3.0"", ""position"": ""(5.939999999999999, -4.8, 0)"", ""speed"": ""4.939999999999998"", ""leader"": ""None""}\n', b'14:59:27.717375 IP 192.168.1.2.53057 > 192.168.1.255.9090: UDP, length 126\n', b'E...3Z@.@............A#...v.CAM::192.168.1.2::{""time"": ""3.1"", ""position"": ""(-1073741824.0, -1073741824.0, 0)"", ""speed"": ""-1073741824.0"", ""leader"": ""None""}\n', b'14:59:27.718685 IP 192.168.1.1.54993 > 192.168.1.255.9090: UDP, length 126\n', b'E...P.@.@.e...........#...`.CAM::192.168.1.1::{""time"": ""3.1"", ""position"": ""(6.459999999999997, -4.8, 0)"", ""speed"": ""5.1999999999999975"", ""leader"": ""None""}\n', b'14:59:27.817226 IP 192.168.1.2.53057 > 192.168.1.255.9090: UDP, length 126\n', b'E...3e@.@............A#...u.CAM::192.168.1.2::{""time"": ""3.2"", ""position"": ""(-1073741824.0, -1073741824.0, 0)"", ""speed"": ""-1073741824.0"", ""leader"": ""None""}\n', b'14:59:27.818788 IP 192.168.1.1.54993 > 192.168.1.255.9090: UDP, length 125\n', b'E...P2@.@.e...........#.....CAM::192.168.1.1::{""time"": ""3.2"", ""position"": ""(7.005999999999997, -4.8, 0)"", ""speed"": ""5.459999999999997"", ""leader"": ""None""}\n', b'14:59:27.918167 IP 192.168.1.2.53057 > 192.168.1.255.9090: UDP, length 126\n', b'E...3o@.@............A#...t.CAM::192.168.1.2::{""time"": ""3.3"", ""position"": ""(-1073741824.0, -1073741824.0, 0)"", ""speed"": ""-1073741824.0"", ""leader"": ""None""}\n', b'14:59:27.919438 IP 192.168.1.1.54993 > 192.168.1.255.9090: UDP, length 125\n', b'E...P=@.@.e...........#.....CAM::192.168.1.1::{""time"": ""3.3"", ""position"": ""(7.577999999999998, -4.8, 0)"", ""speed"": ""5.719999999999997"", ""leader"": ""None""}\n']";-77.0@car2-wlan1
35;3.5s;car1;No leader;No leader;7.799999999999997;[];-76.0@car1-wlan1
35;3.5s;car2;No leader;No leader;Not initialised;[];-77.0@car2-wlan1
36;3.6s;car1;No leader;No leader;8.449999999999998;[];-76.0@car1-wlan1
36;3.6s;car2;No leader;No leader;Not initialised;[];-77.0@car2-wlan1
37;3.7s;car1;No leader;No leader;9.125999999999998;[];-76.0@car1-wlan1
37;3.7s;car2;No leader;No leader;Not initialised;[];-77.0@car2-wlan1
38;3.8s;car1;No leader;No leader;9.827999999999998;[];-75.0@car1-wlan1
38;3.8s;car2;No leader;No leader;Not initialised;[];-77.0@car2-wlan1
39;3.9s;car1;No leader;No leader;10.555999999999997;[];-75.0@car1-wlan1
39;3.9s;car2;No leader;No leader;Not initialised;[];-77.0@car2-wlan1
40;4.0s;car1;No leader;No leader;11.309999999999997;[];-75.0@car1-wlan1
40;4.0s;car2;No leader;No leader;Not initialised;[];-77.0@car2-wlan1
41;4.1s;car1;No leader;No leader;12.089999999999996;[];-75.0@car1-wlan1
41;4.1s;car2;car1;0.48999999999999666;Not initialised;[];-77.0@car2-wlan1
42;4.2s;car1;No leader;No leader;12.895999999999995;[];-75.0@car1-wlan1
42;4.2s;car2;car1;1.269999999999996;0.0259999999999998;[];-76.0@car2-wlan1
43;4.3s;car1;No leader;No leader;13.727999999999994;[];-75.0@car1-wlan1
43;4.3s;car2;car1;2.0499999999999954;0.0779999999999994;[];-76.0@car2-wlan1
44;4.4s;car1;No leader;No leader;14.585999999999993;"[b'14:59:28.016646 IP 192.168.1.1.54993 > 192.168.1.255.9090: UDP, length 125\n', b'E...PE@.@.e...........#.....CAM::192.168.1.1::{""time"": ""3.4"", ""position"": ""(8.175999999999997, -4.8, 0)"", ""speed"": ""5.979999999999997"", ""leader"": ""None""}\n', b'14:59:28.024047 IP 192.168.1.2.53057 > 192.168.1.255.9090: UDP, length 126\n', b'E...3t@.@............A#...s.CAM::192.168.1.2::{""time"": ""3.4"", ""position"": ""(-1073741824.0, -1073741824.0, 0)"", ""speed"": ""-1073741824.0"", ""leader"": ""None""}\n', b'14:59:28.116379 IP 192.168.1.1.54993 > 192.168.1.255.9090: UDP, length 125\n', b'E...P\\@.@.e...........#.....CAM::192.168.1.1::{""time"": ""3.5"", ""position"": ""(8.799999999999997, -4.8, 0)"", ""speed"": ""6.239999999999997"", ""leader"": ""None""}\n', b'14:59:28.121639 IP 192.168.1.2.53057 > 192.168.1.255.9090: UDP, length 126\n', b'E...3.@.@..w.........A#...r.CAM::192.168.1.2::{""time"": ""3.5"", ""position"": ""(-1073741824.0, -1073741824.0, 0)"", ""speed"": ""-1073741824.0"", ""leader"": ""None""}\n', b'14:59:28.216291 IP 192.168.1.1.54993 > 192.168.1.255.9090: UDP, length 126\n', b'E...P]@.@.e...........#...T.CAM::192.168.1.1::{""time"": ""3.6"", ""position"": ""(9.449999999999998, -4.8, 0)"", ""speed"": ""6.4999999999999964"", ""leader"": ""None""}\n', b'14:59:28.221150 IP 192.168.1.2.53057 > 192.168.1.255.9090: UDP, length 126\n', b'E...3.@.@..^.........A#...q.CAM::192.168.1.2::{""time"": ""3.6"", ""position"": ""(-1073741824.0, -1073741824.0, 0)"", ""speed"": ""-1073741824.0"", ""leader"": ""None""}\n', b'14:59:28.317484 IP 192.168.1.1.54993 > 192.168.1.255.9090: UDP, length 126\n', b'E...Pm@.@.e...........#..."".CAM::192.168.1.1::{""time"": ""3.7"", ""position"": ""(10.125999999999998, -4.8, 0)"", ""speed"": ""6.759999999999996"", ""leader"": ""None""}\n', b'14:59:28.322763 IP 192.168.1.2.53057 > 192.168.1.255.9090: UDP, length 126\n', b'E...3.@.@..V.........A#...p.CAM::192.168.1.2::{""time"": ""3.7"", ""position"": ""(-1073741824.0, -1073741824.0, 0)"", ""speed"": ""-1073741824.0"", ""leader"": ""None""}\n', b'14:59:28.416540 IP 192.168.1.1.54993 > 192.168.1.255.9090: UDP, length 126\n', b'E...Pt@.@.e...........#...%.CAM::192.168.1.1::{""time"": ""3.8"", ""position"": ""(10.827999999999998, -4.8, 0)"", ""speed"": ""7.019999999999996"", ""leader"": ""None""}\n', b'14:59:28.421271 IP 192.168.1.2.53057 > 192.168.1.255.9090: UDP, length 126\n', b'E...3.@.@..U.........A#...o.CAM::192.168.1.2::{""time"": ""3.8"", ""position"": ""(-1073741824.0, -1073741824.0, 0)"", ""speed"": ""-1073741824.0"", ""leader"": ""None""}\n', b'14:59:28.516856 IP 192.168.1.1.54993 > 192.168.1.255.9090: UDP, length 126\n', b'E...Px@.@.e...........#.....CAM::192.168.1.1::{""time"": ""3.9"", ""position"": ""(11.555999999999997, -4.8, 0)"", ""speed"": ""7.279999999999996"", ""leader"": ""None""}\n', b'14:59:28.521556 IP 192.168.1.2.53057 > 192.168.1.255.9090: UDP, length 126\n', b'E...3.@.@..?.........A#...n.CAM::192.168.1.2::{""time"": ""3.9"", ""position"": ""(-1073741824.0, -1073741824.0, 0)"", ""speed"": ""-1073741824.0"", ""leader"": ""None""}\n', b'14:59:28.618001 IP 192.168.1.1.54993 > 192.168.1.255.9090: UDP, length 126\n', b'E...Pz@.@.e...........#...,.CAM::192.168.1.1::{""time"": ""4.0"", ""position"": ""(12.309999999999997, -4.8, 0)"", ""speed"": ""7.539999999999996"", ""leader"": ""None""}\n', b'14:59:28.623417 IP 192.168.1.2.53057 > 192.168.1.255.9090: UDP, length 126\n', b'E...3.@.@..9.........A#...v.CAM::192.168.1.2::{""time"": ""4.0"", ""position"": ""(-1073741824.0, -1073741824.0, 0)"", ""speed"": ""-1073741824.0"", ""leader"": ""None""}\n', b'14:59:28.718865 IP 192.168.1.1.54993 > 192.168.1.255.9090: UDP, length 126\n', b'E...P.@.@.ex..........#.....CAM::192.168.1.1::{""time"": ""4.1"", ""position"": ""(13.089999999999996, -4.8, 0)"", ""speed"": ""7.799999999999995"", ""leader"": ""None""}\n', b'14:59:28.726207 IP 192.168.1.2.53057 > 192.168.1.255.9090: UDP, length 97\n', b'E..}3.@.@..C.........A#..i/dCAM::192.168.1.2::{""time"": ""4.1"", ""position"": ""(5.1, -4.8, 0)"", ""speed"": ""0.0"", ""leader"": ""car1""}\n', b'14:59:28.818471 IP 192.168.1.1.54993 > 192.168.1.255.9090: UDP, length 126\n', b'E...P.@.@.ej..........#.....CAM::192.168.1.1::{""time"": ""4.2"", ""position"": ""(13.895999999999994, -4.8, 0)"", ""speed"": ""8.059999999999995"", ""leader"": ""None""}\n', b'14:59:28.822952 IP 192.168.1.2.53057 > 192.168.1.255.9090: UDP, length 113\n', b'E...3.@.@..\'.........A#..y..CAM::192.168.1.2::{""time"": ""4.2"", ""position"": ""(5.1259999999999994, -4.8, 0)"", ""speed"": ""0.26"", ""leader"": ""car1""}\n', b'14:59:28.918148 IP 192.168.1.1.54993 > 192.168.1.255.9090: UDP, length 126\n', b'E...P.@.@.eZ..........#...).CAM::192.168.1.1::{""time"": ""4.3"", ""position"": ""(14.727999999999994, -4.8, 0)"", ""speed"": ""8.319999999999995"", ""leader"": ""None""}\n', b'14:59:28.923321 IP 192.168.1.2.53057 > 192.168.1.255.9090: UDP, length 112\n', b'E...3.@.@.. .........A#..x.>CAM::192.168.1.2::{""time"": ""4.3"", ""position"": ""(5.177999999999999, -4.8, 0)"", ""speed"": ""0.52"", ""leader"": ""car1""}\n']";-75.0@car1-wlan1
44;4.4s;car2;car1;2.829999999999994;0.1559999999999997;"[b'14:59:28.017898 IP 192.168.1.2.53057 > 192.168.1.255.9090: UDP, length 126\n', b'E...3t@.@............A#...s.CAM::192.168.1.2::{""time"": ""3.4"", ""position"": ""(-1073741824.0, -1073741824.0, 0)"", ""speed"": ""-1073741824.0"", ""leader"": ""None""}\n', b'14:59:28.022050 IP 192.168.1.1.54993 > 192.168.1.255.9090: UDP, length 125\n', b'E...PE@.@.e...........#.....CAM::192.168.1.1::{""time"": ""3.4"", ""position"": ""(8.175999999999997, -4.8, 0)"", ""speed"": ""5.979999999999997"", ""leader"": ""None""}\n', b'14:59:28.118015 IP 192.168.1.2.53057 > 192.168.1.255.9090: UDP, length 126\n', b'E...3.@.@..w.........A#...r.CAM::192.168.1.2::{""time"": ""3.5"", ""position"": ""(-1073741824.0, -1073741824.0, 0)"", ""speed"": ""-1073741824.0"", ""leader"": ""None""}\n', b'14:59:28.119212 IP 192.168.1.1.54993 > 192.168.1.255.9090: UDP, length 125\n', b'E...P\\@.@.e...........#.....CAM::192.168.1.1::{""time"": ""3.5"", ""position"": ""(8.799999999999997, -4.8, 0)"", ""speed"": ""6.239999999999997"", ""leader"": ""None""}\n', b'14:59:28.217688 IP 192.168.1.2.53057 > 192.168.1.255.9090: UDP, length 126\n', b'E...3.@.@..^.........A#...q.CAM::192.168.1.2::{""time"": ""3.6"", ""position"": ""(-1073741824.0, -1073741824.0, 0)"", ""speed"": ""-1073741824.0"", ""leader"": ""None""}\n', b'14:59:28.218960 IP 192.168.1.1.54993 > 192.168.1.255.9090: UDP, length 126\n', b'E...P]@.@.e...........#...T.CAM::192.168.1.1::{""time"": ""3.6"", ""position"": ""(9.449999999999998, -4.8, 0)"", ""speed"": ""6.4999999999999964"", ""leader"": ""None""}\n', b'14:59:28.319133 IP 192.168.1.2.53057 > 192.168.1.255.9090: UDP, length 126\n', b'E...3.@.@..V.........A#...p.CAM::192.168.1.2::{""time"": ""3.7"", ""position"": ""(-1073741824.0, -1073741824.0, 0)"", ""speed"": ""-1073741824.0"", ""leader"": ""None""}\n', b'14:59:28.320014 IP 192.168.1.1.54993 > 192.168.1.255.9090: UDP, length 126\n', b'E...Pm@.@.e...........#..."".CAM::192.168.1.1::{""time"": ""3.7"", ""position"": ""(10.125999999999998, -4.8, 0)"", ""speed"": ""6.759999999999996"", ""leader"": ""None""}\n', b'14:59:28.417735 IP 192.168.1.2.53057 > 192.168.1.255.9090: UDP, length 126\n', b'E...3.@.@..U.........A#...o.CAM::192.168.1.2::{""time"": ""3.8"", ""position"": ""(-1073741824.0, -1073741824.0, 0)"", ""speed"": ""-1073741824.0"", ""leader"": ""None""}\n', b'14:59:28.419157 IP 192.168.1.1.54993 > 192.168.1.255.9090: UDP, length 126\n', b'E...Pt@.@.e...........#...%.CAM::192.168.1.1::{""time"": ""3.8"", ""position"": ""(10.827999999999998, -4.8, 0)"", ""speed"": ""7.019999999999996"", ""leader"": ""None""}\n', b'14:59:28.518133 IP 192.168.1.2.53057 > 192.168.1.255.9090: UDP, length 126\n', b'E...3.@.@..?.........A#...n.CAM::192.168.1.2::{""time"": ""3.9"", ""position"": ""(-1073741824.0, -1073741824.0, 0)"", ""speed"": ""-1073741824.0"", ""leader"": ""None""}\n', b'14:59:28.519381 IP 192.168.1.1.54993 > 192.168.1.255.9090: UDP, length 126\n', b'E...Px@.@.e...........#.....CAM::192.168.1.1::{""time"": ""3.9"", ""position"": ""(11.555999999999997, -4.8, 0)"", ""speed"": ""7.279999999999996"", ""leader"": ""None""}\n', b'14:59:28.619429 IP 192.168.1.2.53057 > 192.168.1.255.9090: UDP, length 126\n', b'E...3.@.@..9.........A#...v.CAM::192.168.1.2::{""time"": ""4.0"", ""position"": ""(-1073741824.0, -1073741824.0, 0)"", ""speed"": ""-1073741824.0"", ""leader"": ""None""}\n', b'14:59:28.621251 IP 192.168.1.1.54993 > 192.168.1.255.9090: UDP, length 126\n', b'E...Pz@.@.e...........#...,.CAM::192.168.1.1::{""time"": ""4.0"", ""position"": ""(12.309999999999997, -4.8, 0)"", ""speed"": ""7.539999999999996"", ""leader"": ""None""}\n', b'14:59:28.720618 IP 192.168.1.2.53057 > 192.168.1.255.9090: UDP, length 97\n', b'E..}3.@.@..C.........A#..i/dCAM::192.168.1.2::{""time"": ""4.1"", ""position"": ""(5.1, -4.8, 0)"", ""speed"": ""0.0"", ""leader"": ""car1""}\n', b'14:59:28.722056 IP 192.168.1.1.54993 > 192.168.1.255.9090: UDP, length 126\n', b'E...P.@.@.ex..........#.....CAM::192.168.1.1::{""time"": ""4.1"", ""position"": ""(13.089999999999996, -4.8, 0)"", ""speed"": ""7.799999999999995"", ""leader"": ""None""}\n', b'14:59:28.819812 IP 192.168.1.2.53057 > 192.168.1.255.9090: UDP, length 113\n', b'E...3.@.@..\'.........A#..y..CAM::192.168.1.2::{""time"": ""4.2"", ""position"": ""(5.1259999999999994, -4.8, 0)"", ""speed"": ""0.26"", ""leader"": ""car1""}\n', b'14:59:28.820975 IP 192.168.1.1.54993 > 192.168.1.255.9090: UDP, length 126\n', b'E...P.@.@.ej..........#.....CAM::192.168.1.1::{""time"": ""4.2"", ""position"": ""(13.895999999999994, -4.8, 0)"", ""speed"": ""8.059999999999995"", ""leader"": ""None""}\n', b'14:59:28.919453 IP 192.168.1.2.53057 > 192.168.1.255.9090: UDP, length 112\n', b'E...3.@.@.. .........A#..x.>CAM::192.168.1.2::{""time"": ""4.3"", ""position"": ""(5.177999999999999, -4.8, 0)"", ""speed"": ""0.52"", ""leader"": ""car1""}\n', b'14:59:28.920572 IP 192.168.1.1.54993 > 192.168.1.255.9090: UDP, length 126\n', b'E...P.@.@.eZ..........#...).CAM::192.168.1.1::{""time"": ""4.3"", ""position"": ""(14.727999999999994, -4.8, 0)"", ""speed"": ""8.319999999999995"", ""leader"": ""None""}\n']";-76.0@car2-wlan1
45;4.5s;car1;No leader;No leader;15.469999999999992;[];-74.0@car1-wlan1
45;4.5s;car2;car1;3.6099999999999923;0.2599999999999998;[];-76.0@car2-wlan1
46;4.6s;car1;No leader;No leader;16.379999999999992;[];-74.0@car1-wlan1
46;4.6s;car2;car1;4.389999999999993;0.3899999999999997;[];-76.0@car2-wlan1
47;4.7s;car1;No leader;No leader;17.315999999999992;[];-74.0@car1-wlan1
47;4.7s;car2;car1;5.169999999999993;0.5459999999999994;[];-76.0@car2-wlan1
48;4.8s;car1;No leader;No leader;18.27799999999999;[];-74.0@car1-wlan1
48;4.8s;car2;car1;5.949999999999992;0.7279999999999998;[];-76.0@car2-wlan1
49;4.9s;car1;No leader;No leader;19.26599999999999;[];-74.0@car1-wlan1
49;4.9s;car2;car1;6.7299999999999915;0.9359999999999999;[];-76.0@car2-wlan1
50;5.0s;car1;No leader;No leader;20.27999999999999;[];-73.0@car1-wlan1
50;5.0s;car2;car1;7.509999999999991;1.17;[];-76.0@car2-wlan1
51;5.1s;car1;No leader;No leader;21.31999999999999;[];-73.0@car1-wlan1
51;5.1s;car2;car1;8.28999999999999;1.4299999999999997;[];-76.0@car2-wlan1
52;5.2s;car1;No leader;No leader;22.38599999999999;[];-73.0@car1-wlan1
52;5.2s;car2;car1;9.06999999999999;1.7159999999999993;[];-76.0@car2-wlan1
53;5.3s;car1;obs;69.22200000000001;23.477999999999987;[];-73.0@car1-wlan1
53;5.3s;car2;car1;9.849999999999987;2.0279999999999996;[];-76.0@car2-wlan1
54;5.4s;car1;obs;68.10400000000001;24.595999999999986;[];-72.0@car1-wlan1
54;5.4s;car2;car1;10.629999999999987;2.3659999999999997;[];-76.0@car2-wlan1
55;5.5s;car1;obs;66.96000000000002;25.739999999999984;"[b'14:59:29.018028 IP 192.168.1.1.54993 > 192.168.1.255.9090: UDP, length 126\n', b'E...P.@.@.eA..........#.....CAM::192.168.1.1::{""time"": ""4.4"", ""position"": ""(15.585999999999995, -4.8, 0)"", ""speed"": ""8.579999999999995"", ""leader"": ""None""}\n', b'14:59:29.026117 IP 192.168.1.2.53057 > 192.168.1.255.9090: UDP, length 112\n', b'E...3.@.@............A#..x.:CAM::192.168.1.2::{""time"": ""4.4"", ""position"": ""(5.255999999999999, -4.8, 0)"", ""speed"": ""0.78"", ""leader"": ""car1""}\n', b'14:59:29.118697 IP 192.168.1.1.54993 > 192.168.1.255.9090: UDP, length 125\n', b'E...P.@.@.e/..........#.....CAM::192.168.1.1::{""time"": ""4.5"", ""position"": ""(16.46999999999999, -4.8, 0)"", ""speed"": ""8.839999999999995"", ""leader"": ""None""}\n', b'14:59:29.123391 IP 192.168.1.2.53057 > 192.168.1.255.9090: UDP, length 112\n', b'E...4.@.@............A#..x.>CAM::192.168.1.2::{""time"": ""4.5"", ""position"": ""(5.359999999999999, -4.8, 0)"", ""speed"": ""1.04"", ""leader"": ""car1""}\n', b'14:59:29.218886 IP 192.168.1.1.54993 > 192.168.1.255.9090: UDP, length 126\n', b'E...P.@.@.e""..........#....\n', b'CAM::192.168.1.1::{""time"": ""4.6"", ""position"": ""(17.379999999999992, -4.8, 0)"", ""speed"": ""9.099999999999994"", ""leader"": ""None""}\n', b'14:59:29.224025 IP 192.168.1.2.53057 > 192.168.1.255.9090: UDP, length 111\n', b'E...4.@.@............A#..w..CAM::192.168.1.2::{""time"": ""4.6"", ""position"": ""(5.489999999999999, -4.8, 0)"", ""speed"": ""1.3"", ""leader"": ""car1""}\n', b'14:59:29.319303 IP 192.168.1.1.54993 > 192.168.1.255.9090: UDP, length 126\n', b'E...P.@.@.e...........#...""\n', b'CAM::192.168.1.1::{""time"": ""4.7"", ""position"": ""(18.315999999999992, -4.8, 0)"", ""speed"": ""9.359999999999994"", ""leader"": ""None""}\n', b'14:59:29.325438 IP 192.168.1.2.53057 > 192.168.1.255.9090: UDP, length 112\n', b'E...4""@.@............A#..x.=CAM::192.168.1.2::{""time"": ""4.7"", ""position"": ""(5.645999999999999, -4.8, 0)"", ""speed"": ""1.56"", ""leader"": ""car1""}\n', b'14:59:29.419497 IP 192.168.1.1.54993 > 192.168.1.255.9090: UDP, length 125\n', b'E...Q.@.@.d...........#.....CAM::192.168.1.1::{""time"": ""4.8"", ""position"": ""(19.27799999999999, -4.8, 0)"", ""speed"": ""9.619999999999994"", ""leader"": ""None""}\n', b'14:59:29.424157 IP 192.168.1.2.53057 > 192.168.1.255.9090: UDP, length 112\n', b'E...40@.@............A#..x.CCAM::192.168.1.2::{""time"": ""4.8"", ""position"": ""(5.827999999999999, -4.8, 0)"", ""speed"": ""1.82"", ""leader"": ""car1""}\n', b'14:59:29.519476 IP 192.168.1.1.54993 > 192.168.1.255.9090: UDP, length 125\n', b'E...Q.@.@.d...........#.....CAM::192.168.1.1::{""time"": ""4.9"", ""position"": ""(20.26599999999999, -4.8, 0)"", ""speed"": ""9.879999999999994"", ""leader"": ""None""}\n', b'14:59:29.524690 IP 192.168.1.2.53057 > 192.168.1.255.9090: UDP, length 100\n', b'E...43@.@............A#..l5.CAM::192.168.1.2::{""time"": ""4.9"", ""position"": ""(6.036, -4.8, 0)"", ""speed"": ""2.08"", ""leader"": ""car1""}\n', b'14:59:29.619362 IP 192.168.1.1.54993 > 192.168.1.255.9090: UDP, length 126\n', b'E...Q""@.@.d...........#...t.CAM::192.168.1.1::{""time"": ""5.0"", ""position"": ""(21.27999999999999, -4.8, 0)"", ""speed"": ""10.139999999999993"", ""leader"": ""None""}\n', b'14:59:29.625564 IP 192.168.1.2.53057 > 192.168.1.255.9090: UDP, length 99\n', b'E...4E@.@............A#..k.tCAM::192.168.1.2::{""time"": ""5.0"", ""position"": ""(6.27, -4.8, 0)"", ""speed"": ""2.34"", ""leader"": ""car1""}\n', b'14:59:29.719116 IP 192.168.1.1.54993 > 192.168.1.255.9090: UDP, length 126\n', b'E...Q:@.@.d...........#...s.CAM::192.168.1.1::{""time"": ""5.1"", ""position"": ""(22.31999999999999, -4.8, 0)"", ""speed"": ""10.399999999999993"", ""leader"": ""None""}\n', b'14:59:29.724608 IP 192.168.1.2.53057 > 192.168.1.255.9090: UDP, length 126\n', b'E...4X@.@............A#...G.CAM::192.168.1.2::{""time"": ""5.1"", ""position"": ""(6.529999999999999, -4.8, 0)"", ""speed"": ""2.5999999999999996"", ""leader"": ""car1""}\n', b'14:59:29.819919 IP 192.168.1.1.54993 > 192.168.1.255.9090: UDP, length 126\n', b'E...QG@.@.d...........#...o.CAM::192.168.1.1::{""time"": ""5.2"", ""position"": ""(23.38599999999999, -4.8, 0)"", ""speed"": ""10.659999999999993"", ""leader"": ""None""}\n', b'14:59:29.824815 IP 192.168.1.2.53057 > 192.168.1.255.9090: UDP, length 126\n', b'E...4l@.@............A#...E.CAM::192.168.1.2::{""time"": ""5.2"", ""position"": ""(6.815999999999998, -4.8, 0)"", ""speed"": ""2.8599999999999994"", ""leader"": ""car1""}\n', b'14:59:29.920724 IP 192.168.1.1.54993 > 192.168.1.255.9090: UDP, length 126\n', b'E...Q_@.@.d...........#....7CAM::192.168.1.1::{""time"": ""5.3"", ""position"": ""(24.477999999999987, -4.8, 0)"", ""speed"": ""10.919999999999993"", ""leader"": ""obs""}\n', b'14:59:29.925931 IP 192.168.1.2.53057 > 192.168.1.255.9090: UDP, length 125\n', b'E...4p@.@............A#.....CAM::192.168.1.2::{""time"": ""5.3"", ""position"": ""(7.127999999999999, -4.8, 0)"", ""speed"": ""3.119999999999999"", ""leader"": ""car1""}\n', b'14:59:30.020197 IP 192.168.1.1.54993 > 192.168.1.255.9090: UDP, length 126\n', b'E...Qh@.@.d...........#....2CAM::192.168.1.1::{""time"": ""5.4"", ""position"": ""(25.595999999999986, -4.8, 0)"", ""speed"": ""11.179999999999993"", ""leader"": ""obs""}\n', b'14:59:30.025570 IP 192.168.1.2.53057 > 192.168.1.255.9090: UDP, length 125\n', b'E...4.@.@..}.........A#.....CAM::192.168.1.2::{""time"": ""5.4"", ""position"": ""(7.465999999999999, -4.8, 0)"", ""speed"": ""3.379999999999999"", ""leader"": ""car1""}\n']";-72.0@car1-wlan1
55;5.5s;car2;car1;11.409999999999986;2.7299999999999995;"[b'14:59:29.019743 IP 192.168.1.2.53057 > 192.168.1.255.9090: UDP, length 112\n', b'E...3.@.@............A#..x.:CAM::192.168.1.2::{""time"": ""4.4"", ""position"": ""(5.255999999999999, -4.8, 0)"", ""speed"": ""0.78"", ""leader"": ""car1""}\n', b'14:59:29.020480 IP 192.168.1.1.54993 > 192.168.1.255.9090: UDP, length 126\n', b'E...P.@.@.eA..........#.....CAM::192.168.1.1::{""time"": ""4.4"", ""position"": ""(15.585999999999995, -4.8, 0)"", ""speed"": ""8.579999999999995"", ""leader"": ""None""}\n', b'14:59:29.120295 IP 192.168.1.2.53057 > 192.168.1.255.9090: UDP, length 112\n', b'E...4.@.@............A#..x.>CAM::192.168.1.2::{""time"": ""4.5"", ""position"": ""(5.359999999999999, -4.8, 0)"", ""speed"": ""1.04"", ""leader"": ""car1""}\n', b'14:59:29.121427 IP 192.168.1.1.54993 > 192.168.1.255.9090: UDP, length 125\n', b'E...P.@.@.e/..........#.....CAM::192.168.1.1::{""time"": ""4.5"", ""position"": ""(16.46999999999999, -4.8, 0)"", ""speed"": ""8.839999999999995"", ""leader"": ""None""}\n', b'14:59:29.220275 IP 192.168.1.2.53057 > 192.168.1.255.9090: UDP, length 111\n', b'E...4.@.@............A#..w..CAM::192.168.1.2::{""time"": ""4.6"", ""position"": ""(5.489999999999999, -4.8, 0)"", ""speed"": ""1.3"", ""leader"": ""car1""}\n', b'14:59:29.221901 IP 192.168.1.1.54993 > 192.168.1.255.9090: UDP, length 126\n', b'E...P.@.@.e""..........#....\n', b'CAM::192.168.1.1::{""time"": ""4.6"", ""position"": ""(17.379999999999992, -4.8, 0)"", ""speed"": ""9.099999999999994"", ""leader"": ""None""}\n', b'14:59:29.321084 IP 192.168.1.2.53057 > 192.168.1.255.9090: UDP, length 112\n', b'E...4""@.@............A#..x.=CAM::192.168.1.2::{""time"": ""4.7"", ""position"": ""(5.645999999999999, -4.8, 0)"", ""speed"": ""1.56"", ""leader"": ""car1""}\n', b'14:59:29.323158 IP 192.168.1.1.54993 > 192.168.1.255.9090: UDP, length 126\n', b'E...P.@.@.e...........#...""\n', b'CAM::192.168.1.1::{""time"": ""4.7"", ""position"": ""(18.315999999999992, -4.8, 0)"", ""speed"": ""9.359999999999994"", ""leader"": ""None""}\n', b'14:59:29.420987 IP 192.168.1.2.53057 > 192.168.1.255.9090: UDP, length 112\n', b'E...40@.@............A#..x.CCAM::192.168.1.2::{""time"": ""4.8"", ""position"": ""(5.827999999999999, -4.8, 0)"", ""speed"": ""1.82"", ""leader"": ""car1""}\n', b'14:59:29.422023 IP 192.168.1.1.54993 > 192.168.1.255.9090: UDP, length 125\n', b'E...Q.@.@.d...........#.....CAM::192.168.1.1::{""time"": ""4.8"", ""position"": ""(19.27799999999999, -4.8, 0)"", ""speed"": ""9.619999999999994"", ""leader"": ""None""}\n', b'14:59:29.521011 IP 192.168.1.2.53057 > 192.168.1.255.9090: UDP, length 100\n', b'E...43@.@............A#..l5.CAM::192.168.1.2::{""time"": ""4.9"", ""position"": ""(6.036, -4.8, 0)"", ""speed"": ""2.08"", ""leader"": ""car1""}\n', b'14:59:29.522607 IP 192.168.1.1.54993 > 192.168.1.255.9090: UDP, length 125\n', b'E...Q.@.@.d...........#.....CAM::192.168.1.1::{""time"": ""4.9"", ""position"": ""(20.26599999999999, -4.8, 0)"", ""speed"": ""9.879999999999994"", ""leader"": ""None""}\n', b'14:59:29.622042 IP 192.168.1.2.53057 > 192.168.1.255.9090: UDP, length 99\n', b'E...4E@.@............A#..k.tCAM::192.168.1.2::{""time"": ""5.0"", ""position"": ""(6.27, -4.8, 0)"", ""speed"": ""2.34"", ""leader"": ""car1""}\n', b'14:59:29.622862 IP 192.168.1.1.54993 > 192.168.1.255.9090: UDP, length 126\n', b'E...Q""@.@.d...........#...t.CAM::192.168.1.1::{""time"": ""5.0"", ""position"": ""(21.27999999999999, -4.8, 0)"", ""speed"": ""10.139999999999993"", ""leader"": ""None""}\n', b'14:59:29.720818 IP 192.168.1.2.53057 > 192.168.1.255.9090: UDP, length 126\n', b'E...4X@.@............A#...G.CAM::192.168.1.2::{""time"": ""5.1"", ""position"": ""(6.529999999999999, -4.8, 0)"", ""speed"": ""2.5999999999999996"", ""leader"": ""car1""}\n', b'14:59:29.722385 IP 192.168.1.1.54993 > 192.168.1.255.9090: UDP, length 126\n', b'E...Q:@.@.d...........#...s.CAM::192.168.1.1::{""time"": ""5.1"", ""position"": ""(22.31999999999999, -4.8, 0)"", ""speed"": ""10.399999999999993"", ""leader"": ""None""}\n', b'14:59:29.821384 IP 192.168.1.2.53057 > 192.168.1.255.9090: UDP, length 126\n', b'E...4l@.@............A#...E.CAM::192.168.1.2::{""time"": ""5.2"", ""position"": ""(6.815999999999998, -4.8, 0)"", ""speed"": ""2.8599999999999994"", ""leader"": ""car1""}\n', b'14:59:29.822532 IP 192.168.1.1.54993 > 192.168.1.255.9090: UDP, length 126\n', b'E...QG@.@.d...........#...o.CAM::192.168.1.1::{""time"": ""5.2"", ""position"": ""(23.38599999999999, -4.8, 0)"", ""speed"": ""10.659999999999993"", ""leader"": ""None""}\n', b'14:59:29.922147 IP 192.168.1.2.53057 > 192.168.1.255.9090: UDP, length 125\n', b'E...4p@.@............A#.....CAM::192.168.1.2::{""time"": ""5.3"", ""position"": ""(7.127999999999999, -4.8, 0)"", ""speed"": ""3.119999999999999"", ""leader"": ""car1""}\n', b'14:59:29.923740 IP 192.168.1.1.54993 > 192.168.1.255.9090: UDP, length 126\n', b'E...Q_@.@.d...........#....7CAM::192.168.1.1::{""time"": ""5.3"", ""position"": ""(24.477999999999987, -4.8, 0)"", ""speed"": ""10.919999999999993"", ""leader"": ""obs""}\n', b'14:59:30.021735 IP 192.168.1.2.53057 > 192.168.1.255.9090: UDP, length 125\n', b'E...4.@.@..}.........A#.....CAM::192.168.1.2::{""time"": ""5.4"", ""position"": ""(7.465999999999999, -4.8, 0)"", ""speed"": ""3.379999999999999"", ""leader"": ""car1""}\n', b'14:59:30.023504 IP 192.168.1.1.54993 > 192.168.1.255.9090: UDP, length 126\n', b'E...Qh@.@.d...........#....2CAM::192.168.1.1::{""time"": ""5.4"", ""position"": ""(25.595999999999986, -4.8, 0)"", ""speed"": ""11.179999999999993"", ""leader"": ""obs""}\n']";-76.0@car2-wlan1
56;5.6s;car1;obs;65.79000000000002;26.909999999999982;[];-72.0@car1-wlan1
56;5.6s;car2;car1;12.189999999999984;3.119999999999999;[];-76.0@car2-wlan1
57;5.7s;car1;obs;64.59400000000002;28.10599999999998;[];-72.0@car1-wlan1
57;5.7s;car2;car1;12.969999999999981;3.5359999999999996;[];-76.0@car2-wlan1
58;5.8s;car1;obs;63.37200000000003;29.327999999999978;[];-71.0@car1-wlan1
58;5.8s;car2;car1;13.749999999999979;3.9779999999999998;[];-76.0@car2-wlan1
59;5.9s;car1;obs;62.124000000000024;30.57599999999998;[];-71.0@car1-wlan1
59;5.9s;car2;car1;14.52999999999998;4.446;[];-76.0@car2-wlan1
60;6.0s;car1;obs;60.85000000000002;31.84999999999998;[];-71.0@car1-wlan1
60;6.0s;car2;car1;15.309999999999981;4.9399999999999995;[];-76.0@car2-wlan1
61;6.1s;car1;obs;59.550000000000026;33.14999999999998;[];-70.0@car1-wlan1
61;6.1s;car2;car1;16.08999999999998;5.459999999999999;[];-75.0@car2-wlan1
62;6.2s;car1;obs;58.246693129878395;34.45330687012161;[];-70.0@car1-wlan1
62;6.2s;car2;car1;16.84730687012161;6.0059999999999985;[];-75.0@car2-wlan1
63;6.3s;car1;obs;56.943386259756764;35.75661374024324;[];-70.0@car1-wlan1
63;6.3s;car2;car1;17.57861374024324;6.577999999999998;[];-75.0@car2-wlan1
64;6.4s;car1;obs;55.64007938963513;37.05992061036487;[];-70.0@car1-wlan1
64;6.4s;car2;car1;18.283920610364873;7.175999999999997;[];-75.0@car2-wlan1
65;6.5s;car1;obs;54.3367725195135;38.3632274804865;"[b'14:59:30.119933 IP 192.168.1.1.54993 > 192.168.1.255.9090: UDP, length 126\n', b'E...Q{@.@.d...........#....-CAM::192.168.1.1::{""time"": ""5.5"", ""position"": ""(26.739999999999988, -4.8, 0)"", ""speed"": ""11.439999999999992"", ""leader"": ""obs""}\n', b'14:59:30.128154 IP 192.168.1.2.53057 > 192.168.1.255.9090: UDP, length 125\n', b'E...4.@.@..n.........A#.....CAM::192.168.1.2::{""time"": ""5.5"", ""position"": ""(7.829999999999999, -4.8, 0)"", ""speed"": ""3.639999999999999"", ""leader"": ""car1""}\n', b'14:59:30.220384 IP 192.168.1.1.54993 > 192.168.1.255.9090: UDP, length 126\n', b'E...Q.@.@.dy..........#....&CAM::192.168.1.1::{""time"": ""5.6"", ""position"": ""(27.909999999999986, -4.8, 0)"", ""speed"": ""11.699999999999992"", ""leader"": ""obs""}\n', b'14:59:30.227751 IP 192.168.1.2.53057 > 192.168.1.255.9090: UDP, length 126\n', b'E...4.@.@..d.........A#...@.CAM::192.168.1.2::{""time"": ""5.6"", ""position"": ""(8.219999999999999, -4.8, 0)"", ""speed"": ""3.8999999999999986"", ""leader"": ""car1""}\n', b'14:59:30.320750 IP 192.168.1.1.54993 > 192.168.1.255.9090: UDP, length 125\n', b'E...Q.@.@.dp..........#.....CAM::192.168.1.1::{""time"": ""5.7"", ""position"": ""(29.10599999999998, -4.8, 0)"", ""speed"": ""11.959999999999992"", ""leader"": ""obs""}\n', b'14:59:30.325179 IP 192.168.1.2.53057 > 192.168.1.255.9090: UDP, length 113\n', b'E...4.@.@..Y.........A#..yU.CAM::192.168.1.2::{""time"": ""5.7"", ""position"": ""(8.636, -4.8, 0)"", ""speed"": ""4.159999999999998"", ""leader"": ""car1""}\n', b'14:59:30.419882 IP 192.168.1.1.54993 > 192.168.1.255.9090: UDP, length 126\n', b'E...Q.@.@.dg..........#....;CAM::192.168.1.1::{""time"": ""5.8"", ""position"": ""(30.327999999999978, -4.8, 0)"", ""speed"": ""12.219999999999992"", ""leader"": ""obs""}\n', b'14:59:30.424523 IP 192.168.1.2.53057 > 192.168.1.255.9090: UDP, length 113\n', b'E...4.@.@..F.........A#..yT.CAM::192.168.1.2::{""time"": ""5.8"", ""position"": ""(9.078, -4.8, 0)"", ""speed"": ""4.419999999999998"", ""leader"": ""car1""}\n', b'14:59:30.520209 IP 192.168.1.1.54993 > 192.168.1.255.9090: UDP, length 126\n', b'E...Q.@.@.dU..........#....9CAM::192.168.1.1::{""time"": ""5.9"", ""position"": ""(31.575999999999983, -4.8, 0)"", ""speed"": ""12.479999999999992"", ""leader"": ""obs""}\n', b'14:59:30.526357 IP 192.168.1.2.53057 > 192.168.1.255.9090: UDP, length 113\n', b'E...4.@.@..>.........A#..yN.CAM::192.168.1.2::{""time"": ""5.9"", ""position"": ""(9.546, -4.8, 0)"", ""speed"": ""4.679999999999998"", ""leader"": ""car1""}\n', b'14:59:30.619918 IP 192.168.1.1.54993 > 192.168.1.255.9090: UDP, length 125\n', b'E...Q.@.@.dQ..........#.....CAM::192.168.1.1::{""time"": ""6.0"", ""position"": ""(32.84999999999998, -4.8, 0)"", ""speed"": ""12.739999999999991"", ""leader"": ""obs""}\n', b'14:59:30.624610 IP 192.168.1.2.53057 > 192.168.1.255.9090: UDP, length 113\n', b'E...4.@.@..-.........A#..yd.CAM::192.168.1.2::{""time"": ""6.0"", ""position"": ""(10.04, -4.8, 0)"", ""speed"": ""4.939999999999998"", ""leader"": ""car1""}\n', b'14:59:30.723019 IP 192.168.1.1.54993 > 192.168.1.255.9090: UDP, length 125\n', b'E...Q.@.@.d>..........#.....CAM::192.168.1.1::{""time"": ""6.1"", ""position"": ""(34.14999999999998, -4.8, 0)"", ""speed"": ""12.999999999999991"", ""leader"": ""obs""}\n', b'14:59:30.727894 IP 192.168.1.2.53057 > 192.168.1.255.9090: UDP, length 127\n', b'E...4.@.@............A#.....CAM::192.168.1.2::{""time"": ""6.1"", ""position"": ""(10.559999999999999, -4.8, 0)"", ""speed"": ""5.1999999999999975"", ""leader"": ""car1""}\n', b'14:59:30.822930 IP 192.168.1.1.54993 > 192.168.1.255.9090: UDP, length 125\n', b'E...Q.@.@.d7..........#...4.CAM::192.168.1.1::{""time"": ""6.2"", ""position"": ""(35.45330687012161, -4.8, 0)"", ""speed"": ""13.033068701216276"", ""leader"": ""obs""}\n', b'14:59:30.827813 IP 192.168.1.2.53057 > 192.168.1.255.9090: UDP, length 126\n', b'E...4.@.@............A#.....CAM::192.168.1.2::{""time"": ""6.2"", ""position"": ""(11.105999999999998, -4.8, 0)"", ""speed"": ""5.459999999999997"", ""leader"": ""car1""}\n', b'14:59:30.921915 IP 192.168.1.1.54993 > 192.168.1.255.9090: UDP, length 125\n', b'E...Q.@.@.d*..........#...0.CAM::192.168.1.1::{""time"": ""6.3"", ""position"": ""(36.75661374024324, -4.8, 0)"", ""speed"": ""13.033068701216276"", ""leader"": ""obs""}\n', b'14:59:30.926934 IP 192.168.1.2.53057 > 192.168.1.255.9090: UDP, length 126\n', b'E...5\t@.@............A#.....CAM::192.168.1.2::{""time"": ""6.3"", ""position"": ""(11.677999999999997, -4.8, 0)"", ""speed"": ""5.719999999999997"", ""leader"": ""car1""}\n', b'14:59:31.022331 IP 192.168.1.1.54993 > 192.168.1.255.9090: UDP, length 125\n', b'E...Q.@.@.d...........#...-.CAM::192.168.1.1::{""time"": ""6.4"", ""position"": ""(38.05992061036487, -4.8, 0)"", ""speed"": ""13.033068701216276"", ""leader"": ""obs""}\n', b'14:59:31.028377 IP 192.168.1.2.53057 > 192.168.1.255.9090: UDP, length 126\n', b'E...5.@.@............A#...\t.CAM::192.168.1.2::{""time"": ""6.4"", ""position"": ""(12.275999999999996, -4.8, 0)"", ""speed"": ""5.979999999999997"", ""leader"": ""car1""}\n']";-69.0@car1-wlan1
65;6.5s;car2;car1;18.963227480486506;7.799999999999995;"[b'14:59:30.121406 IP 192.168.1.2.53057 > 192.168.1.255.9090: UDP, length 125\n', b'E...4.@.@..n.........A#.....CAM::192.168.1.2::{""time"": ""5.5"", ""position"": ""(7.829999999999999, -4.8, 0)"", ""speed"": ""3.639999999999999"", ""leader"": ""car1""}\n', b'14:59:30.122383 IP 192.168.1.1.54993 > 192.168.1.255.9090: UDP, length 126\n', b'E...Q{@.@.d...........#....-CAM::192.168.1.1::{""time"": ""5.5"", ""position"": ""(26.739999999999988, -4.8, 0)"", ""speed"": ""11.439999999999992"", ""leader"": ""obs""}\n', b'14:59:30.221859 IP 192.168.1.2.53057 > 192.168.1.255.9090: UDP, length 126\n', b'E...4.@.@..d.........A#...@.CAM::192.168.1.2::{""time"": ""5.6"", ""position"": ""(8.219999999999999, -4.8, 0)"", ""speed"": ""3.8999999999999986"", ""leader"": ""car1""}\n', b'14:59:30.222979 IP 192.168.1.1.54993 > 192.168.1.255.9090: UDP, length 126\n', b'E...Q.@.@.dy..........#....&CAM::192.168.1.1::{""time"": ""5.6"", ""position"": ""(27.909999999999986, -4.8, 0)"", ""speed"": ""11.699999999999992"", ""leader"": ""obs""}\n', b'14:59:30.322106 IP 192.168.1.2.53057 > 192.168.1.255.9090: UDP, length 113\n', b'E...4.@.@..Y.........A#..yU.CAM::192.168.1.2::{""time"": ""5.7"", ""position"": ""(8.636, -4.8, 0)"", ""speed"": ""4.159999999999998"", ""leader"": ""car1""}\n', b'14:59:30.323245 IP 192.168.1.1.54993 > 192.168.1.255.9090: UDP, length 125\n', b'E...Q.@.@.dp..........#.....CAM::192.168.1.1::{""time"": ""5.7"", ""position"": ""(29.10599999999998, -4.8, 0)"", ""speed"": ""11.959999999999992"", ""leader"": ""obs""}\n', b'14:59:30.421316 IP 192.168.1.2.53057 > 192.168.1.255.9090: UDP, length 113\n', b'E...4.@.@..F.........A#..yT.CAM::192.168.1.2::{""time"": ""5.8"", ""position"": ""(9.078, -4.8, 0)"", ""speed"": ""4.419999999999998"", ""leader"": ""car1""}\n', b'14:59:30.422666 IP 192.168.1.1.54993 > 192.168.1.255.9090: UDP, length 126\n', b'E...Q.@.@.dg..........#....;CAM::192.168.1.1::{""time"": ""5.8"", ""position"": ""(30.327999999999978, -4.8, 0)"", ""speed"": ""12.219999999999992"", ""leader"": ""obs""}\n', b'14:59:30.521707 IP 192.168.1.2.53057 > 192.168.1.255.9090: UDP, length 113\n', b'E...4.@.@..>.........A#..yN.CAM::192.168.1.2::{""time"": ""5.9"", ""position"": ""(9.546, -4.8, 0)"", ""speed"": ""4.679999999999998"", ""leader"": ""car1""}\n', b'14:59:30.523567 IP 192.168.1.1.54993 > 192.168.1.255.9090: UDP, length 126\n', b'E...Q.@.@.dU..........#....9CAM::192.168.1.1::{""time"": ""5.9"", ""position"": ""(31.575999999999983, -4.8, 0)"", ""speed"": ""12.479999999999992"", ""leader"": ""obs""}\n', b'14:59:30.621207 IP 192.168.1.2.53057 > 192.168.1.255.9090: UDP, length 113\n', b'E...4.@.@..-.........A#..yd.CAM::192.168.1.2::{""time"": ""6.0"", ""position"": ""(10.04, -4.8, 0)"", ""speed"": ""4.939999999999998"", ""leader"": ""car1""}\n', b'14:59:30.622426 IP 192.168.1.1.54993 > 192.168.1.255.9090: UDP, length 125\n', b'E...Q.@.@.dQ..........#.....CAM::192.168.1.1::{""time"": ""6.0"", ""position"": ""(32.84999999999998, -4.8, 0)"", ""speed"": ""12.739999999999991"", ""leader"": ""obs""}\n', b'14:59:30.724792 IP 192.168.1.2.53057 > 192.168.1.255.9090: UDP, length 127\n', b'E...4.@.@............A#.....CAM::192.168.1.2::{""time"": ""6.1"", ""position"": ""(10.559999999999999, -4.8, 0)"", ""speed"": ""5.1999999999999975"", ""leader"": ""car1""}\n', b'14:59:30.725793 IP 192.168.1.1.54993 > 192.168.1.255.9090: UDP, length 125\n', b'E...Q.@.@.d>..........#.....CAM::192.168.1.1::{""time"": ""6.1"", ""position"": ""(34.14999999999998, -4.8, 0)"", ""speed"": ""12.999999999999991"", ""leader"": ""obs""}\n', b'14:59:30.824482 IP 192.168.1.2.53057 > 192.168.1.255.9090: UDP, length 126\n', b'E...4.@.@............A#.....CAM::192.168.1.2::{""time"": ""6.2"", ""position"": ""(11.105999999999998, -4.8, 0)"", ""speed"": ""5.459999999999997"", ""leader"": ""car1""}\n', b'14:59:30.825710 IP 192.168.1.1.54993 > 192.168.1.255.9090: UDP, length 125\n', b'E...Q.@.@.d7..........#...4.CAM::192.168.1.1::{""time"": ""6.2"", ""position"": ""(35.45330687012161, -4.8, 0)"", ""speed"": ""13.033068701216276"", ""leader"": ""obs""}\n', b'14:59:30.923342 IP 192.168.1.2.53057 > 192.168.1.255.9090: UDP, length 126\n', b'E...5\t@.@............A#.....CAM::192.168.1.2::{""time"": ""6.3"", ""position"": ""(11.677999999999997, -4.8, 0)"", ""speed"": ""5.719999999999997"", ""leader"": ""car1""}\n', b'14:59:30.924608 IP 192.168.1.1.54993 > 192.168.1.255.9090: UDP, length 125\n', b'E...Q.@.@.d*..........#...0.CAM::192.168.1.1::{""time"": ""6.3"", ""position"": ""(36.75661374024324, -4.8, 0)"", ""speed"": ""13.033068701216276"", ""leader"": ""obs""}\n', b'14:59:31.024094 IP 192.168.1.2.53057 > 192.168.1.255.9090: UDP, length 126\n', b'E...5.@.@............A#...\t.CAM::192.168.1.2::{""time"": ""6.4"", ""position"": ""(12.275999999999996, -4.8, 0)"", ""speed"": ""5.979999999999997"", ""leader"": ""car1""}\n', b'14:59:31.025887 IP 192.168.1.1.54993 > 192.168.1.255.9090: UDP, length 125\n', b'E...Q.@.@.d...........#...-.CAM::192.168.1.1::{""time"": ""6.4"", ""position"": ""(38.05992061036487, -4.8, 0)"", ""speed"": ""13.033068701216276"", ""leader"": ""obs""}\n']";-75.0@car2-wlan1
66;6.6s;car1;obs;53.03346564939187;39.66653435060813;[];-69.0@car1-wlan1
66;6.6s;car2;car1;19.616534350608134;8.449999999999996;[];-75.0@car2-wlan1
67;6.7s;car1;obs;51.73015877927024;40.96984122072976;[];-68.0@car1-wlan1
67;6.7s;car2;car1;20.243841220729767;9.125999999999996;[];-75.0@car2-wlan1
68;6.8s;car1;obs;50.42685190914861;42.27314809085139;[];-68.0@car1-wlan1
68;6.8s;car2;car1;20.845148090851396;9.827999999999996;[];-75.0@car2-wlan1
69;6.9s;car1;obs;49.12354503902698;43.576454960973024;[];-68.0@car1-wlan1
69;6.9s;car2;car1;21.42045496097303;10.555999999999996;[];-74.0@car2-wlan1
70;7.0s;car1;car3;12.744135889698688;44.879761831094655;[];-67.0@car1-wlan1
70;7.0s;car2;No leader;No leader;11.309999999999997;[];-74.0@car2-wlan1
71;7.1s;car1;car3;12.94465382964317;46.183068701216285;[];-67.0@car1-wlan1
71;7.1s;car2;car1;22.493068701216288;12.089999999999998;[];-74.0@car2-wlan1
72;7.2s;car1;car3;13.145171769587654;47.486375571337916;[];-66.0@car1-wlan1
72;7.2s;car2;car1;22.990375571337918;12.895999999999999;[];-74.0@car2-wlan1
73;7.3s;car1;car3;13.345689709532136;48.78968244145955;[];-66.0@car1-wlan1
73;7.3s;car2;car1;23.461682441459548;13.728;[];-74.0@car2-wlan1
74;7.4s;car1;car3;13.54620764947662;50.09298931158118;[];-65.0@car1-wlan1
74;7.4s;car2;No leader;No leader;14.586;[];-73.0@car2-wlan1
75;7.5s;car1;car3;13.746725589421104;51.39629618170281;"[b'14:59:31.122350 IP 192.168.1.1.54993 > 192.168.1.255.9090: UDP, length 124\n', b'E...Q.@.@.d...........#...}.CAM::192.168.1.1::{""time"": ""6.5"", ""position"": ""(39.3632274804865, -4.8, 0)"", ""speed"": ""13.033068701216276"", ""leader"": ""obs""}\n', b'14:59:31.127979 IP 192.168.1.2.53057 > 192.168.1.255.9090: UDP, length 126\n', b'E...5+@.@............A#...\n', b'.CAM::192.168.1.2::{""time"": ""6.5"", ""position"": ""(12.899999999999995, -4.8, 0)"", ""speed"": ""6.239999999999997"", ""leader"": ""car1""}\n', b'14:59:31.222134 IP 192.168.1.1.54993 > 192.168.1.255.9090: UDP, length 125\n', b'E...Q.@.@.d...........#..."".CAM::192.168.1.1::{""time"": ""6.6"", ""position"": ""(40.66653435060813, -4.8, 0)"", ""speed"": ""13.033068701216276"", ""leader"": ""obs""}\n', b'14:59:31.227561 IP 192.168.1.2.53057 > 192.168.1.255.9090: UDP, length 127\n', b'E...5?@.@............A#.....CAM::192.168.1.2::{""time"": ""6.6"", ""position"": ""(13.549999999999995, -4.8, 0)"", ""speed"": ""6.4999999999999964"", ""leader"": ""car1""}\n', b'14:59:31.322470 IP 192.168.1.1.54993 > 192.168.1.255.9090: UDP, length 125\n', b'E...Q.@.@.d...........#.....CAM::192.168.1.1::{""time"": ""6.7"", ""position"": ""(41.96984122072976, -4.8, 0)"", ""speed"": ""13.033068701216276"", ""leader"": ""obs""}\n', b'14:59:31.327373 IP 192.168.1.2.53057 > 192.168.1.255.9090: UDP, length 126\n', b'E...5I@.@............A#.....CAM::192.168.1.2::{""time"": ""6.7"", ""position"": ""(14.225999999999994, -4.8, 0)"", ""speed"": ""6.759999999999996"", ""leader"": ""car1""}\n', b'14:59:31.422783 IP 192.168.1.1.54993 > 192.168.1.255.9090: UDP, length 125\n', b'E...R.@.@.d...........#.....CAM::192.168.1.1::{""time"": ""6.8"", ""position"": ""(43.27314809085139, -4.8, 0)"", ""speed"": ""13.033068701216276"", ""leader"": ""obs""}\n', b'14:59:31.427572 IP 192.168.1.2.53057 > 192.168.1.255.9090: UDP, length 126\n', b'E...5V@.@............A#.....CAM::192.168.1.2::{""time"": ""6.8"", ""position"": ""(14.927999999999997, -4.8, 0)"", ""speed"": ""7.019999999999996"", ""leader"": ""car1""}\n', b'14:59:31.522131 IP 192.168.1.1.54993 > 192.168.1.255.9090: UDP, length 126\n', b'E...R.@.@.c...........#...FoCAM::192.168.1.1::{""time"": ""6.9"", ""position"": ""(44.576454960973024, -4.8, 0)"", ""speed"": ""13.033068701216276"", ""leader"": ""obs""}\n', b'14:59:31.522425 IP 192.168.1.1.54993 > 192.168.1.255.9090: UDP, length 49\n', b'E..MR.@.@.d9..........#..9|LDENM::192.168.1.1::{""command"":2,""parameters"":[1]}\n', b'14:59:31.529034 IP 192.168.1.2.53057 > 192.168.1.255.9090: UDP, length 126\n', b'E...5[@.@............A#.....CAM::192.168.1.2::{""time"": ""6.9"", ""position"": ""(15.655999999999995, -4.8, 0)"", ""speed"": ""7.279999999999996"", ""leader"": ""car1""}\n', b'14:59:31.622831 IP 192.168.1.1.54993 > 192.168.1.255.9090: UDP, length 127\n', b'E...R.@.@.c...........#.....CAM::192.168.1.1::{""time"": ""7.0"", ""position"": ""(45.879761831094655, -1.6, 0)"", ""speed"": ""13.033068701216276"", ""leader"": ""car3""}\n', b'14:59:31.627694 IP 192.168.1.2.53057 > 192.168.1.255.9090: UDP, length 126\n', b'E...5o@.@............A#...0.CAM::192.168.1.2::{""time"": ""7.0"", ""position"": ""(16.409999999999997, -4.8, 0)"", ""speed"": ""7.539999999999996"", ""leader"": ""None""}\n', b'14:59:31.722274 IP 192.168.1.1.54993 > 192.168.1.255.9090: UDP, length 127\n', b'E...R&@.@.c...........#.....CAM::192.168.1.1::{""time"": ""7.1"", ""position"": ""(47.183068701216285, -1.6, 0)"", ""speed"": ""13.033068701216276"", ""leader"": ""car3""}\n', b'14:59:31.726763 IP 192.168.1.2.53057 > 192.168.1.255.9090: UDP, length 126\n', b'E...5}@.@............A#.....CAM::192.168.1.2::{""time"": ""7.1"", ""position"": ""(17.189999999999998, -1.6, 0)"", ""speed"": ""7.799999999999995"", ""leader"": ""car1""}\n', b'14:59:31.822991 IP 192.168.1.1.54993 > 192.168.1.255.9090: UDP, length 127\n', b'E...R(@.@.c...........#.....CAM::192.168.1.1::{""time"": ""7.2"", ""position"": ""(48.486375571337916, -1.6, 0)"", ""speed"": ""13.033068701216276"", ""leader"": ""car3""}\n', b'14:59:31.827746 IP 192.168.1.2.53057 > 192.168.1.255.9090: UDP, length 114\n', b'E...5.@.@............A#..zbDCAM::192.168.1.2::{""time"": ""7.2"", ""position"": ""(17.996, -1.6, 0)"", ""speed"": ""8.059999999999995"", ""leader"": ""car1""}\n', b'14:59:31.923144 IP 192.168.1.1.54993 > 192.168.1.255.9090: UDP, length 126\n', b'E...R*@.@.c...........#..../CAM::192.168.1.1::{""time"": ""7.3"", ""position"": ""(49.78968244145955, -1.6, 0)"", ""speed"": ""13.033068701216276"", ""leader"": ""car3""}\n', b'14:59:31.928063 IP 192.168.1.2.53057 > 192.168.1.255.9090: UDP, length 114\n', b'E...5.@.@..w.........A#..zl?CAM::192.168.1.2::{""time"": ""7.3"", ""position"": ""(18.828, -1.6, 0)"", ""speed"": ""8.319999999999995"", ""leader"": ""car1""}\n', b'14:59:32.023396 IP 192.168.1.1.54993 > 192.168.1.255.9090: UDP, length 126\n', b'E...R>@.@.c...........#....?CAM::192.168.1.1::{""time"": ""7.4"", ""position"": ""(50.99298931158118, -1.6, 0)"", ""speed"": ""13.033068701216276"", ""leader"": ""car3""}\n', b'14:59:32.030169 IP 192.168.1.2.53057 > 192.168.1.255.9090: UDP, length 114\n', b'E...5.@.@..f.........A#..zw.CAM::192.168.1.2::{""time"": ""7.4"", ""position"": ""(19.686, -1.6, 0)"", ""speed"": ""8.579999999999995"", ""leader"": ""None""}\n']";-65.0@car1-wlan1
