CAR,STEP,TIME,LEADER_AND_DISTANCE,DRIVING_DISTANCE,WIFI_SIGNAL_STRENGTH,MESH_SIGNAL_STRENGTH,DATAGRAM_COUNT,BYTES_COUNT,WIFI_DATAGRAM,MESH_DATAGRAM
car1,1,0.1,"(None, None)",None,-60,,1,411,[],"[""b'15:21:18.361685 IP 192.168.0.1.42406 > 192.168.0.255.9090: UDP, length 411\\nE....v@.@..o..........#.....{'header': {'from_car_id': 'car1', 'proto_type': 'CAM', 'proto_version': 0, 'message_id': 1, 'generated_time': 0.1}, 'body': {'station_id': 0.9364810751833019, 'leader': null, 'speed': 0.0, 'station_characteristics': {'mobile_its_station': false, 'private_its_station': false, 'physical_relevant_its_station': false}, 'reference_position': {'lane': 0, 'position': [5.1, -4.8, 0], 'elevation': 0, 'heading': 0}}}\\n'""]"
car1,2,0.2,"(None, None)",0.0259999999999998,-60,,1,427,[],"[""b'15:21:18.452585 IP 192.168.0.1.42406 > 192.168.0.255.9090: UDP, length 427\\nE....}@.@..X..........#.....{'header': {'from_car_id': 'car1', 'proto_type': 'CAM', 'proto_version': 0, 'message_id': 3, 'generated_time': 0.2}, 'body': {'station_id': 0.4639107030442765, 'leader': null, 'speed': 0.26, 'station_characteristics': {'mobile_its_station': false, 'private_its_station': false, 'physical_relevant_its_station': false}, 'reference_position': {'lane': 1, 'position': [5.1259999999999994, -1.6, 0], 'elevation': 0, 'heading': 0}}}\\n'""]"
car1,3,0.3,"(None, None)",0.0779999999999994,-60,,2,876,[],"[""b'15:21:18.541645 IP 192.168.0.1.42406 > 192.168.0.255.9090: UDP, length 426\\nE.....@.@..K..........#...j.{'header': {'from_car_id': 'car1', 'proto_type': 'CAM', 'proto_version': 0, 'message_id': 5, 'generated_time': 0.3}, 'body': {'station_id': 0.9661477295730331, 'leader': null, 'speed': 0.52, 'station_characteristics': {'mobile_its_station': false, 'private_its_station': false, 'physical_relevant_its_station': false}, 'reference_position': {'lane': 1, 'position': [5.177999999999999, -1.6, 0], 'elevation': 0, 'heading': 0}}}\\n'"", ""b'15:21:18.550093 IP 192.168.0.2.37868 > 192.168.0.255.9090: UDP, length 450\\nE....e@.@..W..........#.....{'header': {'from_car_id': 'car2', 'proto_type': 'CAM', 'proto_version': 0, 'message_id': 6, 'generated_time': 0.3}, 'body': {'station_id': 0.5576869240335375, 'leader': null, 'speed': -1073741824.0, 'station_characteristics': {'mobile_its_station': false, 'private_its_station': false, 'physical_relevant_its_station': false}, 'reference_position': {'lane': -1073741824, 'position': [-1073741824.0, -1073741824.0, 0], 'elevation': 0, 'heading': 0}}}\\n'""]"
car1,4,0.4,"(None, None)",0.1559999999999997,-60,,2,878,[],"[""b'15:21:18.641459 IP 192.168.0.1.42406 > 192.168.0.255.9090: UDP, length 427\\nE.....@.@..A..........#....k{'header': {'from_car_id': 'car1', 'proto_type': 'CAM', 'proto_version': 0, 'message_id': 7, 'generated_time': 0.4}, 'body': {'station_id': 0.10366075209503767, 'leader': null, 'speed': 0.78, 'station_characteristics': {'mobile_its_station': false, 'private_its_station': false, 'physical_relevant_its_station': false}, 'reference_position': {'lane': 1, 'position': [5.255999999999999, -1.6, 0], 'elevation': 0, 'heading': 0}}}\\n'"", ""b'15:21:18.649901 IP 192.168.0.2.37868 > 192.168.0.255.9090: UDP, length 451\\nE....l@.@..O..........#...G.{'header': {'from_car_id': 'car2', 'proto_type': 'CAM', 'proto_version': 0, 'message_id': 8, 'generated_time': 0.4}, 'body': {'station_id': 0.34100872964357365, 'leader': null, 'speed': -1073741824.0, 'station_characteristics': {'mobile_its_station': false, 'private_its_station': false, 'physical_relevant_its_station': false}, 'reference_position': {'lane': -1073741824, 'position': [-1073741824.0, -1073741824.0, 0], 'elevation': 0, 'heading': 0}}}\\n'""]"
car1,5,0.5,"(None, None)",0.2599999999999998,-60,,2,877,[],"[""b'15:21:18.741566 IP 192.168.0.1.42406 > 192.168.0.255.9090: UDP, length 426\\nE.....@.@..1..........#...p.{'header': {'from_car_id': 'car1', 'proto_type': 'CAM', 'proto_version': 0, 'message_id': 9, 'generated_time': 0.5}, 'body': {'station_id': 0.7508337527302851, 'leader': null, 'speed': 1.04, 'station_characteristics': {'mobile_its_station': false, 'private_its_station': false, 'physical_relevant_its_station': false}, 'reference_position': {'lane': 1, 'position': [5.359999999999999, -1.6, 0], 'elevation': 0, 'heading': 0}}}\\n'"", ""b'15:21:18.749992 IP 192.168.0.2.37868 > 192.168.0.255.9090: UDP, length 451\\nE.....@.@..7..........#...>.{'header': {'from_car_id': 'car2', 'proto_type': 'CAM', 'proto_version': 0, 'message_id': 10, 'generated_time': 0.5}, 'body': {'station_id': 0.9982876453216697, 'leader': null, 'speed': -1073741824.0, 'station_characteristics': {'mobile_its_station': false, 'private_its_station': false, 'physical_relevant_its_station': false}, 'reference_position': {'lane': -1073741824, 'position': [-1073741824.0, -1073741824.0, 0], 'elevation': 0, 'heading': 0}}}\\n'""]"
car1,6,0.6,"(None, None)",0.3899999999999997,-60,,2,878,[],"[""b'15:21:18.842095 IP 192.168.0.1.42406 > 192.168.0.255.9090: UDP, length 427\\nE.....@.@..,..........#....>{'header': {'from_car_id': 'car1', 'proto_type': 'CAM', 'proto_version': 0, 'message_id': 11, 'generated_time': 0.6}, 'body': {'station_id': 0.45134411491903403, 'leader': null, 'speed': 1.3, 'station_characteristics': {'mobile_its_station': false, 'private_its_station': false, 'physical_relevant_its_station': false}, 'reference_position': {'lane': 1, 'position': [5.489999999999999, -1.6, 0], 'elevation': 0, 'heading': 0}}}\\n'"", ""b'15:21:18.850588 IP 192.168.0.2.37868 > 192.168.0.255.9090: UDP, length 451\\nE.....@.@.............#...A${'header': {'from_car_id': 'car2', 'proto_type': 'CAM', 'proto_version': 0, 'message_id': 12, 'generated_time': 0.6}, 'body': {'station_id': 0.3142525914939529, 'leader': null, 'speed': -1073741824.0, 'station_characteristics': {'mobile_its_station': false, 'private_its_station': false, 'physical_relevant_its_station': false}, 'reference_position': {'lane': -1073741824, 'position': [-1073741824.0, -1073741824.0, 0], 'elevation': 0, 'heading': 0}}}\\n'""]"
car1,7,0.7,"(None, None)",0.5459999999999994,-60,,2,880,[],"[""b'15:21:18.941867 IP 192.168.0.1.42406 > 192.168.0.255.9090: UDP, length 428\\nE.....@.@.............#.....{'header': {'from_car_id': 'car1', 'proto_type': 'CAM', 'proto_version': 0, 'message_id': 13, 'generated_time': 0.7}, 'body': {'station_id': 0.08422326870158425, 'leader': null, 'speed': 1.56, 'station_characteristics': {'mobile_its_station': false, 'private_its_station': false, 'physical_relevant_its_station': false}, 'reference_position': {'lane': 1, 'position': [5.645999999999999, -1.6, 0], 'elevation': 0, 'heading': 0}}}\\n'"", ""b'15:21:18.950734 IP 192.168.0.2.37868 > 192.168.0.255.9090: UDP, length 452\\nE.....@.@.............#...m.{'header': {'from_car_id': 'car2', 'proto_type': 'CAM', 'proto_version': 0, 'message_id': 14, 'generated_time': 0.7}, 'body': {'station_id': 0.25856558670813434, 'leader': null, 'speed': -1073741824.0, 'station_characteristics': {'mobile_its_station': false, 'private_its_station': false, 'physical_relevant_its_station': false}, 'reference_position': {'lane': -1073741824, 'position': [-1073741824.0, -1073741824.0, 0], 'elevation': 0, 'heading': 0}}}\\n'""]"
car1,8,0.8,"(None, None)",0.7279999999999998,-60,,2,880,[],"[""b'15:21:19.042903 IP 192.168.0.1.42406 > 192.168.0.255.9090: UDP, length 428\\nE.....@.@.............#...,.{'header': {'from_car_id': 'car1', 'proto_type': 'CAM', 'proto_version': 0, 'message_id': 15, 'generated_time': 0.8}, 'body': {'station_id': 0.06832792449810587, 'leader': null, 'speed': 1.82, 'station_characteristics': {'mobile_its_station': false, 'private_its_station': false, 'physical_relevant_its_station': false}, 'reference_position': {'lane': 1, 'position': [5.827999999999999, -1.6, 0], 'elevation': 0, 'heading': 0}}}\\n'"", ""b'15:21:19.052436 IP 192.168.0.2.37868 > 192.168.0.255.9090: UDP, length 452\\nE.....@.@.............#...v.{'header': {'from_car_id': 'car2', 'proto_type': 'CAM', 'proto_version': 0, 'message_id': 16, 'generated_time': 0.8}, 'body': {'station_id': 0.11989784405547921, 'leader': null, 'speed': -1073741824.0, 'station_characteristics': {'mobile_its_station': false, 'private_its_station': false, 'physical_relevant_its_station': false}, 'reference_position': {'lane': -1073741824, 'position': [-1073741824.0, -1073741824.0, 0], 'elevation': 0, 'heading': 0}}}\\n'""]"
car1,9,0.9,"(None, None)",0.9359999999999999,-60,,2,866,[],"[""b'15:21:19.142689 IP 192.168.0.1.42406 > 192.168.0.255.9090: UDP, length 415\\nE.....@.@.............#...8.{'header': {'from_car_id': 'car1', 'proto_type': 'CAM', 'proto_version': 0, 'message_id': 17, 'generated_time': 0.9}, 'body': {'station_id': 0.2929421243861371, 'leader': null, 'speed': 2.08, 'station_characteristics': {'mobile_its_station': false, 'private_its_station': false, 'physical_relevant_its_station': false}, 'reference_position': {'lane': 1, 'position': [6.036, -1.6, 0], 'elevation': 0, 'heading': 0}}}\\n'"", ""b'15:21:19.151034 IP 192.168.0.2.37868 > 192.168.0.255.9090: UDP, length 451\\nE.....@.@.............#...@.{'header': {'from_car_id': 'car2', 'proto_type': 'CAM', 'proto_version': 0, 'message_id': 18, 'generated_time': 0.9}, 'body': {'station_id': 0.9182262750276793, 'leader': null, 'speed': -1073741824.0, 'station_characteristics': {'mobile_its_station': false, 'private_its_station': false, 'physical_relevant_its_station': false}, 'reference_position': {'lane': -1073741824, 'position': [-1073741824.0, -1073741824.0, 0], 'elevation': 0, 'heading': 0}}}\\n'""]"
car1,10,1.0,"(None, None)",1.17,-60,,2,865,[],"[""b'15:21:19.242178 IP 192.168.0.1.42406 > 192.168.0.255.9090: UDP, length 414\\nE.....@.@.............#....2{'header': {'from_car_id': 'car1', 'proto_type': 'CAM', 'proto_version': 0, 'message_id': 19, 'generated_time': 1.0}, 'body': {'station_id': 0.9780794833915599, 'leader': null, 'speed': 2.34, 'station_characteristics': {'mobile_its_station': false, 'private_its_station': false, 'physical_relevant_its_station': false}, 'reference_position': {'lane': 1, 'position': [6.27, -1.6, 0], 'elevation': 0, 'heading': 0}}}\\n'"", ""b'15:21:19.250514 IP 192.168.0.2.37868 > 192.168.0.255.9090: UDP, length 451\\nE.....@.@.............#...;#{'header': {'from_car_id': 'car2', 'proto_type': 'CAM', 'proto_version': 0, 'message_id': 20, 'generated_time': 1.0}, 'body': {'station_id': 0.3864978420385955, 'leader': null, 'speed': -1073741824.0, 'station_characteristics': {'mobile_its_station': false, 'private_its_station': false, 'physical_relevant_its_station': false}, 'reference_position': {'lane': -1073741824, 'position': [-1073741824.0, -1073741824.0, 0], 'elevation': 0, 'heading': 0}}}\\n'""]"
car1,11,1.1,"(None, None)",1.4299999999999997,-60,,2,893,[],"[""b'15:21:19.342774 IP 192.168.0.1.42406 > 192.168.0.255.9090: UDP, length 441\\nE.....@.@.............#...K.{'header': {'from_car_id': 'car1', 'proto_type': 'CAM', 'proto_version': 0, 'message_id': 21, 'generated_time': 1.1}, 'body': {'station_id': 0.5227240364088559, 'leader': null, 'speed': 2.5999999999999996, 'station_characteristics': {'mobile_its_station': false, 'private_its_station': false, 'physical_relevant_its_station': false}, 'reference_position': {'lane': 1, 'position': [6.529999999999999, -1.6, 0], 'elevation': 0, 'heading': 0}}}\\n'"", ""b'15:21:19.351350 IP 192.168.0.2.37868 > 192.168.0.255.9090: UDP, length 452\\nE.....@.@.............#.....{'header': {'from_car_id': 'car2', 'proto_type': 'CAM', 'proto_version': 0, 'message_id': 22, 'generated_time': 1.1}, 'body': {'station_id': 0.10235233358209261, 'leader': null, 'speed': -1073741824.0, 'station_characteristics': {'mobile_its_station': false, 'private_its_station': false, 'physical_relevant_its_station': false}, 'reference_position': {'lane': -1073741824, 'position': [-1073741824.0, -1073741824.0, 0], 'elevation': 0, 'heading': 0}}}\\n'""]"
car1,12,1.2,"(None, None)",1.7159999999999993,-60,,2,893,[],"[""b'15:21:19.442346 IP 192.168.0.1.42406 > 192.168.0.255.9090: UDP, length 441\\nE.....@.@.............#...K.{'header': {'from_car_id': 'car1', 'proto_type': 'CAM', 'proto_version': 0, 'message_id': 23, 'generated_time': 1.2}, 'body': {'station_id': 0.9918453342503428, 'leader': null, 'speed': 2.8599999999999994, 'station_characteristics': {'mobile_its_station': false, 'private_its_station': false, 'physical_relevant_its_station': false}, 'reference_position': {'lane': 1, 'position': [6.815999999999998, -1.6, 0], 'elevation': 0, 'heading': 0}}}\\n'"", ""b'15:21:19.451411 IP 192.168.0.2.37868 > 192.168.0.255.9090: UDP, length 452\\nE.....@.@.............#...y.{'header': {'from_car_id': 'car2', 'proto_type': 'CAM', 'proto_version': 0, 'message_id': 24, 'generated_time': 1.2}, 'body': {'station_id': 0.47020665573111864, 'leader': null, 'speed': -1073741824.0, 'station_characteristics': {'mobile_its_station': false, 'private_its_station': false, 'physical_relevant_its_station': false}, 'reference_position': {'lane': -1073741824, 'position': [-1073741824.0, -1073741824.0, 0], 'elevation': 0, 'heading': 0}}}\\n'""]"
car1,13,1.3,"(None, None)",2.0279999999999996,-60,,2,893,[],"[""b'15:21:19.542372 IP 192.168.0.1.42406 > 192.168.0.255.9090: UDP, length 441\\nE.....@.@.............#.....{'header': {'from_car_id': 'car1', 'proto_type': 'CAM', 'proto_version': 0, 'message_id': 25, 'generated_time': 1.3}, 'body': {'station_id': 0.16457318685026534, 'leader': null, 'speed': 3.119999999999999, 'station_characteristics': {'mobile_its_station': false, 'private_its_station': false, 'physical_relevant_its_station': false}, 'reference_position': {'lane': 1, 'position': [7.127999999999999, -1.6, 0], 'elevation': 0, 'heading': 0}}}\\n'"", ""b'15:21:19.550954 IP 192.168.0.2.37868 > 192.168.0.255.9090: UDP, length 452\\nE.....@.@.............#...r.{'header': {'from_car_id': 'car2', 'proto_type': 'CAM', 'proto_version': 0, 'message_id': 26, 'generated_time': 1.3}, 'body': {'station_id': 0.13798904088273334, 'leader': null, 'speed': -1073741824.0, 'station_characteristics': {'mobile_its_station': false, 'private_its_station': false, 'physical_relevant_its_station': false}, 'reference_position': {'lane': -1073741824, 'position': [-1073741824.0, -1073741824.0, 0], 'elevation': 0, 'heading': 0}}}\\n'""]"
car1,14,1.4,"(None, None)",2.3659999999999997,-60,,2,892,[],"[""b'15:21:19.642178 IP 192.168.0.1.42406 > 192.168.0.255.9090: UDP, length 441\\nE.....@.@.............#....|{'header': {'from_car_id': 'car1', 'proto_type': 'CAM', 'proto_version': 0, 'message_id': 27, 'generated_time': 1.4}, 'body': {'station_id': 0.03795396734210321, 'leader': null, 'speed': 3.379999999999999, 'station_characteristics': {'mobile_its_station': false, 'private_its_station': false, 'physical_relevant_its_station': false}, 'reference_position': {'lane': 1, 'position': [7.465999999999999, -1.6, 0], 'elevation': 0, 'heading': 0}}}\\n'"", ""b'15:21:19.650699 IP 192.168.0.2.37868 > 192.168.0.255.9090: UDP, length 451\\nE.....@.@.............#...<!{'header': {'from_car_id': 'car2', 'proto_type': 'CAM', 'proto_version': 0, 'message_id': 28, 'generated_time': 1.4}, 'body': {'station_id': 0.6402741357791388, 'leader': null, 'speed': -1073741824.0, 'station_characteristics': {'mobile_its_station': false, 'private_its_station': false, 'physical_relevant_its_station': false}, 'reference_position': {'lane': -1073741824, 'position': [-1073741824.0, -1073741824.0, 0], 'elevation': 0, 'heading': 0}}}\\n'""]"
car1,15,1.5,"(None, None)",2.7299999999999995,-60,,2,891,[],"[""b'15:21:19.742025 IP 192.168.0.1.42406 > 192.168.0.255.9090: UDP, length 440\\nE.....@.@.............#...w.{'header': {'from_car_id': 'car1', 'proto_type': 'CAM', 'proto_version': 0, 'message_id': 29, 'generated_time': 1.5}, 'body': {'station_id': 0.8635696784984827, 'leader': null, 'speed': 3.639999999999999, 'station_characteristics': {'mobile_its_station': false, 'private_its_station': false, 'physical_relevant_its_station': false}, 'reference_position': {'lane': 1, 'position': [7.829999999999999, -1.6, 0], 'elevation': 0, 'heading': 0}}}\\n'"", ""b'15:21:19.750602 IP 192.168.0.2.37868 > 192.168.0.255.9090: UDP, length 451\\nE....)@.@.............#...<2{'header': {'from_car_id': 'car2', 'proto_type': 'CAM', 'proto_version': 0, 'message_id': 30, 'generated_time': 1.5}, 'body': {'station_id': 0.3910658608144234, 'leader': null, 'speed': -1073741824.0, 'station_characteristics': {'mobile_its_station': false, 'private_its_station': false, 'physical_relevant_its_station': false}, 'reference_position': {'lane': -1073741824, 'position': [-1073741824.0, -1073741824.0, 0], 'elevation': 0, 'heading': 0}}}\\n'""]"
car1,16,1.6,"(None, None)",3.119999999999999,-60,,2,893,[],"[""b'15:21:19.842106 IP 192.168.0.1.42406 > 192.168.0.255.9090: UDP, length 442\\nE.... @.@.............#....7{'header': {'from_car_id': 'car1', 'proto_type': 'CAM', 'proto_version': 0, 'message_id': 31, 'generated_time': 1.6}, 'body': {'station_id': 0.29622179015168415, 'leader': null, 'speed': 3.8999999999999986, 'station_characteristics': {'mobile_its_station': false, 'private_its_station': false, 'physical_relevant_its_station': false}, 'reference_position': {'lane': 1, 'position': [8.219999999999999, -1.6, 0], 'elevation': 0, 'heading': 0}}}\\n'"", ""b'15:21:19.850652 IP 192.168.0.2.37868 > 192.168.0.255.9090: UDP, length 451\\nE....@@.@..{..........#...D!{'header': {'from_car_id': 'car2', 'proto_type': 'CAM', 'proto_version': 0, 'message_id': 32, 'generated_time': 1.6}, 'body': {'station_id': 0.6775509300733744, 'leader': null, 'speed': -1073741824.0, 'station_characteristics': {'mobile_its_station': false, 'private_its_station': false, 'physical_relevant_its_station': false}, 'reference_position': {'lane': -1073741824, 'position': [-1073741824.0, -1073741824.0, 0], 'elevation': 0, 'heading': 0}}}\\n'""]"
car1,17,1.7,"(None, None)",3.5359999999999996,-60,,2,881,[],"[""b'15:21:19.942570 IP 192.168.0.1.42406 > 192.168.0.255.9090: UDP, length 430\\nE....$@.@.............#.....{'header': {'from_car_id': 'car1', 'proto_type': 'CAM', 'proto_version': 0, 'message_id': 33, 'generated_time': 1.7}, 'body': {'station_id': 0.022274881702579408, 'leader': null, 'speed': 4.159999999999998, 'station_characteristics': {'mobile_its_station': false, 'private_its_station': false, 'physical_relevant_its_station': false}, 'reference_position': {'lane': 1, 'position': [8.636, -1.6, 0], 'elevation': 0, 'heading': 0}}}\\n'"", ""b'15:21:19.951072 IP 192.168.0.2.37868 > 192.168.0.255.9090: UDP, length 451\\nE....M@.@..n..........#...>#{'header': {'from_car_id': 'car2', 'proto_type': 'CAM', 'proto_version': 0, 'message_id': 34, 'generated_time': 1.7}, 'body': {'station_id': 0.7640516250881819, 'leader': null, 'speed': -1073741824.0, 'station_characteristics': {'mobile_its_station': false, 'private_its_station': false, 'physical_relevant_its_station': false}, 'reference_position': {'lane': -1073741824, 'position': [-1073741824.0, -1073741824.0, 0], 'elevation': 0, 'heading': 0}}}\\n'""]"
car1,18,1.8,"(None, None)",3.9779999999999998,-60,,2,879,[],"[""b'15:21:20.043124 IP 192.168.0.1.42406 > 192.168.0.255.9090: UDP, length 428\\nE....\\'@.@.............#.....{'header': {'from_car_id': 'car1', 'proto_type': 'CAM', 'proto_version': 0, 'message_id': 35, 'generated_time': 1.8}, 'body': {'station_id': 0.5788717939821896, 'leader': null, 'speed': 4.419999999999998, 'station_characteristics': {'mobile_its_station': false, 'private_its_station': false, 'physical_relevant_its_station': false}, 'reference_position': {'lane': 1, 'position': [9.078, -1.6, 0], 'elevation': 0, 'heading': 0}}}\\n'"", ""b'15:21:20.052029 IP 192.168.0.2.37868 > 192.168.0.255.9090: UDP, length 451\\nE....b@.@..Y..........#...?*{'header': {'from_car_id': 'car2', 'proto_type': 'CAM', 'proto_version': 0, 'message_id': 36, 'generated_time': 1.8}, 'body': {'station_id': 0.4901031485800674, 'leader': null, 'speed': -1073741824.0, 'station_characteristics': {'mobile_its_station': false, 'private_its_station': false, 'physical_relevant_its_station': false}, 'reference_position': {'lane': -1073741824, 'position': [-1073741824.0, -1073741824.0, 0], 'elevation': 0, 'heading': 0}}}\\n'""]"
car1,19,1.9,"(None, None)",4.446,-60,,2,880,[],"[""b'15:21:20.144623 IP 192.168.0.1.42406 > 192.168.0.255.9090: UDP, length 429\\nE....6@.@.............#.....{'header': {'from_car_id': 'car1', 'proto_type': 'CAM', 'proto_version': 0, 'message_id': 37, 'generated_time': 1.9}, 'body': {'station_id': 0.48952469862801695, 'leader': null, 'speed': 4.679999999999998, 'station_characteristics': {'mobile_its_station': false, 'private_its_station': false, 'physical_relevant_its_station': false}, 'reference_position': {'lane': 1, 'position': [9.546, -1.6, 0], 'elevation': 0, 'heading': 0}}}\\n'"", ""b'15:21:20.153117 IP 192.168.0.2.37868 > 192.168.0.255.9090: UDP, length 451\\nE....q@.@..J..........#...8.{'header': {'from_car_id': 'car2', 'proto_type': 'CAM', 'proto_version': 0, 'message_id': 38, 'generated_time': 1.9}, 'body': {'station_id': 0.2872576531917569, 'leader': null, 'speed': -1073741824.0, 'station_characteristics': {'mobile_its_station': false, 'private_its_station': false, 'physical_relevant_its_station': false}, 'reference_position': {'lane': -1073741824, 'position': [-1073741824.0, -1073741824.0, 0], 'elevation': 0, 'heading': 0}}}\\n'""]"
car1,20,2.0,"(None, None)",4.9399999999999995,-60,,2,880,[],"[""b'15:21:20.245253 IP 192.168.0.1.42406 > 192.168.0.255.9090: UDP, length 428\\nE....D@.@.............#....\\t{'header': {'from_car_id': 'car1', 'proto_type': 'CAM', 'proto_version': 0, 'message_id': 39, 'generated_time': 2.0}, 'body': {'station_id': 0.8349456099959472, 'leader': null, 'speed': 4.939999999999998, 'station_characteristics': {'mobile_its_station': false, 'private_its_station': false, 'physical_relevant_its_station': false}, 'reference_position': {'lane': 1, 'position': [10.04, -1.6, 0], 'elevation': 0, 'heading': 0}}}\\n'"", ""b'15:21:20.255314 IP 192.168.0.2.37868 > 192.168.0.255.9090: UDP, length 452\\nE....v@.@..D..........#.....{'header': {'from_car_id': 'car2', 'proto_type': 'CAM', 'proto_version': 0, 'message_id': 40, 'generated_time': 2.0}, 'body': {'station_id': 0.26902491156198305, 'leader': null, 'speed': -1073741824.0, 'station_characteristics': {'mobile_its_station': false, 'private_its_station': false, 'physical_relevant_its_station': false}, 'reference_position': {'lane': -1073741824, 'position': [-1073741824.0, -1073741824.0, 0], 'elevation': 0, 'heading': 0}}}\\n'""]"
car1,21,2.1,"(None, None)",5.4399999999999995,-60,,2,864,[],"[""b'15:21:20.346227 IP 192.168.0.1.42406 > 192.168.0.255.9090: UDP, length 412\\nE....Y@.@.............#....\\t{'header': {'from_car_id': 'car1', 'proto_type': 'CAM', 'proto_version': 0, 'message_id': 41, 'generated_time': 2.1}, 'body': {'station_id': 0.55058313483717, 'leader': null, 'speed': 5.0, 'station_characteristics': {'mobile_its_station': false, 'private_its_station': false, 'physical_relevant_its_station': false}, 'reference_position': {'lane': 1, 'position': [10.54, -1.6, 0], 'elevation': 0, 'heading': 0}}}\\n'"", ""b'15:21:20.354554 IP 192.168.0.2.37868 > 192.168.0.255.9090: UDP, length 452\\nE.....@.@..:..........#...x.{'header': {'from_car_id': 'car2', 'proto_type': 'CAM', 'proto_version': 0, 'message_id': 42, 'generated_time': 2.1}, 'body': {'station_id': 0.24696701645540942, 'leader': null, 'speed': -1073741824.0, 'station_characteristics': {'mobile_its_station': false, 'private_its_station': false, 'physical_relevant_its_station': false}, 'reference_position': {'lane': -1073741824, 'position': [-1073741824.0, -1073741824.0, 0], 'elevation': 0, 'heading': 0}}}\\n'""]"
car1,22,2.2,"(None, None)",5.9399999999999995,-60,,2,867,[],"[""b'15:21:20.445683 IP 192.168.0.1.42406 > 192.168.0.255.9090: UDP, length 414\\nE....^@.@.............#.....{'header': {'from_car_id': 'car1', 'proto_type': 'CAM', 'proto_version': 0, 'message_id': 43, 'generated_time': 2.2}, 'body': {'station_id': 0.7642905654861863, 'leader': null, 'speed': 5.0, 'station_characteristics': {'mobile_its_station': false, 'private_its_station': false, 'physical_relevant_its_station': false}, 'reference_position': {'lane': 1, 'position': [11.04, -1.6, 0], 'elevation': 0, 'heading': 0}}}\\n'"", ""b'15:21:20.454111 IP 192.168.0.2.37868 > 192.168.0.255.9090: UDP, length 453\\nE.....@.@..1..........#.....{'header': {'from_car_id': 'car2', 'proto_type': 'CAM', 'proto_version': 0, 'message_id': 44, 'generated_time': 2.2}, 'body': {'station_id': 0.005228051908854892, 'leader': null, 'speed': -1073741824.0, 'station_characteristics': {'mobile_its_station': false, 'private_its_station': false, 'physical_relevant_its_station': false}, 'reference_position': {'lane': -1073741824, 'position': [-1073741824.0, -1073741824.0, 0], 'elevation': 0, 'heading': 0}}}\\n'""]"
car1,23,2.3,"(None, None)",6.4399999999999995,-60,,2,866,[],"[""b'15:21:20.546528 IP 192.168.0.1.42406 > 192.168.0.255.9090: UDP, length 414\\nE....p@.@..r..........#.....{'header': {'from_car_id': 'car1', 'proto_type': 'CAM', 'proto_version': 0, 'message_id': 45, 'generated_time': 2.3}, 'body': {'station_id': 0.9620191382486374, 'leader': null, 'speed': 5.0, 'station_characteristics': {'mobile_its_station': false, 'private_its_station': false, 'physical_relevant_its_station': false}, 'reference_position': {'lane': 1, 'position': [11.54, -1.6, 0], 'elevation': 0, 'heading': 0}}}\\n'"", ""b'15:21:20.554988 IP 192.168.0.2.37868 > 192.168.0.255.9090: UDP, length 452\\nE.....@.@../..........#...u.{'header': {'from_car_id': 'car2', 'proto_type': 'CAM', 'proto_version': 0, 'message_id': 46, 'generated_time': 2.3}, 'body': {'station_id': 0.42276426654772925, 'leader': null, 'speed': -1073741824.0, 'station_characteristics': {'mobile_its_station': false, 'private_its_station': false, 'physical_relevant_its_station': false}, 'reference_position': {'lane': -1073741824, 'position': [-1073741824.0, -1073741824.0, 0], 'elevation': 0, 'heading': 0}}}\\n'""]"
car1,24,2.4,"(None, None)",6.9399999999999995,-60,,2,865,[],"[""b'15:21:20.645145 IP 192.168.0.1.42406 > 192.168.0.255.9090: UDP, length 414\\nE....y@.@..i..........#.....{'header': {'from_car_id': 'car1', 'proto_type': 'CAM', 'proto_version': 0, 'message_id': 47, 'generated_time': 2.4}, 'body': {'station_id': 0.7321627800658363, 'leader': null, 'speed': 5.0, 'station_characteristics': {'mobile_its_station': false, 'private_its_station': false, 'physical_relevant_its_station': false}, 'reference_position': {'lane': 1, 'position': [12.04, -1.6, 0], 'elevation': 0, 'heading': 0}}}\\n'"", ""b'15:21:20.653522 IP 192.168.0.2.37868 > 192.168.0.255.9090: UDP, length 451\\nE.....@.@..'..........#...8%{'header': {'from_car_id': 'car2', 'proto_type': 'CAM', 'proto_version': 0, 'message_id': 48, 'generated_time': 2.4}, 'body': {'station_id': 0.3591553427285724, 'leader': null, 'speed': -1073741824.0, 'station_characteristics': {'mobile_its_station': false, 'private_its_station': false, 'physical_relevant_its_station': false}, 'reference_position': {'lane': -1073741824, 'position': [-1073741824.0, -1073741824.0, 0], 'elevation': 0, 'heading': 0}}}\\n'""]"
car1,25,2.5,"(None, None)",7.4399999999999995,-60,,2,865,[],"[""b'15:21:20.745496 IP 192.168.0.1.42406 > 192.168.0.255.9090: UDP, length 414\\nE.....@.@..]..........#.....{'header': {'from_car_id': 'car1', 'proto_type': 'CAM', 'proto_version': 0, 'message_id': 49, 'generated_time': 2.5}, 'body': {'station_id': 0.2926043193942587, 'leader': null, 'speed': 5.0, 'station_characteristics': {'mobile_its_station': false, 'private_its_station': false, 'physical_relevant_its_station': false}, 'reference_position': {'lane': 1, 'position': [12.54, -1.6, 0], 'elevation': 0, 'heading': 0}}}\\n'"", ""b'15:21:20.753868 IP 192.168.0.2.37868 > 192.168.0.255.9090: UDP, length 451\\nE.....@.@.............#...;'{'header': {'from_car_id': 'car2', 'proto_type': 'CAM', 'proto_version': 0, 'message_id': 50, 'generated_time': 2.5}, 'body': {'station_id': 0.8711965375186056, 'leader': null, 'speed': -1073741824.0, 'station_characteristics': {'mobile_its_station': false, 'private_its_station': false, 'physical_relevant_its_station': false}, 'reference_position': {'lane': -1073741824, 'position': [-1073741824.0, -1073741824.0, 0], 'elevation': 0, 'heading': 0}}}\\n'""]"
car1,26,2.6,"(None, None)",7.9399999999999995,-60,,2,865,[],"[""b'15:21:20.845661 IP 192.168.0.1.42406 > 192.168.0.255.9090: UDP, length 415\\nE.....@.@..S..........#...k.{'header': {'from_car_id': 'car1', 'proto_type': 'CAM', 'proto_version': 0, 'message_id': 51, 'generated_time': 2.6}, 'body': {'station_id': 0.28901876305439356, 'leader': null, 'speed': 5.0, 'station_characteristics': {'mobile_its_station': false, 'private_its_station': false, 'physical_relevant_its_station': false}, 'reference_position': {'lane': 1, 'position': [13.04, -1.6, 0], 'elevation': 0, 'heading': 0}}}\\n'"", ""b'15:21:20.853988 IP 192.168.0.2.37868 > 192.168.0.255.9090: UDP, length 450\\nE.....@.@.............#.....{'header': {'from_car_id': 'car2', 'proto_type': 'CAM', 'proto_version': 0, 'message_id': 52, 'generated_time': 2.6}, 'body': {'station_id': 0.710486119572279, 'leader': null, 'speed': -1073741824.0, 'station_characteristics': {'mobile_its_station': false, 'private_its_station': false, 'physical_relevant_its_station': false}, 'reference_position': {'lane': -1073741824, 'position': [-1073741824.0, -1073741824.0, 0], 'elevation': 0, 'heading': 0}}}\\n'""]"
car1,27,2.7,"(None, None)",8.44,-60,,2,866,[],"[""b'15:21:20.946095 IP 192.168.0.1.42406 > 192.168.0.255.9090: UDP, length 415\\nE.....@.@..<..........#...i.{'header': {'from_car_id': 'car1', 'proto_type': 'CAM', 'proto_version': 0, 'message_id': 53, 'generated_time': 2.7}, 'body': {'station_id': 0.24922913420559822, 'leader': null, 'speed': 5.0, 'station_characteristics': {'mobile_its_station': false, 'private_its_station': false, 'physical_relevant_its_station': false}, 'reference_position': {'lane': 1, 'position': [13.54, -1.6, 0], 'elevation': 0, 'heading': 0}}}\\n'"", ""b'15:21:20.954441 IP 192.168.0.2.37868 > 192.168.0.255.9090: UDP, length 451\\nE.....@.@.............#...:.{'header': {'from_car_id': 'car2', 'proto_type': 'CAM', 'proto_version': 0, 'message_id': 54, 'generated_time': 2.7}, 'body': {'station_id': 0.5480249079897653, 'leader': null, 'speed': -1073741824.0, 'station_characteristics': {'mobile_its_station': false, 'private_its_station': false, 'physical_relevant_its_station': false}, 'reference_position': {'lane': -1073741824, 'position': [-1073741824.0, -1073741824.0, 0], 'elevation': 0, 'heading': 0}}}\\n'""]"
car1,28,2.8,"(None, None)",8.94,-60,,2,865,[],"[""b'15:21:21.046919 IP 192.168.0.1.42406 > 192.168.0.255.9090: UDP, length 414\\nE.....@.@..1..........#...z.{'header': {'from_car_id': 'car1', 'proto_type': 'CAM', 'proto_version': 0, 'message_id': 55, 'generated_time': 2.8}, 'body': {'station_id': 0.2088450217290876, 'leader': null, 'speed': 5.0, 'station_characteristics': {'mobile_its_station': false, 'private_its_station': false, 'physical_relevant_its_station': false}, 'reference_position': {'lane': 1, 'position': [14.04, -1.6, 0], 'elevation': 0, 'heading': 0}}}\\n'"", ""b'15:21:21.055408 IP 192.168.0.2.37868 > 192.168.0.255.9090: UDP, length 451\\nE.....@.@.............#...-.{'header': {'from_car_id': 'car2', 'proto_type': 'CAM', 'proto_version': 0, 'message_id': 56, 'generated_time': 2.8}, 'body': {'station_id': 0.2809987475887342, 'leader': null, 'speed': -1073741824.0, 'station_characteristics': {'mobile_its_station': false, 'private_its_station': false, 'physical_relevant_its_station': false}, 'reference_position': {'lane': -1073741824, 'position': [-1073741824.0, -1073741824.0, 0], 'elevation': 0, 'heading': 0}}}\\n'""]"
car1,29,2.9,"(None, None)",9.44,-60,,2,880,[],"[""b'15:21:21.146565 IP 192.168.0.1.42406 > 192.168.0.255.9090: UDP, length 428\\nE.....@.@.............#.....{'header': {'from_car_id': 'car1', 'proto_type': 'CAM', 'proto_version': 0, 'message_id': 57, 'generated_time': 2.9}, 'body': {'station_id': 0.47792334364227307, 'leader': null, 'speed': 5.0, 'station_characteristics': {'mobile_its_station': false, 'private_its_station': false, 'physical_relevant_its_station': false}, 'reference_position': {'lane': 1, 'position': [14.540000000000001, -1.6, 0], 'elevation': 0, 'heading': 0}}}\\n'"", ""b'15:21:21.155062 IP 192.168.0.2.37868 > 192.168.0.255.9090: UDP, length 452\\nE.....@.@.............#...|.{'header': {'from_car_id': 'car2', 'proto_type': 'CAM', 'proto_version': 0, 'message_id': 58, 'generated_time': 2.9}, 'body': {'station_id': 0.12556333217363014, 'leader': null, 'speed': -1073741824.0, 'station_characteristics': {'mobile_its_station': false, 'private_its_station': false, 'physical_relevant_its_station': false}, 'reference_position': {'lane': -1073741824, 'position': [-1073741824.0, -1073741824.0, 0], 'elevation': 0, 'heading': 0}}}\\n'""]"
car1,30,3.0,"(None, None)",9.94,-60,,2,878,[],"[""b'15:21:21.245853 IP 192.168.0.1.42406 > 192.168.0.255.9090: UDP, length 427\\nE.....@.@.............#...n.{'header': {'from_car_id': 'car1', 'proto_type': 'CAM', 'proto_version': 0, 'message_id': 59, 'generated_time': 3.0}, 'body': {'station_id': 0.5279601210254509, 'leader': null, 'speed': 5.0, 'station_characteristics': {'mobile_its_station': false, 'private_its_station': false, 'physical_relevant_its_station': false}, 'reference_position': {'lane': 1, 'position': [15.039999999999997, -1.6, 0], 'elevation': 0, 'heading': 0}}}\\n'"", ""b'15:21:21.254301 IP 192.168.0.2.37868 > 192.168.0.255.9090: UDP, length 451\\nE.....@.@.............#...A/{'header': {'from_car_id': 'car2', 'proto_type': 'CAM', 'proto_version': 0, 'message_id': 60, 'generated_time': 3.0}, 'body': {'station_id': 0.8021351125499804, 'leader': null, 'speed': -1073741824.0, 'station_characteristics': {'mobile_its_station': false, 'private_its_station': false, 'physical_relevant_its_station': false}, 'reference_position': {'lane': -1073741824, 'position': [-1073741824.0, -1073741824.0, 0], 'elevation': 0, 'heading': 0}}}\\n'""]"
car1,31,3.1,"(None, None)",10.44,-60,,2,867,[],"[""b'15:21:21.345651 IP 192.168.0.1.42406 > 192.168.0.255.9090: UDP, length 415\\nE.....@.@.............#...g.{'header': {'from_car_id': 'car1', 'proto_type': 'CAM', 'proto_version': 0, 'message_id': 61, 'generated_time': 3.1}, 'body': {'station_id': 0.02521968184581158, 'leader': null, 'speed': 5.0, 'station_characteristics': {'mobile_its_station': false, 'private_its_station': false, 'physical_relevant_its_station': false}, 'reference_position': {'lane': 1, 'position': [15.54, -1.6, 0], 'elevation': 0, 'heading': 0}}}\\n'"", ""b'15:21:21.354012 IP 192.168.0.2.37868 > 192.168.0.255.9090: UDP, length 452\\nE.....@.@.............#...l.{'header': {'from_car_id': 'car2', 'proto_type': 'CAM', 'proto_version': 0, 'message_id': 62, 'generated_time': 3.1}, 'body': {'station_id': 0.16761378372343572, 'leader': null, 'speed': -1073741824.0, 'station_characteristics': {'mobile_its_station': false, 'private_its_station': false, 'physical_relevant_its_station': false}, 'reference_position': {'lane': -1073741824, 'position': [-1073741824.0, -1073741824.0, 0], 'elevation': 0, 'heading': 0}}}\\n'""]"
car1,32,3.2,"(None, None)",10.94,-60,,2,866,[],"[""b'15:21:21.445913 IP 192.168.0.1.42406 > 192.168.0.255.9090: UDP, length 414\\nE.....@.@.............#.....{'header': {'from_car_id': 'car1', 'proto_type': 'CAM', 'proto_version': 0, 'message_id': 63, 'generated_time': 3.2}, 'body': {'station_id': 0.6711474900617483, 'leader': null, 'speed': 5.0, 'station_characteristics': {'mobile_its_station': false, 'private_its_station': false, 'physical_relevant_its_station': false}, 'reference_position': {'lane': 1, 'position': [16.04, -1.6, 0], 'elevation': 0, 'heading': 0}}}\\n'"", ""b'15:21:21.454574 IP 192.168.0.2.37868 > 192.168.0.255.9090: UDP, length 452\\nE.....@.@.............#...q.{'header': {'from_car_id': 'car2', 'proto_type': 'CAM', 'proto_version': 0, 'message_id': 64, 'generated_time': 3.2}, 'body': {'station_id': 0.20925900791236596, 'leader': null, 'speed': -1073741824.0, 'station_characteristics': {'mobile_its_station': false, 'private_its_station': false, 'physical_relevant_its_station': false}, 'reference_position': {'lane': -1073741824, 'position': [-1073741824.0, -1073741824.0, 0], 'elevation': 0, 'heading': 0}}}\\n'""]"
car1,33,3.3,"(None, None)",11.44,-60,,2,867,[],"[""b'15:21:21.546146 IP 192.168.0.1.42406 > 192.168.0.255.9090: UDP, length 415\\nE.....@.@.............#...`.{'header': {'from_car_id': 'car1', 'proto_type': 'CAM', 'proto_version': 0, 'message_id': 65, 'generated_time': 3.3}, 'body': {'station_id': 0.05341627431648155, 'leader': null, 'speed': 5.0, 'station_characteristics': {'mobile_its_station': false, 'private_its_station': false, 'physical_relevant_its_station': false}, 'reference_position': {'lane': 1, 'position': [16.54, -1.6, 0], 'elevation': 0, 'heading': 0}}}\\n'"", ""b'15:21:21.554505 IP 192.168.0.2.37868 > 192.168.0.255.9090: UDP, length 452\\nE.....@.@.............#.....{'header': {'from_car_id': 'car2', 'proto_type': 'CAM', 'proto_version': 0, 'message_id': 66, 'generated_time': 3.3}, 'body': {'station_id': 0.40468180920132957, 'leader': null, 'speed': -1073741824.0, 'station_characteristics': {'mobile_its_station': false, 'private_its_station': false, 'physical_relevant_its_station': false}, 'reference_position': {'lane': -1073741824, 'position': [-1073741824.0, -1073741824.0, 0], 'elevation': 0, 'heading': 0}}}\\n'""]"
car1,34,3.4,"(None, None)",11.94,-60,,2,867,[],"[""b'15:21:21.645918 IP 192.168.0.1.42406 > 192.168.0.255.9090: UDP, length 415\\nE.....@.@.............#...`.{'header': {'from_car_id': 'car1', 'proto_type': 'CAM', 'proto_version': 0, 'message_id': 67, 'generated_time': 3.4}, 'body': {'station_id': 0.17721916855976239, 'leader': null, 'speed': 5.0, 'station_characteristics': {'mobile_its_station': false, 'private_its_station': false, 'physical_relevant_its_station': false}, 'reference_position': {'lane': 1, 'position': [17.04, -1.6, 0], 'elevation': 0, 'heading': 0}}}\\n'"", ""b'15:21:21.654417 IP 192.168.0.2.37868 > 192.168.0.255.9090: UDP, length 452\\nE.....@.@.............#...p.{'header': {'from_car_id': 'car2', 'proto_type': 'CAM', 'proto_version': 0, 'message_id': 68, 'generated_time': 3.4}, 'body': {'station_id': 0.30692742458611366, 'leader': null, 'speed': -1073741824.0, 'station_characteristics': {'mobile_its_station': false, 'private_its_station': false, 'physical_relevant_its_station': false}, 'reference_position': {'lane': -1073741824, 'position': [-1073741824.0, -1073741824.0, 0], 'elevation': 0, 'heading': 0}}}\\n'""]"
car1,35,3.5,"(None, None)",12.44,-60,,2,865,[],"[""b'15:21:21.745332 IP 192.168.0.1.42406 > 192.168.0.255.9090: UDP, length 414\\nE.....@.@.............#.....{'header': {'from_car_id': 'car1', 'proto_type': 'CAM', 'proto_version': 0, 'message_id': 69, 'generated_time': 3.5}, 'body': {'station_id': 0.7952268041060985, 'leader': null, 'speed': 5.0, 'station_characteristics': {'mobile_its_station': false, 'private_its_station': false, 'physical_relevant_its_station': false}, 'reference_position': {'lane': 1, 'position': [17.54, -1.6, 0], 'elevation': 0, 'heading': 0}}}\\n'"", ""b'15:21:21.753690 IP 192.168.0.2.37868 > 192.168.0.255.9090: UDP, length 451\\nE.....@.@.............#...;1{'header': {'from_car_id': 'car2', 'proto_type': 'CAM', 'proto_version': 0, 'message_id': 70, 'generated_time': 3.5}, 'body': {'station_id': 0.7112416816020786, 'leader': null, 'speed': -1073741824.0, 'station_characteristics': {'mobile_its_station': false, 'private_its_station': false, 'physical_relevant_its_station': false}, 'reference_position': {'lane': -1073741824, 'position': [-1073741824.0, -1073741824.0, 0], 'elevation': 0, 'heading': 0}}}\\n'""]"
