CAR,STEP,TIME,LEADER_AND_DISTANCE,DRIVING_DISTANCE,WIFI_SIGNAL_STRENGTH,MESH_SIGNAL_STRENGTH,DATAGRAM_COUNT,BYTES_COUNT,WIFI_DATAGRAM,MESH_DATAGRAM
car2,1,0.1,"(None, None)",None,-60,,1,451,[],"[""b'14:37:23.438203 IP 192.168.0.2.43118 > 192.168.0.255.9090: UDP, length 451\\nE.....@.@............n#...C.{'header': {'from_car_id': 'car2', 'proto_type': 'CAM', 'proto_version': 0, 'message_id': 2, 'generated_time': 0.1}, 'body': {'station_id': 0.09661006851118603, 'leader': null, 'speed': -1073741824.0, 'station_characteristics': {'mobile_its_station': false, 'private_its_station': false, 'physical_relevant_its_station': false}, 'reference_position': {'lane': -1073741824, 'position': [-1073741824.0, -1073741824.0, 0], 'elevation': 0, 'heading': 0}}}\\n'""]"
car2,2,0.2,"(None, None)",None,-60,,1,451,[],"[""b'14:37:23.465248 IP 192.168.0.2.43118 > 192.168.0.255.9090: UDP, length 451\\nE.....@.@............n#...7.{'header': {'from_car_id': 'car2', 'proto_type': 'CAM', 'proto_version': 0, 'message_id': 4, 'generated_time': 0.2}, 'body': {'station_id': 0.19293557295475328, 'leader': null, 'speed': -1073741824.0, 'station_characteristics': {'mobile_its_station': false, 'private_its_station': false, 'physical_relevant_its_station': false}, 'reference_position': {'lane': -1073741824, 'position': [-1073741824.0, -1073741824.0, 0], 'elevation': 0, 'heading': 0}}}\\n'""]"
car2,3,0.3,"(None, None)",None,-60,,1,450,[],"[""b'14:37:23.553763 IP 192.168.0.2.43118 > 192.168.0.255.9090: UDP, length 450\\nE.....@.@............n#....^{'header': {'from_car_id': 'car2', 'proto_type': 'CAM', 'proto_version': 0, 'message_id': 6, 'generated_time': 0.3}, 'body': {'station_id': 0.6829940113234679, 'leader': null, 'speed': -1073741824.0, 'station_characteristics': {'mobile_its_station': false, 'private_its_station': false, 'physical_relevant_its_station': false}, 'reference_position': {'lane': -1073741824, 'position': [-1073741824.0, -1073741824.0, 0], 'elevation': 0, 'heading': 0}}}\\n'""]"
car2,4,0.4,"(None, None)",None,-60,,1,450,[],"[""b'14:37:23.654262 IP 192.168.0.2.43118 > 192.168.0.255.9090: UDP, length 450\\nE.....@.@............n#....\\\\{'header': {'from_car_id': 'car2', 'proto_type': 'CAM', 'proto_version': 0, 'message_id': 8, 'generated_time': 0.4}, 'body': {'station_id': 0.3110893566376709, 'leader': null, 'speed': -1073741824.0, 'station_characteristics': {'mobile_its_station': false, 'private_its_station': false, 'physical_relevant_its_station': false}, 'reference_position': {'lane': -1073741824, 'position': [-1073741824.0, -1073741824.0, 0], 'elevation': 0, 'heading': 0}}}\\n'""]"
car2,5,0.5,"(None, None)",None,-60,,2,879,[],"[""b'14:37:23.753189 IP 192.168.0.2.43118 > 192.168.0.255.9090: UDP, length 451\\nE.....@.@............n#...+.{'header': {'from_car_id': 'car2', 'proto_type': 'CAM', 'proto_version': 0, 'message_id': 10, 'generated_time': 0.5}, 'body': {'station_id': 0.6879841710500861, 'leader': null, 'speed': -1073741824.0, 'station_characteristics': {'mobile_its_station': false, 'private_its_station': false, 'physical_relevant_its_station': false}, 'reference_position': {'lane': -1073741824, 'position': [-1073741824.0, -1073741824.0, 0], 'elevation': 0, 'heading': 0}}}\\n'"", ""b'14:37:23.756310 IP 192.168.0.1.43570 > 192.168.0.255.9090: UDP, length 428\\nE...6&@.@............2#...;H{'header': {'from_car_id': 'car1', 'proto_type': 'CAM', 'proto_version': 0, 'message_id': 9, 'generated_time': 0.5}, 'body': {'station_id': 0.021916279757421164, 'leader': null, 'speed': 1.04, 'station_characteristics': {'mobile_its_station': false, 'private_its_station': false, 'physical_relevant_its_station': false}, 'reference_position': {'lane': 1, 'position': [5.359999999999999, -1.6, 0], 'elevation': 0, 'heading': 0}}}\\n'""]"
car2,6,0.6,"(None, None)",None,-60,,2,877,[],"[""b'14:37:23.854159 IP 192.168.0.2.43118 > 192.168.0.255.9090: UDP, length 451\\nE.....@.@............n#...1.{'header': {'from_car_id': 'car2', 'proto_type': 'CAM', 'proto_version': 0, 'message_id': 12, 'generated_time': 0.6}, 'body': {'station_id': 0.8511237972511148, 'leader': null, 'speed': -1073741824.0, 'station_characteristics': {'mobile_its_station': false, 'private_its_station': false, 'physical_relevant_its_station': false}, 'reference_position': {'lane': -1073741824, 'position': [-1073741824.0, -1073741824.0, 0], 'elevation': 0, 'heading': 0}}}\\n'"", ""b'14:37:23.857240 IP 192.168.0.1.43570 > 192.168.0.255.9090: UDP, length 426\\nE...65@.@............2#.....{'header': {'from_car_id': 'car1', 'proto_type': 'CAM', 'proto_version': 0, 'message_id': 11, 'generated_time': 0.6}, 'body': {'station_id': 0.1606458598637278, 'leader': null, 'speed': 1.3, 'station_characteristics': {'mobile_its_station': false, 'private_its_station': false, 'physical_relevant_its_station': false}, 'reference_position': {'lane': 1, 'position': [5.489999999999999, -1.6, 0], 'elevation': 0, 'heading': 0}}}\\n'""]"
car2,7,0.7,"(None, None)",None,-60,,2,878,[],"[""b'14:37:23.953406 IP 192.168.0.2.43118 > 192.168.0.255.9090: UDP, length 451\\nE.....@.@............n#...7.{'header': {'from_car_id': 'car2', 'proto_type': 'CAM', 'proto_version': 0, 'message_id': 14, 'generated_time': 0.7}, 'body': {'station_id': 0.4062750114105912, 'leader': null, 'speed': -1073741824.0, 'station_characteristics': {'mobile_its_station': false, 'private_its_station': false, 'physical_relevant_its_station': false}, 'reference_position': {'lane': -1073741824, 'position': [-1073741824.0, -1073741824.0, 0], 'elevation': 0, 'heading': 0}}}\\n'"", ""b'14:37:23.957151 IP 192.168.0.1.43570 > 192.168.0.255.9090: UDP, length 427\\nE...68@.@............2#.....{'header': {'from_car_id': 'car1', 'proto_type': 'CAM', 'proto_version': 0, 'message_id': 13, 'generated_time': 0.7}, 'body': {'station_id': 0.8889950294042045, 'leader': null, 'speed': 1.56, 'station_characteristics': {'mobile_its_station': false, 'private_its_station': false, 'physical_relevant_its_station': false}, 'reference_position': {'lane': 1, 'position': [5.645999999999999, -1.6, 0], 'elevation': 0, 'heading': 0}}}\\n'""]"
car2,8,0.8,"(None, None)",None,-60,,2,879,[],"[""b'14:37:24.053457 IP 192.168.0.2.43118 > 192.168.0.255.9090: UDP, length 451\\nE.....@.@............n#.....{'header': {'from_car_id': 'car2', 'proto_type': 'CAM', 'proto_version': 0, 'message_id': 16, 'generated_time': 0.8}, 'body': {'station_id': 0.8882833939806938, 'leader': null, 'speed': -1073741824.0, 'station_characteristics': {'mobile_its_station': false, 'private_its_station': false, 'physical_relevant_its_station': false}, 'reference_position': {'lane': -1073741824, 'position': [-1073741824.0, -1073741824.0, 0], 'elevation': 0, 'heading': 0}}}\\n'"", ""b'14:37:24.056980 IP 192.168.0.1.43570 > 192.168.0.255.9090: UDP, length 428\\nE...6A@.@............2#...4F{'header': {'from_car_id': 'car1', 'proto_type': 'CAM', 'proto_version': 0, 'message_id': 15, 'generated_time': 0.8}, 'body': {'station_id': 0.22579295218562723, 'leader': null, 'speed': 1.82, 'station_characteristics': {'mobile_its_station': false, 'private_its_station': false, 'physical_relevant_its_station': false}, 'reference_position': {'lane': 1, 'position': [5.827999999999999, -1.6, 0], 'elevation': 0, 'heading': 0}}}\\n'""]"
car2,9,0.9,"(None, None)",None,-60,,2,867,[],"[""b'14:37:24.156326 IP 192.168.0.2.43118 > 192.168.0.255.9090: UDP, length 452\\nE....#@.@............n#...h5{'header': {'from_car_id': 'car2', 'proto_type': 'CAM', 'proto_version': 0, 'message_id': 18, 'generated_time': 0.9}, 'body': {'station_id': 0.32007008581683705, 'leader': null, 'speed': -1073741824.0, 'station_characteristics': {'mobile_its_station': false, 'private_its_station': false, 'physical_relevant_its_station': false}, 'reference_position': {'lane': -1073741824, 'position': [-1073741824.0, -1073741824.0, 0], 'elevation': 0, 'heading': 0}}}\\n'"", ""b'14:37:24.158970 IP 192.168.0.1.43570 > 192.168.0.255.9090: UDP, length 415\\nE...6Y@.@............2#.../I{'header': {'from_car_id': 'car1', 'proto_type': 'CAM', 'proto_version': 0, 'message_id': 17, 'generated_time': 0.9}, 'body': {'station_id': 0.3655522748139881, 'leader': null, 'speed': 2.08, 'station_characteristics': {'mobile_its_station': false, 'private_its_station': false, 'physical_relevant_its_station': false}, 'reference_position': {'lane': 1, 'position': [6.036, -1.6, 0], 'elevation': 0, 'heading': 0}}}\\n'""]"
car2,10,1.0,"(None, None)",None,-60,,2,863,[],"[""b'14:37:24.255361 IP 192.168.0.2.43118 > 192.168.0.255.9090: UDP, length 449\\nE....\\'@.@............n#...^.{'header': {'from_car_id': 'car2', 'proto_type': 'CAM', 'proto_version': 0, 'message_id': 20, 'generated_time': 1.0}, 'body': {'station_id': 0.44672235256688, 'leader': null, 'speed': -1073741824.0, 'station_characteristics': {'mobile_its_station': false, 'private_its_station': false, 'physical_relevant_its_station': false}, 'reference_position': {'lane': -1073741824, 'position': [-1073741824.0, -1073741824.0, 0], 'elevation': 0, 'heading': 0}}}\\n'"", ""b'14:37:24.258124 IP 192.168.0.1.43570 > 192.168.0.255.9090: UDP, length 414\\nE...6_@.@............2#.....{'header': {'from_car_id': 'car1', 'proto_type': 'CAM', 'proto_version': 0, 'message_id': 19, 'generated_time': 1.0}, 'body': {'station_id': 0.6657450283173112, 'leader': null, 'speed': 2.34, 'station_characteristics': {'mobile_its_station': false, 'private_its_station': false, 'physical_relevant_its_station': false}, 'reference_position': {'lane': 1, 'position': [6.27, -1.6, 0], 'elevation': 0, 'heading': 0}}}\\n'""]"
car2,11,1.1,"(None, None)",None,-60,,2,892,[],"[""b'14:37:24.355009 IP 192.168.0.2.43118 > 192.168.0.255.9090: UDP, length 451\\nE....)@.@............n#...-.{'header': {'from_car_id': 'car2', 'proto_type': 'CAM', 'proto_version': 0, 'message_id': 22, 'generated_time': 1.1}, 'body': {'station_id': 0.9582838347787485, 'leader': null, 'speed': -1073741824.0, 'station_characteristics': {'mobile_its_station': false, 'private_its_station': false, 'physical_relevant_its_station': false}, 'reference_position': {'lane': -1073741824, 'position': [-1073741824.0, -1073741824.0, 0], 'elevation': 0, 'heading': 0}}}\\n'"", ""b'14:37:24.358122 IP 192.168.0.1.43570 > 192.168.0.255.9090: UDP, length 441\\nE...6k@.@..\\\\.........2#...W-{'header': {'from_car_id': 'car1', 'proto_type': 'CAM', 'proto_version': 0, 'message_id': 21, 'generated_time': 1.1}, 'body': {'station_id': 0.7154326954134063, 'leader': null, 'speed': 2.5999999999999996, 'station_characteristics': {'mobile_its_station': false, 'private_its_station': false, 'physical_relevant_its_station': false}, 'reference_position': {'lane': 1, 'position': [6.529999999999999, -1.6, 0], 'elevation': 0, 'heading': 0}}}\\n'""]"
car2,12,1.2,"(None, None)",None,-60,,2,892,[],"[""b'14:37:24.454491 IP 192.168.0.2.43118 > 192.168.0.255.9090: UDP, length 451\\nE....=@.@..~.........n#...9.{'header': {'from_car_id': 'car2', 'proto_type': 'CAM', 'proto_version': 0, 'message_id': 24, 'generated_time': 1.2}, 'body': {'station_id': 0.6492651130687351, 'leader': null, 'speed': -1073741824.0, 'station_characteristics': {'mobile_its_station': false, 'private_its_station': false, 'physical_relevant_its_station': false}, 'reference_position': {'lane': -1073741824, 'position': [-1073741824.0, -1073741824.0, 0], 'elevation': 0, 'heading': 0}}}\\n'"", ""b'14:37:24.457756 IP 192.168.0.1.43570 > 192.168.0.255.9090: UDP, length 441\\nE...6n@.@..Y.........2#...L2{'header': {'from_car_id': 'car1', 'proto_type': 'CAM', 'proto_version': 0, 'message_id': 23, 'generated_time': 1.2}, 'body': {'station_id': 0.1868801981204583, 'leader': null, 'speed': 2.8599999999999994, 'station_characteristics': {'mobile_its_station': false, 'private_its_station': false, 'physical_relevant_its_station': false}, 'reference_position': {'lane': 1, 'position': [6.815999999999998, -1.6, 0], 'elevation': 0, 'heading': 0}}}\\n'""]"
car2,13,1.3,"(None, None)",None,-60,,2,891,[],"[""b'14:37:24.555162 IP 192.168.0.2.43118 > 192.168.0.255.9090: UDP, length 451\\nE....@@.@..{.........n#.....{'header': {'from_car_id': 'car2', 'proto_type': 'CAM', 'proto_version': 0, 'message_id': 26, 'generated_time': 1.3}, 'body': {'station_id': 0.3278245095943487, 'leader': null, 'speed': -1073741824.0, 'station_characteristics': {'mobile_its_station': false, 'private_its_station': false, 'physical_relevant_its_station': false}, 'reference_position': {'lane': -1073741824, 'position': [-1073741824.0, -1073741824.0, 0], 'elevation': 0, 'heading': 0}}}\\n'"", ""b'14:37:24.557884 IP 192.168.0.1.43570 > 192.168.0.255.9090: UDP, length 440\\nE...6.@.@..C.........2#....,{'header': {'from_car_id': 'car1', 'proto_type': 'CAM', 'proto_version': 0, 'message_id': 25, 'generated_time': 1.3}, 'body': {'station_id': 0.9068171659820428, 'leader': null, 'speed': 3.119999999999999, 'station_characteristics': {'mobile_its_station': false, 'private_its_station': false, 'physical_relevant_its_station': false}, 'reference_position': {'lane': 1, 'position': [7.127999999999999, -1.6, 0], 'elevation': 0, 'heading': 0}}}\\n'""]"
car2,14,1.4,"(None, None)",None,-60,,2,891,[],"[""b'14:37:24.654916 IP 192.168.0.2.43118 > 192.168.0.255.9090: UDP, length 451\\nE....D@.@..w.........n#...(.{'header': {'from_car_id': 'car2', 'proto_type': 'CAM', 'proto_version': 0, 'message_id': 28, 'generated_time': 1.4}, 'body': {'station_id': 0.7965307805005567, 'leader': null, 'speed': -1073741824.0, 'station_characteristics': {'mobile_its_station': false, 'private_its_station': false, 'physical_relevant_its_station': false}, 'reference_position': {'lane': -1073741824, 'position': [-1073741824.0, -1073741824.0, 0], 'elevation': 0, 'heading': 0}}}\\n'"", ""b'14:37:24.658294 IP 192.168.0.1.43570 > 192.168.0.255.9090: UDP, length 440\\nE...6.@.@..0.........2#....#{'header': {'from_car_id': 'car1', 'proto_type': 'CAM', 'proto_version': 0, 'message_id': 27, 'generated_time': 1.4}, 'body': {'station_id': 0.5045483814562757, 'leader': null, 'speed': 3.379999999999999, 'station_characteristics': {'mobile_its_station': false, 'private_its_station': false, 'physical_relevant_its_station': false}, 'reference_position': {'lane': 1, 'position': [7.465999999999999, -1.6, 0], 'elevation': 0, 'heading': 0}}}\\n'""]"
car2,15,1.5,"(None, None)",None,-60,,2,892,[],"[""b'14:37:24.755078 IP 192.168.0.2.43118 > 192.168.0.255.9090: UDP, length 452\\nE....O@.@..k.........n#...X?{'header': {'from_car_id': 'car2', 'proto_type': 'CAM', 'proto_version': 0, 'message_id': 30, 'generated_time': 1.5}, 'body': {'station_id': 0.02284775783913129, 'leader': null, 'speed': -1073741824.0, 'station_characteristics': {'mobile_its_station': false, 'private_its_station': false, 'physical_relevant_its_station': false}, 'reference_position': {'lane': -1073741824, 'position': [-1073741824.0, -1073741824.0, 0], 'elevation': 0, 'heading': 0}}}\\n'"", ""b'14:37:24.758664 IP 192.168.0.1.43570 > 192.168.0.255.9090: UDP, length 440\\nE...6.@.@.. .........2#.....{'header': {'from_car_id': 'car1', 'proto_type': 'CAM', 'proto_version': 0, 'message_id': 29, 'generated_time': 1.5}, 'body': {'station_id': 0.7140575662634656, 'leader': null, 'speed': 3.639999999999999, 'station_characteristics': {'mobile_its_station': false, 'private_its_station': false, 'physical_relevant_its_station': false}, 'reference_position': {'lane': 1, 'position': [7.829999999999999, -1.6, 0], 'elevation': 0, 'heading': 0}}}\\n'""]"
car2,16,1.6,"(None, None)",None,-60,,2,893,[],"[""b'14:37:24.855845 IP 192.168.0.2.43118 > 192.168.0.255.9090: UDP, length 451\\nE....[@.@..`.........n#.....{'header': {'from_car_id': 'car2', 'proto_type': 'CAM', 'proto_version': 0, 'message_id': 32, 'generated_time': 1.6}, 'body': {'station_id': 0.6517796876450751, 'leader': null, 'speed': -1073741824.0, 'station_characteristics': {'mobile_its_station': false, 'private_its_station': false, 'physical_relevant_its_station': false}, 'reference_position': {'lane': -1073741824, 'position': [-1073741824.0, -1073741824.0, 0], 'elevation': 0, 'heading': 0}}}\\n'"", ""b'14:37:24.858506 IP 192.168.0.1.43570 > 192.168.0.255.9090: UDP, length 442\\nE...6.@.@............2#.....{'header': {'from_car_id': 'car1', 'proto_type': 'CAM', 'proto_version': 0, 'message_id': 31, 'generated_time': 1.6}, 'body': {'station_id': 0.29985442598688716, 'leader': null, 'speed': 3.8999999999999986, 'station_characteristics': {'mobile_its_station': false, 'private_its_station': false, 'physical_relevant_its_station': false}, 'reference_position': {'lane': 1, 'position': [8.219999999999999, -1.6, 0], 'elevation': 0, 'heading': 0}}}\\n'""]"
car2,17,1.7,"(None, None)",None,-60,,2,880,[],"[""b'14:37:24.955729 IP 192.168.0.2.43118 > 192.168.0.255.9090: UDP, length 451\\nE....s@.@..H.........n#.....{'header': {'from_car_id': 'car2', 'proto_type': 'CAM', 'proto_version': 0, 'message_id': 34, 'generated_time': 1.7}, 'body': {'station_id': 0.4369243338192952, 'leader': null, 'speed': -1073741824.0, 'station_characteristics': {'mobile_its_station': false, 'private_its_station': false, 'physical_relevant_its_station': false}, 'reference_position': {'lane': -1073741824, 'position': [-1073741824.0, -1073741824.0, 0], 'elevation': 0, 'heading': 0}}}\\n'"", ""b'14:37:24.958361 IP 192.168.0.1.43570 > 192.168.0.255.9090: UDP, length 429\\nE...6.@.@............2#....W{'header': {'from_car_id': 'car1', 'proto_type': 'CAM', 'proto_version': 0, 'message_id': 33, 'generated_time': 1.7}, 'body': {'station_id': 0.32289072594167467, 'leader': null, 'speed': 4.159999999999998, 'station_characteristics': {'mobile_its_station': false, 'private_its_station': false, 'physical_relevant_its_station': false}, 'reference_position': {'lane': 1, 'position': [8.636, -1.6, 0], 'elevation': 0, 'heading': 0}}}\\n'""]"
car2,18,1.8,"(None, None)",None,-60,,2,879,[],"[""b'14:37:25.055643 IP 192.168.0.2.43118 > 192.168.0.255.9090: UDP, length 451\\nE.....@.@..:.........n#.....{'header': {'from_car_id': 'car2', 'proto_type': 'CAM', 'proto_version': 0, 'message_id': 36, 'generated_time': 1.8}, 'body': {'station_id': 0.8509992769223489, 'leader': null, 'speed': -1073741824.0, 'station_characteristics': {'mobile_its_station': false, 'private_its_station': false, 'physical_relevant_its_station': false}, 'reference_position': {'lane': -1073741824, 'position': [-1073741824.0, -1073741824.0, 0], 'elevation': 0, 'heading': 0}}}\\n'"", ""b'14:37:25.058818 IP 192.168.0.1.43570 > 192.168.0.255.9090: UDP, length 428\\nE...6.@.@............2#.....{'header': {'from_car_id': 'car1', 'proto_type': 'CAM', 'proto_version': 0, 'message_id': 35, 'generated_time': 1.8}, 'body': {'station_id': 0.8432369349239437, 'leader': null, 'speed': 4.419999999999998, 'station_characteristics': {'mobile_its_station': false, 'private_its_station': false, 'physical_relevant_its_station': false}, 'reference_position': {'lane': 1, 'position': [9.078, -1.6, 0], 'elevation': 0, 'heading': 0}}}\\n'""]"
car2,19,1.9,"(None, None)",None,-60,,1,451,[],"[""b'14:37:25.155067 IP 192.168.0.2.43118 > 192.168.0.255.9090: UDP, length 451\\nE.....@.@..7.........n#.....{'header': {'from_car_id': 'car2', 'proto_type': 'CAM', 'proto_version': 0, 'message_id': 38, 'generated_time': 1.9}, 'body': {'station_id': 0.0496580207282844, 'leader': null, 'speed': -1073741824.0, 'station_characteristics': {'mobile_its_station': false, 'private_its_station': false, 'physical_relevant_its_station': false}, 'reference_position': {'lane': -1073741824, 'position': [-1073741824.0, -1073741824.0, 0], 'elevation': 0, 'heading': 0}}}\\n'""]"
car2,20,2.0,"(None, None)",None,-60,,2,880,[],"[""b'14:37:25.255189 IP 192.168.0.2.43118 > 192.168.0.255.9090: UDP, length 452\\nE.....@.@............n#...c<{'header': {'from_car_id': 'car2', 'proto_type': 'CAM', 'proto_version': 0, 'message_id': 40, 'generated_time': 2.0}, 'body': {'station_id': 0.22696730586035452, 'leader': null, 'speed': -1073741824.0, 'station_characteristics': {'mobile_its_station': false, 'private_its_station': false, 'physical_relevant_its_station': false}, 'reference_position': {'lane': -1073741824, 'position': [-1073741824.0, -1073741824.0, 0], 'elevation': 0, 'heading': 0}}}\\n'"", ""b'14:37:25.258385 IP 192.168.0.1.43570 > 192.168.0.255.9090: UDP, length 428\\nE...6.@.@............2#.....{'header': {'from_car_id': 'car1', 'proto_type': 'CAM', 'proto_version': 0, 'message_id': 39, 'generated_time': 2.0}, 'body': {'station_id': 0.5721366052696982, 'leader': null, 'speed': 4.939999999999998, 'station_characteristics': {'mobile_its_station': false, 'private_its_station': false, 'physical_relevant_its_station': false}, 'reference_position': {'lane': 1, 'position': [10.04, -1.6, 0], 'elevation': 0, 'heading': 0}}}\\n'""]"
car2,21,2.1,"(None, None)",None,-60,,2,865,[],"[""b'14:37:25.354892 IP 192.168.0.2.43118 > 192.168.0.255.9090: UDP, length 451\\nE.....@.@............n#...&.{'header': {'from_car_id': 'car2', 'proto_type': 'CAM', 'proto_version': 0, 'message_id': 42, 'generated_time': 2.1}, 'body': {'station_id': 0.9637982674702129, 'leader': null, 'speed': -1073741824.0, 'station_characteristics': {'mobile_its_station': false, 'private_its_station': false, 'physical_relevant_its_station': false}, 'reference_position': {'lane': -1073741824, 'position': [-1073741824.0, -1073741824.0, 0], 'elevation': 0, 'heading': 0}}}\\n'"", ""b'14:37:25.358103 IP 192.168.0.1.43570 > 192.168.0.255.9090: UDP, length 414\\nE...6.@.@............2#....G{'header': {'from_car_id': 'car1', 'proto_type': 'CAM', 'proto_version': 0, 'message_id': 41, 'generated_time': 2.1}, 'body': {'station_id': 0.9300246637020847, 'leader': null, 'speed': 5.0, 'station_characteristics': {'mobile_its_station': false, 'private_its_station': false, 'physical_relevant_its_station': false}, 'reference_position': {'lane': 1, 'position': [10.54, -1.6, 0], 'elevation': 0, 'heading': 0}}}\\n'""]"
car2,22,2.2,"(None, None)",None,-60,,2,865,[],"[""b'14:37:25.456507 IP 192.168.0.2.43118 > 192.168.0.255.9090: UDP, length 451\\nE.....@.@............n#.....{'header': {'from_car_id': 'car2', 'proto_type': 'CAM', 'proto_version': 0, 'message_id': 44, 'generated_time': 2.2}, 'body': {'station_id': 0.6894699819415309, 'leader': null, 'speed': -1073741824.0, 'station_characteristics': {'mobile_its_station': false, 'private_its_station': false, 'physical_relevant_its_station': false}, 'reference_position': {'lane': -1073741824, 'position': [-1073741824.0, -1073741824.0, 0], 'elevation': 0, 'heading': 0}}}\\n'"", ""b'14:37:25.459052 IP 192.168.0.1.43570 > 192.168.0.255.9090: UDP, length 414\\nE...6.@.@............2#....C{'header': {'from_car_id': 'car1', 'proto_type': 'CAM', 'proto_version': 0, 'message_id': 43, 'generated_time': 2.2}, 'body': {'station_id': 0.6261162557158219, 'leader': null, 'speed': 5.0, 'station_characteristics': {'mobile_its_station': false, 'private_its_station': false, 'physical_relevant_its_station': false}, 'reference_position': {'lane': 1, 'position': [11.04, -1.6, 0], 'elevation': 0, 'heading': 0}}}\\n'""]"
car2,23,2.4,"(None, None)",None,-60,,2,865,[],"[""b'14:37:25.657331 IP 192.168.0.2.43118 > 192.168.0.255.9090: UDP, length 451\\nE.....@.@............n#...0.{'header': {'from_car_id': 'car2', 'proto_type': 'CAM', 'proto_version': 0, 'message_id': 47, 'generated_time': 2.4}, 'body': {'station_id': 0.6711306182239777, 'leader': null, 'speed': -1073741824.0, 'station_characteristics': {'mobile_its_station': false, 'private_its_station': false, 'physical_relevant_its_station': false}, 'reference_position': {'lane': -1073741824, 'position': [-1073741824.0, -1073741824.0, 0], 'elevation': 0, 'heading': 0}}}\\n'"", ""b'14:37:25.661297 IP 192.168.0.1.43570 > 192.168.0.255.9090: UDP, length 414\\nE...7.@.@............2#....:{'header': {'from_car_id': 'car1', 'proto_type': 'CAM', 'proto_version': 0, 'message_id': 46, 'generated_time': 2.4}, 'body': {'station_id': 0.8014512841845821, 'leader': null, 'speed': 5.0, 'station_characteristics': {'mobile_its_station': false, 'private_its_station': false, 'physical_relevant_its_station': false}, 'reference_position': {'lane': 1, 'position': [12.04, -1.6, 0], 'elevation': 0, 'heading': 0}}}\\n'""]"
car2,24,2.5,"(None, None)",None,-60,,2,866,[],"[""b'14:37:25.757746 IP 192.168.0.2.43118 > 192.168.0.255.9090: UDP, length 451\\nE.....@.@............n#.....{'header': {'from_car_id': 'car2', 'proto_type': 'CAM', 'proto_version': 0, 'message_id': 49, 'generated_time': 2.5}, 'body': {'station_id': 0.6046351879274565, 'leader': null, 'speed': -1073741824.0, 'station_characteristics': {'mobile_its_station': false, 'private_its_station': false, 'physical_relevant_its_station': false}, 'reference_position': {'lane': -1073741824, 'position': [-1073741824.0, -1073741824.0, 0], 'elevation': 0, 'heading': 0}}}\\n'"", ""b'14:37:25.762210 IP 192.168.0.1.43570 > 192.168.0.255.9090: UDP, length 415\\nE...7*@.@............2#...l.{'header': {'from_car_id': 'car1', 'proto_type': 'CAM', 'proto_version': 0, 'message_id': 48, 'generated_time': 2.5}, 'body': {'station_id': 0.30718343092656253, 'leader': null, 'speed': 5.0, 'station_characteristics': {'mobile_its_station': false, 'private_its_station': false, 'physical_relevant_its_station': false}, 'reference_position': {'lane': 1, 'position': [12.54, -1.6, 0], 'elevation': 0, 'heading': 0}}}\\n'""]"
car2,25,2.6,"(None, None)",None,-60,,2,866,[],"[""b'14:37:25.855722 IP 192.168.0.2.43118 > 192.168.0.255.9090: UDP, length 451\\nE.....@.@............n#...'.{'header': {'from_car_id': 'car2', 'proto_type': 'CAM', 'proto_version': 0, 'message_id': 51, 'generated_time': 2.6}, 'body': {'station_id': 0.7829945641842037, 'leader': null, 'speed': -1073741824.0, 'station_characteristics': {'mobile_its_station': false, 'private_its_station': false, 'physical_relevant_its_station': false}, 'reference_position': {'lane': -1073741824, 'position': [-1073741824.0, -1073741824.0, 0], 'elevation': 0, 'heading': 0}}}\\n'"", ""b'14:37:25.859044 IP 192.168.0.1.43570 > 192.168.0.255.9090: UDP, length 415\\nE...70@.@............2#...k.{'header': {'from_car_id': 'car1', 'proto_type': 'CAM', 'proto_version': 0, 'message_id': 50, 'generated_time': 2.6}, 'body': {'station_id': 0.04343379018544968, 'leader': null, 'speed': 5.0, 'station_characteristics': {'mobile_its_station': false, 'private_its_station': false, 'physical_relevant_its_station': false}, 'reference_position': {'lane': 1, 'position': [13.04, -1.6, 0], 'elevation': 0, 'heading': 0}}}\\n'""]"
car2,26,2.7,"(None, None)",None,-60,,2,865,[],"[""b'14:37:25.955951 IP 192.168.0.2.43118 > 192.168.0.255.9090: UDP, length 450\\nE.....@.@............n#....i{'header': {'from_car_id': 'car2', 'proto_type': 'CAM', 'proto_version': 0, 'message_id': 53, 'generated_time': 2.7}, 'body': {'station_id': 0.946371019145462, 'leader': null, 'speed': -1073741824.0, 'station_characteristics': {'mobile_its_station': false, 'private_its_station': false, 'physical_relevant_its_station': false}, 'reference_position': {'lane': -1073741824, 'position': [-1073741824.0, -1073741824.0, 0], 'elevation': 0, 'heading': 0}}}\\n'"", ""b'14:37:25.960175 IP 192.168.0.1.43570 > 192.168.0.255.9090: UDP, length 415\\nE...7A@.@............2#...s.{'header': {'from_car_id': 'car1', 'proto_type': 'CAM', 'proto_version': 0, 'message_id': 52, 'generated_time': 2.7}, 'body': {'station_id': 0.21812083851067854, 'leader': null, 'speed': 5.0, 'station_characteristics': {'mobile_its_station': false, 'private_its_station': false, 'physical_relevant_its_station': false}, 'reference_position': {'lane': 1, 'position': [13.54, -1.6, 0], 'elevation': 0, 'heading': 0}}}\\n'""]"
car2,27,2.8,"(None, None)",None,-60,,2,865,[],"[""b'14:37:26.056348 IP 192.168.0.2.43118 > 192.168.0.255.9090: UDP, length 451\\nE....*@.@............n#.....{'header': {'from_car_id': 'car2', 'proto_type': 'CAM', 'proto_version': 0, 'message_id': 55, 'generated_time': 2.8}, 'body': {'station_id': 0.6239047167283696, 'leader': null, 'speed': -1073741824.0, 'station_characteristics': {'mobile_its_station': false, 'private_its_station': false, 'physical_relevant_its_station': false}, 'reference_position': {'lane': -1073741824, 'position': [-1073741824.0, -1073741824.0, 0], 'elevation': 0, 'heading': 0}}}\\n'"", ""b'14:37:26.059638 IP 192.168.0.1.43570 > 192.168.0.255.9090: UDP, length 414\\nE...7F@.@............2#...z8{'header': {'from_car_id': 'car1', 'proto_type': 'CAM', 'proto_version': 0, 'message_id': 54, 'generated_time': 2.8}, 'body': {'station_id': 0.9174575419544517, 'leader': null, 'speed': 5.0, 'station_characteristics': {'mobile_its_station': false, 'private_its_station': false, 'physical_relevant_its_station': false}, 'reference_position': {'lane': 1, 'position': [14.04, -1.6, 0], 'elevation': 0, 'heading': 0}}}\\n'""]"
car2,28,2.9,"(None, None)",None,-60,,2,878,[],"[""b'14:37:26.156472 IP 192.168.0.2.43118 > 192.168.0.255.9090: UDP, length 451\\nE....8@.@............n#...'.{'header': {'from_car_id': 'car2', 'proto_type': 'CAM', 'proto_version': 0, 'message_id': 57, 'generated_time': 2.9}, 'body': {'station_id': 0.7746917082690734, 'leader': null, 'speed': -1073741824.0, 'station_characteristics': {'mobile_its_station': false, 'private_its_station': false, 'physical_relevant_its_station': false}, 'reference_position': {'lane': -1073741824, 'position': [-1073741824.0, -1073741824.0, 0], 'elevation': 0, 'heading': 0}}}\\n'"", ""b'14:37:26.159408 IP 192.168.0.1.43570 > 192.168.0.255.9090: UDP, length 427\\nE...7T@.@............2#.....{'header': {'from_car_id': 'car1', 'proto_type': 'CAM', 'proto_version': 0, 'message_id': 56, 'generated_time': 2.9}, 'body': {'station_id': 0.6356462032129672, 'leader': null, 'speed': 5.0, 'station_characteristics': {'mobile_its_station': false, 'private_its_station': false, 'physical_relevant_its_station': false}, 'reference_position': {'lane': 1, 'position': [14.540000000000001, -1.6, 0], 'elevation': 0, 'heading': 0}}}\\n'""]"
car2,29,3.0,"(None, None)",None,-60,,2,879,[],"[""b'14:37:26.256689 IP 192.168.0.2.43118 > 192.168.0.255.9090: UDP, length 451\\nE....N@.@..m.........n#...4.{'header': {'from_car_id': 'car2', 'proto_type': 'CAM', 'proto_version': 0, 'message_id': 59, 'generated_time': 3.0}, 'body': {'station_id': 0.6074705101081458, 'leader': null, 'speed': -1073741824.0, 'station_characteristics': {'mobile_its_station': false, 'private_its_station': false, 'physical_relevant_its_station': false}, 'reference_position': {'lane': -1073741824, 'position': [-1073741824.0, -1073741824.0, 0], 'elevation': 0, 'heading': 0}}}\\n'"", ""b'14:37:26.259072 IP 192.168.0.1.43570 > 192.168.0.255.9090: UDP, length 428\\nE...7l@.@..h.........2#.....{'header': {'from_car_id': 'car1', 'proto_type': 'CAM', 'proto_version': 0, 'message_id': 58, 'generated_time': 3.0}, 'body': {'station_id': 0.31209244705816763, 'leader': null, 'speed': 5.0, 'station_characteristics': {'mobile_its_station': false, 'private_its_station': false, 'physical_relevant_its_station': false}, 'reference_position': {'lane': 1, 'position': [15.039999999999997, -1.6, 0], 'elevation': 0, 'heading': 0}}}\\n'""]"
car2,30,3.1,"(None, None)",None,-60,,2,866,[],"[""b'14:37:26.356107 IP 192.168.0.2.43118 > 192.168.0.255.9090: UDP, length 452\\nE....O@.@..k.........n#...[/{'header': {'from_car_id': 'car2', 'proto_type': 'CAM', 'proto_version': 0, 'message_id': 61, 'generated_time': 3.1}, 'body': {'station_id': 0.43496074477499147, 'leader': null, 'speed': -1073741824.0, 'station_characteristics': {'mobile_its_station': false, 'private_its_station': false, 'physical_relevant_its_station': false}, 'reference_position': {'lane': -1073741824, 'position': [-1073741824.0, -1073741824.0, 0], 'elevation': 0, 'heading': 0}}}\\n'"", ""b'14:37:26.359032 IP 192.168.0.1.43570 > 192.168.0.255.9090: UDP, length 414\\nE...7o@.@..s.........2#...x3{'header': {'from_car_id': 'car1', 'proto_type': 'CAM', 'proto_version': 0, 'message_id': 60, 'generated_time': 3.1}, 'body': {'station_id': 0.9673796884180624, 'leader': null, 'speed': 5.0, 'station_characteristics': {'mobile_its_station': false, 'private_its_station': false, 'physical_relevant_its_station': false}, 'reference_position': {'lane': 1, 'position': [15.54, -1.6, 0], 'elevation': 0, 'heading': 0}}}\\n'""]"
car2,31,3.2,"(None, None)",None,-60,,2,865,[],"[""b'14:37:26.456587 IP 192.168.0.2.43118 > 192.168.0.255.9090: UDP, length 452\\nE....V@.@..d.........n#...^5{'header': {'from_car_id': 'car2', 'proto_type': 'CAM', 'proto_version': 0, 'message_id': 63, 'generated_time': 3.2}, 'body': {'station_id': 0.48286102207656956, 'leader': null, 'speed': -1073741824.0, 'station_characteristics': {'mobile_its_station': false, 'private_its_station': false, 'physical_relevant_its_station': false}, 'reference_position': {'lane': -1073741824, 'position': [-1073741824.0, -1073741824.0, 0], 'elevation': 0, 'heading': 0}}}\\n'"", ""b'14:37:26.459442 IP 192.168.0.1.43570 > 192.168.0.255.9090: UDP, length 413\\nE...7.@.@..\\\\.........2#....L{'header': {'from_car_id': 'car1', 'proto_type': 'CAM', 'proto_version': 0, 'message_id': 62, 'generated_time': 3.2}, 'body': {'station_id': 0.823280746079085, 'leader': null, 'speed': 5.0, 'station_characteristics': {'mobile_its_station': false, 'private_its_station': false, 'physical_relevant_its_station': false}, 'reference_position': {'lane': 1, 'position': [16.04, -1.6, 0], 'elevation': 0, 'heading': 0}}}\\n'""]"
,,,,,,,1,414,,"[""b'14:37:25.559480 IP 192.168.0.1.43570 > 192.168.0.255.9090: UDP, length 414\\nE...7.@.@............2#...w;{'header': {'from_car_id': 'car1', 'proto_type': 'CAM', 'proto_version': 0, 'message_id': 45, 'generated_time': 2.3}, 'body': {'station_id': 0.5541293609887428, 'leader': null, 'speed': 5.0, 'station_characteristics': {'mobile_its_station': false, 'private_its_station': false, 'physical_relevant_its_station': false}, 'reference_position': {'lane': 1, 'position': [11.54, -1.6, 0], 'elevation': 0, 'heading': 0}}}\\n'""]"
car2,32,3.3,"(None, None)",None,-60,,2,864,[],"[""b'14:37:26.558024 IP 192.168.0.2.43118 > 192.168.0.255.9090: UDP, length 450\\nE...._@.@..].........n#....`{'header': {'from_car_id': 'car2', 'proto_type': 'CAM', 'proto_version': 0, 'message_id': 65, 'generated_time': 3.3}, 'body': {'station_id': 0.635912788587578, 'leader': null, 'speed': -1073741824.0, 'station_characteristics': {'mobile_its_station': false, 'private_its_station': false, 'physical_relevant_its_station': false}, 'reference_position': {'lane': -1073741824, 'position': [-1073741824.0, -1073741824.0, 0], 'elevation': 0, 'heading': 0}}}\\n'"", ""b'14:37:26.559874 IP 192.168.0.1.43570 > 192.168.0.255.9090: UDP, length 414\\nE...7.@.@..S.........2#...|2{'header': {'from_car_id': 'car1', 'proto_type': 'CAM', 'proto_version': 0, 'message_id': 64, 'generated_time': 3.3}, 'body': {'station_id': 0.7259244696280572, 'leader': null, 'speed': 5.0, 'station_characteristics': {'mobile_its_station': false, 'private_its_station': false, 'physical_relevant_its_station': false}, 'reference_position': {'lane': 1, 'position': [16.54, -1.6, 0], 'elevation': 0, 'heading': 0}}}\\n'""]"
car2,33,3.4,"(None, None)",None,-60,,2,866,[],"[""b'14:37:26.657675 IP 192.168.0.2.43118 > 192.168.0.255.9090: UDP, length 452\\nE....x@.@..B.........n#...e7{'header': {'from_car_id': 'car2', 'proto_type': 'CAM', 'proto_version': 0, 'message_id': 67, 'generated_time': 3.4}, 'body': {'station_id': 0.30660391033305767, 'leader': null, 'speed': -1073741824.0, 'station_characteristics': {'mobile_its_station': false, 'private_its_station': false, 'physical_relevant_its_station': false}, 'reference_position': {'lane': -1073741824, 'position': [-1073741824.0, -1073741824.0, 0], 'elevation': 0, 'heading': 0}}}\\n'"", ""b'14:37:26.660582 IP 192.168.0.1.43570 > 192.168.0.255.9090: UDP, length 414\\nE...7.@.@..:.........2#....7{'header': {'from_car_id': 'car1', 'proto_type': 'CAM', 'proto_version': 0, 'message_id': 66, 'generated_time': 3.4}, 'body': {'station_id': 0.5910151094602587, 'leader': null, 'speed': 5.0, 'station_characteristics': {'mobile_its_station': false, 'private_its_station': false, 'physical_relevant_its_station': false}, 'reference_position': {'lane': 1, 'position': [17.04, -1.6, 0], 'elevation': 0, 'heading': 0}}}\\n'""]"
car2,34,3.5,"(None, None)",None,-60,,2,866,[],"[""b'14:37:26.757306 IP 192.168.0.2.43118 > 192.168.0.255.9090: UDP, length 452\\nE.....@.@..0.........n#...X){'header': {'from_car_id': 'car2', 'proto_type': 'CAM', 'proto_version': 0, 'message_id': 69, 'generated_time': 3.5}, 'body': {'station_id': 0.20732887740478856, 'leader': null, 'speed': -1073741824.0, 'station_characteristics': {'mobile_its_station': false, 'private_its_station': false, 'physical_relevant_its_station': false}, 'reference_position': {'lane': -1073741824, 'position': [-1073741824.0, -1073741824.0, 0], 'elevation': 0, 'heading': 0}}}\\n'"", ""b'14:37:26.760142 IP 192.168.0.1.43570 > 192.168.0.255.9090: UDP, length 414\\nE...7.@.@..&.........2#...z1{'header': {'from_car_id': 'car1', 'proto_type': 'CAM', 'proto_version': 0, 'message_id': 68, 'generated_time': 3.5}, 'body': {'station_id': 0.2894663730392444, 'leader': null, 'speed': 5.0, 'station_characteristics': {'mobile_its_station': false, 'private_its_station': false, 'physical_relevant_its_station': false}, 'reference_position': {'lane': 1, 'position': [17.54, -1.6, 0], 'elevation': 0, 'heading': 0}}}\\n'""]"
car2,35,3.6,"(None, None)",None,-60,,2,867,[],"[""b'14:37:26.857853 IP 192.168.0.2.43118 > 192.168.0.255.9090: UDP, length 452\\nE.....@.@............n#...N\\'{'header': {'from_car_id': 'car2', 'proto_type': 'CAM', 'proto_version': 0, 'message_id': 71, 'generated_time': 3.6}, 'body': {'station_id': 0.08737765688987609, 'leader': null, 'speed': -1073741824.0, 'station_characteristics': {'mobile_its_station': false, 'private_its_station': false, 'physical_relevant_its_station': false}, 'reference_position': {'lane': -1073741824, 'position': [-1073741824.0, -1073741824.0, 0], 'elevation': 0, 'heading': 0}}}\\n'"", ""b'14:37:26.861283 IP 192.168.0.1.43570 > 192.168.0.255.9090: UDP, length 415\\nE...7.@.@............2#...h){'header': {'from_car_id': 'car1', 'proto_type': 'CAM', 'proto_version': 0, 'message_id': 70, 'generated_time': 3.6}, 'body': {'station_id': 0.22345614601750086, 'leader': null, 'speed': 5.0, 'station_characteristics': {'mobile_its_station': false, 'private_its_station': false, 'physical_relevant_its_station': false}, 'reference_position': {'lane': 1, 'position': [18.04, -1.6, 0], 'elevation': 0, 'heading': 0}}}\\n'""]"
car2,36,3.7,"(None, None)",None,-60,,2,865,[],"[""b'14:37:26.958088 IP 192.168.0.2.43118 > 192.168.0.255.9090: UDP, length 450\\nE.....@.@............n#....r{'header': {'from_car_id': 'car2', 'proto_type': 'CAM', 'proto_version': 0, 'message_id': 73, 'generated_time': 3.7}, 'body': {'station_id': 0.475623305565017, 'leader': null, 'speed': -1073741824.0, 'station_characteristics': {'mobile_its_station': false, 'private_its_station': false, 'physical_relevant_its_station': false}, 'reference_position': {'lane': -1073741824, 'position': [-1073741824.0, -1073741824.0, 0], 'elevation': 0, 'heading': 0}}}\\n'"", ""b'14:37:26.961277 IP 192.168.0.1.43570 > 192.168.0.255.9090: UDP, length 415\\nE...7.@.@.~..........2#...^.{'header': {'from_car_id': 'car1', 'proto_type': 'CAM', 'proto_version': 0, 'message_id': 72, 'generated_time': 3.7}, 'body': {'station_id': 0.46200284484883647, 'leader': null, 'speed': 5.0, 'station_characteristics': {'mobile_its_station': false, 'private_its_station': false, 'physical_relevant_its_station': false}, 'reference_position': {'lane': 1, 'position': [18.54, -1.6, 0], 'elevation': 0, 'heading': 0}}}\\n'""]"
