CAR,STEP,TIME,LEADER_AND_DISTANCE,DRIVING_DISTANCE,WIFI_SIGNAL_STRENGTH,MESH_SIGNAL_STRENGTH,DATAGRAM_COUNT,WIFI_DATAGRAM,MESH_DATAGRAM
car2,1,0.1,"(None, None)",None,-60,,1,[],"[""b'21:47:42.189971 IP 192.168.0.2.60757 > 192.168.0.255.9090: UDP, length 450\\nE....?@.@.,~.........U#...R.{'header': {'from_car_id': 'car2', 'proto_type': 'CAM', 'proto_version': 0, 'message_id': 2, 'generated_time': 0.1}, 'body': {'station_id': 0.5273539862842336, 'leader': null, 'speed': -1073741824.0, 'station_characteristics': {'mobile_its_station': false, 'private_its_station': false, 'physical_relevant_its_station': false}, 'reference_position': {'lane': -1073741824, 'position': [-1073741824.0, -1073741824.0, 0], 'elevation': 0, 'heading': 0}}}\\n'""]"
car2,2,0.2,"(None, None)",None,-60,,1,[],"[""b'21:47:42.217133 IP 192.168.0.2.60757 > 192.168.0.255.9090: UDP, length 450\\nE....D@.@.,y.........U#...Q.{'header': {'from_car_id': 'car2', 'proto_type': 'CAM', 'proto_version': 0, 'message_id': 4, 'generated_time': 0.2}, 'body': {'station_id': 0.9174833552386037, 'leader': null, 'speed': -1073741824.0, 'station_characteristics': {'mobile_its_station': false, 'private_its_station': false, 'physical_relevant_its_station': false}, 'reference_position': {'lane': -1073741824, 'position': [-1073741824.0, -1073741824.0, 0], 'elevation': 0, 'heading': 0}}}\\n'""]"
car2,3,0.3,"(None, None)",None,-60,,1,[],"[""b'21:47:42.307709 IP 192.168.0.2.60757 > 192.168.0.255.9090: UDP, length 450\\nE....M@.@.,p.........U#...Z.{'header': {'from_car_id': 'car2', 'proto_type': 'CAM', 'proto_version': 0, 'message_id': 6, 'generated_time': 0.3}, 'body': {'station_id': 0.5403106783625327, 'leader': null, 'speed': -1073741824.0, 'station_characteristics': {'mobile_its_station': false, 'private_its_station': false, 'physical_relevant_its_station': false}, 'reference_position': {'lane': -1073741824, 'position': [-1073741824.0, -1073741824.0, 0], 'elevation': 0, 'heading': 0}}}\\n'""]"
car2,4,0.4,"(None, None)",None,-60,,1,[],"[""b'21:47:42.407696 IP 192.168.0.2.60757 > 192.168.0.255.9090: UDP, length 450\\nE....\\\\@.@.,a.........U#...^y{'header': {'from_car_id': 'car2', 'proto_type': 'CAM', 'proto_version': 0, 'message_id': 8, 'generated_time': 0.4}, 'body': {'station_id': 0.5737354720032388, 'leader': null, 'speed': -1073741824.0, 'station_characteristics': {'mobile_its_station': false, 'private_its_station': false, 'physical_relevant_its_station': false}, 'reference_position': {'lane': -1073741824, 'position': [-1073741824.0, -1073741824.0, 0], 'elevation': 0, 'heading': 0}}}\\n'""]"
car2,5,0.5,"(None, None)",None,-60,,1,[],"[""b'21:47:42.507198 IP 192.168.0.2.60757 > 192.168.0.255.9090: UDP, length 452\\nE....k@.@.,P.........U#...)W{'header': {'from_car_id': 'car2', 'proto_type': 'CAM', 'proto_version': 0, 'message_id': 10, 'generated_time': 0.5}, 'body': {'station_id': 0.12573884321250306, 'leader': null, 'speed': -1073741824.0, 'station_characteristics': {'mobile_its_station': false, 'private_its_station': false, 'physical_relevant_its_station': false}, 'reference_position': {'lane': -1073741824, 'position': [-1073741824.0, -1073741824.0, 0], 'elevation': 0, 'heading': 0}}}\\n'""]"
car2,6,0.6,"(None, None)",None,-60,,1,[],"[""b'21:47:42.607931 IP 192.168.0.2.60757 > 192.168.0.255.9090: UDP, length 451\\nE.....@.@.,8.........U#.....{'header': {'from_car_id': 'car2', 'proto_type': 'CAM', 'proto_version': 0, 'message_id': 12, 'generated_time': 0.6}, 'body': {'station_id': 0.7055052613742289, 'leader': null, 'speed': -1073741824.0, 'station_characteristics': {'mobile_its_station': false, 'private_its_station': false, 'physical_relevant_its_station': false}, 'reference_position': {'lane': -1073741824, 'position': [-1073741824.0, -1073741824.0, 0], 'elevation': 0, 'heading': 0}}}\\n'""]"
car2,7,0.7,"(None, None)",None,-60,,1,[],"[""b'21:47:42.710241 IP 192.168.0.2.60757 > 192.168.0.255.9090: UDP, length 451\\nE.....@.@.,!.........U#.....{'header': {'from_car_id': 'car2', 'proto_type': 'CAM', 'proto_version': 0, 'message_id': 14, 'generated_time': 0.7}, 'body': {'station_id': 0.5261087500332567, 'leader': null, 'speed': -1073741824.0, 'station_characteristics': {'mobile_its_station': false, 'private_its_station': false, 'physical_relevant_its_station': false}, 'reference_position': {'lane': -1073741824, 'position': [-1073741824.0, -1073741824.0, 0], 'elevation': 0, 'heading': 0}}}\\n'""]"
car2,8,0.8,"(None, None)",None,-60,,1,[],"[""b'21:47:42.809561 IP 192.168.0.2.60757 > 192.168.0.255.9090: UDP, length 452\\nE.....@.@.,..........U#....O{'header': {'from_car_id': 'car2', 'proto_type': 'CAM', 'proto_version': 0, 'message_id': 16, 'generated_time': 0.8}, 'body': {'station_id': 0.09337910485874179, 'leader': null, 'speed': -1073741824.0, 'station_characteristics': {'mobile_its_station': false, 'private_its_station': false, 'physical_relevant_its_station': false}, 'reference_position': {'lane': -1073741824, 'position': [-1073741824.0, -1073741824.0, 0], 'elevation': 0, 'heading': 0}}}\\n'""]"
car2,9,0.9,"(None, None)",None,-60,,2,[],"[""b'21:47:42.935146 IP 192.168.0.2.60757 > 192.168.0.255.9090: UDP, length 451\\nE.....@.@.,..........U#.....{'header': {'from_car_id': 'car2', 'proto_type': 'CAM', 'proto_version': 0, 'message_id': 18, 'generated_time': 0.9}, 'body': {'station_id': 0.2746279396935063, 'leader': null, 'speed': -1073741824.0, 'station_characteristics': {'mobile_its_station': false, 'private_its_station': false, 'physical_relevant_its_station': false}, 'reference_position': {'lane': -1073741824, 'position': [-1073741824.0, -1073741824.0, 0], 'elevation': 0, 'heading': 0}}}\\n'"", ""b'21:47:42.938375 IP 192.168.0.1.49524 > 192.168.0.255.9090: UDP, length 415\\nE.....@.@............t#.....{'header': {'from_car_id': 'car1', 'proto_type': 'CAM', 'proto_version': 0, 'message_id': 17, 'generated_time': 0.9}, 'body': {'station_id': 0.6967148062678118, 'leader': null, 'speed': 2.08, 'station_characteristics': {'mobile_its_station': false, 'private_its_station': false, 'physical_relevant_its_station': false}, 'reference_position': {'lane': 1, 'position': [6.036, -1.6, 0], 'elevation': 0, 'heading': 0}}}\\n'""]"
car2,10,1.0,"(None, None)",None,-60,,2,[],"[""b'21:47:43.008809 IP 192.168.0.2.60757 > 192.168.0.255.9090: UDP, length 451\\nE.....@.@.+..........U#.....{'header': {'from_car_id': 'car2', 'proto_type': 'CAM', 'proto_version': 0, 'message_id': 20, 'generated_time': 1.0}, 'body': {'station_id': 0.6522820642793324, 'leader': null, 'speed': -1073741824.0, 'station_characteristics': {'mobile_its_station': false, 'private_its_station': false, 'physical_relevant_its_station': false}, 'reference_position': {'lane': -1073741824, 'position': [-1073741824.0, -1073741824.0, 0], 'elevation': 0, 'heading': 0}}}\\n'"", ""b'21:47:43.011267 IP 192.168.0.1.49524 > 192.168.0.255.9090: UDP, length 414\\nE....+@.@............t#.....{'header': {'from_car_id': 'car1', 'proto_type': 'CAM', 'proto_version': 0, 'message_id': 19, 'generated_time': 1.0}, 'body': {'station_id': 0.5614250536204773, 'leader': null, 'speed': 2.34, 'station_characteristics': {'mobile_its_station': false, 'private_its_station': false, 'physical_relevant_its_station': false}, 'reference_position': {'lane': 1, 'position': [6.27, -1.6, 0], 'elevation': 0, 'heading': 0}}}\\n'""]"
car2,11,1.1,"(None, None)",None,-60,,2,[],"[""b'21:47:43.109763 IP 192.168.0.2.60757 > 192.168.0.255.9090: UDP, length 451\\nE.....@.@.+..........U#.....{'header': {'from_car_id': 'car2', 'proto_type': 'CAM', 'proto_version': 0, 'message_id': 22, 'generated_time': 1.1}, 'body': {'station_id': 0.6505194474354129, 'leader': null, 'speed': -1073741824.0, 'station_characteristics': {'mobile_its_station': false, 'private_its_station': false, 'physical_relevant_its_station': false}, 'reference_position': {'lane': -1073741824, 'position': [-1073741824.0, -1073741824.0, 0], 'elevation': 0, 'heading': 0}}}\\n'"", ""b'21:47:43.112795 IP 192.168.0.1.49524 > 192.168.0.255.9090: UDP, length 442\\nE....@@.@............t#....l{'header': {'from_car_id': 'car1', 'proto_type': 'CAM', 'proto_version': 0, 'message_id': 21, 'generated_time': 1.1}, 'body': {'station_id': 0.13870046384590295, 'leader': null, 'speed': 2.5999999999999996, 'station_characteristics': {'mobile_its_station': false, 'private_its_station': false, 'physical_relevant_its_station': false}, 'reference_position': {'lane': 1, 'position': [6.529999999999999, -1.6, 0], 'elevation': 0, 'heading': 0}}}\\n'""]"
car2,12,1.2,"(None, None)",None,-60,,2,[],"[""b'21:47:43.211727 IP 192.168.0.2.60757 > 192.168.0.255.9090: UDP, length 452\\nE.....@.@.+..........U#...\\'_{'header': {'from_car_id': 'car2', 'proto_type': 'CAM', 'proto_version': 0, 'message_id': 24, 'generated_time': 1.2}, 'body': {'station_id': 0.23266500200715723, 'leader': null, 'speed': -1073741824.0, 'station_characteristics': {'mobile_its_station': false, 'private_its_station': false, 'physical_relevant_its_station': false}, 'reference_position': {'lane': -1073741824, 'position': [-1073741824.0, -1073741824.0, 0], 'elevation': 0, 'heading': 0}}}\\n'"", ""b'21:47:43.212427 IP 192.168.0.1.49524 > 192.168.0.255.9090: UDP, length 442\\nE....K@.@..{.........t#....j{'header': {'from_car_id': 'car1', 'proto_type': 'CAM', 'proto_version': 0, 'message_id': 23, 'generated_time': 1.2}, 'body': {'station_id': 0.38623254754100234, 'leader': null, 'speed': 2.8599999999999994, 'station_characteristics': {'mobile_its_station': false, 'private_its_station': false, 'physical_relevant_its_station': false}, 'reference_position': {'lane': 1, 'position': [6.815999999999998, -1.6, 0], 'elevation': 0, 'heading': 0}}}\\n'""]"
car2,13,1.3,"(None, None)",None,-60,,2,[],"[""b'21:47:43.311222 IP 192.168.0.2.60757 > 192.168.0.255.9090: UDP, length 452\\nE.....@.@.+..........U#....E{'header': {'from_car_id': 'car2', 'proto_type': 'CAM', 'proto_version': 0, 'message_id': 26, 'generated_time': 1.3}, 'body': {'station_id': 0.27950185948009665, 'leader': null, 'speed': -1073741824.0, 'station_characteristics': {'mobile_its_station': false, 'private_its_station': false, 'physical_relevant_its_station': false}, 'reference_position': {'lane': -1073741824, 'position': [-1073741824.0, -1073741824.0, 0], 'elevation': 0, 'heading': 0}}}\\n'"", ""b'21:47:43.314181 IP 192.168.0.1.49524 > 192.168.0.255.9090: UDP, length 441\\nE....S@.@..t.........t#...w.{'header': {'from_car_id': 'car1', 'proto_type': 'CAM', 'proto_version': 0, 'message_id': 25, 'generated_time': 1.3}, 'body': {'station_id': 0.36759876864123575, 'leader': null, 'speed': 3.119999999999999, 'station_characteristics': {'mobile_its_station': false, 'private_its_station': false, 'physical_relevant_its_station': false}, 'reference_position': {'lane': 1, 'position': [7.127999999999999, -1.6, 0], 'elevation': 0, 'heading': 0}}}\\n'""]"
car2,14,1.4,"(None, None)",None,-60,,2,[],"[""b'21:47:43.412594 IP 192.168.0.2.60757 > 192.168.0.255.9090: UDP, length 452\\nE.....@.@.+..........U#...!K{'header': {'from_car_id': 'car2', 'proto_type': 'CAM', 'proto_version': 0, 'message_id': 28, 'generated_time': 1.4}, 'body': {'station_id': 0.05963363538641153, 'leader': null, 'speed': -1073741824.0, 'station_characteristics': {'mobile_its_station': false, 'private_its_station': false, 'physical_relevant_its_station': false}, 'reference_position': {'lane': -1073741824, 'position': [-1073741824.0, -1073741824.0, 0], 'elevation': 0, 'heading': 0}}}\\n'"", ""b'21:47:43.413449 IP 192.168.0.1.49524 > 192.168.0.255.9090: UDP, length 440\\nE....e@.@..c.........t#...p.{'header': {'from_car_id': 'car1', 'proto_type': 'CAM', 'proto_version': 0, 'message_id': 27, 'generated_time': 1.4}, 'body': {'station_id': 0.6531281903871349, 'leader': null, 'speed': 3.379999999999999, 'station_characteristics': {'mobile_its_station': false, 'private_its_station': false, 'physical_relevant_its_station': false}, 'reference_position': {'lane': 1, 'position': [7.465999999999999, -1.6, 0], 'elevation': 0, 'heading': 0}}}\\n'""]"
car2,15,1.5,"(None, None)",None,-60,,2,[],"[""b'21:47:43.510942 IP 192.168.0.2.60757 > 192.168.0.255.9090: UDP, length 453\\nE.....@.@.+..........U#.....{'header': {'from_car_id': 'car2', 'proto_type': 'CAM', 'proto_version': 0, 'message_id': 30, 'generated_time': 1.5}, 'body': {'station_id': 0.018385110178809505, 'leader': null, 'speed': -1073741824.0, 'station_characteristics': {'mobile_its_station': false, 'private_its_station': false, 'physical_relevant_its_station': false}, 'reference_position': {'lane': -1073741824, 'position': [-1073741824.0, -1073741824.0, 0], 'elevation': 0, 'heading': 0}}}\\n'"", ""b'21:47:43.512523 IP 192.168.0.1.49524 > 192.168.0.255.9090: UDP, length 440\\nE....n@.@..Z.........t#...j.{'header': {'from_car_id': 'car1', 'proto_type': 'CAM', 'proto_version': 0, 'message_id': 29, 'generated_time': 1.5}, 'body': {'station_id': 0.5274588577450791, 'leader': null, 'speed': 3.639999999999999, 'station_characteristics': {'mobile_its_station': false, 'private_its_station': false, 'physical_relevant_its_station': false}, 'reference_position': {'lane': 1, 'position': [7.829999999999999, -1.6, 0], 'elevation': 0, 'heading': 0}}}\\n'""]"
car2,16,1.6,"(None, None)",None,-60,,2,[],"[""b'21:47:43.612012 IP 192.168.0.2.60757 > 192.168.0.255.9090: UDP, length 451\\nE....)@.@.+..........U#.....{'header': {'from_car_id': 'car2', 'proto_type': 'CAM', 'proto_version': 0, 'message_id': 32, 'generated_time': 1.6}, 'body': {'station_id': 0.3976617894555554, 'leader': null, 'speed': -1073741824.0, 'station_characteristics': {'mobile_its_station': false, 'private_its_station': false, 'physical_relevant_its_station': false}, 'reference_position': {'lane': -1073741824, 'position': [-1073741824.0, -1073741824.0, 0], 'elevation': 0, 'heading': 0}}}\\n'"", ""b'21:47:43.613005 IP 192.168.0.1.49524 > 192.168.0.255.9090: UDP, length 440\\nE.....@.@..F.........t#.....{'header': {'from_car_id': 'car1', 'proto_type': 'CAM', 'proto_version': 0, 'message_id': 31, 'generated_time': 1.6}, 'body': {'station_id': 0.602974546164957, 'leader': null, 'speed': 3.8999999999999986, 'station_characteristics': {'mobile_its_station': false, 'private_its_station': false, 'physical_relevant_its_station': false}, 'reference_position': {'lane': 1, 'position': [8.219999999999999, -1.6, 0], 'elevation': 0, 'heading': 0}}}\\n'""]"
car2,17,1.7,"(None, None)",None,-60,,2,[],"[""b'21:47:43.708930 IP 192.168.0.2.60757 > 192.168.0.255.9090: UDP, length 451\\nE....2@.@.+..........U#.....{'header': {'from_car_id': 'car2', 'proto_type': 'CAM', 'proto_version': 0, 'message_id': 34, 'generated_time': 1.7}, 'body': {'station_id': 0.8925706492219558, 'leader': null, 'speed': -1073741824.0, 'station_characteristics': {'mobile_its_station': false, 'private_its_station': false, 'physical_relevant_its_station': false}, 'reference_position': {'lane': -1073741824, 'position': [-1073741824.0, -1073741824.0, 0], 'elevation': 0, 'heading': 0}}}\\n'"", ""b'21:47:43.712059 IP 192.168.0.1.49524 > 192.168.0.255.9090: UDP, length 427\\nE.....@.@..R.........t#....I{'header': {'from_car_id': 'car1', 'proto_type': 'CAM', 'proto_version': 0, 'message_id': 33, 'generated_time': 1.7}, 'body': {'station_id': 0.575479722691745, 'leader': null, 'speed': 4.159999999999998, 'station_characteristics': {'mobile_its_station': false, 'private_its_station': false, 'physical_relevant_its_station': false}, 'reference_position': {'lane': 1, 'position': [8.636, -1.6, 0], 'elevation': 0, 'heading': 0}}}\\n'""]"
car2,18,1.8,"(None, None)",None,-60,,2,[],"[""b'21:47:43.810700 IP 192.168.0.2.60757 > 192.168.0.255.9090: UDP, length 451\\nE....G@.@.+u.........U#.....{'header': {'from_car_id': 'car2', 'proto_type': 'CAM', 'proto_version': 0, 'message_id': 36, 'generated_time': 1.8}, 'body': {'station_id': 0.9140549467978066, 'leader': null, 'speed': -1073741824.0, 'station_characteristics': {'mobile_its_station': false, 'private_its_station': false, 'physical_relevant_its_station': false}, 'reference_position': {'lane': -1073741824, 'position': [-1073741824.0, -1073741824.0, 0], 'elevation': 0, 'heading': 0}}}\\n'"", ""b'21:47:43.812381 IP 192.168.0.1.49524 > 192.168.0.255.9090: UDP, length 428\\nE.....@.@..=.........t#....K{'header': {'from_car_id': 'car1', 'proto_type': 'CAM', 'proto_version': 0, 'message_id': 35, 'generated_time': 1.8}, 'body': {'station_id': 0.7557609153514904, 'leader': null, 'speed': 4.419999999999998, 'station_characteristics': {'mobile_its_station': false, 'private_its_station': false, 'physical_relevant_its_station': false}, 'reference_position': {'lane': 1, 'position': [9.078, -1.6, 0], 'elevation': 0, 'heading': 0}}}\\n'""]"
car2,19,1.9,"(None, None)",None,-60,,2,[],"[""b'21:47:43.909690 IP 192.168.0.2.60757 > 192.168.0.255.9090: UDP, length 451\\nE...._@.@.+].........U#.....{'header': {'from_car_id': 'car2', 'proto_type': 'CAM', 'proto_version': 0, 'message_id': 38, 'generated_time': 1.9}, 'body': {'station_id': 0.6450568823425916, 'leader': null, 'speed': -1073741824.0, 'station_characteristics': {'mobile_its_station': false, 'private_its_station': false, 'physical_relevant_its_station': false}, 'reference_position': {'lane': -1073741824, 'position': [-1073741824.0, -1073741824.0, 0], 'elevation': 0, 'heading': 0}}}\\n'"", ""b'21:47:43.912672 IP 192.168.0.1.49524 > 192.168.0.255.9090: UDP, length 428\\nE.....@.@..;.........t#....J{'header': {'from_car_id': 'car1', 'proto_type': 'CAM', 'proto_version': 0, 'message_id': 37, 'generated_time': 1.9}, 'body': {'station_id': 0.4487118689113544, 'leader': null, 'speed': 4.679999999999998, 'station_characteristics': {'mobile_its_station': false, 'private_its_station': false, 'physical_relevant_its_station': false}, 'reference_position': {'lane': 1, 'position': [9.546, -1.6, 0], 'elevation': 0, 'heading': 0}}}\\n'""]"
car2,20,2.0,"(None, None)",None,-60,,2,[],"[""b'21:47:44.011229 IP 192.168.0.2.60757 > 192.168.0.255.9090: UDP, length 452\\nE....s@.@.+H.........U#....S{'header': {'from_car_id': 'car2', 'proto_type': 'CAM', 'proto_version': 0, 'message_id': 40, 'generated_time': 2.0}, 'body': {'station_id': 0.37429939478312324, 'leader': null, 'speed': -1073741824.0, 'station_characteristics': {'mobile_its_station': false, 'private_its_station': false, 'physical_relevant_its_station': false}, 'reference_position': {'lane': -1073741824, 'position': [-1073741824.0, -1073741824.0, 0], 'elevation': 0, 'heading': 0}}}\\n'"", ""b'21:47:44.015628 IP 192.168.0.1.49524 > 192.168.0.255.9090: UDP, length 429\\nE.....@.@............t#....'{'header': {'from_car_id': 'car1', 'proto_type': 'CAM', 'proto_version': 0, 'message_id': 39, 'generated_time': 2.0}, 'body': {'station_id': 0.10461159548934862, 'leader': null, 'speed': 4.939999999999998, 'station_characteristics': {'mobile_its_station': false, 'private_its_station': false, 'physical_relevant_its_station': false}, 'reference_position': {'lane': 1, 'position': [10.04, -1.6, 0], 'elevation': 0, 'heading': 0}}}\\n'""]"
car2,21,2.1,"(None, None)",None,-60,,2,[],"[""b'21:47:44.109417 IP 192.168.0.2.60757 > 192.168.0.255.9090: UDP, length 452\\nE....y@.@.+B.........U#....H{'header': {'from_car_id': 'car2', 'proto_type': 'CAM', 'proto_version': 0, 'message_id': 42, 'generated_time': 2.1}, 'body': {'station_id': 0.19526989585768884, 'leader': null, 'speed': -1073741824.0, 'station_characteristics': {'mobile_its_station': false, 'private_its_station': false, 'physical_relevant_its_station': false}, 'reference_position': {'lane': -1073741824, 'position': [-1073741824.0, -1073741824.0, 0], 'elevation': 0, 'heading': 0}}}\\n'"", ""b'21:47:44.113041 IP 192.168.0.1.49524 > 192.168.0.255.9090: UDP, length 414\\nE.....@.@..).........t#...s.{'header': {'from_car_id': 'car1', 'proto_type': 'CAM', 'proto_version': 0, 'message_id': 41, 'generated_time': 2.1}, 'body': {'station_id': 0.9303714977719484, 'leader': null, 'speed': 5.0, 'station_characteristics': {'mobile_its_station': false, 'private_its_station': false, 'physical_relevant_its_station': false}, 'reference_position': {'lane': 1, 'position': [10.54, -1.6, 0], 'elevation': 0, 'heading': 0}}}\\n'""]"
car2,22,2.2,"(None, None)",None,-60,,2,[],"[""b'21:47:44.209337 IP 192.168.0.2.60757 > 192.168.0.255.9090: UDP, length 451\\nE.....@.@.+..........U#.....{'header': {'from_car_id': 'car2', 'proto_type': 'CAM', 'proto_version': 0, 'message_id': 44, 'generated_time': 2.2}, 'body': {'station_id': 0.9055176603658549, 'leader': null, 'speed': -1073741824.0, 'station_characteristics': {'mobile_its_station': false, 'private_its_station': false, 'physical_relevant_its_station': false}, 'reference_position': {'lane': -1073741824, 'position': [-1073741824.0, -1073741824.0, 0], 'elevation': 0, 'heading': 0}}}\\n'"", ""b'21:47:44.212245 IP 192.168.0.1.49524 > 192.168.0.255.9090: UDP, length 415\\nE.....@.@............t#...V.{'header': {'from_car_id': 'car1', 'proto_type': 'CAM', 'proto_version': 0, 'message_id': 43, 'generated_time': 2.2}, 'body': {'station_id': 0.46629687920936325, 'leader': null, 'speed': 5.0, 'station_characteristics': {'mobile_its_station': false, 'private_its_station': false, 'physical_relevant_its_station': false}, 'reference_position': {'lane': 1, 'position': [11.04, -1.6, 0], 'elevation': 0, 'heading': 0}}}\\n'""]"
car2,23,2.3,"(None, None)",None,-60,,2,[],"[""b'21:47:44.309315 IP 192.168.0.2.60757 > 192.168.0.255.9090: UDP, length 451\\nE.....@.@.+..........U#.....{'header': {'from_car_id': 'car2', 'proto_type': 'CAM', 'proto_version': 0, 'message_id': 46, 'generated_time': 2.3}, 'body': {'station_id': 0.6769776635293716, 'leader': null, 'speed': -1073741824.0, 'station_characteristics': {'mobile_its_station': false, 'private_its_station': false, 'physical_relevant_its_station': false}, 'reference_position': {'lane': -1073741824, 'position': [-1073741824.0, -1073741824.0, 0], 'elevation': 0, 'heading': 0}}}\\n'"", ""b'21:47:44.312330 IP 192.168.0.1.49524 > 192.168.0.255.9090: UDP, length 414\\nE.....@.@............t#..._.{'header': {'from_car_id': 'car1', 'proto_type': 'CAM', 'proto_version': 0, 'message_id': 45, 'generated_time': 2.3}, 'body': {'station_id': 0.5967463694782317, 'leader': null, 'speed': 5.0, 'station_characteristics': {'mobile_its_station': false, 'private_its_station': false, 'physical_relevant_its_station': false}, 'reference_position': {'lane': 1, 'position': [11.54, -1.6, 0], 'elevation': 0, 'heading': 0}}}\\n'""]"
car2,24,2.4,"(None, None)",None,-60,,2,[],"[""b'21:47:44.410797 IP 192.168.0.2.60757 > 192.168.0.255.9090: UDP, length 451\\nE.....@.@.+..........U#.....{'header': {'from_car_id': 'car2', 'proto_type': 'CAM', 'proto_version': 0, 'message_id': 48, 'generated_time': 2.4}, 'body': {'station_id': 0.9537110273114294, 'leader': null, 'speed': -1073741824.0, 'station_characteristics': {'mobile_its_station': false, 'private_its_station': false, 'physical_relevant_its_station': false}, 'reference_position': {'lane': -1073741824, 'position': [-1073741824.0, -1073741824.0, 0], 'elevation': 0, 'heading': 0}}}\\n'"", ""b'21:47:44.413364 IP 192.168.0.1.49524 > 192.168.0.255.9090: UDP, length 415\\nE.....@.@............t#...\\\\.{'header': {'from_car_id': 'car1', 'proto_type': 'CAM', 'proto_version': 0, 'message_id': 47, 'generated_time': 2.4}, 'body': {'station_id': 0.23943157639348223, 'leader': null, 'speed': 5.0, 'station_characteristics': {'mobile_its_station': false, 'private_its_station': false, 'physical_relevant_its_station': false}, 'reference_position': {'lane': 1, 'position': [12.04, -1.6, 0], 'elevation': 0, 'heading': 0}}}\\n'""]"
car2,25,2.5,"(None, None)",None,-60,,2,[],"[""b'21:47:44.509948 IP 192.168.0.2.60757 > 192.168.0.255.9090: UDP, length 452\\nE.....@.@.+..........U#....W{'header': {'from_car_id': 'car2', 'proto_type': 'CAM', 'proto_version': 0, 'message_id': 50, 'generated_time': 2.5}, 'body': {'station_id': 0.23962342395884062, 'leader': null, 'speed': -1073741824.0, 'station_characteristics': {'mobile_its_station': false, 'private_its_station': false, 'physical_relevant_its_station': false}, 'reference_position': {'lane': -1073741824, 'position': [-1073741824.0, -1073741824.0, 0], 'elevation': 0, 'heading': 0}}}\\n'"", ""b'E.....@.@..\\n.........t#...F.{'header': {'from_car_id': 'car1', 'proto_type': 'CAM', 'proto_version': 0, 'message_id': 49, 'generated_time': 2.5}, 'body': {'station_id': 0.09885025263947933, 'leader': null, 'speed': 5.0, 'station_characteristics': {'mobile_its_station': false, 'private_its_station': false, 'physical_relevant_its_station': false}, 'reference_position': {'lane': 1, 'position': [12.54, -1.6, 0], 'elevation': 0, 'heading': 0}}}\\n'""]"
car2,26,2.6,"(None, None)",None,-60,,2,[],"[""b'21:47:44.609439 IP 192.168.0.2.60757 > 192.168.0.255.9090: UDP, length 452\\nE.....@.@.*..........U#...#K{'header': {'from_car_id': 'car2', 'proto_type': 'CAM', 'proto_version': 0, 'message_id': 52, 'generated_time': 2.6}, 'body': {'station_id': 0.42635487734052036, 'leader': null, 'speed': -1073741824.0, 'station_characteristics': {'mobile_its_station': false, 'private_its_station': false, 'physical_relevant_its_station': false}, 'reference_position': {'lane': -1073741824, 'position': [-1073741824.0, -1073741824.0, 0], 'elevation': 0, 'heading': 0}}}\\n'"", ""b'21:47:44.614542 IP 192.168.0.1.49524 > 192.168.0.255.9090: UDP, length 414\\nE.....@.@............t#...b.{'header': {'from_car_id': 'car1', 'proto_type': 'CAM', 'proto_version': 0, 'message_id': 51, 'generated_time': 2.6}, 'body': {'station_id': 0.3099182369839526, 'leader': null, 'speed': 5.0, 'station_characteristics': {'mobile_its_station': false, 'private_its_station': false, 'physical_relevant_its_station': false}, 'reference_position': {'lane': 1, 'position': [13.04, -1.6, 0], 'elevation': 0, 'heading': 0}}}\\n'""]"
car2,27,2.7,"(None, None)",None,-60,,2,[],"[""b'21:47:44.742634 IP 192.168.0.2.60757 > 192.168.0.255.9090: UDP, length 451\\nE.....@.@.*..........U#.....{'header': {'from_car_id': 'car2', 'proto_type': 'CAM', 'proto_version': 0, 'message_id': 54, 'generated_time': 2.7}, 'body': {'station_id': 0.8934900625361255, 'leader': null, 'speed': -1073741824.0, 'station_characteristics': {'mobile_its_station': false, 'private_its_station': false, 'physical_relevant_its_station': false}, 'reference_position': {'lane': -1073741824, 'position': [-1073741824.0, -1073741824.0, 0], 'elevation': 0, 'heading': 0}}}\\n'"", ""b'21:47:44.747828 IP 192.168.0.1.49524 > 192.168.0.255.9090: UDP, length 414\\nE.....@.@............t#...s.{'header': {'from_car_id': 'car1', 'proto_type': 'CAM', 'proto_version': 0, 'message_id': 53, 'generated_time': 2.7}, 'body': {'station_id': 0.9173036040870526, 'leader': null, 'speed': 5.0, 'station_characteristics': {'mobile_its_station': false, 'private_its_station': false, 'physical_relevant_its_station': false}, 'reference_position': {'lane': 1, 'position': [13.54, -1.6, 0], 'elevation': 0, 'heading': 0}}}\\n'""]"
car2,28,2.8,"(None, None)",None,-60,,2,[],"[""b'21:47:44.809452 IP 192.168.0.2.60757 > 192.168.0.255.9090: UDP, length 451\\nE.....@.@.*..........U#.....{'header': {'from_car_id': 'car2', 'proto_type': 'CAM', 'proto_version': 0, 'message_id': 56, 'generated_time': 2.8}, 'body': {'station_id': 0.6250233624115606, 'leader': null, 'speed': -1073741824.0, 'station_characteristics': {'mobile_its_station': false, 'private_its_station': false, 'physical_relevant_its_station': false}, 'reference_position': {'lane': -1073741824, 'position': [-1073741824.0, -1073741824.0, 0], 'elevation': 0, 'heading': 0}}}\\n'"", ""b'21:47:44.813302 IP 192.168.0.1.49524 > 192.168.0.255.9090: UDP, length 415\\nE.....@.@............t#...O.{'header': {'from_car_id': 'car1', 'proto_type': 'CAM', 'proto_version': 0, 'message_id': 55, 'generated_time': 2.8}, 'body': {'station_id': 0.22222335891835032, 'leader': null, 'speed': 5.0, 'station_characteristics': {'mobile_its_station': false, 'private_its_station': false, 'physical_relevant_its_station': false}, 'reference_position': {'lane': 1, 'position': [14.04, -1.6, 0], 'elevation': 0, 'heading': 0}}}\\n'""]"
car2,29,2.9,"(None, None)",None,-60,,2,[],"[""b'21:47:44.952271 IP 192.168.0.2.60757 > 192.168.0.255.9090: UDP, length 451\\nE.....@.@.*..........U#.....{'header': {'from_car_id': 'car2', 'proto_type': 'CAM', 'proto_version': 0, 'message_id': 58, 'generated_time': 2.9}, 'body': {'station_id': 0.4664000507972088, 'leader': null, 'speed': -1073741824.0, 'station_characteristics': {'mobile_its_station': false, 'private_its_station': false, 'physical_relevant_its_station': false}, 'reference_position': {'lane': -1073741824, 'position': [-1073741824.0, -1073741824.0, 0], 'elevation': 0, 'heading': 0}}}\\n'"", ""b'21:47:44.956510 IP 192.168.0.1.49524 > 192.168.0.255.9090: UDP, length 427\\nE.....@.@............t#...xM{'header': {'from_car_id': 'car1', 'proto_type': 'CAM', 'proto_version': 0, 'message_id': 57, 'generated_time': 2.9}, 'body': {'station_id': 0.2969214673444761, 'leader': null, 'speed': 5.0, 'station_characteristics': {'mobile_its_station': false, 'private_its_station': false, 'physical_relevant_its_station': false}, 'reference_position': {'lane': 1, 'position': [14.540000000000001, -1.6, 0], 'elevation': 0, 'heading': 0}}}\\n'""]"
car2,30,3.0,"(None, None)",None,-60,,2,[],"[""b'21:47:45.009648 IP 192.168.0.2.60757 > 192.168.0.255.9090: UDP, length 451\\nE.....@.@.*..........U#.....{'header': {'from_car_id': 'car2', 'proto_type': 'CAM', 'proto_version': 0, 'message_id': 60, 'generated_time': 3.0}, 'body': {'station_id': 0.7221347365772277, 'leader': null, 'speed': -1073741824.0, 'station_characteristics': {'mobile_its_station': false, 'private_its_station': false, 'physical_relevant_its_station': false}, 'reference_position': {'lane': -1073741824, 'position': [-1073741824.0, -1073741824.0, 0], 'elevation': 0, 'heading': 0}}}\\n'"", ""b'21:47:45.012667 IP 192.168.0.1.49524 > 192.168.0.255.9090: UDP, length 426\\nE.....@.@............t#.....{'header': {'from_car_id': 'car1', 'proto_type': 'CAM', 'proto_version': 0, 'message_id': 59, 'generated_time': 3.0}, 'body': {'station_id': 0.555232711851271, 'leader': null, 'speed': 5.0, 'station_characteristics': {'mobile_its_station': false, 'private_its_station': false, 'physical_relevant_its_station': false}, 'reference_position': {'lane': 1, 'position': [15.039999999999997, -1.6, 0], 'elevation': 0, 'heading': 0}}}\\n'""]"
car2,31,3.1,"(None, None)",None,-60,,2,[],"[""b'21:47:45.113607 IP 192.168.0.2.60757 > 192.168.0.255.9090: UDP, length 451\\nE.....@.@.*..........U#.....{'header': {'from_car_id': 'car2', 'proto_type': 'CAM', 'proto_version': 0, 'message_id': 62, 'generated_time': 3.1}, 'body': {'station_id': 0.7411059956635319, 'leader': null, 'speed': -1073741824.0, 'station_characteristics': {'mobile_its_station': false, 'private_its_station': false, 'physical_relevant_its_station': false}, 'reference_position': {'lane': -1073741824, 'position': [-1073741824.0, -1073741824.0, 0], 'elevation': 0, 'heading': 0}}}\\n'"", ""b'21:47:45.114020 IP 192.168.0.1.49524 > 192.168.0.255.9090: UDP, length 415\\nE.....@.@............t#...Q.{'header': {'from_car_id': 'car1', 'proto_type': 'CAM', 'proto_version': 0, 'message_id': 61, 'generated_time': 3.1}, 'body': {'station_id': 0.31050762071735005, 'leader': null, 'speed': 5.0, 'station_characteristics': {'mobile_its_station': false, 'private_its_station': false, 'physical_relevant_its_station': false}, 'reference_position': {'lane': 1, 'position': [15.54, -1.6, 0], 'elevation': 0, 'heading': 0}}}\\n'""]"
car2,32,3.2,"(None, None)",None,-60,,2,[],"[""b'21:47:45.212185 IP 192.168.0.2.60757 > 192.168.0.255.9090: UDP, length 452\\nE.....@.@.*..........U#....U{'header': {'from_car_id': 'car2', 'proto_type': 'CAM', 'proto_version': 0, 'message_id': 64, 'generated_time': 3.2}, 'body': {'station_id': 0.48108929790100863, 'leader': null, 'speed': -1073741824.0, 'station_characteristics': {'mobile_its_station': false, 'private_its_station': false, 'physical_relevant_its_station': false}, 'reference_position': {'lane': -1073741824, 'position': [-1073741824.0, -1073741824.0, 0], 'elevation': 0, 'heading': 0}}}\\n'"", ""b'21:47:45.215017 IP 192.168.0.1.49524 > 192.168.0.255.9090: UDP, length 414\\nE.....@.@............t#...o.{'header': {'from_car_id': 'car1', 'proto_type': 'CAM', 'proto_version': 0, 'message_id': 63, 'generated_time': 3.2}, 'body': {'station_id': 0.8457131220591285, 'leader': null, 'speed': 5.0, 'station_characteristics': {'mobile_its_station': false, 'private_its_station': false, 'physical_relevant_its_station': false}, 'reference_position': {'lane': 1, 'position': [16.04, -1.6, 0], 'elevation': 0, 'heading': 0}}}\\n'""]"
car2,33,3.3,"(None, None)",None,-60,,2,[],"[""b'21:47:45.310601 IP 192.168.0.2.60757 > 192.168.0.255.9090: UDP, length 451\\nE.....@.@.*..........U#.....{'header': {'from_car_id': 'car2', 'proto_type': 'CAM', 'proto_version': 0, 'message_id': 66, 'generated_time': 3.3}, 'body': {'station_id': 0.6335492409609147, 'leader': null, 'speed': -1073741824.0, 'station_characteristics': {'mobile_its_station': false, 'private_its_station': false, 'physical_relevant_its_station': false}, 'reference_position': {'lane': -1073741824, 'position': [-1073741824.0, -1073741824.0, 0], 'elevation': 0, 'heading': 0}}}\\n'"", ""b'21:47:45.313072 IP 192.168.0.1.49524 > 192.168.0.255.9090: UDP, length 414\\nE.....@.@............t#...r.{'header': {'from_car_id': 'car1', 'proto_type': 'CAM', 'proto_version': 0, 'message_id': 65, 'generated_time': 3.3}, 'body': {'station_id': 0.3299804311561354, 'leader': null, 'speed': 5.0, 'station_characteristics': {'mobile_its_station': false, 'private_its_station': false, 'physical_relevant_its_station': false}, 'reference_position': {'lane': 1, 'position': [16.54, -1.6, 0], 'elevation': 0, 'heading': 0}}}\\n'""]"
car2,34,3.4,"(None, None)",None,-60,,2,[],"[""b'21:47:45.411143 IP 192.168.0.2.60757 > 192.168.0.255.9090: UDP, length 451\\nE....!@.@.*..........U#.....{'header': {'from_car_id': 'car2', 'proto_type': 'CAM', 'proto_version': 0, 'message_id': 68, 'generated_time': 3.4}, 'body': {'station_id': 0.7200141460489587, 'leader': null, 'speed': -1073741824.0, 'station_characteristics': {'mobile_its_station': false, 'private_its_station': false, 'physical_relevant_its_station': false}, 'reference_position': {'lane': -1073741824, 'position': [-1073741824.0, -1073741824.0, 0], 'elevation': 0, 'heading': 0}}}\\n'"", ""b'21:47:45.413538 IP 192.168.0.1.49524 > 192.168.0.255.9090: UDP, length 415\\nE.....@.@............t#...X.{'header': {'from_car_id': 'car1', 'proto_type': 'CAM', 'proto_version': 0, 'message_id': 67, 'generated_time': 3.4}, 'body': {'station_id': 0.20966121689960227, 'leader': null, 'speed': 5.0, 'station_characteristics': {'mobile_its_station': false, 'private_its_station': false, 'physical_relevant_its_station': false}, 'reference_position': {'lane': 1, 'position': [17.04, -1.6, 0], 'elevation': 0, 'heading': 0}}}\\n'""]"
car2,35,3.5,"(None, None)",None,-60,,2,[],"[""b'21:47:45.512264 IP 192.168.0.2.60757 > 192.168.0.255.9090: UDP, length 451\\nE....\\'@.@.*..........U#.....{'header': {'from_car_id': 'car2', 'proto_type': 'CAM', 'proto_version': 0, 'message_id': 70, 'generated_time': 3.5}, 'body': {'station_id': 0.8915451537837423, 'leader': null, 'speed': -1073741824.0, 'station_characteristics': {'mobile_its_station': false, 'private_its_station': false, 'physical_relevant_its_station': false}, 'reference_position': {'lane': -1073741824, 'position': [-1073741824.0, -1073741824.0, 0], 'elevation': 0, 'heading': 0}}}\\n'"", ""b'21:47:45.513404 IP 192.168.0.1.49524 > 192.168.0.255.9090: UDP, length 414\\nE....2@.@............t#...j.{'header': {'from_car_id': 'car1', 'proto_type': 'CAM', 'proto_version': 0, 'message_id': 69, 'generated_time': 3.5}, 'body': {'station_id': 0.5580319153595857, 'leader': null, 'speed': 5.0, 'station_characteristics': {'mobile_its_station': false, 'private_its_station': false, 'physical_relevant_its_station': false}, 'reference_position': {'lane': 1, 'position': [17.54, -1.6, 0], 'elevation': 0, 'heading': 0}}}\\n'""]"
car2,36,3.6,"(None, None)",None,-60,,2,[],"[""b'21:47:45.612989 IP 192.168.0.2.60757 > 192.168.0.255.9090: UDP, length 451\\nE....)@.@.*..........U#.....{'header': {'from_car_id': 'car2', 'proto_type': 'CAM', 'proto_version': 0, 'message_id': 72, 'generated_time': 3.6}, 'body': {'station_id': 0.8337013331870056, 'leader': null, 'speed': -1073741824.0, 'station_characteristics': {'mobile_its_station': false, 'private_its_station': false, 'physical_relevant_its_station': false}, 'reference_position': {'lane': -1073741824, 'position': [-1073741824.0, -1073741824.0, 0], 'elevation': 0, 'heading': 0}}}\\n'"", ""b'21:47:45.613299 IP 192.168.0.1.49524 > 192.168.0.255.9090: UDP, length 414\\nE....7@.@............t#...l.{'header': {'from_car_id': 'car1', 'proto_type': 'CAM', 'proto_version': 0, 'message_id': 71, 'generated_time': 3.6}, 'body': {'station_id': 0.3944255087409302, 'leader': null, 'speed': 5.0, 'station_characteristics': {'mobile_its_station': false, 'private_its_station': false, 'physical_relevant_its_station': false}, 'reference_position': {'lane': 1, 'position': [18.04, -1.6, 0], 'elevation': 0, 'heading': 0}}}\\n'""]"
car2,37,3.7,"(None, None)",None,-60,,2,[],"[""b'21:47:45.712592 IP 192.168.0.2.60757 > 192.168.0.255.9090: UDP, length 451\\nE....1@.@.*..........U#.....{'header': {'from_car_id': 'car2', 'proto_type': 'CAM', 'proto_version': 0, 'message_id': 74, 'generated_time': 3.7}, 'body': {'station_id': 0.7310670416468935, 'leader': null, 'speed': -1073741824.0, 'station_characteristics': {'mobile_its_station': false, 'private_its_station': false, 'physical_relevant_its_station': false}, 'reference_position': {'lane': -1073741824, 'position': [-1073741824.0, -1073741824.0, 0], 'elevation': 0, 'heading': 0}}}\\n'"", ""b'21:47:45.714428 IP 192.168.0.1.49524 > 192.168.0.255.9090: UDP, length 414\\nE....I@.@............t#...h.{'header': {'from_car_id': 'car1', 'proto_type': 'CAM', 'proto_version': 0, 'message_id': 73, 'generated_time': 3.7}, 'body': {'station_id': 0.8910110436001994, 'leader': null, 'speed': 5.0, 'station_characteristics': {'mobile_its_station': false, 'private_its_station': false, 'physical_relevant_its_station': false}, 'reference_position': {'lane': 1, 'position': [18.54, -1.6, 0], 'elevation': 0, 'heading': 0}}}\\n'""]"
car2,38,3.8,"(None, None)",None,-60,,2,[],"[""b'21:47:45.810514 IP 192.168.0.2.60757 > 192.168.0.255.9090: UDP, length 451\\nE....:@.@.*..........U#.....{'header': {'from_car_id': 'car2', 'proto_type': 'CAM', 'proto_version': 0, 'message_id': 76, 'generated_time': 3.8}, 'body': {'station_id': 0.8165171179727329, 'leader': null, 'speed': -1073741824.0, 'station_characteristics': {'mobile_its_station': false, 'private_its_station': false, 'physical_relevant_its_station': false}, 'reference_position': {'lane': -1073741824, 'position': [-1073741824.0, -1073741824.0, 0], 'elevation': 0, 'heading': 0}}}\\n'"", ""b'21:47:45.813124 IP 192.168.0.1.49524 > 192.168.0.255.9090: UDP, length 415\\nE....O@.@............t#...V.{'header': {'from_car_id': 'car1', 'proto_type': 'CAM', 'proto_version': 0, 'message_id': 75, 'generated_time': 3.8}, 'body': {'station_id': 0.35316083302398027, 'leader': null, 'speed': 5.0, 'station_characteristics': {'mobile_its_station': false, 'private_its_station': false, 'physical_relevant_its_station': false}, 'reference_position': {'lane': 1, 'position': [19.04, -1.6, 0], 'elevation': 0, 'heading': 0}}}\\n'""]"
