CAR,STEP,TIME,LEADER_AND_DISTANCE,DRIVING_DISTANCE,WIFI_SIGNAL_STRENGTH,MESH_SIGNAL_STRENGTH,DATAGRAM_COUNT,BYTES_COUNT,WIFI_DATAGRAM,MESH_DATAGRAM
car2,1,0.1,"(None, None)",None,-77.0,,0,0,[],[]
car2,2,0.2,"(None, None)",None,-77.0,,0,0,[],[]
car2,3,0.3,"(None, None)",None,-77.0,,0,0,[],[]
car2,4,0.4,"(None, None)",None,-77.0,,0,0,[],[]
car2,5,0.5,"(None, None)",None,-77.0,,0,0,[],[]
car2,6,0.6,"(None, None)",None,-77.0,,0,0,[],[]
car2,7,0.7,"(None, None)",None,-77.0,,0,0,[],[]
car2,8,0.8,"(None, None)",None,-77.0,,0,0,[],[]
car2,9,0.9,"(None, None)",None,-77.0,,0,0,[],[]
car2,10,1.0,"(None, None)",None,-77.0,,0,0,[],[]
car2,11,1.1,"(None, None)",None,-77.0,,0,0,[],[]
car2,12,1.2,"(None, None)",None,-77.0,,0,0,[],[]
car2,13,1.3,"(None, None)",None,-77.0,,0,0,[],[]
car2,14,1.4,"(None, None)",None,-77.0,,0,0,[],[]
car2,15,1.5,"(None, None)",None,-77.0,,0,0,[],[]
car2,16,1.6,"(None, None)",None,-77.0,,0,0,[],[]
car2,17,1.7,"(None, None)",None,-77.0,,0,0,[],[]
car2,18,1.8,"(None, None)",None,-77.0,,0,0,[],[]
car2,19,1.9,"(None, None)",None,-77.0,,0,0,[],[]
car2,20,2.0,"(None, None)",None,-77.0,,0,0,[],[]
car2,21,2.1,"(None, None)",None,-77.0,,0,0,[],[]
car2,22,2.2,"(None, None)",0.0259999999999998,-76.0,,0,0,[],[]
car2,23,2.3,"(None, None)",0.0779999999999994,-76.0,,0,0,[],[]
car2,24,2.4,"(None, None)",0.1559999999999997,-76.0,,0,0,[],[]
car2,25,2.5,"(None, None)",0.2599999999999998,-76.0,,0,0,[],[]
car2,26,2.6,"(None, None)",0.3899999999999997,-76.0,,0,0,[],[]
car2,27,2.7,"(None, None)",0.5459999999999994,-76.0,,0,0,[],[]
car2,28,2.8,"(None, None)",0.7279999999999998,-76.0,,0,0,[],[]
car2,29,2.9,"(None, None)",0.9359999999999999,-76.0,,0,0,[],[]
car2,30,3.0,"(None, None)",1.17,-76.0,,0,0,[],[]
car2,31,3.1,"(None, None)",1.4299999999999997,-76.0,,0,0,[],[]
car2,32,3.2,"(None, None)",1.7159999999999993,-76.0,,0,0,[],[]
car2,33,3.3,"(None, None)",2.0279999999999996,-76.0,,0,0,[],[]
car2,34,3.4,"(None, None)",2.3659999999999997,-76.0,,0,0,[],[]
car2,35,3.5,"(None, None)",2.7299999999999995,-76.0,,0,0,[],[]
car2,36,3.6,"(None, None)",3.119999999999999,-76.0,,0,0,[],[]
car2,37,3.7,"(None, None)",3.5359999999999996,-76.0,,0,0,[],[]
car2,38,3.8,"(None, None)",3.9779999999999998,-76.0,,0,0,[],[]
car2,39,3.9,"(None, None)",4.446,-76.0,,0,0,[],[]
car2,40,4.0,"(None, None)",4.9399999999999995,-76.0,,0,0,[],[]
car2,41,4.1,"(None, None)",5.459999999999999,-75.0,,0,0,[],[]
car2,42,4.2,"(None, None)",6.0059999999999985,-75.0,,0,0,[],[]
car2,43,4.3,"(None, None)",6.577999999999998,-75.0,,0,0,[],[]
car2,44,4.4,"(None, None)",7.175999999999997,-75.0,,0,0,[],[]
car2,45,4.5,"(None, None)",7.799999999999995,-75.0,,0,0,[],[]
car2,46,4.6,"(None, None)",8.449999999999996,-75.0,,0,0,[],[]
car2,47,4.7,"(None, None)",9.125999999999996,-75.0,,0,0,[],[]
car2,48,4.8,"(None, None)",9.827999999999996,-75.0,,0,0,[],[]
car2,49,4.9,"(None, None)",10.555999999999996,-74.0,,0,0,[],[]
car2,50,5.0,"(None, None)",11.309999999999997,-74.0,,0,0,[],[]
car2,51,5.1,"(None, None)",12.089999999999998,-74.0,,0,0,[],[]
car2,52,5.2,"(None, None)",12.895999999999999,-74.0,,0,0,[],[]
car2,53,5.3,"(None, None)",13.728,-74.0,,0,0,[],[]
car2,54,5.4,"(None, None)",14.586,-74.0,,0,0,[],[]
car2,55,5.5,"(None, None)",15.47,-73.0,,0,0,[],[]
car2,56,5.6,"(None, None)",16.380000000000003,-73.0,,0,0,[],[]
car2,57,5.7,"(None, None)",17.316000000000003,-73.0,,0,0,[],[]
car2,58,5.8,"(None, None)",18.278,-73.0,,0,0,[],[]
car2,59,5.9,"(None, None)",19.266,-73.0,,0,0,[],[]
car2,60,6.0,"(None, None)",20.28,-72.0,,0,0,[],[]
car2,61,6.1,"('obs', 67.28)",21.32,-72.0,,0,0,[],[]
car2,62,6.2,"('obs', 66.214)",22.385999999999996,-72.0,,0,0,[],[]
car2,63,6.3,"('obs', 65.12200000000001)",23.477999999999994,-72.0,,0,0,[],[]
car2,64,6.4,"('obs', 64.004)",24.595999999999997,-71.0,,0,0,[],[]
car2,65,6.5,"('obs', 62.860000000000014)",25.739999999999995,-71.0,,0,0,[],[]
car2,66,6.6,"('obs', 61.69000000000001)",26.90999999999999,-71.0,,0,0,[],[]
car2,67,6.7,"('obs', 60.494000000000014)",28.105999999999987,-71.0,,0,0,[],[]
car2,68,6.8,"('obs', 59.27200000000001)",29.32799999999999,-70.0,,0,0,[],[]
car2,69,6.9,"('obs', 58.024000000000015)",30.575999999999986,-70.0,,0,0,[],[]
car2,70,7.0,"('obs', 56.750000000000014)",31.849999999999987,-70.0,,0,0,[],[]
car2,71,7.1,"('obs', 55.45000000000002)",33.149999999999984,-69.0,,0,0,[],[]
car2,72,7.2,"('obs', 54.12400000000002)",34.475999999999985,-69.0,,0,0,[],[]
car2,73,7.3,"('obs', 52.77200000000002)",35.82799999999998,-69.0,,0,0,[],[]
car2,74,7.4,"('obs', 51.39400000000002)",37.20599999999998,-68.0,,0,0,[],[]
car2,75,7.5,"('obs', 49.990564301524245)",38.60943569847576,-68.0,,0,0,[],[]
car2,76,7.6,"('obs', 48.58712860304847)",40.01287139695153,-68.0,,0,0,[],[]
car2,77,7.7,"('obs', 47.183692904572695)",41.41630709542731,-67.0,,0,0,[],[]
car2,78,7.8,"('obs', 45.78025720609692)",42.81974279390308,-67.0,,0,0,[],[]
car2,79,7.9,"('obs', 44.376821507621145)",44.22317849237886,-67.0,,0,0,[],[]
car2,80,8.0,"(None, None)",45.62661419085463,-66.0,,0,0,[],[]
car2,81,8.1,"(None, None)",47.03004988933041,-66.0,,0,0,[],[]
car2,82,8.2,"(None, None)",48.43348558780618,-65.0,,0,0,[],[]
car2,83,8.3,"(None, None)",49.83692128628195,-65.0,,0,0,[],[]
car2,84,8.4,"(None, None)",51.240356984757724,-64.0,,0,0,[],[]
car2,85,8.5,"(None, None)",52.6437926832335,-64.0,,0,0,[],[]
car2,86,8.6,"(None, None)",54.047228381709274,-64.0,,0,0,[],[]
car2,87,8.7,"(None, None)",55.43414767216654,-63.0,,0,0,[],[]
car2,88,8.8,"(None, None)",56.78639398036238,-63.0,,0,0,[],[]
car2,89,8.9,"(None, None)",58.10402490394283,-62.0,,0,0,[],[]
car2,90,9.0,"(None, None)",59.38731372226012,-62.0,,0,0,[],[]
car2,91,9.1,"(None, None)",60.63654848652336,-62.0,,0,0,[],[]
car2,92,9.2,"(None, None)",61.85202014904976,-61.0,,0,0,[],[]
car2,93,9.3,"(None, None)",63.03374181157615,-61.0,,0,0,[],[]
car2,94,9.4,"(None, None)",64.18203490267398,-60.0,,0,0,[],[]
car2,95,9.5,"(None, None)",65.29723975847769,-60.0,,0,0,[],[]
car2,96,9.6,"(None, None)",66.37964447146364,-60.0,,1,453,"[""b'03:51:39.296193 IP 192.168.1.2.44383 > 192.168.1.255.9090: UDP, length 453\\nE....]@.@..\\\\........._#.....{'header': {'from_car_id': 'car1', 'proto_type': 'DENM', 'proto_version': 0, 'message_id': 13, 'generated_time': 9.6}, 'body': {'management': {'station_id': 0, 'sequence_id': 0, 'data_version': 0, 'expirity_time': 0, 'frequency': 0, 'reliablity': 100, 'is_negation': false}, 'situation': {'cause': 0, 'subcause': 0, 'severity': 2}, 'location': {'lane': 0, 'position': [96.7988091554733, -1.6, 0], 'elevation': 0, 'trace_id': 0, 'way_point': [0, 0, 0]}}}\\n'""]",[]
car2,97,9.7,"(None, None)",67.42932191172231,-59.0,,1,454,"[""b'03:51:39.949676 IP 192.168.1.2.44383 > 192.168.1.255.9090: UDP, length 454\\nE.....@.@............_#....\\t{'header': {'from_car_id': 'car1', 'proto_type': 'DENM', 'proto_version': 0, 'message_id': 14, 'generated_time': 9.7}, 'body': {'management': {'station_id': 0, 'sequence_id': 0, 'data_version': 0, 'expirity_time': 0, 'frequency': 0, 'reliablity': 100, 'is_negation': false}, 'situation': {'cause': 0, 'subcause': 0, 'severity': 2}, 'location': {'lane': 0, 'position': [98.10211602559492, -1.6, 0], 'elevation': 0, 'trace_id': 0, 'way_point': [0, 0, 0]}}}\\n'""]",[]
car2,98,9.8,"('car1', 18.458767293735566)",68.44665560198099,-59.0,,1,454,"[""b'03:51:40.247284 IP 192.168.1.2.44383 > 192.168.1.255.9090: UDP, length 454\\nE....8@.@............_#...}.{'header': {'from_car_id': 'car1', 'proto_type': 'DENM', 'proto_version': 0, 'message_id': 15, 'generated_time': 9.8}, 'body': {'management': {'station_id': 0, 'sequence_id': 0, 'data_version': 0, 'expirity_time': 0, 'frequency': 0, 'reliablity': 100, 'is_negation': false}, 'situation': {'cause': 0, 'subcause': 0, 'severity': 2}, 'location': {'lane': 0, 'position': [99.40542289571655, -1.6, 0], 'elevation': 0, 'trace_id': 0, 'way_point': [0, 0, 0]}}}\\n'""]",[]
car2,99,9.9,"(None, None)",69.48998929223967,-57.0,,1,455,"[""b'03:51:41.098435 IP 192.168.1.2.44383 > 192.168.1.255.9090: UDP, length 455\\nE.....@.@............_#.....{'header': {'from_car_id': 'car1', 'proto_type': 'DENM', 'proto_version': 0, 'message_id': 16, 'generated_time': 9.9}, 'body': {'management': {'station_id': 0, 'sequence_id': 0, 'data_version': 0, 'expirity_time': 0, 'frequency': 0, 'reliablity': 100, 'is_negation': false}, 'situation': {'cause': 0, 'subcause': 0, 'severity': 2}, 'location': {'lane': 0, 'position': [100.60872976583819, -1.6, 0], 'elevation': 0, 'trace_id': 0, 'way_point': [0, 0, 0]}}}\\n'""]",[]
car2,100,10.0,"('car1', 18.952713653461473)",70.55932298249834,-57.0,,1,456,"[""b'03:51:41.349734 IP 192.168.1.2.44383 > 192.168.1.255.9090: UDP, length 456\\nE.....@.@............_#....z{'header': {'from_car_id': 'car1', 'proto_type': 'DENM', 'proto_version': 0, 'message_id': 17, 'generated_time': 10.0}, 'body': {'management': {'station_id': 0, 'sequence_id': 0, 'data_version': 0, 'expirity_time': 0, 'frequency': 0, 'reliablity': 100, 'is_negation': false}, 'situation': {'cause': 0, 'subcause': 0, 'severity': 2}, 'location': {'lane': 0, 'position': [101.91203663595981, -1.6, 0], 'elevation': 0, 'trace_id': 0, 'way_point': [0, 0, 0]}}}\\n'""]",[]
car2,101,10.1,"('car1', 19.16068683332442)",71.65465667275703,-57.0,,1,456,"[""b'03:51:41.751074 IP 192.168.1.2.44383 > 192.168.1.255.9090: UDP, length 456\\nE.....@.@............_#.....{'header': {'from_car_id': 'car1', 'proto_type': 'DENM', 'proto_version': 0, 'message_id': 18, 'generated_time': 10.1}, 'body': {'management': {'station_id': 0, 'sequence_id': 0, 'data_version': 0, 'expirity_time': 0, 'frequency': 0, 'reliablity': 100, 'is_negation': false}, 'situation': {'cause': 0, 'subcause': 0, 'severity': 2}, 'location': {'lane': 0, 'position': [103.21534350608144, -1.6, 0], 'elevation': 0, 'trace_id': 0, 'way_point': [0, 0, 0]}}}\\n'""]",[]
car2,102,10.2,"('car1', 19.342660013187373)",72.7759903630157,-56.0,,1,456,"[""b'03:51:42.150981 IP 192.168.1.2.44383 > 192.168.1.255.9090: UDP, length 456\\nE.....@.@............_#....}{'header': {'from_car_id': 'car1', 'proto_type': 'DENM', 'proto_version': 0, 'message_id': 19, 'generated_time': 10.2}, 'body': {'management': {'station_id': 0, 'sequence_id': 0, 'data_version': 0, 'expirity_time': 0, 'frequency': 0, 'reliablity': 100, 'is_negation': false}, 'situation': {'cause': 0, 'subcause': 0, 'severity': 2}, 'location': {'lane': 0, 'position': [104.51865037620307, -1.6, 0], 'elevation': 0, 'trace_id': 0, 'way_point': [0, 0, 0]}}}\\n'""]",[]
car2,103,10.3,"('car1', 19.498633193050324)",73.92332405327437,-56.0,,1,455,"[""b'03:51:42.501942 IP 192.168.1.2.44383 > 192.168.1.255.9090: UDP, length 455\\nE.....@.@............_#...#D{'header': {'from_car_id': 'car1', 'proto_type': 'DENM', 'proto_version': 0, 'message_id': 20, 'generated_time': 10.3}, 'body': {'management': {'station_id': 0, 'sequence_id': 0, 'data_version': 0, 'expirity_time': 0, 'frequency': 0, 'reliablity': 100, 'is_negation': false}, 'situation': {'cause': 0, 'subcause': 0, 'severity': 2}, 'location': {'lane': 0, 'position': [105.8219572463247, -1.6, 0], 'elevation': 0, 'trace_id': 0, 'way_point': [0, 0, 0]}}}\\n'""]",[]
car2,104,10.4,"('car1', 19.628606372913275)",75.09665774353306,-55.0,,2,911,"[""b'03:51:42.954975 IP 192.168.1.2.44383 > 192.168.1.255.9090: UDP, length 456\\nE....\\\\@.@..Z........._#.....{'header': {'from_car_id': 'car1', 'proto_type': 'DENM', 'proto_version': 0, 'message_id': 21, 'generated_time': 10.4}, 'body': {'management': {'station_id': 0, 'sequence_id': 0, 'data_version': 0, 'expirity_time': 0, 'frequency': 0, 'reliablity': 100, 'is_negation': false}, 'situation': {'cause': 0, 'subcause': 0, 'severity': 2}, 'location': {'lane': 0, 'position': [107.12526411644632, -1.6, 0], 'elevation': 0, 'trace_id': 0, 'way_point': [0, 0, 0]}}}\\n'"", ""b'03:51:42.979233 IP 192.168.1.3.33393 > 192.168.1.255.9090: UDP, length 455\\nE....n@.@..H.........q#...B3{'header': {'from_car_id': 'car2', 'proto_type': 'DENM', 'proto_version': 0, 'message_id': 22, 'generated_time': 10.4}, 'body': {'management': {'station_id': 0, 'sequence_id': 0, 'data_version': 0, 'expirity_time': 0, 'frequency': 0, 'reliablity': 100, 'is_negation': false}, 'situation': {'cause': 0, 'subcause': 0, 'severity': 2}, 'location': {'lane': 0, 'position': [80.09665774353306, -1.6, 0], 'elevation': 0, 'trace_id': 0, 'way_point': [0, 0, 0]}}}\\n'""]",[]
car2,105,10.5,"('car1', 19.732579552776226)",76.29599143379173,-55.0,,2,911,"[""b'03:51:43.249584 IP 192.168.1.3.33393 > 192.168.1.255.9090: UDP, length 455\\nE.....@.@............q#...F#{'header': {'from_car_id': 'car2', 'proto_type': 'DENM', 'proto_version': 0, 'message_id': 24, 'generated_time': 10.5}, 'body': {'management': {'station_id': 0, 'sequence_id': 0, 'data_version': 0, 'expirity_time': 0, 'frequency': 0, 'reliablity': 100, 'is_negation': false}, 'situation': {'cause': 0, 'subcause': 0, 'severity': 2}, 'location': {'lane': 0, 'position': [81.29599143379173, -1.6, 0], 'elevation': 0, 'trace_id': 0, 'way_point': [0, 0, 0]}}}\\n'"", ""b'03:51:43.251909 IP 192.168.1.2.44383 > 192.168.1.255.9090: UDP, length 456\\nE.....@.@............_#....v{'header': {'from_car_id': 'car1', 'proto_type': 'DENM', 'proto_version': 0, 'message_id': 23, 'generated_time': 10.5}, 'body': {'management': {'station_id': 0, 'sequence_id': 0, 'data_version': 0, 'expirity_time': 0, 'frequency': 0, 'reliablity': 100, 'is_negation': false}, 'situation': {'cause': 0, 'subcause': 0, 'severity': 2}, 'location': {'lane': 0, 'position': [108.42857098656795, -1.6, 0], 'elevation': 0, 'trace_id': 0, 'way_point': [0, 0, 0]}}}\\n'""]",[]
car2,106,10.6,"('car1', 19.810552732639174)",77.5213251240504,-54.0,,2,910,"[""b'03:51:43.502746 IP 192.168.1.3.33393 > 192.168.1.255.9090: UDP, length 454\\nE.....@.@............q#... .{'header': {'from_car_id': 'car2', 'proto_type': 'DENM', 'proto_version': 0, 'message_id': 26, 'generated_time': 10.6}, 'body': {'management': {'station_id': 0, 'sequence_id': 0, 'data_version': 0, 'expirity_time': 0, 'frequency': 0, 'reliablity': 100, 'is_negation': false}, 'situation': {'cause': 0, 'subcause': 0, 'severity': 2}, 'location': {'lane': 0, 'position': [82.5213251240504, -1.6, 0], 'elevation': 0, 'trace_id': 0, 'way_point': [0, 0, 0]}}}\\n'"", ""b'03:51:43.503233 IP 192.168.1.2.44383 > 192.168.1.255.9090: UDP, length 456\\nE.....@.@............_#....h{'header': {'from_car_id': 'car1', 'proto_type': 'DENM', 'proto_version': 0, 'message_id': 25, 'generated_time': 10.6}, 'body': {'management': {'station_id': 0, 'sequence_id': 0, 'data_version': 0, 'expirity_time': 0, 'frequency': 0, 'reliablity': 100, 'is_negation': false}, 'situation': {'cause': 0, 'subcause': 0, 'severity': 2}, 'location': {'lane': 0, 'position': [109.73187785668958, -1.6, 0], 'elevation': 0, 'trace_id': 0, 'way_point': [0, 0, 0]}}}\\n'""]",[]
car2,107,10.7,"('car1', 19.862525912502125)",78.77265881430908,-54.0,,2,911,"[""b'03:51:43.902014 IP 192.168.1.3.33393 > 192.168.1.255.9090: UDP, length 455\\nE.....@.@............q#...7.{'header': {'from_car_id': 'car2', 'proto_type': 'DENM', 'proto_version': 0, 'message_id': 28, 'generated_time': 10.7}, 'body': {'management': {'station_id': 0, 'sequence_id': 0, 'data_version': 0, 'expirity_time': 0, 'frequency': 0, 'reliablity': 100, 'is_negation': false}, 'situation': {'cause': 0, 'subcause': 0, 'severity': 2}, 'location': {'lane': 0, 'position': [83.77265881430908, -1.6, 0], 'elevation': 0, 'trace_id': 0, 'way_point': [0, 0, 0]}}}\\n'"", ""b'03:51:43.904898 IP 192.168.1.2.44383 > 192.168.1.255.9090: UDP, length 456\\nE.....@.@............_#.....{'header': {'from_car_id': 'car1', 'proto_type': 'DENM', 'proto_version': 0, 'message_id': 27, 'generated_time': 10.7}, 'body': {'management': {'station_id': 0, 'sequence_id': 0, 'data_version': 0, 'expirity_time': 0, 'frequency': 0, 'reliablity': 100, 'is_negation': false}, 'situation': {'cause': 0, 'subcause': 0, 'severity': 2}, 'location': {'lane': 0, 'position': [111.03518472681121, -1.6, 0], 'elevation': 0, 'trace_id': 0, 'way_point': [0, 0, 0]}}}\\n'""]",[]
car2,108,10.8,"('car1', 19.888499092365073)",80.04999250456777,-54.0,,2,911,"[""b'03:51:44.151905 IP 192.168.1.3.33393 > 192.168.1.255.9090: UDP, length 455\\nE.....@.@............q#...F.{'header': {'from_car_id': 'car2', 'proto_type': 'DENM', 'proto_version': 0, 'message_id': 30, 'generated_time': 10.8}, 'body': {'management': {'station_id': 0, 'sequence_id': 0, 'data_version': 0, 'expirity_time': 0, 'frequency': 0, 'reliablity': 100, 'is_negation': false}, 'situation': {'cause': 0, 'subcause': 0, 'severity': 2}, 'location': {'lane': 0, 'position': [85.04999250456777, -1.6, 0], 'elevation': 0, 'trace_id': 0, 'way_point': [0, 0, 0]}}}\\n'"", ""b'03:51:44.155080 IP 192.168.1.2.44383 > 192.168.1.255.9090: UDP, length 456\\nE.....@.@............_#....u{'header': {'from_car_id': 'car1', 'proto_type': 'DENM', 'proto_version': 0, 'message_id': 29, 'generated_time': 10.8}, 'body': {'management': {'station_id': 0, 'sequence_id': 0, 'data_version': 0, 'expirity_time': 0, 'frequency': 0, 'reliablity': 100, 'is_negation': false}, 'situation': {'cause': 0, 'subcause': 0, 'severity': 2}, 'location': {'lane': 0, 'position': [112.33849159693284, -1.6, 0], 'elevation': 0, 'trace_id': 0, 'way_point': [0, 0, 0]}}}\\n'""]",[]
car2,109,10.9,"('car1', 19.88847227222802)",81.35332619482644,-53.0,,2,911,"[""b'03:51:46.567456 IP 192.168.1.3.33393 > 192.168.1.255.9090: UDP, length 455\\nE.....@.@............q#...<1{'header': {'from_car_id': 'car2', 'proto_type': 'DENM', 'proto_version': 0, 'message_id': 32, 'generated_time': 10.9}, 'body': {'management': {'station_id': 0, 'sequence_id': 0, 'data_version': 0, 'expirity_time': 0, 'frequency': 0, 'reliablity': 100, 'is_negation': false}, 'situation': {'cause': 0, 'subcause': 0, 'severity': 2}, 'location': {'lane': 0, 'position': [86.35332619482644, -1.6, 0], 'elevation': 0, 'trace_id': 0, 'way_point': [0, 0, 0]}}}\\n'"", ""b'03:51:46.569923 IP 192.168.1.2.44383 > 192.168.1.255.9090: UDP, length 456\\nE....h@.@..N........._#....q{'header': {'from_car_id': 'car1', 'proto_type': 'DENM', 'proto_version': 0, 'message_id': 31, 'generated_time': 10.9}, 'body': {'management': {'station_id': 0, 'sequence_id': 0, 'data_version': 0, 'expirity_time': 0, 'frequency': 0, 'reliablity': 100, 'is_negation': false}, 'situation': {'cause': 0, 'subcause': 0, 'severity': 2}, 'location': {'lane': 0, 'position': [113.64179846705446, -1.6, 0], 'elevation': 0, 'trace_id': 0, 'way_point': [0, 0, 0]}}}\\n'""]",[]
car2,110,11.0,"('car1', 19.862445452090974)",82.68265988508512,-53.0,,2,911,"[""b'03:51:46.666696 IP 192.168.1.3.33393 > 192.168.1.255.9090: UDP, length 455\\nE.....@.@............q#...E {'header': {'from_car_id': 'car2', 'proto_type': 'DENM', 'proto_version': 0, 'message_id': 34, 'generated_time': 11.0}, 'body': {'management': {'station_id': 0, 'sequence_id': 0, 'data_version': 0, 'expirity_time': 0, 'frequency': 0, 'reliablity': 100, 'is_negation': false}, 'situation': {'cause': 0, 'subcause': 0, 'severity': 2}, 'location': {'lane': 0, 'position': [87.68265988508512, -1.6, 0], 'elevation': 0, 'trace_id': 0, 'way_point': [0, 0, 0]}}}\\n'"", ""b'03:51:46.671769 IP 192.168.1.2.44383 > 192.168.1.255.9090: UDP, length 456\\nE....v@.@..@........._#....w{'header': {'from_car_id': 'car1', 'proto_type': 'DENM', 'proto_version': 0, 'message_id': 33, 'generated_time': 11.0}, 'body': {'management': {'station_id': 0, 'sequence_id': 0, 'data_version': 0, 'expirity_time': 0, 'frequency': 0, 'reliablity': 100, 'is_negation': false}, 'situation': {'cause': 0, 'subcause': 0, 'severity': 2}, 'location': {'lane': 0, 'position': [114.94510533717609, -1.6, 0], 'elevation': 0, 'trace_id': 0, 'way_point': [0, 0, 0]}}}\\n'""]",[]
car2,111,11.1,"('car1', 19.810418631953922)",84.03799357534379,-53.0,,2,911,"[""b'03:51:46.766401 IP 192.168.1.3.33393 > 192.168.1.255.9090: UDP, length 455\\nE.....@.@............q#...C.{'header': {'from_car_id': 'car2', 'proto_type': 'DENM', 'proto_version': 0, 'message_id': 36, 'generated_time': 11.1}, 'body': {'management': {'station_id': 0, 'sequence_id': 0, 'data_version': 0, 'expirity_time': 0, 'frequency': 0, 'reliablity': 100, 'is_negation': false}, 'situation': {'cause': 0, 'subcause': 0, 'severity': 2}, 'location': {'lane': 0, 'position': [89.03799357534379, -1.6, 0], 'elevation': 0, 'trace_id': 0, 'way_point': [0, 0, 0]}}}\\n'"", ""b'03:51:46.770517 IP 192.168.1.2.44383 > 192.168.1.255.9090: UDP, length 456\\nE....z@.@..<........._#.....{'header': {'from_car_id': 'car1', 'proto_type': 'DENM', 'proto_version': 0, 'message_id': 35, 'generated_time': 11.1}, 'body': {'management': {'station_id': 0, 'sequence_id': 0, 'data_version': 0, 'expirity_time': 0, 'frequency': 0, 'reliablity': 100, 'is_negation': false}, 'situation': {'cause': 0, 'subcause': 0, 'severity': 2}, 'location': {'lane': 0, 'position': [116.24841220729772, -1.6, 0], 'elevation': 0, 'trace_id': 0, 'way_point': [0, 0, 0]}}}\\n'""]",[]
car2,112,11.2,"('car1', 19.732391811816875)",85.41932726560248,-52.0,,2,911,"[""b'03:51:46.867359 IP 192.168.1.3.33393 > 192.168.1.255.9090: UDP, length 455\\nE.....@.@............q#...C0{'header': {'from_car_id': 'car2', 'proto_type': 'DENM', 'proto_version': 0, 'message_id': 38, 'generated_time': 11.2}, 'body': {'management': {'station_id': 0, 'sequence_id': 0, 'data_version': 0, 'expirity_time': 0, 'frequency': 0, 'reliablity': 100, 'is_negation': false}, 'situation': {'cause': 0, 'subcause': 0, 'severity': 2}, 'location': {'lane': 0, 'position': [90.41932726560248, -1.6, 0], 'elevation': 0, 'trace_id': 0, 'way_point': [0, 0, 0]}}}\\n'"", ""b'03:51:46.870553 IP 192.168.1.2.44383 > 192.168.1.255.9090: UDP, length 456\\nE.....@.@..0........._#....g{'header': {'from_car_id': 'car1', 'proto_type': 'DENM', 'proto_version': 0, 'message_id': 37, 'generated_time': 11.2}, 'body': {'management': {'station_id': 0, 'sequence_id': 0, 'data_version': 0, 'expirity_time': 0, 'frequency': 0, 'reliablity': 100, 'is_negation': false}, 'situation': {'cause': 0, 'subcause': 0, 'severity': 2}, 'location': {'lane': 0, 'position': [117.55171907741934, -1.6, 0], 'elevation': 0, 'trace_id': 0, 'way_point': [0, 0, 0]}}}\\n'""]",[]
car2,113,11.3,"('car1', 19.632262983462724)",86.82276296407824,-52.0,,2,911,"[""b'03:51:46.967675 IP 192.168.1.3.33393 > 192.168.1.255.9090: UDP, length 455\\nE.....@.@............q#...N'{'header': {'from_car_id': 'car2', 'proto_type': 'DENM', 'proto_version': 0, 'message_id': 40, 'generated_time': 11.3}, 'body': {'management': {'station_id': 0, 'sequence_id': 0, 'data_version': 0, 'expirity_time': 0, 'frequency': 0, 'reliablity': 100, 'is_negation': false}, 'situation': {'cause': 0, 'subcause': 0, 'severity': 2}, 'location': {'lane': 0, 'position': [91.82276296407824, -1.6, 0], 'elevation': 0, 'trace_id': 0, 'way_point': [0, 0, 0]}}}\\n'"", ""b'03:51:46.971275 IP 192.168.1.2.44383 > 192.168.1.255.9090: UDP, length 456\\nE.....@.@............_#....z{'header': {'from_car_id': 'car1', 'proto_type': 'DENM', 'proto_version': 0, 'message_id': 39, 'generated_time': 11.3}, 'body': {'management': {'station_id': 0, 'sequence_id': 0, 'data_version': 0, 'expirity_time': 0, 'frequency': 0, 'reliablity': 100, 'is_negation': false}, 'situation': {'cause': 0, 'subcause': 0, 'severity': 2}, 'location': {'lane': 0, 'position': [118.85502594754097, -1.6, 0], 'elevation': 0, 'trace_id': 0, 'way_point': [0, 0, 0]}}}\\n'""]",[]
car2,114,11.4,"('car1', 19.53213415510858)",88.22619866255403,-52.0,,2,910,"[""b'03:51:47.068826 IP 192.168.1.3.33393 > 192.168.1.255.9090: UDP, length 455\\nE.....@.@............q#...K({'header': {'from_car_id': 'car2', 'proto_type': 'DENM', 'proto_version': 0, 'message_id': 42, 'generated_time': 11.4}, 'body': {'management': {'station_id': 0, 'sequence_id': 0, 'data_version': 0, 'expirity_time': 0, 'frequency': 0, 'reliablity': 100, 'is_negation': false}, 'situation': {'cause': 0, 'subcause': 0, 'severity': 2}, 'location': {'lane': 0, 'position': [93.22619866255403, -1.6, 0], 'elevation': 0, 'trace_id': 0, 'way_point': [0, 0, 0]}}}\\n'"", ""b'03:51:47.074859 IP 192.168.1.2.44383 > 192.168.1.255.9090: UDP, length 455\\nE.....@.@............_#....J{'header': {'from_car_id': 'car1', 'proto_type': 'DENM', 'proto_version': 0, 'message_id': 41, 'generated_time': 11.4}, 'body': {'management': {'station_id': 0, 'sequence_id': 0, 'data_version': 0, 'expirity_time': 0, 'frequency': 0, 'reliablity': 100, 'is_negation': false}, 'situation': {'cause': 0, 'subcause': 0, 'severity': 2}, 'location': {'lane': 0, 'position': [120.1583328176626, -1.6, 0], 'elevation': 0, 'trace_id': 0, 'way_point': [0, 0, 0]}}}\\n'""]",[]
car2,115,11.5,"('car1', 19.432005326754428)",89.62963436102979,-51.0,,2,911,"[""b'03:51:47.168000 IP 192.168.1.3.33393 > 192.168.1.255.9090: UDP, length 455\\nE.....@.@............q#...A&{'header': {'from_car_id': 'car2', 'proto_type': 'DENM', 'proto_version': 0, 'message_id': 44, 'generated_time': 11.5}, 'body': {'management': {'station_id': 0, 'sequence_id': 0, 'data_version': 0, 'expirity_time': 0, 'frequency': 0, 'reliablity': 100, 'is_negation': false}, 'situation': {'cause': 0, 'subcause': 0, 'severity': 2}, 'location': {'lane': 0, 'position': [94.62963436102979, -1.6, 0], 'elevation': 0, 'trace_id': 0, 'way_point': [0, 0, 0]}}}\\n'"", ""b'03:51:47.175413 IP 192.168.1.2.44383 > 192.168.1.255.9090: UDP, length 456\\nE.....@.@............_#....g{'header': {'from_car_id': 'car1', 'proto_type': 'DENM', 'proto_version': 0, 'message_id': 43, 'generated_time': 11.5}, 'body': {'management': {'station_id': 0, 'sequence_id': 0, 'data_version': 0, 'expirity_time': 0, 'frequency': 0, 'reliablity': 100, 'is_negation': false}, 'situation': {'cause': 0, 'subcause': 0, 'severity': 2}, 'location': {'lane': 0, 'position': [121.46163968778423, -1.6, 0], 'elevation': 0, 'trace_id': 0, 'way_point': [0, 0, 0]}}}\\n'""]",[]
car2,116,11.6,"('car1', 19.331876498400284)",91.03307005950558,-51.0,,1,455,"[""b'03:51:47.267914 IP 192.168.1.3.33393 > 192.168.1.255.9090: UDP, length 455\\nE.....@.@............q#...H+{'header': {'from_car_id': 'car2', 'proto_type': 'DENM', 'proto_version': 0, 'message_id': 46, 'generated_time': 11.6}, 'body': {'management': {'station_id': 0, 'sequence_id': 0, 'data_version': 0, 'expirity_time': 0, 'frequency': 0, 'reliablity': 100, 'is_negation': false}, 'situation': {'cause': 0, 'subcause': 0, 'severity': 2}, 'location': {'lane': 0, 'position': [96.03307005950558, -1.6, 0], 'elevation': 0, 'trace_id': 0, 'way_point': [0, 0, 0]}}}\\n'""]",[]
car2,117,11.8,"('car1', 19.13161884169199)",93.83994145645713,-51.0,,2,910,"[""b'03:51:47.467176 IP 192.168.1.3.33393 > 192.168.1.255.9090: UDP, length 455\\nE.....@.@............q#...=.{'header': {'from_car_id': 'car2', 'proto_type': 'DENM', 'proto_version': 0, 'message_id': 49, 'generated_time': 11.8}, 'body': {'management': {'station_id': 0, 'sequence_id': 0, 'data_version': 0, 'expirity_time': 0, 'frequency': 0, 'reliablity': 100, 'is_negation': false}, 'situation': {'cause': 0, 'subcause': 0, 'severity': 2}, 'location': {'lane': 0, 'position': [98.83994145645713, -1.6, 0], 'elevation': 0, 'trace_id': 0, 'way_point': [0, 0, 0]}}}\\n'"", ""b'03:51:47.472581 IP 192.168.1.2.44383 > 192.168.1.255.9090: UDP, length 455\\nE.....@.@............_#....>{'header': {'from_car_id': 'car1', 'proto_type': 'DENM', 'proto_version': 0, 'message_id': 48, 'generated_time': 11.8}, 'body': {'management': {'station_id': 0, 'sequence_id': 0, 'data_version': 0, 'expirity_time': 0, 'frequency': 0, 'reliablity': 100, 'is_negation': false}, 'situation': {'cause': 0, 'subcause': 0, 'severity': 2}, 'location': {'lane': 0, 'position': [125.3715602981491, -1.6, 0], 'elevation': 0, 'trace_id': 0, 'way_point': [0, 0, 0]}}}\\n'""]",[]
car2,118,11.9,"('car1', 19.03149001333784)",95.24337715493289,-51.0,,2,912,"[""b'03:51:47.570354 IP 192.168.1.3.33393 > 192.168.1.255.9090: UDP, length 456\\nE.....@.@............q#....X{'header': {'from_car_id': 'car2', 'proto_type': 'DENM', 'proto_version': 0, 'message_id': 51, 'generated_time': 11.9}, 'body': {'management': {'station_id': 0, 'sequence_id': 0, 'data_version': 0, 'expirity_time': 0, 'frequency': 0, 'reliablity': 100, 'is_negation': false}, 'situation': {'cause': 0, 'subcause': 0, 'severity': 2}, 'location': {'lane': 0, 'position': [100.14337715493289, -1.6, 0], 'elevation': 0, 'trace_id': 0, 'way_point': [0, 0, 0]}}}\\n'"", ""b'03:51:47.574187 IP 192.168.1.2.44383 > 192.168.1.255.9090: UDP, length 456\\nE.....@.@............_#....o{'header': {'from_car_id': 'car1', 'proto_type': 'DENM', 'proto_version': 0, 'message_id': 50, 'generated_time': 11.9}, 'body': {'management': {'station_id': 0, 'sequence_id': 0, 'data_version': 0, 'expirity_time': 0, 'frequency': 0, 'reliablity': 100, 'is_negation': false}, 'situation': {'cause': 0, 'subcause': 0, 'severity': 2}, 'location': {'lane': 0, 'position': [126.67486716827074, -1.6, 0], 'elevation': 0, 'trace_id': 0, 'way_point': [0, 0, 0]}}}\\n'""]",[]
car2,119,12.0,"('car1', 18.931361184983693)",96.64681285340866,-51.0,,2,912,"[""b'03:51:47.877442 IP 192.168.1.3.33393 > 192.168.1.255.9090: UDP, length 456\\nE....]@.@..X.........q#....Y{'header': {'from_car_id': 'car2', 'proto_type': 'DENM', 'proto_version': 0, 'message_id': 53, 'generated_time': 12.0}, 'body': {'management': {'station_id': 0, 'sequence_id': 0, 'data_version': 0, 'expirity_time': 0, 'frequency': 0, 'reliablity': 100, 'is_negation': false}, 'situation': {'cause': 0, 'subcause': 0, 'severity': 2}, 'location': {'lane': 0, 'position': [101.54681285340867, -1.6, 0], 'elevation': 0, 'trace_id': 0, 'way_point': [0, 0, 0]}}}\\n'"", ""b'03:51:47.884155 IP 192.168.1.2.44383 > 192.168.1.255.9090: UDP, length 456\\nE.....@.@............_#....x{'header': {'from_car_id': 'car1', 'proto_type': 'DENM', 'proto_version': 0, 'message_id': 52, 'generated_time': 12.0}, 'body': {'management': {'station_id': 0, 'sequence_id': 0, 'data_version': 0, 'expirity_time': 0, 'frequency': 0, 'reliablity': 100, 'is_negation': false}, 'situation': {'cause': 0, 'subcause': 0, 'severity': 2}, 'location': {'lane': 0, 'position': [127.97817403839235, -1.6, 0], 'elevation': 0, 'trace_id': 0, 'way_point': [0, 0, 0]}}}\\n'""]",[]
car2,120,12.1,"('car1', 18.83123235662955)",98.05024855188444,-51.0,,2,910,"[""b'03:51:47.888557 IP 192.168.1.3.33393 > 192.168.1.255.9090: UDP, length 456\\nE....`@.@..U.........q#....[{'header': {'from_car_id': 'car2', 'proto_type': 'DENM', 'proto_version': 0, 'message_id': 55, 'generated_time': 12.1}, 'body': {'management': {'station_id': 0, 'sequence_id': 0, 'data_version': 0, 'expirity_time': 0, 'frequency': 0, 'reliablity': 100, 'is_negation': false}, 'situation': {'cause': 0, 'subcause': 0, 'severity': 2}, 'location': {'lane': 0, 'position': [102.95024855188444, -1.6, 0], 'elevation': 0, 'trace_id': 0, 'way_point': [0, 0, 0]}}}\\n'"", ""b'03:51:47.895502 IP 192.168.1.2.44383 > 192.168.1.255.9090: UDP, length 454\\nE.....@.@............_#.....{'header': {'from_car_id': 'car1', 'proto_type': 'DENM', 'proto_version': 0, 'message_id': 54, 'generated_time': 12.1}, 'body': {'management': {'station_id': 0, 'sequence_id': 0, 'data_version': 0, 'expirity_time': 0, 'frequency': 0, 'reliablity': 100, 'is_negation': false}, 'situation': {'cause': 0, 'subcause': 0, 'severity': 2}, 'location': {'lane': 0, 'position': [129.281480908514, -1.6, 0], 'elevation': 0, 'trace_id': 0, 'way_point': [0, 0, 0]}}}\\n'""]",[]
car2,121,12.2,"('car1', 18.731103528275405)",99.45368425036021,-51.0,,1,456,"[""b'03:51:47.982122 IP 192.168.1.3.33393 > 192.168.1.255.9090: UDP, length 456\\nE....c@.@..R.........q#....f{'header': {'from_car_id': 'car2', 'proto_type': 'DENM', 'proto_version': 0, 'message_id': 56, 'generated_time': 12.2}, 'body': {'management': {'station_id': 0, 'sequence_id': 0, 'data_version': 0, 'expirity_time': 0, 'frequency': 0, 'reliablity': 100, 'is_negation': false}, 'situation': {'cause': 0, 'subcause': 0, 'severity': 2}, 'location': {'lane': 0, 'position': [104.35368425036022, -1.6, 0], 'elevation': 0, 'trace_id': 0, 'way_point': [0, 0, 0]}}}\\n'""]",[]
car2,122,12.3,"('car1', 18.630974699921257)",100.85711994883599,-51.0,,1,456,"[""b'03:51:48.081313 IP 192.168.1.3.33393 > 192.168.1.255.9090: UDP, length 456\\nE....t@.@..A.........q#....V{'header': {'from_car_id': 'car2', 'proto_type': 'DENM', 'proto_version': 0, 'message_id': 57, 'generated_time': 12.3}, 'body': {'management': {'station_id': 0, 'sequence_id': 0, 'data_version': 0, 'expirity_time': 0, 'frequency': 0, 'reliablity': 100, 'is_negation': false}, 'situation': {'cause': 0, 'subcause': 0, 'severity': 2}, 'location': {'lane': 0, 'position': [105.75711994883599, -1.6, 0], 'elevation': 0, 'trace_id': 0, 'way_point': [0, 0, 0]}}}\\n'""]",[]
car2,123,12.4,"('car1', 18.53084587156711)",102.26055564731175,-51.0,,1,456,"[""b'03:51:48.180995 IP 192.168.1.3.33393 > 192.168.1.255.9090: UDP, length 456\\nE.....@.@..6.........q#....b{'header': {'from_car_id': 'car2', 'proto_type': 'DENM', 'proto_version': 0, 'message_id': 58, 'generated_time': 12.4}, 'body': {'management': {'station_id': 0, 'sequence_id': 0, 'data_version': 0, 'expirity_time': 0, 'frequency': 0, 'reliablity': 100, 'is_negation': false}, 'situation': {'cause': 0, 'subcause': 0, 'severity': 2}, 'location': {'lane': 0, 'position': [107.16055564731175, -1.6, 0], 'elevation': 0, 'trace_id': 0, 'way_point': [0, 0, 0]}}}\\n'""]",[]
car2,124,12.5,"('car1', 18.43071704321297)",103.66399134578752,-51.0,,1,456,"[""b'03:51:48.280925 IP 192.168.1.3.33393 > 192.168.1.255.9090: UDP, length 456\\nE.....@.@.. .........q#....Z{'header': {'from_car_id': 'car2', 'proto_type': 'DENM', 'proto_version': 0, 'message_id': 59, 'generated_time': 12.5}, 'body': {'management': {'station_id': 0, 'sequence_id': 0, 'data_version': 0, 'expirity_time': 0, 'frequency': 0, 'reliablity': 100, 'is_negation': false}, 'situation': {'cause': 0, 'subcause': 0, 'severity': 2}, 'location': {'lane': 0, 'position': [108.56399134578753, -1.6, 0], 'elevation': 0, 'trace_id': 0, 'way_point': [0, 0, 0]}}}\\n'""]",[]
,,,,,,,1,456,"[""b'03:51:47.378172 IP 192.168.1.2.44383 > 192.168.1.255.9090: UDP, length 456\\nE.....@.@............_#....v{'header': {'from_car_id': 'car1', 'proto_type': 'DENM', 'proto_version': 0, 'message_id': 47, 'generated_time': 11.7}, 'body': {'management': {'station_id': 0, 'sequence_id': 0, 'data_version': 0, 'expirity_time': 0, 'frequency': 0, 'reliablity': 100, 'is_negation': false}, 'situation': {'cause': 0, 'subcause': 0, 'severity': 2}, 'location': {'lane': 0, 'position': [124.06825342802748, -1.6, 0], 'elevation': 0, 'trace_id': 0, 'way_point': [0, 0, 0]}}}\\n'""]",
car2,125,12.6,"('car1', 18.330588214858828)",105.0674270442633,-52.0,,1,455,"[""b'03:51:48.384247 IP 192.168.1.3.33393 > 192.168.1.255.9090: UDP, length 455\\nE.....@.@............q#...E/{'header': {'from_car_id': 'car2', 'proto_type': 'DENM', 'proto_version': 0, 'message_id': 60, 'generated_time': 12.6}, 'body': {'management': {'station_id': 0, 'sequence_id': 0, 'data_version': 0, 'expirity_time': 0, 'frequency': 0, 'reliablity': 100, 'is_negation': false}, 'situation': {'cause': 0, 'subcause': 0, 'severity': 2}, 'location': {'lane': 0, 'position': [109.9674270442633, -1.6, 0], 'elevation': 0, 'trace_id': 0, 'way_point': [0, 0, 0]}}}\\n'""]",[]
car2,126,12.7,"('car1', 18.230459386504684)",106.47086274273907,-52.0,,1,456,"[""b'03:51:48.481521 IP 192.168.1.3.33393 > 192.168.1.255.9090: UDP, length 456\\nE.....@.@............q#....P{'header': {'from_car_id': 'car2', 'proto_type': 'DENM', 'proto_version': 0, 'message_id': 61, 'generated_time': 12.7}, 'body': {'management': {'station_id': 0, 'sequence_id': 0, 'data_version': 0, 'expirity_time': 0, 'frequency': 0, 'reliablity': 100, 'is_negation': false}, 'situation': {'cause': 0, 'subcause': 0, 'severity': 2}, 'location': {'lane': 0, 'position': [111.37086274273908, -1.6, 0], 'elevation': 0, 'trace_id': 0, 'way_point': [0, 0, 0]}}}\\n'""]",[]
car2,127,12.8,"('car1', 18.13033055815054)",107.87429844121485,-52.0,,1,456,"[""b'03:51:48.581021 IP 192.168.1.3.33393 > 192.168.1.255.9090: UDP, length 456\\nE.....@.@............q#....]{'header': {'from_car_id': 'car2', 'proto_type': 'DENM', 'proto_version': 0, 'message_id': 62, 'generated_time': 12.8}, 'body': {'management': {'station_id': 0, 'sequence_id': 0, 'data_version': 0, 'expirity_time': 0, 'frequency': 0, 'reliablity': 100, 'is_negation': false}, 'situation': {'cause': 0, 'subcause': 0, 'severity': 2}, 'location': {'lane': 0, 'position': [112.77429844121485, -1.6, 0], 'elevation': 0, 'trace_id': 0, 'way_point': [0, 0, 0]}}}\\n'""]",[]
car2,128,12.9,"('car1', 18.0302017297964)",109.27773413969062,-53.0,,1,456,"[""b'03:51:48.681467 IP 192.168.1.3.33393 > 192.168.1.255.9090: UDP, length 456\\nE.....@.@............q#...._{'header': {'from_car_id': 'car2', 'proto_type': 'DENM', 'proto_version': 0, 'message_id': 63, 'generated_time': 12.9}, 'body': {'management': {'station_id': 0, 'sequence_id': 0, 'data_version': 0, 'expirity_time': 0, 'frequency': 0, 'reliablity': 100, 'is_negation': false}, 'situation': {'cause': 0, 'subcause': 0, 'severity': 2}, 'location': {'lane': 0, 'position': [114.17773413969063, -1.6, 0], 'elevation': 0, 'trace_id': 0, 'way_point': [0, 0, 0]}}}\\n'""]",[]
car2,129,13.0,"('car1', 17.93007290144226)",110.6811698381664,-53.0,,1,455,"[""b'03:51:48.782037 IP 192.168.1.3.33393 > 192.168.1.255.9090: UDP, length 455\\nE.....@.@............q#...C,{'header': {'from_car_id': 'car2', 'proto_type': 'DENM', 'proto_version': 0, 'message_id': 64, 'generated_time': 13.0}, 'body': {'management': {'station_id': 0, 'sequence_id': 0, 'data_version': 0, 'expirity_time': 0, 'frequency': 0, 'reliablity': 100, 'is_negation': false}, 'situation': {'cause': 0, 'subcause': 0, 'severity': 2}, 'location': {'lane': 0, 'position': [115.5811698381664, -1.6, 0], 'elevation': 0, 'trace_id': 0, 'way_point': [0, 0, 0]}}}\\n'""]",[]
car2,130,13.1,"('car1', 17.829944073088114)",112.08460553664216,-54.0,,1,456,"[""b'03:51:48.880890 IP 192.168.1.3.33393 > 192.168.1.255.9090: UDP, length 456\\nE.....@.@............q#....Y{'header': {'from_car_id': 'car2', 'proto_type': 'DENM', 'proto_version': 0, 'message_id': 65, 'generated_time': 13.1}, 'body': {'management': {'station_id': 0, 'sequence_id': 0, 'data_version': 0, 'expirity_time': 0, 'frequency': 0, 'reliablity': 100, 'is_negation': false}, 'situation': {'cause': 0, 'subcause': 0, 'severity': 2}, 'location': {'lane': 0, 'position': [116.98460553664216, -1.6, 0], 'elevation': 0, 'trace_id': 0, 'way_point': [0, 0, 0]}}}\\n'""]",[]
car2,131,13.2,"('car1', 17.729815244733974)",113.48804123511793,-54.0,,1,456,"[""b'03:51:48.981109 IP 192.168.1.3.33393 > 192.168.1.255.9090: UDP, length 456\\nE.....@.@............q#....e{'header': {'from_car_id': 'car2', 'proto_type': 'DENM', 'proto_version': 0, 'message_id': 66, 'generated_time': 13.2}, 'body': {'management': {'station_id': 0, 'sequence_id': 0, 'data_version': 0, 'expirity_time': 0, 'frequency': 0, 'reliablity': 100, 'is_negation': false}, 'situation': {'cause': 0, 'subcause': 0, 'severity': 2}, 'location': {'lane': 0, 'position': [118.38804123511794, -1.6, 0], 'elevation': 0, 'trace_id': 0, 'way_point': [0, 0, 0]}}}\\n'""]",[]
car2,132,13.3,"('car1', 17.629686416379833)",114.89147693359371,-54.0,,1,456,"[""b'03:51:49.080752 IP 192.168.1.3.33393 > 192.168.1.255.9090: UDP, length 456\\nE.....@.@............q#....^{'header': {'from_car_id': 'car2', 'proto_type': 'DENM', 'proto_version': 0, 'message_id': 67, 'generated_time': 13.3}, 'body': {'management': {'station_id': 0, 'sequence_id': 0, 'data_version': 0, 'expirity_time': 0, 'frequency': 0, 'reliablity': 100, 'is_negation': false}, 'situation': {'cause': 0, 'subcause': 0, 'severity': 2}, 'location': {'lane': 0, 'position': [119.79147693359371, -1.6, 0], 'elevation': 0, 'trace_id': 0, 'way_point': [0, 0, 0]}}}\\n'""]",[]
car2,133,13.4,"('car1', 17.529557588025693)",116.29491263206948,-55.0,,1,456,"[""b'03:51:49.180997 IP 192.168.1.3.33393 > 192.168.1.255.9090: UDP, length 456\\nE.....@.@............q#....S{'header': {'from_car_id': 'car2', 'proto_type': 'DENM', 'proto_version': 0, 'message_id': 68, 'generated_time': 13.4}, 'body': {'management': {'station_id': 0, 'sequence_id': 0, 'data_version': 0, 'expirity_time': 0, 'frequency': 0, 'reliablity': 100, 'is_negation': false}, 'situation': {'cause': 0, 'subcause': 0, 'severity': 2}, 'location': {'lane': 0, 'position': [121.19491263206949, -1.6, 0], 'elevation': 0, 'trace_id': 0, 'way_point': [0, 0, 0]}}}\\n'""]",[]
car2,134,13.5,"('car1', 17.429428759671552)",117.69834833054526,-55.0,,1,456,"[""b'03:51:49.281261 IP 192.168.1.3.33393 > 192.168.1.255.9090: UDP, length 456\\nE.....@.@............q#....U{'header': {'from_car_id': 'car2', 'proto_type': 'DENM', 'proto_version': 0, 'message_id': 69, 'generated_time': 13.5}, 'body': {'management': {'station_id': 0, 'sequence_id': 0, 'data_version': 0, 'expirity_time': 0, 'frequency': 0, 'reliablity': 100, 'is_negation': false}, 'situation': {'cause': 0, 'subcause': 0, 'severity': 2}, 'location': {'lane': 0, 'position': [122.59834833054526, -1.6, 0], 'elevation': 0, 'trace_id': 0, 'way_point': [0, 0, 0]}}}\\n'""]",[]
car2,135,13.6,"('car1', 17.32929993131741)",119.10178402902102,-56.0,,1,456,"[""b'03:51:49.381473 IP 192.168.1.3.33393 > 192.168.1.255.9090: UDP, length 456\\nE....(@.@............q#....k{'header': {'from_car_id': 'car2', 'proto_type': 'DENM', 'proto_version': 0, 'message_id': 70, 'generated_time': 13.6}, 'body': {'management': {'station_id': 0, 'sequence_id': 0, 'data_version': 0, 'expirity_time': 0, 'frequency': 0, 'reliablity': 100, 'is_negation': false}, 'situation': {'cause': 0, 'subcause': 0, 'severity': 2}, 'location': {'lane': 0, 'position': [124.00178402902102, -1.6, 0], 'elevation': 0, 'trace_id': 0, 'way_point': [0, 0, 0]}}}\\n'""]",[]
car2,136,13.7,"('car1', 17.22917110296327)",120.5052197274968,-56.0,,1,455,"[""b'03:51:49.481735 IP 192.168.1.3.33393 > 192.168.1.255.9090: UDP, length 455\\nE....5@.@............q#...</{'header': {'from_car_id': 'car2', 'proto_type': 'DENM', 'proto_version': 0, 'message_id': 71, 'generated_time': 13.7}, 'body': {'management': {'station_id': 0, 'sequence_id': 0, 'data_version': 0, 'expirity_time': 0, 'frequency': 0, 'reliablity': 100, 'is_negation': false}, 'situation': {'cause': 0, 'subcause': 0, 'severity': 2}, 'location': {'lane': 0, 'position': [125.4052197274968, -1.6, 0], 'elevation': 0, 'trace_id': 0, 'way_point': [0, 0, 0]}}}\\n'""]",[]
car2,137,13.8,"('car1', 17.12904227460913)",121.90865542597257,-57.0,,1,456,"[""b'03:51:49.583123 IP 192.168.1.3.33393 > 192.168.1.255.9090: UDP, length 456\\nE....I@.@..l.........q#....\\\\{'header': {'from_car_id': 'car2', 'proto_type': 'DENM', 'proto_version': 0, 'message_id': 72, 'generated_time': 13.8}, 'body': {'management': {'station_id': 0, 'sequence_id': 0, 'data_version': 0, 'expirity_time': 0, 'frequency': 0, 'reliablity': 100, 'is_negation': false}, 'situation': {'cause': 0, 'subcause': 0, 'severity': 2}, 'location': {'lane': 0, 'position': [126.80865542597257, -1.6, 0], 'elevation': 0, 'trace_id': 0, 'way_point': [0, 0, 0]}}}\\n'""]",[]
car2,138,13.9,"('car1', 17.028913446254982)",123.31209112444833,-57.0,,1,456,"[""b'03:51:49.681787 IP 192.168.1.3.33393 > 192.168.1.255.9090: UDP, length 456\\nE....P@.@..e.........q#....g{'header': {'from_car_id': 'car2', 'proto_type': 'DENM', 'proto_version': 0, 'message_id': 73, 'generated_time': 13.9}, 'body': {'management': {'station_id': 0, 'sequence_id': 0, 'data_version': 0, 'expirity_time': 0, 'frequency': 0, 'reliablity': 100, 'is_negation': false}, 'situation': {'cause': 0, 'subcause': 0, 'severity': 2}, 'location': {'lane': 0, 'position': [128.21209112444834, -1.6, 0], 'elevation': 0, 'trace_id': 0, 'way_point': [0, 0, 0]}}}\\n'""]",[]
car2,139,14.0,"('car1', 16.928784617900842)",124.7155268229241,-58.0,,1,456,"[""b'03:51:49.782828 IP 192.168.1.3.33393 > 192.168.1.255.9090: UDP, length 456\\nE....U@.@..`.........q#....^{'header': {'from_car_id': 'car2', 'proto_type': 'DENM', 'proto_version': 0, 'message_id': 74, 'generated_time': 14.0}, 'body': {'management': {'station_id': 0, 'sequence_id': 0, 'data_version': 0, 'expirity_time': 0, 'frequency': 0, 'reliablity': 100, 'is_negation': false}, 'situation': {'cause': 0, 'subcause': 0, 'severity': 2}, 'location': {'lane': 0, 'position': [129.61552682292412, -1.6, 0], 'elevation': 0, 'trace_id': 0, 'way_point': [0, 0, 0]}}}\\n'""]",[]
car2,140,14.1,"('car1', 16.830374976283288)",126.11724333466329,-58.0,,0,0,[],[]
car2,141,14.2,"('car1', 16.73436556982714)",127.51655961124106,-59.0,,0,0,[],[]
car2,142,14.3,"('car1', 16.640697856211386)",128.91353419497844,-60.0,,0,0,[],[]
car2,143,14.4,"('car1', 16.54932247084259)",130.30821645046888,-60.0,,0,0,[],[]
car2,144,14.5,"('car1', 16.460231470108006)",131.70061432132508,-61.0,,0,0,[],[]
car2,145,14.6,"('car1', 16.3733677443918)",133.09078491716292,-61.0,,0,0,[],[]
car2,146,14.7,"('car1', 16.28867561181849)",134.47878391985785,-61.0,,0,0,[],[]
car2,147,14.8,"('car1', 16.206100782559517)",135.86466561923845,-62.0,,0,0,[],[]
car2,148,14.9,"('car1', 16.12559032403201)",137.24848294788757,-62.0,,0,0,[],[]
car2,149,15.0,"('car1', 16.047092626967704)",138.63028751507352,-63.0,,0,0,[],[]
car2,150,15.1,"('car1', 15.970557372329992)",140.01012963983285,-63.0,,0,0,[],[]
car2,151,15.2,"('car1', 15.895935499058233)",141.38805838322625,-64.0,,0,0,[],[]
car2,152,15.3,"('car1', 15.823179172618264)",142.76412157978785,-64.0,,0,0,[],[]
car2,153,15.4,"('car1', 15.752241754339295)",144.13836586818843,-65.0,,0,0,[],[]
car2,154,15.5,"('car1', 15.6830777715173)",145.51083672113205,-65.0,,0,0,[],[]
car2,155,15.6,"('car1', 15.615642888265853)",146.88157847450512,-65.0,,0,0,[],[]
car2,156,15.7,"('car1', 15.549893877095695)",148.2506343557969,-66.0,,0,0,[],[]
car2,157,15.8,"('car1', 15.485788591204791)",149.61804651180944,-66.0,,0,0,[],[]
car2,158,15.9,"('car1', 15.42328593746116)",150.9838560356747,-67.0,,0,0,[],[]
car2,159,16.0,"('car1', 15.362345850061118)",152.34810299319636,-67.0,,0,0,[],[]
car2,160,16.1,"('car1', 15.302929264846078)",153.71082644853303,-67.0,,0,0,[],[]
car2,161,16.2,"('car1', 15.244998094261412)",155.07206448923932,-68.0,,0,0,[],[]
car2,162,16.3,"('car1', 15.188515202941367)",156.431854250681,-68.0,,0,0,[],[]
car2,163,16.4,"('car1', 15.133444383904326)",157.79023193983969,-69.0,,0,0,[],[]
car2,164,16.5,"('car1', 15.07975033534321)",159.14723285852241,-69.0,,0,0,[],[]
car2,165,16.6,"('car1', 15.027398637996122)",160.50289142599115,-69.0,,0,0,[],[]
car2,166,16.7,"('car1', 14.976355733082709)",161.8572412010262,-70.0,,0,0,[],[]
car2,167,16.8,"('car1', 14.926588900792133)",163.2103149034384,-70.0,,0,0,[],[]
car2,168,16.9,"('car1', 14.878066239308822)",164.56214443504334,-70.0,,0,0,[],[]
car2,169,17.0,"('car1', 14.830756644362594)",165.9127609001112,-71.0,,0,0,[],[]
car2,170,17.1,"('car1', 14.784644309156835)",167.26218010543857,-71.0,,0,0,[],[]
car2,171,17.2,"('car1', 14.739714341520454)",168.61041694319658,-71.0,,0,0,[],[]
car2,172,17.3,"('car1', 14.695936424336288)",169.9575017305024,-72.0,,0,0,[],[]
car2,173,17.4,"('car1', 14.653281017849153)",171.30346400711116,-72.0,,0,0,[],[]
car2,174,17.5,"('car1', 14.611719339733483)",172.64833255534847,-72.0,,0,0,[],[]
car2,175,17.8,"(None, None)",176.75774114789763,-73.0,,0,0,[],[]
car2,176,17.9,"(None, None)",178.1611768463734,-74.0,,0,0,[],[]
car2,177,18.0,"(None, None)",179.56461254484918,-74.0,,0,0,[],[]
car2,178,18.1,"(None, None)",180.96804824332494,-74.0,,0,0,[],[]
car2,179,18.2,"(None, None)",182.3714839418007,-74.0,,0,0,[],[]
car2,180,18.3,"(None, None)",183.7749196402765,-75.0,,0,0,[],[]
car2,181,18.4,"(None, None)",185.17835533875228,-75.0,,0,0,[],[]
car2,182,18.5,"(None, None)",186.58179103722804,-75.0,,0,0,[],[]
car2,183,18.6,"(None, None)",187.9852267357038,-76.0,,0,0,[],[]
car2,184,18.7,"(None, None)",189.3886624341796,-76.0,,0,0,[],[]
car2,185,18.8,"(None, None)",190.79209813265538,-76.0,,0,0,[],[]
car2,186,18.9,"(None, None)",192.19553383113114,-76.0,,0,0,[],[]
car2,187,19.0,"(None, None)",193.5989695296069,-77.0,,0,0,[],[]
car2,188,19.1,"(None, None)",195.0024052280827,-77.0,,0,0,[],[]
